Protein,Protein_definition,Disease_category,Disease,NB_individual,NB_case,HR[95%CI],P_value
B4GAT1,"Beta-1,4-glucuronyltransferase 1","Chapter IV Endocrine, nutritional and metabolic diseases",Alcohol dependence,21730,191,3.20 [1.97-5.20],2.6229251268010647e-06
B4GAT1,"Beta-1,4-glucuronyltransferase 1",Chapter IX Diseases of the circulatory system,Atrial fibrillation and flutter,13899,2314,0.70 [0.60-0.82],5.344221542038937e-06
B4GAT1,"Beta-1,4-glucuronyltransferase 1",Chapter V Mental and behavioural disorders,"Alcohol use disorder, ICD-based",23545,496,2.37 [1.73-3.24],6.293621167152899e-08
B4GAT1,"Beta-1,4-glucuronyltransferase 1",Chapter V Mental and behavioural disorders,"Mental and behavioural disorders due to alcohol, excluding acute intoxication",23482,586,2.16 [1.62-2.89],1.962010274446001e-07
B4GAT1,"Beta-1,4-glucuronyltransferase 1",Chapter XI Diseases of the digestive system,Inguinal hernia,19788,1638,0.60 [0.50-0.71],1.7742086562224215e-08
B4GAT1,"Beta-1,4-glucuronyltransferase 1",Chapter XIV Diseases of the genitourinary system,Chronic kidney disease,22407,1541,1.60 [1.33-1.92],6.606681677342004e-07
B4GAT1,"Beta-1,4-glucuronyltransferase 1",Chapter XIV Diseases of the genitourinary system,Dialysis,20969,103,5.26 [3.01-9.21],5.9716737126544305e-09
