Protein,Protein_definition,Disease_category,Disease,NB_individual,NB_case,HR[95%CI],P_value
HMCN2,Hemicentin-2,"Chapter IV Endocrine, nutritional and metabolic diseases",Type 1 diabetes without complications,17718,143,2.16 [1.63-2.87],1.125996843154613e-07
HMCN2,Hemicentin-2,"Chapter IV Endocrine, nutritional and metabolic diseases",Type 2 diabetes without complications,19420,1845,1.33 [1.23-1.44],1.1661725008740053e-12
HMCN2,Hemicentin-2,Chapter V Mental and behavioural disorders,"Mental and behavioural disorders due to alcohol, excluding acute intoxication",19843,483,0.69 [0.60-0.80],4.521464431464328e-07
HMCN2,Hemicentin-2,"Chapter VII Diseases of the eye, adnexa, ear and mastoid process",Background diabetic retinopathy,19913,246,1.62 [1.31-2.01],9.160299704114349e-06
HMCN2,Hemicentin-2,Chapter XIV Diseases of the genitourinary system,Chronic kidney disease,18946,1124,1.33 [1.20-1.47],3.645454350597824e-08
