Protein,Protein_definition,Disease_category,Disease,NB_individual,NB_case,HR[95%CI],P_value
CTBS,Di-N-acetylchitobiase,"Chapter IV Endocrine, nutritional and metabolic diseases",Other disorders of glucose regulation and pancreatic internal secretion,20289,203,2.83 [1.82-4.39],3.714841042094759e-06
CTBS,Di-N-acetylchitobiase,"Chapter IV Endocrine, nutritional and metabolic diseases",Type 2 diabetes without complications,19652,1861,2.30 [1.97-2.68],5.389965245689848e-26
CTBS,Di-N-acetylchitobiase,"Chapter VII Diseases of the eye, adnexa, ear and mastoid process",Background diabetic retinopathy,20146,250,2.56 [1.69-3.89],9.995825732401844e-06
CTBS,Di-N-acetylchitobiase,Chapter XI Diseases of the digestive system,Other diseases of stomach and duodenum,15968,671,2.17 [1.68-2.81],3.876133013644592e-09
CTBS,Di-N-acetylchitobiase,Chapter XIII Diseases of the musculoskeletal system and connective tissue,Other psoriatic arthropathies,20284,56,4.18 [2.34-7.47],1.3397256094849567e-06
