Protein,Protein_definition,Disease_category,Disease,NB_individual,NB_case,HR[95%CI],P_value
AGT,Angiotensinogen,Chapter II Neoplasms,Benign neoplasm of other and ill-defined parts of digestive system,20535,60,4.96 [2.50-9.83],4.387114181576731e-06
AGT,Angiotensinogen,Chapter IX Diseases of the circulatory system,Hypertensive Renal Disease,12686,104,3.44 [2.11-5.61],7.085267528519212e-07
AGT,Angiotensinogen,Chapter V Mental and behavioural disorders,"Alcohol use disorder, ICD-based",20411,427,2.19 [1.56-3.07],6.237462985191003e-06
AGT,Angiotensinogen,Chapter V Mental and behavioural disorders,"Mental and behavioural disorders due to alcohol, excluding acute intoxication",20356,496,2.09 [1.51-2.87],6.930781671407191e-06
AGT,Angiotensinogen,Chapter XIII Diseases of the musculoskeletal system and connective tissue,Gout,15499,824,1.88 [1.46-2.42],1.1949312395012537e-06
AGT,Angiotensinogen,Chapter XIII Diseases of the musculoskeletal system and connective tissue,"Gout, unspecified",20467,811,1.94 [1.51-2.51],3.419960572704001e-07
