Protein,Protein_definition,Disease_category,Disease,NB_individual,NB_case,OR[95%CI],P_value
BCL2L1,Bcl-2-like protein 1,Chapter I Certain infectious and parasitic diseases,Other septicaemia,23903,61,0.71 [0.56-0.91],0.0072254639985939
BCL2L1,Bcl-2-like protein 1,Chapter II Neoplasms,"Squamous cell neoplasms and carcinomas of the skin, excluding all cancers (controls excluding all cancers)",21272,116,1.11 [1.08-1.14],1.1934344480169609e-17
BCL2L1,Bcl-2-like protein 1,Chapter IX Diseases of the circulatory system,Varicose veins,23753,386,0.87 [0.79-0.95],0.0037555863510472
BCL2L1,Bcl-2-like protein 1,Chapter XI Diseases of the digestive system,Other noninfective gastroenteritis and colitis,23640,532,1.12 [1.03-1.21],0.009798177496177
BCL2L1,Bcl-2-like protein 1,Chapter XI Diseases of the digestive system,Diseases of liver,23900,109,0.70 [0.58-0.83],9.017383489588542e-05
BCL2L1,Bcl-2-like protein 1,Chapter XI Diseases of the digestive system,Other diseases of liver,23853,62,0.71 [0.56-0.90],0.0049308254263524
BCL2L1,Bcl-2-like protein 1,Chapter XIII Diseases of the musculoskeletal system and connective tissue,Soft tissue disorders,22371,974,1.09 [1.02-1.16],0.0078608766852901
BCL2L1,Bcl-2-like protein 1,Chapter XIII Diseases of the musculoskeletal system and connective tissue,Pain in limb,21599,202,1.20 [1.05-1.37],0.0088603397251518
