Protein,Protein_definition,Disease_category,Disease,NB_individual,NB_case,OR[95%CI],P_value
EPB41L5,Band 4.1-like protein 5,Chapter IX Diseases of the circulatory system,Atrial fibrillation and flutter,16369,169,1.36 [1.17-1.59],6.911109057548287e-05
EPB41L5,Band 4.1-like protein 5,Chapter XI Diseases of the digestive system,Intestinal malabsorption,22663,61,1.41 [1.13-1.77],0.0028735322201876
EPB41L5,Band 4.1-like protein 5,Chapter XI Diseases of the digestive system,Coeliac disease,22652,50,1.46 [1.16-1.85],0.0013668391532381
EPB41L5,Band 4.1-like protein 5,Chapter XII Diseases of the skin and subcutaneous tissue,Cellulitis,23100,199,1.26 [1.07-1.47],0.00471724460003
EPB41L5,Band 4.1-like protein 5,"Chapter XV Pregnancy, childbirth and the puerperium",Maternal care for known or suspected abnormality of pelvic organs,12651,162,1.37 [1.15-1.62],0.0002815158920134
