Protein,Protein_definition,Disease_category,Disease,NB_individual,NB_case,OR[95%CI],P_value
HK2,Hexokinase-2,Chapter I Certain infectious and parasitic diseases,Other bacterial diseases,27148,105,2.23 [1.32-3.77],0.0028051840724317
HK2,Hexokinase-2,"Chapter VII Diseases of the eye, adnexa, ear and mastoid process",Chalazion,27137,87,2.16 [1.24-3.78],0.0065251039525793
HK2,Hexokinase-2,Chapter XIV Diseases of the genitourinary system,Erosion and ectropion of cervix uteri,11308,82,2.15 [1.30-3.56],0.0030301256862954
HK2,Hexokinase-2,Chapter XIV Diseases of the genitourinary system,Other noninflammatory disorders of cervix uteri,11298,72,2.21 [1.26-3.88],0.0056296400320984
HK2,Hexokinase-2,"Chapter XV Pregnancy, childbirth and the puerperium",Delivery,15416,331,0.59 [0.41-0.85],0.0049022413047805
HK2,Hexokinase-2,"Chapter XV Pregnancy, childbirth and the puerperium",Single spontaneous delivery,15335,250,0.55 [0.36-0.84],0.0054340367228536
