Protein,Protein_definition,Disease_category,Disease,NB_individual,NB_case,OR[95%CI],P_value
IRAK4,Interleukin-1 receptor-associated kinase 4,Chapter XI Diseases of the digestive system,Diseases of liver,27562,121,0.77 [0.66-0.89],0.0004191485081772
IRAK4,Interleukin-1 receptor-associated kinase 4,Chapter XI Diseases of the digestive system,Other diseases of liver,27505,64,0.74 [0.61-0.91],0.0035556093429786
IRAK4,Interleukin-1 receptor-associated kinase 4,Chapter XIII Diseases of the musculoskeletal system and connective tissue,Pain in limb,24955,225,1.17 [1.04-1.31],0.0099932527902989
IRAK4,Interleukin-1 receptor-associated kinase 4,Chapter XIV Diseases of the genitourinary system,Irregular menses,15539,385,1.13 [1.03-1.24],0.0066140181971581
IRAK4,Interleukin-1 receptor-associated kinase 4,"Chapter XV Pregnancy, childbirth and the puerperium",Haemorrhage in early pregnancy,15362,125,0.77 [0.66-0.89],0.0004071995802041
