Protein,Protein_definition,Disease_category,Disease,NB_individual,NB_case,OR[95%CI],P_value
CD84,SLAM family member 5,Chapter II Neoplasms,"Malignant neoplasm of breast, excluding all cancers (controls excluding all cancers)",13746,293,0.43 [0.31-0.60],6.60814395521933e-07
CD84,SLAM family member 5,Chapter II Neoplasms,"Non-Hodgkin lymphoma, all, excluding all cancers (controls excluding all cancers)",24494,49,0.30 [0.14-0.64],0.0020668134306117
CD84,SLAM family member 5,Chapter III Diseases of the blood and blood-forming organs and certain disorders involving the immune mechanism,Agranulocytosis,27837,82,0.34 [0.19-0.62],0.0004493971284145
CD84,SLAM family member 5,Chapter IX Diseases of the circulatory system,"Ischaemic heart disease, wide definition",26777,568,0.73 [0.57-0.92],0.0084011925275448
CD84,SLAM family member 5,Chapter IX Diseases of the circulatory system,Angina pectoris,26560,351,0.61 [0.45-0.83],0.0014699525903438
CD84,SLAM family member 5,"Chapter XV Pregnancy, childbirth and the puerperium",Haemorrhage in early pregnancy,15362,125,0.48 [0.29-0.79],0.0037811439773927
