Protein,Protein_definition,Disease_category,Disease,NB_individual,NB_case,OR[95%CI],P_value
PITHD1,PITH domain-containing protein 1,Chapter I Certain infectious and parasitic diseases,Viral infections characterized by skin and mucous membrane lesions,23601,56,1.39 [1.13-1.71],0.0017542221356697
PITHD1,PITH domain-containing protein 1,Chapter IX Diseases of the circulatory system,Transient ischemic attack,23275,37,0.37 [0.19-0.72],0.0037133315314034
PITHD1,PITH domain-containing protein 1,Chapter XI Diseases of the digestive system,Paralytic ileus and intestinal obstruction,18139,58,0.50 [0.31-0.82],0.0062226570927908
PITHD1,PITH domain-containing protein 1,Chapter XI Diseases of the digestive system,Intestinal stricture,23405,58,0.50 [0.31-0.82],0.006227568859464
PITHD1,PITH domain-containing protein 1,Chapter XIV Diseases of the genitourinary system,"Other noninflammatory disorders of uterus, except cervix",9752,184,1.21 [1.05-1.39],0.0087924911462523
