Protein,Protein_definition,Disease_category,Disease,NB_individual,NB_case,OR[95%CI],P_value
GSTM4,Glutathione S-transferase Mu 4,Chapter II Neoplasms,"Squamous cell neoplasms and carcinomas of the skin, excluding all cancers (controls excluding all cancers)",20665,114,1.09 [1.03-1.15],0.002176484628134
GSTM4,Glutathione S-transferase Mu 4,"Chapter IV Endocrine, nutritional and metabolic diseases",Volume depletion,20311,39,1.58 [1.23-2.04],0.0003917990101862
GSTM4,Glutathione S-transferase Mu 4,Chapter XI Diseases of the digestive system,Noninfective enteritis and colitis,23084,645,1.16 [1.05-1.27],0.002150720088748
GSTM4,Glutathione S-transferase Mu 4,Chapter XI Diseases of the digestive system,Other noninfective gastroenteritis and colitis,22958,519,1.16 [1.05-1.29],0.0041684798621186
GSTM4,Glutathione S-transferase Mu 4,Chapter XI Diseases of the digestive system,Noninfectious colitis NAS,22954,515,1.17 [1.05-1.29],0.0031964843139381
GSTM4,Glutathione S-transferase Mu 4,Chapter XII Diseases of the skin and subcutaneous tissue,Scar conditions and fibrosis of skin,22498,70,0.52 [0.32-0.84],0.0079533829610798
GSTM4,Glutathione S-transferase Mu 4,Chapter XIII Diseases of the musculoskeletal system and connective tissue,Hallux valgus (acquired),18362,152,1.27 [1.07-1.50],0.005116875681342
