Protein,Protein_definition,Disease_category,Disease,NB_individual,NB_case,OR[95%CI],P_value
TNPO1,Transportin-1,Chapter I Certain infectious and parasitic diseases,Other bacterial diseases,23570,95,1.89 [1.35-2.64],0.0001888630762296
TNPO1,Transportin-1,Chapter I Certain infectious and parasitic diseases,Mycoses,23853,44,0.25 [0.11-0.58],0.0010828168489039
TNPO1,Transportin-1,Chapter I Certain infectious and parasitic diseases,Streptococcus and staphylococcus as the cause of diseases classified to other chapters,23089,120,1.81 [1.30-2.50],0.0003900397866102
TNPO1,Transportin-1,Chapter II Neoplasms,Other benign neoplasms of skin,24042,164,1.57 [1.15-2.15],0.0042931709299495
TNPO1,Transportin-1,Chapter IX Diseases of the circulatory system,Unstable angina pectoris,23543,119,0.50 [0.30-0.85],0.0099677426933429
TNPO1,Transportin-1,Chapter XIV Diseases of the genitourinary system,Other noninflammatory disorders of vagina,9765,53,1.96 [1.21-3.18],0.0061043113464197
