Protein,Protein_definition,Disease_category,Disease,NB_individual,NB_case,OR[95%CI],P_value
ANXA11,Annexin A11,Chapter IX Diseases of the circulatory system,Varicose veins,27344,443,0.80 [0.71-0.90],0.0001810160288139
ANXA11,Annexin A11,Chapter XI Diseases of the digestive system,Diseases of liver,27513,119,0.71 [0.57-0.88],0.0018990040134811
ANXA11,Annexin A11,Chapter XII Diseases of the skin and subcutaneous tissue,Atrophic disorders of skin,26718,100,0.72 [0.57-0.92],0.0077178246821565
ANXA11,Annexin A11,Chapter XII Diseases of the skin and subcutaneous tissue,Scar conditions and fibrosis of skin,26702,84,0.68 [0.53-0.87],0.0027295714440906
ANXA11,Annexin A11,Chapter XIV Diseases of the genitourinary system,Other disorders of male genital organs,11151,104,0.73 [0.58-0.93],0.0099534302080765
