Protein,Protein_definition,Disease_category,Disease,NB_individual,NB_case,OR[95%CI],P_value
CTLA4,Cytotoxic T-lymphocyte protein 4,Chapter I Certain infectious and parasitic diseases,Mycoses,24295,45,2.00 [1.27-3.14],0.0026672119715467
CTLA4,Cytotoxic T-lymphocyte protein 4,Chapter III Diseases of the blood and blood-forming organs and certain disorders involving the immune mechanism,Other anaemias,23625,308,1.70 [1.31-2.21],7.171898804473965e-05
CTLA4,Cytotoxic T-lymphocyte protein 4,Chapter III Diseases of the blood and blood-forming organs and certain disorders involving the immune mechanism,Other and unspecified anaemias,23625,308,1.70 [1.31-2.21],7.171898804473965e-05
CTLA4,Cytotoxic T-lymphocyte protein 4,"Chapter VII Diseases of the eye, adnexa, ear and mastoid process",Visual disturbances,24241,90,0.40 [0.20-0.79],0.0083844896134156
CTLA4,Cytotoxic T-lymphocyte protein 4,Chapter XI Diseases of the digestive system,"Diseases of oral cavity, salivary glands and jaws",24075,434,1.44 [1.11-1.88],0.0061911916840469
CTLA4,Cytotoxic T-lymphocyte protein 4,Chapter XIII Diseases of the musculoskeletal system and connective tissue,"Soft tissue disorders related to use, overuse and pressure",21503,52,2.00 [1.28-3.13],0.0024712383696247
CTLA4,Cytotoxic T-lymphocyte protein 4,"Chapter XV Pregnancy, childbirth and the puerperium",Perineal laceration during delivery,13129,564,0.65 [0.48-0.88],0.0053682163246958
