Protein,Protein_definition,Disease_category,Disease,NB_individual,NB_case,OR[95%CI],P_value
NPHS2,Podocin,Chapter I Certain infectious and parasitic diseases,Condition for Implicit Sepsis (Organ dysfunction codes),21892,302,0.82 [0.73-0.94],0.002832378857716
NPHS2,Podocin,Chapter VI Diseases of the nervous system,Other degenerative diseases of the nervous system,19837,155,1.23 [1.10-1.39],0.0004214921454005
NPHS2,Podocin,Chapter IX Diseases of the circulatory system,DVT of lower extremities,22854,88,1.23 [1.05-1.44],0.0093915493978083
NPHS2,Podocin,Chapter IX Diseases of the circulatory system,"!Phlebitis/thrombophlebitis venae iliacae [externae/internae/communis], drug-induced",23778,85,1.25 [1.07-1.46],0.0054230020992593
NPHS2,Podocin,Chapter XIV Diseases of the genitourinary system,Acute renal failure,22778,33,0.48 [0.28-0.83],0.0085110598600474
