Protein,Protein_definition,Disease_category,Disease,NB_individual,NB_case,OR[95%CI],P_value
PARD3,Partitioning defective 3 homolog,Chapter II Neoplasms,"Squamous cell neoplasms and carcinomas of the skin, excluding all cancers (controls excluding all cancers)",20930,116,1.28 [1.06-1.54],0.0098007554412518
PARD3,Partitioning defective 3 homolog,Chapter II Neoplasms,Leiomyoma of uterus,12991,597,1.21 [1.10-1.32],8.84622446668106e-05
PARD3,Partitioning defective 3 homolog,Chapter X Diseases of the respiratory system,Other respiratory diseases principally affecting the interstitium,23996,55,1.40 [1.10-1.78],0.0067700483839534
PARD3,Partitioning defective 3 homolog,Chapter XI Diseases of the digestive system,Diseases of the digestive system,23077,248,1.24 [1.08-1.42],0.0022714350079746
PARD3,Partitioning defective 3 homolog,Chapter XI Diseases of the digestive system,Intestinal malabsorption,22887,58,1.38 [1.09-1.76],0.0080957109962234
PARD3,Partitioning defective 3 homolog,Chapter XII Diseases of the skin and subcutaneous tissue,Nail disorders,23445,57,1.42 [1.12-1.80],0.0040189036508769
PARD3,Partitioning defective 3 homolog,"Chapter XV Pregnancy, childbirth and the puerperium",Medical abortion,13072,138,1.32 [1.09-1.59],0.0040458327480449
