Protein,Protein_definition,Disease_category,Disease,NB_individual,NB_case,OR[95%CI],P_value
FLI1,Friend leukemia integration 1 transcription factor,Chapter IX Diseases of the circulatory system,Varicose veins,26732,430,0.87 [0.80-0.94],0.0005260291729857
FLI1,Friend leukemia integration 1 transcription factor,Chapter XI Diseases of the digestive system,Diseases of liver,26904,118,0.78 [0.67-0.91],0.0019572301064502
FLI1,Friend leukemia integration 1 transcription factor,Chapter XI Diseases of the digestive system,Other diseases of liver,26851,65,0.75 [0.60-0.92],0.0063378935311564
FLI1,Friend leukemia integration 1 transcription factor,Chapter XIII Diseases of the musculoskeletal system and connective tissue,Fibroblastic disorders,24203,62,1.38 [1.14-1.67],0.0009154602056342
FLI1,Friend leukemia integration 1 transcription factor,Chapter XIV Diseases of the genitourinary system,Genitourinary diseases,23345,4326,0.96 [0.94-0.99],0.0069472122390304
FLI1,Friend leukemia integration 1 transcription factor,Chapter XIV Diseases of the genitourinary system,Irregular menses,15185,374,1.13 [1.04-1.23],0.0039225667567771
FLI1,Friend leukemia integration 1 transcription factor,"Chapter XV Pregnancy, childbirth and the puerperium",Haemorrhage in early pregnancy,15011,118,0.77 [0.65-0.91],0.0018938691453406
