Protein,Protein_definition,Disease_category,Disease,NB_individual,NB_case,OR[95%CI],P_value
C9orf40,Uncharacterized protein C9orf40,Chapter I Certain infectious and parasitic diseases,Condition for Implicit Sepsis (Organ dysfunction codes),22455,309,1.19 [1.05-1.35],0.0085615954720788
C9orf40,Uncharacterized protein C9orf40,Chapter V Mental and behavioural disorders,"Alcohol use disorder, ICD-based",24199,145,1.33 [1.09-1.61],0.0039823804091668
C9orf40,Uncharacterized protein C9orf40,Chapter XI Diseases of the digestive system,Inguinal hernia,21414,349,1.18 [1.05-1.34],0.0064169394262363
C9orf40,Uncharacterized protein C9orf40,Chapter XI Diseases of the digestive system,Acute pancreatitis,22996,49,1.56 [1.15-2.12],0.004613560311914
C9orf40,Uncharacterized protein C9orf40,Chapter XI Diseases of the digestive system,Acute pancreatitis (for exclusion),24359,49,1.57 [1.16-2.13],0.0038898640536937
C9orf40,Uncharacterized protein C9orf40,Chapter XIII Diseases of the musculoskeletal system and connective tissue,Ganglion,21485,102,0.69 [0.54-0.88],0.0025261347352814
C9orf40,Uncharacterized protein C9orf40,Chapter XIV Diseases of the genitourinary system,Inflammatory disease of cervix uteri,13077,71,0.65 [0.49-0.86],0.0029680607338029
C9orf40,Uncharacterized protein C9orf40,Chapter XIV Diseases of the genitourinary system,Unspecified/other endometriosis,9962,81,0.70 [0.54-0.91],0.0082399886279388
