Protein,Protein_definition,Disease_category,Disease,NB_individual,NB_case,OR[95%CI],P_value
PPME1,Protein phosphatase methylesterase 1,Chapter I Certain infectious and parasitic diseases,Condition for Implicit Sepsis (Organ dysfunction codes),25848,360,1.39 [1.19-1.62],2.9310769489089345e-05
PPME1,Protein phosphatase methylesterase 1,"Chapter IV Endocrine, nutritional and metabolic diseases",Metabolic disorders,24735,700,1.17 [1.05-1.31],0.0051793753565713
PPME1,Protein phosphatase methylesterase 1,Chapter VI Diseases of the nervous system,Other sleep disorders,26533,174,1.40 [1.12-1.75],0.0034571969946936
PPME1,Protein phosphatase methylesterase 1,Chapter VI Diseases of the nervous system,Sleep apnoea,27585,136,1.42 [1.10-1.82],0.0069316332638607
PPME1,Protein phosphatase methylesterase 1,Chapter X Diseases of the respiratory system,Other diseases of pleura,26951,180,1.34 [1.08-1.66],0.0081051196711513
PPME1,Protein phosphatase methylesterase 1,Chapter X Diseases of the respiratory system,Other respiratory disorders and diseases,27356,84,1.75 [1.28-2.38],0.0004281908832083
PPME1,Protein phosphatase methylesterase 1,Chapter XI Diseases of the digestive system,Inguinal hernia,24648,401,1.24 [1.07-1.43],0.0038232714203596
PPME1,Protein phosphatase methylesterase 1,Chapter XIV Diseases of the genitourinary system,Genitourinary diseases,23837,4418,0.92 [0.88-0.97],0.0013284088163957
PPME1,Protein phosphatase methylesterase 1,Chapter XIV Diseases of the genitourinary system,Inflammatory disease of cervix uteri,15067,83,0.67 [0.49-0.91],0.0099898892964562
