Protein,Protein_definition,Disease_category,Disease,NB_individual,NB_case,OR[95%CI],P_value
TAGLN3,Transgelin-3,Chapter II Neoplasms,"Malignant neoplasm of prostate, excluding all cancers (controls excluding all cancers)",9230,19,0.51 [0.31-0.84],0.0085120061134948
TAGLN3,Transgelin-3,"Chapter IV Endocrine, nutritional and metabolic diseases",Metabolic disorders,20809,602,0.83 [0.72-0.95],0.0091758014319054
TAGLN3,Transgelin-3,"Chapter IV Endocrine, nutritional and metabolic diseases",Pure hypercholesterolaemia,20640,433,0.79 [0.67-0.93],0.0043808478810334
TAGLN3,Transgelin-3,Chapter IX Diseases of the circulatory system,Other diseases of arteries and capillaries,23108,45,0.48 [0.33-0.69],8.659709056594987e-05
TAGLN3,Transgelin-3,Chapter XI Diseases of the digestive system,Irritable bowel syndrome,18262,145,1.31 [1.07-1.60],0.0090064335678106
