Protein,Protein_definition,Disease_category,Disease,NB_individual,NB_case,OR[95%CI],P_value
GLYR1,Putative oxidoreductase GLYR1,Chapter III Diseases of the blood and blood-forming organs and certain disorders involving the immune mechanism,Other and unspecified iron deficiency,23624,168,1.31 [1.09-1.57],0.0044893584002367
GLYR1,Putative oxidoreductase GLYR1,"Chapter IV Endocrine, nutritional and metabolic diseases",Metabolic disorders,21477,628,1.18 [1.05-1.32],0.004038630926832
GLYR1,Putative oxidoreductase GLYR1,Chapter X Diseases of the respiratory system,Other diseases of pleura,23399,164,1.32 [1.09-1.59],0.003838472071693
GLYR1,Putative oxidoreductase GLYR1,Chapter X Diseases of the respiratory system,Other respiratory disorders and diseases,23750,75,1.62 [1.31-2.01],9.103330327402736e-06
GLYR1,Putative oxidoreductase GLYR1,Chapter XI Diseases of the digestive system,"Diseases of oesophagus, stomach and duodenum",21071,1555,1.11 [1.02-1.19],0.0098986785517081
GLYR1,Putative oxidoreductase GLYR1,Chapter XIII Diseases of the musculoskeletal system and connective tissue,Dorsopathies,22636,804,1.17 [1.06-1.29],0.0023354688727118
GLYR1,Putative oxidoreductase GLYR1,Chapter XIII Diseases of the musculoskeletal system and connective tissue,"Other dorsopathies, not elsewhere classified",22512,680,1.17 [1.05-1.30],0.0041991041613752
GLYR1,Putative oxidoreductase GLYR1,Chapter XIV Diseases of the genitourinary system,Pain and other conditions associated with female genital organs and menstrual cycle,10098,230,1.31 [1.12-1.53],0.000710449557549
