Protein,Protein_definition,Disease_category,Disease,NB_individual,NB_case,OR[95%CI],P_value
STEAP4,Metalloreductase STEAP4,Chapter II Neoplasms,Benign neoplasm of breast,13153,81,1.35 [1.10-1.64],0.0036666834914882
STEAP4,Metalloreductase STEAP4,Chapter XI Diseases of the digestive system,Other diseases of lip and oral mucosa,22754,56,1.40 [1.13-1.74],0.0021988319356206
STEAP4,Metalloreductase STEAP4,Chapter XI Diseases of the digestive system,Oral lichen ruber planus,23728,41,1.48 [1.18-1.85],0.0007338752456799
STEAP4,Metalloreductase STEAP4,Chapter XIII Diseases of the musculoskeletal system and connective tissue,Hallux rigidus,18202,23,1.64 [1.27-2.12],0.0001469437273036
STEAP4,Metalloreductase STEAP4,Chapter XIII Diseases of the musculoskeletal system and connective tissue,Other enthesopathies,20845,66,1.34 [1.08-1.66],0.0071204819899991
