Protein,Protein_definition,Disease_category,Disease,NB_individual,NB_case,OR[95%CI],P_value
APP,Amyloid-beta precursor protein,Chapter IX Diseases of the circulatory system,"Ischaemic heart disease, wide definition",26740,571,0.82 [0.73-0.91],0.0004720191469521
APP,Amyloid-beta precursor protein,Chapter IX Diseases of the circulatory system,Angina pectoris,26520,351,0.81 [0.70-0.93],0.0032408471970086
APP,Amyloid-beta precursor protein,Chapter IX Diseases of the circulatory system,Coronary atherosclerosis,26581,423,0.76 [0.67-0.87],6.362385076435101e-05
APP,Amyloid-beta precursor protein,Chapter XI Diseases of the digestive system,Crohn's disease NAS,26695,80,1.56 [1.17-2.07],0.0021715213652128
APP,Amyloid-beta precursor protein,Chapter XIII Diseases of the musculoskeletal system and connective tissue,Spinal stenosis,25285,57,0.60 [0.42-0.87],0.0065166078543465
APP,Amyloid-beta precursor protein,Chapter XIII Diseases of the musculoskeletal system and connective tissue,Other/unspecified synovitis and tenosynovitis,24748,55,1.67 [1.19-2.34],0.0029725601665121
APP,Amyloid-beta precursor protein,Chapter XIV Diseases of the genitourinary system,Unspecified/other endometriosis,11508,93,1.48 [1.14-1.92],0.0034559415947381
APP,Amyloid-beta precursor protein,Chapter VI Diseases of the nervous system,Falls/tendency to fall,26602,525,0.85 [0.75-0.96],0.0065081158007658
