Protein,Protein_definition,Disease_category,Disease,NB_individual,NB_case,OR[95%CI],P_value
ELAVL4,ELAV-like protein 4,Chapter I Certain infectious and parasitic diseases,Implicit Sepsis,17047,431,1.18 [1.07-1.30],0.0006771621659446
ELAVL4,ELAV-like protein 4,Chapter II Neoplasms,Melanocytic naevi,23654,208,0.79 [0.66-0.94],0.0089154421466329
ELAVL4,ELAV-like protein 4,"Chapter IV Endocrine, nutritional and metabolic diseases",Type 2 diabetes,22459,281,1.17 [1.04-1.32],0.0079562778626757
ELAVL4,ELAV-like protein 4,Chapter V Mental and behavioural disorders,Other anxiety disorders,22553,57,0.61 [0.43-0.87],0.0058347982904489
ELAVL4,ELAV-like protein 4,Chapter XI Diseases of the digestive system,Ventral hernia,20550,77,1.30 [1.07-1.58],0.0093995968943604
ELAVL4,ELAV-like protein 4,Chapter XI Diseases of the digestive system,Diseases of liver,23209,108,1.30 [1.11-1.53],0.0016048534483048
ELAVL4,ELAV-like protein 4,Chapter XIII Diseases of the musculoskeletal system and connective tissue,Other systemic involvement of connective tissue,23376,37,1.45 [1.15-1.83],0.0016961640584118
ELAVL4,ELAV-like protein 4,Chapter XIV Diseases of the genitourinary system,Chronic kidney disease,22699,29,1.47 [1.14-1.90],0.0028996053926795
