Protein,Protein_definition,Disease_category,Disease,NB_individual,NB_case,OR[95%CI],P_value
PRDX1,Peroxiredoxin-1,Chapter I Certain infectious and parasitic diseases,"Bacterial, viral and other infectious agents",26583,384,0.86 [0.78-0.96],0.0067435974308693
PRDX1,Peroxiredoxin-1,Chapter V Mental and behavioural disorders,"Schizophrenia or delusion, excluding more controls",23251,72,0.64 [0.49-0.83],0.0008866106259666
PRDX1,Peroxiredoxin-1,Chapter IX Diseases of the circulatory system,"Ischaemic heart disease, wide definition",26062,552,0.89 [0.81-0.97],0.0084035084807392
PRDX1,Peroxiredoxin-1,Chapter IX Diseases of the circulatory system,Major coronary heart disease event,26968,253,0.78 [0.68-0.90],0.0003925626283225
PRDX1,Peroxiredoxin-1,Chapter IX Diseases of the circulatory system,"Myocardial infarction, strict",25665,155,0.79 [0.66-0.94],0.0077487679961794
PRDX1,Peroxiredoxin-1,Chapter IX Diseases of the circulatory system,Coronary atherosclerosis,25908,409,0.86 [0.77-0.95],0.0048170368761603
PRDX1,Peroxiredoxin-1,Chapter XI Diseases of the digestive system,Gastroduodenal ulcer,22177,195,0.82 [0.70-0.95],0.0098856594287951
PRDX1,Peroxiredoxin-1,Chapter XII Diseases of the skin and subcutaneous tissue,Other and unspecified disorders of skin and subcutaneous tissue,26112,177,0.81 [0.69-0.95],0.0084560187596305
PRDX1,Peroxiredoxin-1,Chapter XIV Diseases of the genitourinary system,Unspecified/other endometriosis,11223,86,1.30 [1.07-1.57],0.0076238529705473
