Protein,Protein_definition,Disease_category,Disease,NB_individual,NB_case,OR[95%CI],P_value
IL20,Interleukin-20,Chapter VI Diseases of the nervous system,"Nerve, nerve root and plexus disorders",26684,618,0.77 [0.65-0.92],0.0029915082136411
IL20,Interleukin-20,"Chapter VII Diseases of the eye, adnexa, ear and mastoid process",Senile cataract,26109,65,1.52 [1.16-1.98],0.0021622708167528
IL20,Interleukin-20,Chapter XI Diseases of the digestive system,Chronic gastritis,22261,98,0.45 [0.28-0.73],0.0012469355586269
IL20,Interleukin-20,Chapter XI Diseases of the digestive system,Diseases of liver,27068,118,1.35 [1.08-1.68],0.0093800563612344
IL20,Interleukin-20,Chapter XII Diseases of the skin and subcutaneous tissue,Psoriasis,27531,70,1.43 [1.09-1.87],0.0086990643159063
IL20,Interleukin-20,Chapter XII Diseases of the skin and subcutaneous tissue,Other and unspecified psoriasis,27510,49,1.48 [1.10-1.99],0.0095500417939749
IL20,Interleukin-20,Chapter XIV Diseases of the genitourinary system,Renal tubulo-interstitial diseases,26271,210,1.31 [1.09-1.57],0.0039883636289721
IL20,Interleukin-20,Chapter XIV Diseases of the genitourinary system,Unspecified kidney failure,26429,54,1.50 [1.14-1.96],0.0032331585788766
