Protein,Protein_definition,Disease_category,Disease,NB_individual,NB_case,OR[95%CI],P_value
ERN1,Serine/threonine-protein kinase/endoribonuclease IRE1,"Chapter IV Endocrine, nutritional and metabolic diseases",Disorders of the thyroid gland,18601,538,1.66 [1.38-2.00],7.995116142175341e-08
ERN1,Serine/threonine-protein kinase/endoribonuclease IRE1,Chapter IX Diseases of the circulatory system,"Ischaemic heart disease, wide definition",17582,1511,0.60 [0.52-0.70],1.0338630309056272e-11
ERN1,Serine/threonine-protein kinase/endoribonuclease IRE1,Chapter IX Diseases of the circulatory system,Coronary atherosclerosis,17262,1213,0.61 [0.52-0.72],2.300393912699925e-09
ERN1,Serine/threonine-protein kinase/endoribonuclease IRE1,Chapter IX Diseases of the circulatory system,Atrial fibrillation and flutter,8405,581,0.49 [0.39-0.63],8.701874619992415e-09
ERN1,Serine/threonine-protein kinase/endoribonuclease IRE1,Chapter XI Diseases of the digestive system,Inguinal hernia,15880,689,0.46 [0.37-0.56],2.523989953430184e-13
