Protein,Protein_definition,Disease_category,Disease,NB_individual,NB_case,HR[95%CI],P_value
ASAH2,Neutral ceramidase,"Chapter IV Endocrine, nutritional and metabolic diseases",Type 2 diabetes without complications,22137,2130,1.64 [1.50-1.78],5.23218378252431e-31
ASAH2,Neutral ceramidase,Chapter IX Diseases of the circulatory system,"Hypertension, Pulmonary Arterial",12065,258,0.68 [0.58-0.79],1.268017656539684e-06
ASAH2,Neutral ceramidase,Chapter IX Diseases of the circulatory system,Other pulmonary heart/vessel disease,22199,522,0.73 [0.64-0.82],1.207080731614796e-07
ASAH2,Neutral ceramidase,Chapter IX Diseases of the circulatory system,Secondary right heart disease,22192,515,0.72 [0.64-0.81],3.038658845618409e-08
ASAH2,Neutral ceramidase,Chapter XII Diseases of the skin and subcutaneous tissue,"Ulcer of lower limb, not elsewhere classified",20594,338,0.70 [0.60-0.80],7.66871376117936e-07
