Protein,Protein_definition,Disease_category,Disease,NB_individual,NB_case,HR[95%CI],P_value
LYPD8,Ly6/PLAUR domain-containing protein 8,Chapter I Certain infectious and parasitic diseases,Certain infectious and parasitic diseases,21766,4121,1.16 [1.10-1.22],1.1850553824308542e-08
LYPD8,Ly6/PLAUR domain-containing protein 8,Chapter II Neoplasms,"Non-Hodgkin lymphoma, all, excluding all cancers (controls excluding all cancers)",16314,196,1.55 [1.30-1.84],7.043872312647008e-07
LYPD8,Ly6/PLAUR domain-containing protein 8,"Chapter IV Endocrine, nutritional and metabolic diseases",Type 1 diabetes without complications,19925,179,1.65 [1.36-2.00],3.79436784178074e-07
LYPD8,Ly6/PLAUR domain-containing protein 8,Chapter X Diseases of the respiratory system,Idiopathic pulmonary fibrosis,21401,438,1.37 [1.19-1.57],5.571559757697741e-06
LYPD8,Ly6/PLAUR domain-containing protein 8,Chapter X Diseases of the respiratory system,Influenza and pneumonia,22407,2525,1.20 [1.12-1.27],2.200073929905347e-08
LYPD8,Ly6/PLAUR domain-containing protein 8,Chapter X Diseases of the respiratory system,"Pneumonia, organism unspecified",22124,2242,1.17 [1.09-1.25],5.604237565957382e-06
LYPD8,Ly6/PLAUR domain-containing protein 8,Chapter XI Diseases of the digestive system,"Cirrhosis of liver, NAS",22526,119,1.65 [1.36-2.01],3.309148348839309e-07
LYPD8,Ly6/PLAUR domain-containing protein 8,Chapter XI Diseases of the digestive system,Fibrosis and cirrhosis of liver,21788,140,1.59 [1.33-1.90],3.303600063034615e-07
LYPD8,Ly6/PLAUR domain-containing protein 8,Chapter XIV Diseases of the genitourinary system,Chronic kidney disease,21251,2277,1.18 [1.10-1.26],2.2962779505606416e-06
