Protein,Protein_definition,Disease_category,Disease,NB_individual,NB_case,HR[95%CI],P_value
NID2,Nidogen-2,Chapter I Certain infectious and parasitic diseases,Certain infectious and parasitic diseases,22294,4233,1.09 [1.05-1.13],5.029697673393978e-06
NID2,Nidogen-2,Chapter III Diseases of the blood and blood-forming organs and certain disorders involving the immune mechanism,"Thrombocytopenia, unspecified",22962,295,0.68 [0.59-0.79],2.286937550640548e-07
NID2,Nidogen-2,Chapter IX Diseases of the circulatory system,"Ischaemic Stroke, excluding all haemorrhages",22689,808,1.21 [1.11-1.31],6.448646915859445e-06
NID2,Nidogen-2,Chapter IX Diseases of the circulatory system,"Stroke, excluding SAH",22673,920,1.20 [1.12-1.30],1.5683489986679945e-06
NID2,Nidogen-2,Chapter IX Diseases of the circulatory system,"Stroke, including SAH",22658,961,1.19 [1.10-1.28],6.739881022314086e-06
