Protein,Protein_definition,Disease_category,Disease,Method,Nb_SNP,OR[95%CI],P_value
AREG,Amphiregulin,Chapter I Certain infectious and parasitic diseases,Mycoses,Inverse variance weighted,7,1.26 [1.07-1.50],0.0064874418787479
AREG,Amphiregulin,"Chapter IV Endocrine, nutritional and metabolic diseases",Depression or dysthymia,Inverse variance weighted,7,1.09 [1.01-1.17],0.0341208184208392
AREG,Amphiregulin,Chapter VI Diseases of the nervous system,Cerebral palsy and other paralytic syndromes,Inverse variance weighted,7,1.40 [1.08-1.81],0.0099757027478919
AREG,Amphiregulin,Chapter IX Diseases of the circulatory system,Cardiac arrest,Inverse variance weighted,7,1.49 [1.07-2.07],0.0188863478663266
AREG,Amphiregulin,Chapter IX Diseases of the circulatory system,Hypotension,Inverse variance weighted,7,1.42 [1.09-1.86],0.00952784893546
AREG,Amphiregulin,Chapter IX Diseases of the circulatory system,"Hypertension, essential",Inverse variance weighted,7,1.09 [1.01-1.18],0.024162938948226
AREG,Amphiregulin,Chapter X Diseases of the respiratory system,Emphysema,Inverse variance weighted,7,1.45 [1.02-2.05],0.0391944156037607
AREG,Amphiregulin,Chapter XI Diseases of the digestive system,Acute gastritis,Inverse variance weighted,7,1.47 [1.01-2.14],0.0438956026063363
AREG,Amphiregulin,Chapter XI Diseases of the digestive system,Other diseases of anus and rectum,Inverse variance weighted,7,0.79 [0.68-0.93],0.0037106203423578
