Protein,Protein_definition,Disease_category,Disease,Method,Nb_SNP,OR[95%CI],P_value
GSR,"Glutathione reductase, mitochondrial",Chapter IX Diseases of the circulatory system,"Hypertension, essential",Wald ratio,1,1.06 [1.01-1.10],0.0075548303606513
GSR,"Glutathione reductase, mitochondrial",Chapter IX Diseases of the circulatory system,Hypertension,Wald ratio,1,1.06 [1.02-1.10],0.0012918603504619
GSR,"Glutathione reductase, mitochondrial",Chapter IX Diseases of the circulatory system,Other other unspecified disorders of the circulatory system,Wald ratio,1,0.69 [0.52-0.93],0.0154136212531776
GSR,"Glutathione reductase, mitochondrial",Chapter X Diseases of the respiratory system,Pleural effusion,Wald ratio,1,0.78 [0.68-0.89],0.0003013864152884
GSR,"Glutathione reductase, mitochondrial",Chapter XIII Diseases of the musculoskeletal system and connective tissue,Other arthrosis,Wald ratio,1,1.08 [1.01-1.15],0.0303844930270952
