Protein,Protein_definition,Disease_category,Disease,Method,Nb_SNP,OR[95%CI],P_value
YAP1,Transcriptional coactivator YAP1,Chapter I Certain infectious and parasitic diseases,Diarrhoea and gastroenteritis of presumed infectious origin,Inverse variance weighted,10,0.88 [0.79-0.97],0.0125007869382395
YAP1,Transcriptional coactivator YAP1,Chapter IX Diseases of the circulatory system,Aortic aneurysm,Inverse variance weighted,10,1.26 [1.04-1.54],0.0214468610661286
YAP1,Transcriptional coactivator YAP1,Chapter IX Diseases of the circulatory system,Rheumatic valve diseases,Inverse variance weighted,10,0.55 [0.31-0.97],0.0384908992092823
YAP1,Transcriptional coactivator YAP1,Chapter XI Diseases of the digestive system,Other diseases of intestines,Inverse variance weighted,10,0.91 [0.84-1.00],0.0407987789367342
YAP1,Transcriptional coactivator YAP1,Chapter XIV Diseases of the genitourinary system,Hydronephrosis,Inverse variance weighted,10,1.42 [1.09-1.84],0.0101101070825596
