Protein,Protein_definition,Disease_category,Disease,Method,Nb_SNP,OR[95%CI],P_value
NECTIN2,Nectin-2,Chapter I Certain infectious and parasitic diseases,Diarrhoea and gastroenteritis of presumed infectious origin,Inverse variance weighted,8,0.92 [0.88-0.97],0.001572269955367
NECTIN2,Nectin-2,Chapter I Certain infectious and parasitic diseases,Enterocolitis due to Clostridium difficile,Inverse variance weighted,8,1.20 [1.04-1.38],0.0125082733544625
NECTIN2,Nectin-2,Chapter III Diseases of the blood and blood-forming organs and certain disorders involving the immune mechanism,Vitamin B12 deficiency anaemia,Inverse variance weighted,8,0.84 [0.72-0.98],0.0239905804211449
NECTIN2,Nectin-2,Chapter III Diseases of the blood and blood-forming organs and certain disorders involving the immune mechanism,Folate deficiency anaemia,Inverse variance weighted,8,2.47 [1.08-5.65],0.0316622612121428
NECTIN2,Nectin-2,Chapter IX Diseases of the circulatory system,Other diseases of arteries and capillaries,Inverse variance weighted,8,1.17 [1.00-1.36],0.0472426237989453
NECTIN2,Nectin-2,Chapter X Diseases of the respiratory system,Bronchiectasis,Inverse variance weighted,8,0.82 [0.68-0.99],0.0387975322951798
NECTIN2,Nectin-2,Chapter X Diseases of the respiratory system,Pulmonary oedema,Inverse variance weighted,8,0.65 [0.43-0.99],0.0448839485249502
NECTIN2,Nectin-2,Chapter XIII Diseases of the musculoskeletal system and connective tissue,Gonarthrosis,Inverse variance weighted,8,1.08 [1.01-1.16],0.0333759975214857
