Protein,Protein_definition,Disease_category,Disease,Method,Nb_SNP,OR[95%CI],P_value
TFF1,Trefoil factor 1,Chapter I Certain infectious and parasitic diseases,Mycoses,Inverse variance weighted,14,1.11 [1.01-1.23],0.0355597785779075
TFF1,Trefoil factor 1,Chapter III Diseases of the blood and blood-forming organs and certain disorders involving the immune mechanism,Other and unspecified aplastic anaemias,Inverse variance weighted,14,1.85 [1.04-3.28],0.0360431093276017
TFF1,Trefoil factor 1,"Chapter IV Endocrine, nutritional and metabolic diseases",Disorders of mineral metabolism,Inverse variance weighted,14,1.26 [1.05-1.50],0.0107771822168106
TFF1,Trefoil factor 1,"Chapter IV Endocrine, nutritional and metabolic diseases",Depression,Inverse variance weighted,14,0.96 [0.92-1.00],0.049335534429878
TFF1,Trefoil factor 1,"Chapter IV Endocrine, nutritional and metabolic diseases",Depression or dysthymia,Inverse variance weighted,14,0.95 [0.91-0.99],0.0155160821226112
TFF1,Trefoil factor 1,Chapter V Mental and behavioural disorders,Any mental disorder,Inverse variance weighted,14,0.97 [0.94-1.00],0.0472775722109158
TFF1,Trefoil factor 1,Chapter XIII Diseases of the musculoskeletal system and connective tissue,Polyarthrosis,Inverse variance weighted,14,0.89 [0.80-1.00],0.0417755576772708
TFF1,Trefoil factor 1,Chapter XIII Diseases of the musculoskeletal system and connective tissue,Gout,Inverse variance weighted,14,0.91 [0.82-0.99],0.0366165591228051
TFF1,Trefoil factor 1,Chapter XIV Diseases of the genitourinary system,Chronic nephritic syndrome,Inverse variance weighted,14,1.38 [1.08-1.78],0.0106186909839209
