Protein,Protein_definition,Disease_category,Disease,Method,Nb_SNP,OR[95%CI],P_value
IGLC2,Immunoglobulin lambda constant 2,Chapter IX Diseases of the circulatory system,Right bundle-branch block,Inverse variance weighted,14,0.73 [0.54-1.00],0.0498704257783185
IGLC2,Immunoglobulin lambda constant 2,Chapter IX Diseases of the circulatory system,Rheumatic valve diseases,Inverse variance weighted,14,2.01 [1.40-2.88],0.0001354980076529
IGLC2,Immunoglobulin lambda constant 2,Chapter X Diseases of the respiratory system,Idiopathic pulmonary fibrosis,Inverse variance weighted,14,0.80 [0.64-0.98],0.0340433193183879
IGLC2,Immunoglobulin lambda constant 2,Chapter X Diseases of the respiratory system,Unspecified acute lower respiratory infection,Inverse variance weighted,14,0.81 [0.71-0.93],0.0032681161900832
IGLC2,Immunoglobulin lambda constant 2,Chapter XIII Diseases of the musculoskeletal system and connective tissue,Polyarthropathies,Inverse variance weighted,14,1.07 [1.00-1.15],0.0428137915913151
IGLC2,Immunoglobulin lambda constant 2,Chapter XIV Diseases of the genitourinary system,Other disorders of urethra and urinary system,Inverse variance weighted,14,1.06 [1.00-1.13],0.0444562763261725
