Protein,Protein_definition,Disease_category,Disease,Method,Nb_SNP,OR[95%CI],P_value
CPM,Carboxypeptidase M,Chapter I Certain infectious and parasitic diseases,Diarrhoea and gastroenteritis of presumed infectious origin,Inverse variance weighted,23,0.93 [0.88-0.99],0.0326523769206793
CPM,Carboxypeptidase M,Chapter I Certain infectious and parasitic diseases,Intestinal infectious diseases,Inverse variance weighted,23,0.94 [0.88-1.00],0.0468685198731904
CPM,Carboxypeptidase M,"Chapter IV Endocrine, nutritional and metabolic diseases","Hyperlipidaemia, other/unspecified",Inverse variance weighted,23,1.14 [1.00-1.28],0.0428034529793395
CPM,Carboxypeptidase M,Chapter IX Diseases of the circulatory system,Angina pectoris,Inverse variance weighted,23,1.15 [1.04-1.27],0.0053769580910765
CPM,Carboxypeptidase M,Chapter IX Diseases of the circulatory system,Coronary atherosclerosis,Inverse variance weighted,23,1.10 [1.01-1.19],0.0252239334999907
