Protein,Protein_definition,Disease_category,Disease,Method,Nb_SNP,OR[95%CI],P_value
DTNB,Dystrobrevin beta,Chapter III Diseases of the blood and blood-forming organs and certain disorders involving the immune mechanism,Anaemia in chronic diseases classified elsewhere,Inverse variance weighted,4,0.12 [0.02-0.98],0.0473373058838908
DTNB,Dystrobrevin beta,"Chapter IV Endocrine, nutritional and metabolic diseases",Other disorders of glucose regulation and pancreatic internal secretion,Inverse variance weighted,4,0.38 [0.19-0.73],0.0036837418189799
DTNB,Dystrobrevin beta,"Chapter IV Endocrine, nutritional and metabolic diseases",Disorders of mineral metabolism,Inverse variance weighted,4,0.41 [0.19-0.86],0.0182862366086261
DTNB,Dystrobrevin beta,Chapter IX Diseases of the circulatory system,Atrial fibrillation and flutter,Inverse variance weighted,4,1.34 [1.05-1.71],0.0168350081119994
DTNB,Dystrobrevin beta,Chapter X Diseases of the respiratory system,Unspecified acute lower respiratory infection,Inverse variance weighted,4,0.53 [0.32-0.89],0.0166743802027787
DTNB,Dystrobrevin beta,Chapter XIII Diseases of the musculoskeletal system and connective tissue,Pain in joint,Inverse variance weighted,4,0.73 [0.58-0.91],0.006010358545334
