Protein,Protein_definition,Disease_category,Disease,Method,Nb_SNP,OR[95%CI],P_value
CCN4,CCN family member 4,Chapter I Certain infectious and parasitic diseases,Mycoses,Inverse variance weighted,40,0.94 [0.89-0.99],0.0164680675294557
CCN4,CCN family member 4,"Chapter IV Endocrine, nutritional and metabolic diseases",Hypo-osmolality and hyponatraemia,Inverse variance weighted,40,0.89 [0.83-0.96],0.0030686798787444
CCN4,CCN family member 4,Chapter VI Diseases of the nervous system,"Other and unspecified polyneuropathies, also in other diseases",Inverse variance weighted,40,0.92 [0.86-0.98],0.0111452315270111
CCN4,CCN family member 4,Chapter IX Diseases of the circulatory system,"Myocardial infarction, strict",Inverse variance weighted,40,1.05 [1.01-1.09],0.0175495290750792
CCN4,CCN family member 4,Chapter XIV Diseases of the genitourinary system,Unspecified kidney failure,Inverse variance weighted,40,1.11 [1.00-1.22],0.0470252298664095
