Protein,Protein_definition,Disease_category,Disease,Method,Nb_SNP,OR[95%CI],P_value
IDUA,Alpha-L-iduronidase,Chapter XI Diseases of the digestive system,"Cirrhosis of liver, NAS",Inverse variance weighted,55,0.88 [0.79-0.98],0.0260107233075265
IDUA,Alpha-L-iduronidase,"Chapter IV Endocrine, nutritional and metabolic diseases","Other disorders of fluid, electrolyte and acid-base balance",Inverse variance weighted,55,1.06 [1.02-1.10],0.0044635484759048
IDUA,Alpha-L-iduronidase,"Chapter IV Endocrine, nutritional and metabolic diseases",Hypo-osmolality and hyponatraemia,Inverse variance weighted,55,1.09 [1.04-1.15],0.0008748260087683
IDUA,Alpha-L-iduronidase,Chapter IX Diseases of the circulatory system,Oesophageal varices,Inverse variance weighted,55,0.86 [0.77-0.97],0.0128543637287117
IDUA,Alpha-L-iduronidase,Chapter X Diseases of the respiratory system,Influenza and pneumonia,Inverse variance weighted,55,0.98 [0.96-1.00],0.0174958021272272
