Protein,Protein_definition,Disease_category,Disease,Method,Nb_SNP,OR[95%CI],P_value
SLURP1,Secreted Ly-6/uPAR-related protein 1,"Chapter IV Endocrine, nutritional and metabolic diseases",Other disorders of glucose regulation and pancreatic internal secretion,Inverse variance weighted,24,0.82 [0.71-0.95],0.0071862489010143
SLURP1,Secreted Ly-6/uPAR-related protein 1,"Chapter IV Endocrine, nutritional and metabolic diseases",Hyperkalaemia,Inverse variance weighted,24,0.83 [0.70-0.98],0.0309402349988792
SLURP1,Secreted Ly-6/uPAR-related protein 1,Chapter IX Diseases of the circulatory system,Other arterial embolism and thrombosis,Inverse variance weighted,24,0.76 [0.60-0.96],0.0233181079749312
SLURP1,Secreted Ly-6/uPAR-related protein 1,Chapter X Diseases of the respiratory system,Pulmonary oedema,Inverse variance weighted,24,1.40 [1.04-1.89],0.0254228639231441
SLURP1,Secreted Ly-6/uPAR-related protein 1,Chapter XIII Diseases of the musculoskeletal system and connective tissue,Gout,Inverse variance weighted,24,1.10 [1.02-1.18],0.0117880908563119
