Protein,Protein_definition,Disease_category,Disease,Method,Nb_SNP,OR[95%CI],P_value
KITLG,Kit ligand,"Chapter IV Endocrine, nutritional and metabolic diseases",Hyperparathyroidism,Inverse variance weighted,31,1.19 [1.03-1.37],0.0173094173977116
KITLG,Kit ligand,"Chapter IV Endocrine, nutritional and metabolic diseases",Disorders of lipoprotein metabolism and other lipidaemias,Inverse variance weighted,31,1.13 [1.04-1.23],0.0031852284946636
KITLG,Kit ligand,"Chapter IV Endocrine, nutritional and metabolic diseases",Metabolic disorders,Inverse variance weighted,31,1.10 [1.03-1.17],0.0058385879212196
KITLG,Kit ligand,Chapter X Diseases of the respiratory system,Chronic lower respiratory diseases,Inverse variance weighted,31,0.96 [0.91-1.00],0.0463357890932804
KITLG,Kit ligand,Chapter XI Diseases of the digestive system,Other inflammatory liver diseases,Inverse variance weighted,31,1.37 [1.11-1.69],0.0030703196784374
KITLG,Kit ligand,Chapter V Mental and behavioural disorders,Any mental disorder,Inverse variance weighted,31,1.04 [1.00-1.08],0.0453655253468526
