Protein,Protein_definition,Disease_category,Disease,Method,Nb_SNP,OR[95%CI],P_value
SCARB2,Lysosome membrane protein 2,"Chapter IV Endocrine, nutritional and metabolic diseases",Disorders of magnesium metabolism,Inverse variance weighted,17,2.35 [1.07-5.15],0.0330611711287996
SCARB2,Lysosome membrane protein 2,"Chapter IV Endocrine, nutritional and metabolic diseases",Vitamin D deficiency,Inverse variance weighted,17,1.72 [1.07-2.76],0.0245499903732282
SCARB2,Lysosome membrane protein 2,Chapter VI Diseases of the nervous system,Epilepsy,Inverse variance weighted,17,1.10 [1.01-1.21],0.0366874811653402
SCARB2,Lysosome membrane protein 2,Chapter X Diseases of the respiratory system,Acute upper respiratory infections,Inverse variance weighted,17,0.95 [0.91-0.99],0.0143987025109254
SCARB2,Lysosome membrane protein 2,Chapter XI Diseases of the digestive system,Fibrosis and cirrhosis of liver,Inverse variance weighted,17,1.31 [1.04-1.64],0.0207977856539105
SCARB2,Lysosome membrane protein 2,Chapter XI Diseases of the digestive system,Acute peritonitis,Inverse variance weighted,17,1.31 [1.04-1.65],0.0221959576446653
SCARB2,Lysosome membrane protein 2,Chapter XIII Diseases of the musculoskeletal system and connective tissue,Disorders of muscles,Inverse variance weighted,17,1.28 [1.06-1.55],0.010081527417564
SCARB2,Lysosome membrane protein 2,Chapter XIV Diseases of the genitourinary system,Other diseases of urinary system,Inverse variance weighted,17,1.05 [1.00-1.11],0.0310655897166946
