Protein,Protein_definition,Disease_category,Disease,NB_individual,NB_case,HR[95%CI],P_value
C9,Complement component C9,Chapter III Diseases of the blood and blood-forming organs and certain disorders involving the immune mechanism,Diseases of the blood and blood-forming organs and certain disorders involving the immune mechanism,23929,1986,1.29 [1.19-1.40],1.1400109085667803e-09
C9,Complement component C9,"Chapter IV Endocrine, nutritional and metabolic diseases",Disorders of lipoprotein metabolism and other lipidaemias,23104,2144,0.79 [0.74-0.85],3.460198657483157e-10
C9,Complement component C9,"Chapter IV Endocrine, nutritional and metabolic diseases",Type 2 diabetes without complications,24281,1355,0.77 [0.70-0.84],2.5862528766742557e-09
C9,Complement component C9,Chapter X Diseases of the respiratory system,"COPD, hospital admissions 1, only main diagnosis",24558,646,1.54 [1.34-1.78],2.9844080120296358e-09
C9,Complement component C9,Chapter XIII Diseases of the musculoskeletal system and connective tissue,"Gout, unspecified",24600,336,0.64 [0.54-0.75],9.969018826432528e-08
