Protein,Protein_definition,Disease_category,Disease,NB_individual,NB_case,OR[95%CI],P_value
CES1,Liver carboxylesterase 1,"Chapter IV Endocrine, nutritional and metabolic diseases",Type 2 diabetes,47804,1122,1.21 [1.14-1.29],1.6028703984260202e-10
CES1,Liver carboxylesterase 1,"Chapter IV Endocrine, nutritional and metabolic diseases",Type 2 diabetes without complications,47767,1085,1.22 [1.15-1.30],5.737549727587288e-11
CES1,Liver carboxylesterase 1,"Chapter VII Diseases of the eye, adnexa, ear and mastoid process",Diabetic maculopathy,4401,107,0.57 [0.47-0.69],6.067649484649865e-09
CES1,Liver carboxylesterase 1,Chapter XI Diseases of the digestive system,Noninfective enteritis and colitis,49653,1515,1.16 [1.10-1.23],3.109459719740363e-08
CES1,Liver carboxylesterase 1,Chapter XIV Diseases of the genitourinary system,Chronic kidney disease,46525,141,0.59 [0.49-0.72],9.849178752621569e-08
