Protein,Protein_definition,Disease_category,Disease,NB_individual,NB_case,OR[95%CI],P_value
NID1,Nidogen-1,Chapter IX Diseases of the circulatory system,Venous thromboembolism,50070,456,1.79 [1.45-2.20],4.152324640403762e-08
NID1,Nidogen-1,Chapter X Diseases of the respiratory system,Diseases of the respiratory system,41074,4131,1.25 [1.16-1.35],4.672645082266421e-09
NID1,Nidogen-1,Chapter XIII Diseases of the musculoskeletal system and connective tissue,Rheumatoid arthritis,35958,297,2.10 [1.64-2.70],4.843935054029734e-09
NID1,Nidogen-1,Chapter XIII Diseases of the musculoskeletal system and connective tissue,"Other (seronegative) rheumatoid arthritis, wide",50659,285,2.13 [1.66-2.74],3.775101489571404e-09
NID1,Nidogen-1,Chapter XIII Diseases of the musculoskeletal system and connective tissue,Other/unspecified rheumatoid arthritis,50681,257,2.08 [1.59-2.71],7.218898223596886e-08
