Protein,Protein_definition,Disease_category,Disease,NB_individual,NB_case,OR[95%CI],P_value
FCRL5,Fc receptor-like protein 5,"Chapter IV Endocrine, nutritional and metabolic diseases",Type 1 diabetes,46841,270,1.63 [1.37-1.94],4.176072703961665e-08
FCRL5,Fc receptor-like protein 5,"Chapter IV Endocrine, nutritional and metabolic diseases",Type 1 diabetes without complications,46814,243,1.67 [1.39-2.01],3.5322068183982655e-08
FCRL5,Fc receptor-like protein 5,Chapter XI Diseases of the digestive system,Diseases of liver,49856,246,1.71 [1.43-2.05],5.922937285374516e-09
FCRL5,Fc receptor-like protein 5,"Chapter XV Pregnancy, childbirth and the puerperium",Complications of labour and delivery,27768,1201,1.36 [1.22-1.51],3.6658101789510806e-08
FCRL5,Fc receptor-like protein 5,"Chapter XV Pregnancy, childbirth and the puerperium",Labour and delivery complicated by fetal stress [distress],27005,438,1.60 [1.36-1.89],2.4127585896669292e-08
