Protein,Protein_definition,Disease_category,Disease,NB_individual,NB_case,OR[95%CI],P_value
BCHE,Cholinesterase,Chapter III Diseases of the blood and blood-forming organs and certain disorders involving the immune mechanism,Diseases of the blood and blood-forming organs and certain disorders involving the immune mechanism,39138,1318,0.59 [0.50-0.71],6.227116166592454e-09
BCHE,Cholinesterase,"Chapter IV Endocrine, nutritional and metabolic diseases",Metabolic disorders,35561,1929,1.63 [1.37-1.93],3.0489648322237794e-08
BCHE,Cholinesterase,"Chapter IV Endocrine, nutritional and metabolic diseases",Disorders of lipoprotein metabolism and other lipidaemias,35267,1635,2.08 [1.72-2.52],4.111858262244905e-14
BCHE,Cholinesterase,"Chapter IV Endocrine, nutritional and metabolic diseases",Pure hypercholesterolaemia,35146,1514,2.13 [1.75-2.59],5.579070663842685e-14
BCHE,Cholinesterase,Chapter IX Diseases of the circulatory system,"Heart failure, strict",42166,353,0.43 [0.32-0.58],2.636787975895176e-08
BCHE,Cholinesterase,Chapter XI Diseases of the digestive system,Diseases of liver,42567,204,0.32 [0.22-0.47],2.9165118005562716e-09
