Protein,Protein_definition,Disease_category,Disease,NB_individual,NB_case,OR[95%CI],P_value
RBP1,Retinol-binding protein 1,Chapter III Diseases of the blood and blood-forming organs and certain disorders involving the immune mechanism,Diseases of the blood and blood-forming organs and certain disorders involving the immune mechanism,38769,1299,1.27 [1.19-1.34],5.597032789111404e-15
RBP1,Retinol-binding protein 1,"Chapter IV Endocrine, nutritional and metabolic diseases",Disorders of the thyroid gland,41022,906,1.25 [1.16-1.34],1.538221168701706e-09
RBP1,Retinol-binding protein 1,Chapter IX Diseases of the circulatory system,Hypertensive Renal Disease,28802,92,1.57 [1.33-1.85],7.083523159016919e-08
RBP1,Retinol-binding protein 1,Chapter XI Diseases of the digestive system,Diseases of the digestive system,41197,520,1.33 [1.22-1.45],5.330671007947616e-11
RBP1,Retinol-binding protein 1,Chapter XI Diseases of the digestive system,Intestinal malabsorption,40794,117,1.70 [1.50-1.92],2.229522418615923e-17
RBP1,Retinol-binding protein 1,Chapter XI Diseases of the digestive system,Coeliac disease,40775,98,1.71 [1.50-1.95],2.358635965731058e-15
RBP1,Retinol-binding protein 1,Chapter XIV Diseases of the genitourinary system,Chronic kidney disease,39554,83,1.70 [1.46-1.97],9.598920792917349e-12
