Protein,Protein_definition,Disease_category,Disease,NB_individual,NB_case,HR[95%CI],P_value
ARHGAP45,Rho GTPase-activating protein 45,Chapter III Diseases of the blood and blood-forming organs and certain disorders involving the immune mechanism,Other and unspecified iron deficiency,23350,1063,1.14 [1.06-1.23],0.0002921610365399
ARHGAP45,Rho GTPase-activating protein 45,Chapter X Diseases of the respiratory system,Bronchiectasis,20464,345,1.27 [1.12-1.44],0.0001815950643553
ARHGAP45,Rho GTPase-activating protein 45,Chapter XII Diseases of the skin and subcutaneous tissue,Other and unspecified psoriasis,23509,149,0.69 [0.56-0.83],0.0001662547404628
ARHGAP45,Rho GTPase-activating protein 45,Chapter XII Diseases of the skin and subcutaneous tissue,Psoriasis,23575,215,0.75 [0.64-0.88],0.0005691040184524
ARHGAP45,Rho GTPase-activating protein 45,Chapter XIV Diseases of the genitourinary system,Irregular menses,23311,107,0.67 [0.53-0.85],0.0008344201582665
