Protein,Protein_definition,Disease_category,Disease,NB_individual,NB_case,HR[95%CI],P_value
PPM1B,Protein phosphatase 1B,Chapter IX Diseases of the circulatory system,Atrial fibrillation and flutter,15288,1246,1.16 [1.07-1.26],0.0003691798044314
PPM1B,Protein phosphatase 1B,Chapter X Diseases of the respiratory system,Respiratory insufficiency,16649,41,1.61 [1.24-2.09],0.0003544867983908
PPM1B,Protein phosphatase 1B,Chapter XI Diseases of the digestive system,Coeliac disease,22210,129,1.35 [1.14-1.60],0.0006125762838915
PPM1B,Protein phosphatase 1B,Chapter XI Diseases of the digestive system,Intestinal malabsorption,22237,156,1.33 [1.13-1.56],0.0005230431904578
PPM1B,Protein phosphatase 1B,Chapter XI Diseases of the digestive system,Oesophageal obstruction,17751,129,1.37 [1.15-1.64],0.0004675050280188
