Protein,Protein_definition,Disease_category,Disease,NB_individual,NB_case,HR[95%CI],P_value
CNPY2,Protein canopy homolog 2,Chapter III Diseases of the blood and blood-forming organs and certain disorders involving the immune mechanism,Other and unspecified iron deficiency,26873,1269,1.15 [1.07-1.24],0.0001155790943388
CNPY2,Protein canopy homolog 2,Chapter III Diseases of the blood and blood-forming organs and certain disorders involving the immune mechanism,Vitamin B12 deficiency anaemia,25737,133,1.38 [1.17-1.63],0.0001577254176636
CNPY2,Protein canopy homolog 2,Chapter IX Diseases of the circulatory system,Cerebral atherosclerosis,27276,34,1.81 [1.45-2.27],1.5783076627816573e-07
CNPY2,Protein canopy homolog 2,Chapter XIII Diseases of the musculoskeletal system and connective tissue,Sicca syndrome [Sjgren],26386,157,1.41 [1.22-1.64],6.411209748938293e-06
CNPY2,Protein canopy homolog 2,Chapter XIV Diseases of the genitourinary system,Chronic nephritic syndrome,27103,79,1.44 [1.17-1.78],0.0006939960283094
