Protein,Protein_definition,Disease_category,Disease,NB_individual,NB_case,HR[95%CI],P_value
ARFIP1,Arfaptin-1,Chapter III Diseases of the blood and blood-forming organs and certain disorders involving the immune mechanism,Other and unspecified iron deficiency,23821,1085,1.19 [1.09-1.29],3.9485195686239205e-05
ARFIP1,Arfaptin-1,"Chapter IV Endocrine, nutritional and metabolic diseases",Disorders of lipoprotein metabolism and other lipidaemias,22066,2762,1.10 [1.04-1.15],0.0006339692988769
ARFIP1,Arfaptin-1,"Chapter IV Endocrine, nutritional and metabolic diseases",Metabolic disorders,23411,4107,1.09 [1.04-1.13],0.0001389219606872
ARFIP1,Arfaptin-1,Chapter XII Diseases of the skin and subcutaneous tissue,Psoriasis,24044,219,0.72 [0.60-0.87],0.0008038376333792
ARFIP1,Arfaptin-1,Chapter XIV Diseases of the genitourinary system,Irregular menses,23773,109,0.61 [0.46-0.80],0.0004648386621117
