Protein,Protein_definition,Disease_category,Disease,NB_individual,NB_case,HR[95%CI],P_value
AMPD3,AMP deaminase 3,Chapter I Certain infectious and parasitic diseases,Implicit Sepsis,16880,1430,1.13 [1.06-1.21],0.0002787678051705
AMPD3,AMP deaminase 3,"Chapter IV Endocrine, nutritional and metabolic diseases",Obesity,24005,1797,0.89 [0.83-0.94],0.0001236407317083
AMPD3,AMP deaminase 3,"Chapter IV Endocrine, nutritional and metabolic diseases","Obesity, other/unspecified",24009,1796,0.89 [0.84-0.95],0.0001776740828752
AMPD3,AMP deaminase 3,"Chapter IV Endocrine, nutritional and metabolic diseases",Type 2 diabetes without complications,23753,1309,1.15 [1.07-1.23],0.0001501261957953
AMPD3,AMP deaminase 3,Chapter XIII Diseases of the musculoskeletal system and connective tissue,Other specified/unspecified arthritis,18082,1760,0.89 [0.84-0.95],0.0003362829680004
