Protein,Protein_definition,Disease_category,Disease,NB_individual,NB_case,HR[95%CI],P_value
KLB,Beta-klotho,"Chapter IV Endocrine, nutritional and metabolic diseases",Type 2 diabetes with ophthalmic complications,1788,185,1.34 [1.13-1.59],0.0008915525333128
KLB,Beta-klotho,"Chapter IV Endocrine, nutritional and metabolic diseases",Type 2 diabetes without complications,26636,1458,0.87 [0.81-0.93],3.0499853477390704e-05
KLB,Beta-klotho,Chapter VI Diseases of the nervous system,Epilepsy,25635,273,1.36 [1.18-1.56],1.2554513077093958e-05
KLB,Beta-klotho,Chapter VI Diseases of the nervous system,Generalized epilepsy,26747,48,1.74 [1.29-2.35],0.0002614049565133
KLB,Beta-klotho,Chapter XIII Diseases of the musculoskeletal system and connective tissue,Systemic lupus erythematosus,26297,220,1.34 [1.15-1.57],0.0001553647307902
