Protein,Protein_definition,Disease_category,Disease,NB_individual,NB_case,HR[95%CI],P_value
POSTN,Periostin,Chapter III Diseases of the blood and blood-forming organs and certain disorders involving the immune mechanism,Vitamin B12 deficiency anaemia,22885,114,0.41 [0.25-0.67],0.0003622613783784
POSTN,Periostin,"Chapter IV Endocrine, nutritional and metabolic diseases","Disorder of lipoprotein metabolism, unspecified",19362,46,2.67 [1.58-4.49],0.0002252913457022
POSTN,Periostin,"Chapter IV Endocrine, nutritional and metabolic diseases",Type 2 diabetes without complications,23805,1320,0.65 [0.56-0.74],1.6698227195044459e-09
POSTN,Periostin,Chapter IX Diseases of the circulatory system,Phlebitis and thrombophlebitis (not including DVT),22977,290,1.63 [1.23-2.15],0.0005847393378767
POSTN,Periostin,Chapter IX Diseases of the circulatory system,Venous thromboembolism,24034,614,1.53 [1.26-1.86],2.0375524745465315e-05
POSTN,Periostin,Chapter X Diseases of the respiratory system,Early onset COPD,23437,284,0.58 [0.43-0.79],0.0004937269175609
POSTN,Periostin,Chapter XI Diseases of the digestive system,Collagenous colitis,22543,96,2.15 [1.37-3.37],0.0008060205629986
POSTN,Periostin,Chapter XIII Diseases of the musculoskeletal system and connective tissue,Other/unspecified dorsalgia,21211,570,1.41 [1.15-1.73],0.0008349637594891
