Protein,Protein_definition,Disease_category,Disease,NB_individual,NB_case,HR[95%CI],P_value
GGCT,Gamma-glutamylcyclotransferase,Chapter III Diseases of the blood and blood-forming organs and certain disorders involving the immune mechanism,Other and unspecified iron deficiency,23818,1083,1.22 [1.09-1.38],0.0007188469855544
GGCT,Gamma-glutamylcyclotransferase,"Chapter IV Endocrine, nutritional and metabolic diseases",Disorders of lipoprotein metabolism and other lipidaemias,22043,2755,1.14 [1.06-1.23],0.0006552372535646
GGCT,Gamma-glutamylcyclotransferase,"Chapter IV Endocrine, nutritional and metabolic diseases",Metabolic disorders,23401,4113,1.13 [1.06-1.20],7.460086690282318e-05
GGCT,Gamma-glutamylcyclotransferase,Chapter X Diseases of the respiratory system,Diseases of the respiratory system,22317,4526,1.11 [1.05-1.18],0.0002732098111081
GGCT,Gamma-glutamylcyclotransferase,Chapter X Diseases of the respiratory system,Emphysema,20752,235,1.58 [1.24-2.01],0.0001920542475405
GGCT,Gamma-glutamylcyclotransferase,Chapter XIV Diseases of the genitourinary system,Irregular menses,23762,110,0.51 [0.34-0.76],0.0009859091204754
