Protein,Protein_definition,Disease_category,Disease,NB_individual,NB_case,HR[95%CI],P_value
CRYZL1,Quinone oxidoreductase-like protein 1,Chapter III Diseases of the blood and blood-forming organs and certain disorders involving the immune mechanism,Diseases of the blood and blood-forming organs and certain disorders involving the immune mechanism,22733,2528,1.07 [1.03-1.12],0.0006901277918237
CRYZL1,Quinone oxidoreductase-like protein 1,Chapter III Diseases of the blood and blood-forming organs and certain disorders involving the immune mechanism,Other and unspecified iron deficiency,23255,1065,1.19 [1.12-1.27],1.057378817878763e-07
CRYZL1,Quinone oxidoreductase-like protein 1,"Chapter IV Endocrine, nutritional and metabolic diseases",Disorders of lipoprotein metabolism and other lipidaemias,21518,2678,1.08 [1.04-1.12],0.0002429211883571
CRYZL1,Quinone oxidoreductase-like protein 1,"Chapter IV Endocrine, nutritional and metabolic diseases",Metabolic disorders,22850,4010,1.07 [1.03-1.10],0.0001236182132446
CRYZL1,Quinone oxidoreductase-like protein 1,Chapter X Diseases of the respiratory system,Diseases of the respiratory system,21789,4414,1.07 [1.03-1.10],4.202616309074665e-05
