Protein,Protein_definition,Disease_category,Disease,NB_individual,NB_case,HR[95%CI],P_value
STXBP1,Syntaxin-binding protein 1,Chapter III Diseases of the blood and blood-forming organs and certain disorders involving the immune mechanism,Other and unspecified iron deficiency,23821,1085,1.15 [1.07-1.24],0.0002249309062757
STXBP1,Syntaxin-binding protein 1,Chapter XI Diseases of the digestive system,Impacted teeth,24106,52,1.90 [1.34-2.68],0.0002872201312162
STXBP1,Syntaxin-binding protein 1,Chapter XI Diseases of the digestive system,Ulcerative colitis,22574,150,1.42 [1.16-1.74],0.0007512659016942
STXBP1,Syntaxin-binding protein 1,Chapter XII Diseases of the skin and subcutaneous tissue,Lupus erythematosus,22274,89,0.65 [0.50-0.83],0.0007482764186585
STXBP1,Syntaxin-binding protein 1,Chapter XII Diseases of the skin and subcutaneous tissue,Other and unspecified psoriasis,23976,151,0.72 [0.59-0.87],0.0008476440579145
STXBP1,Syntaxin-binding protein 1,Chapter XIII Diseases of the musculoskeletal system and connective tissue,Other systemic involvement of connective tissue,23670,458,1.22 [1.08-1.37],0.0009931055582368
