Protein,Protein_definition,Disease_category,Disease,NB_individual,NB_case,HR[95%CI],P_value
TMOD4,Tropomodulin-4,Chapter I Certain infectious and parasitic diseases,Implicit bacterial Sepsis,20971,768,1.31 [1.12-1.52],0.0007508776681435
TMOD4,Tropomodulin-4,Chapter III Diseases of the blood and blood-forming organs and certain disorders involving the immune mechanism,Anaemia in chronic diseases classified elsewhere,21664,82,1.95 [1.39-2.75],0.0001194579103633
TMOD4,Tropomodulin-4,Chapter VI Diseases of the nervous system,Small fibre neuropathy,23140,33,2.24 [1.45-3.45],0.0002491015931697
TMOD4,Tropomodulin-4,Chapter XII Diseases of the skin and subcutaneous tissue,Decubitus ulcer and pressure area,21684,269,1.54 [1.21-1.95],0.0003815242250771
TMOD4,Tropomodulin-4,Chapter XII Diseases of the skin and subcutaneous tissue,Other disorders of skin and subcutaneous tissue,22776,1361,1.24 [1.10-1.39],0.0003780571015666
