Protein,Protein_definition,Disease_category,Disease,NB_individual,NB_case,HR[95%CI],P_value
ECM1,Extracellular matrix protein 1,Chapter X Diseases of the respiratory system,All influenza,22111,114,2.63 [1.57-4.38],0.0002207048086998
ECM1,Extracellular matrix protein 1,Chapter X Diseases of the respiratory system,All influenza (not pneumonia),22110,113,2.66 [1.59-4.45],0.0001856203027288
ECM1,Extracellular matrix protein 1,Chapter XIII Diseases of the musculoskeletal system and connective tissue,Arthrosis,20205,4283,0.87 [0.81-0.95],0.0007329451385727
ECM1,Extracellular matrix protein 1,Chapter XIII Diseases of the musculoskeletal system and connective tissue,Other arthrosis,18536,2614,0.83 [0.75-0.92],0.0002422514391764
ECM1,Extracellular matrix protein 1,Chapter XIV Diseases of the genitourinary system,Other disorders of  bladder,21018,405,0.66 [0.52-0.83],0.0004032954357487
