Protein,Protein_definition,Disease_category,Disease,NB_individual,NB_case,HR[95%CI],P_value
CARHSP1,Calcium-regulated heat-stable protein 1,Chapter II Neoplasms,Lung cancer and mesothelioma,19435,311,1.35 [1.13-1.61],0.0007817238239102
CARHSP1,Calcium-regulated heat-stable protein 1,Chapter II Neoplasms,"Non-small cell lung cancer, excluding all cancers (controls excluding all cancers)",22220,226,1.46 [1.19-1.79],0.0003130709272171
CARHSP1,Calcium-regulated heat-stable protein 1,"Chapter IV Endocrine, nutritional and metabolic diseases",Acidosis,21836,247,1.39 [1.15-1.69],0.0007822642458354
CARHSP1,Calcium-regulated heat-stable protein 1,Chapter XII Diseases of the skin and subcutaneous tissue,Disorders of skin appendages,26665,470,0.74 [0.63-0.87],0.0002282015310402
CARHSP1,Calcium-regulated heat-stable protein 1,Chapter XII Diseases of the skin and subcutaneous tissue,Follicular cysts of skin and subcutaneous tissue,26518,323,0.68 [0.56-0.83],0.0001091893683621
