Protein,Protein_definition,Disease_category,Disease,NB_individual,NB_case,HR[95%CI],P_value
IFT20,Intraflagellar transport protein 20 homolog,Chapter III Diseases of the blood and blood-forming organs and certain disorders involving the immune mechanism,Other and unspecified iron deficiency,23192,1053,1.26 [1.11-1.43],0.0003289529961523
IFT20,Intraflagellar transport protein 20 homolog,"Chapter IV Endocrine, nutritional and metabolic diseases",Acidosis,18991,202,1.59 [1.22-2.07],0.0005938659599591
IFT20,Intraflagellar transport protein 20 homolog,"Chapter IV Endocrine, nutritional and metabolic diseases",Hyperkalaemia,18957,168,1.70 [1.28-2.26],0.0002310566994776
IFT20,Intraflagellar transport protein 20 homolog,"Chapter IV Endocrine, nutritional and metabolic diseases",Metabolic disorders,22799,4010,1.12 [1.05-1.20],0.0007103777677624
IFT20,Intraflagellar transport protein 20 homolog,Chapter XI Diseases of the digestive system,Coeliac disease,22232,124,1.94 [1.45-2.59],7.947644492654276e-06
IFT20,Intraflagellar transport protein 20 homolog,Chapter XI Diseases of the digestive system,Intestinal malabsorption,22258,150,1.68 [1.26-2.24],0.0003885747524082
IFT20,Intraflagellar transport protein 20 homolog,Chapter XIII Diseases of the musculoskeletal system and connective tissue,Other systemic involvement of connective tissue,23042,446,1.41 [1.17-1.69],0.0002778096081429
IFT20,Intraflagellar transport protein 20 homolog,Chapter XIV Diseases of the genitourinary system,Dialysis,21735,43,2.35 [1.48-3.73],0.0002861112740579
