Protein,Protein_definition,Disease_category,Disease,NB_individual,NB_case,HR[95%CI],P_value
CERT,Ceramide transfer protein,Chapter III Diseases of the blood and blood-forming organs and certain disorders involving the immune mechanism,Diseases of the blood and blood-forming organs and certain disorders involving the immune mechanism,26107,2923,1.12 [1.06-1.18],2.904039484312233e-05
CERT,Ceramide transfer protein,Chapter III Diseases of the blood and blood-forming organs and certain disorders involving the immune mechanism,Idiopathic thrombocytopenic purpura,26712,48,1.90 [1.33-2.71],0.0004257215293933
CERT,Ceramide transfer protein,Chapter III Diseases of the blood and blood-forming organs and certain disorders involving the immune mechanism,Other and unspecified iron deficiency,26705,1258,1.21 [1.12-1.32],2.888348982479749e-06
CERT,Ceramide transfer protein,"Chapter IV Endocrine, nutritional and metabolic diseases",Type 2 diabetes without complications,26636,1458,1.14 [1.06-1.23],0.0008073685284331
CERT,Ceramide transfer protein,Chapter IX Diseases of the circulatory system,Death due to cardiac causes,24375,7164,1.06 [1.02-1.10],0.0008609619080637
CERT,Ceramide transfer protein,Chapter X Diseases of the respiratory system,Diseases of the respiratory system,25053,5122,1.09 [1.05-1.14],1.537720850948775e-05
CERT,Ceramide transfer protein,Chapter X Diseases of the respiratory system,Emphysema,23304,271,1.42 [1.19-1.69],8.386532800575202e-05
CERT,Ceramide transfer protein,Chapter XI Diseases of the digestive system,Noninfective enteritis and colitis,26206,1087,1.16 [1.06-1.26],0.0009158181464782
CERT,Ceramide transfer protein,Chapter XIII Diseases of the musculoskeletal system and connective tissue,Other/unspecified rheumatoid arthritis,26926,579,1.24 [1.10-1.40],0.0004356407840907
