Protein,Protein_definition,Disease_category,Disease,NB_individual,NB_case,HR[95%CI],P_value
SUSD1,Sushi domain-containing protein 1,Chapter III Diseases of the blood and blood-forming organs and certain disorders involving the immune mechanism,Other and unspecified iron deficiency,26873,1269,1.23 [1.11-1.37],8.39105539948143e-05
SUSD1,Sushi domain-containing protein 1,"Chapter IV Endocrine, nutritional and metabolic diseases",Type 2 diabetes without complications,26793,1482,1.18 [1.07-1.30],0.0007921842591839
SUSD1,Sushi domain-containing protein 1,Chapter IX Diseases of the circulatory system,Cerebral atherosclerosis,27276,34,29.17 [16.87-50.41],1.3318348303872045e-33
SUSD1,Sushi domain-containing protein 1,Chapter IX Diseases of the circulatory system,"Hypertension, portal",27169,43,0.39 [0.23-0.64],0.0002406845866575
SUSD1,Sushi domain-containing protein 1,Chapter XI Diseases of the digestive system,Other inflammatory liver diseases,26468,97,0.53 [0.38-0.76],0.0004481592475049
