Protein,Protein_definition,Disease_category,Disease,NB_individual,NB_case,HR[95%CI],P_value
MCEE,"Methylmalonyl-CoA epimerase, mitochondrial",Chapter III Diseases of the blood and blood-forming organs and certain disorders involving the immune mechanism,Idiopathic thrombocytopenic purpura,23838,44,1.74 [1.26-2.40],0.0007842043724692
MCEE,"Methylmalonyl-CoA epimerase, mitochondrial",Chapter V Mental and behavioural disorders,"Schizophrenia or delusion, excluding more controls",19958,79,1.66 [1.29-2.13],7.523603820187608e-05
MCEE,"Methylmalonyl-CoA epimerase, mitochondrial",Chapter X Diseases of the respiratory system,Bronchiectasis,20888,351,1.37 [1.15-1.63],0.000432047582587
MCEE,"Methylmalonyl-CoA epimerase, mitochondrial",Chapter X Diseases of the respiratory system,Diseases of the respiratory system,22337,4526,1.11 [1.04-1.18],0.0008060603561485
MCEE,"Methylmalonyl-CoA epimerase, mitochondrial",Chapter X Diseases of the respiratory system,Other diseases of pleura,24018,1532,1.19 [1.08-1.31],0.0006364584969333
