Protein,Protein_definition,Disease_category,Disease,NB_individual,NB_case,HR[95%CI],P_value
S100A16,Protein S100-A16,Chapter III Diseases of the blood and blood-forming organs and certain disorders involving the immune mechanism,Anaemia in chronic diseases classified elsewhere,25078,99,1.47 [1.17-1.85],0.0008603183562212
S100A16,Protein S100-A16,Chapter VI Diseases of the nervous system,Other sleep disorders,25722,400,1.28 [1.12-1.45],0.000169626674477
S100A16,Protein S100-A16,Chapter XI Diseases of the digestive system,Coeliac disease,25522,149,1.63 [1.39-1.90],9.958959792070727e-10
S100A16,Protein S100-A16,Chapter XI Diseases of the digestive system,Intestinal malabsorption,25546,173,1.57 [1.35-1.83],7.623177290294488e-09
S100A16,Protein S100-A16,Chapter XIV Diseases of the genitourinary system,Chronic kidney disease,26238,1469,1.17 [1.09-1.25],1.2536302416017851e-05
S100A16,Protein S100-A16,Chapter XIV Diseases of the genitourinary system,Renal tubulo-interstitial diseases,26873,2434,1.10 [1.04-1.17],0.000532484308354
