Protein,Protein_definition,Disease_category,Disease,NB_individual,NB_case,HR[95%CI],P_value
MARS1,"Methionine--tRNA ligase, cytoplasmic",Chapter III Diseases of the blood and blood-forming organs and certain disorders involving the immune mechanism,Other and unspecified iron deficiency,23302,1060,1.17 [1.09-1.25],9.987313415654125e-06
MARS1,"Methionine--tRNA ligase, cytoplasmic","Chapter IV Endocrine, nutritional and metabolic diseases",Disorders of lipoprotein metabolism and other lipidaemias,21590,2678,1.09 [1.04-1.13],0.0001762103728577
MARS1,"Methionine--tRNA ligase, cytoplasmic","Chapter IV Endocrine, nutritional and metabolic diseases",Metabolic disorders,22912,4000,1.07 [1.03-1.11],0.0003485841491363
MARS1,"Methionine--tRNA ligase, cytoplasmic",Chapter X Diseases of the respiratory system,Diseases of the respiratory system,21847,4448,1.07 [1.03-1.11],9.472237040010292e-05
MARS1,"Methionine--tRNA ligase, cytoplasmic",Chapter XI Diseases of the digestive system,Nonalcoholic fatty liver disease,23651,302,1.28 [1.13-1.46],0.0001276876765328
MARS1,"Methionine--tRNA ligase, cytoplasmic",Chapter XI Diseases of the digestive system,Noninfectious colitis NAS,22631,707,1.15 [1.06-1.25],0.0008284588106232
MARS1,"Methionine--tRNA ligase, cytoplasmic",Chapter XI Diseases of the digestive system,Noninfective enteritis and colitis,22873,949,1.14 [1.06-1.22],0.0005331017260963
MARS1,"Methionine--tRNA ligase, cytoplasmic",Chapter XIV Diseases of the genitourinary system,Irregular menses,23263,107,0.68 [0.54-0.85],0.0007861971460749
