Protein,Protein_definition,Disease_category,Disease,NB_individual,NB_case,HR[95%CI],P_value
FGF6,Fibroblast growth factor 6,Chapter VI Diseases of the nervous system,Circumscribed brain atrophy,23122,36,1.63 [1.22-2.17],0.0009759655184142
FGF6,Fibroblast growth factor 6,"Chapter VII Diseases of the eye, adnexa, ear and mastoid process",Myopia,22908,180,1.41 [1.16-1.72],0.0004714460927443
FGF6,Fibroblast growth factor 6,Chapter XII Diseases of the skin and subcutaneous tissue,Arthropathic psoriasis,23258,73,1.57 [1.25-1.97],0.0001191139993521
FGF6,Fibroblast growth factor 6,Chapter XIII Diseases of the musculoskeletal system and connective tissue,Other psoriatic arthropathies,23519,73,1.58 [1.26-1.97],6.266088040964067e-05
FGF6,Fibroblast growth factor 6,Chapter XIII Diseases of the musculoskeletal system and connective tissue,Psoriatic arthropathies,15958,74,1.62 [1.28-2.05],5.307483114122496e-05
