Protein,Protein_definition,Disease_category,Disease,NB_individual,NB_case,OR[95%CI],P_value
LCN15,Lipocalin-15,Chapter I Certain infectious and parasitic diseases,Implicit Sepsis,16102,644,1.32 [1.19-1.46],7.925343156343045e-08
LCN15,Lipocalin-15,Chapter III Diseases of the blood and blood-forming organs and certain disorders involving the immune mechanism,Diseases of the blood and blood-forming organs and certain disorders involving the immune mechanism,21599,898,1.28 [1.18-1.39],7.94095775331447e-09
LCN15,Lipocalin-15,"Chapter IV Endocrine, nutritional and metabolic diseases",Type 2 diabetes,22813,358,1.57 [1.40-1.76],2.081593283620068e-14
LCN15,Lipocalin-15,"Chapter IV Endocrine, nutritional and metabolic diseases",Type 2 diabetes without complications,22803,348,1.55 [1.38-1.74],1.8706512854940497e-13
LCN15,Lipocalin-15,Chapter IX Diseases of the circulatory system,Hypertensive Renal Disease,16953,34,1.94 [1.53-2.45],3.0370348254034874e-08
LCN15,Lipocalin-15,Chapter XIV Diseases of the genitourinary system,Renal tubulo-interstitial diseases,22142,157,1.61 [1.39-1.86],1.6345370893165751e-10
LCN15,Lipocalin-15,Chapter XIV Diseases of the genitourinary system,Chronic kidney disease,22318,31,2.14 [1.72-2.66],1.0785991040425992e-11
