Protein,Protein_definition,Disease_category,Disease,NB_individual,NB_case,OR[95%CI],P_value
CLGN,Calmegin,Chapter I Certain infectious and parasitic diseases,Implicit bacterial Sepsis,20525,166,2.23 [1.74-2.86],2.536089456620957e-10
CLGN,Calmegin,Chapter I Certain infectious and parasitic diseases,Implicit Sepsis,15683,637,1.78 [1.52-2.08],3.9590517284090347e-13
CLGN,Calmegin,Chapter IX Diseases of the circulatory system,Hypertensive Renal Disease,16502,34,3.34 [2.21-5.05],1.1703635372046208e-08
CLGN,Calmegin,Chapter X Diseases of the respiratory system,Diseases of the respiratory system,19152,1796,1.38 [1.24-1.53],7.98907957970599e-10
CLGN,Calmegin,Chapter XI Diseases of the digestive system,Gastrointestinal diseases,16337,5136,1.25 [1.16-1.35],5.555349300221221e-09
CLGN,Calmegin,Chapter XIII Diseases of the musculoskeletal system and connective tissue,Diseases of the musculoskeletal system and connective tissue,16553,3780,1.30 [1.20-1.41],2.6163996574906673e-10
CLGN,Calmegin,Chapter XIV Diseases of the genitourinary system,Renal tubulo-interstitial diseases,21543,153,2.37 [1.85-3.03],7.743163511722222e-12
CLGN,Calmegin,Chapter XIV Diseases of the genitourinary system,Acute renal failure,21718,26,3.55 [2.25-5.59],5.0014786128861074e-08
CLGN,Calmegin,Chapter XIV Diseases of the genitourinary system,Chronic kidney disease,21722,30,4.56 [3.21-6.49],2.974837036187257e-17
