Protein,Protein_definition,Disease_category,Disease,NB_individual,NB_case,OR[95%CI],P_value
FCRLB,Fc receptor-like B,Chapter I Certain infectious and parasitic diseases,Implicit Sepsis,18051,746,1.39 [1.26-1.53],7.060194329500153e-11
FCRLB,Fc receptor-like B,Chapter III Diseases of the blood and blood-forming organs and certain disorders involving the immune mechanism,Diseases of the blood and blood-forming organs and certain disorders involving the immune mechanism,24204,1004,1.32 [1.22-1.43],4.0448995528308336e-11
FCRLB,Fc receptor-like B,"Chapter IV Endocrine, nutritional and metabolic diseases",Type 2 diabetes,25593,405,1.42 [1.26-1.59],4.763163701786939e-09
FCRLB,Fc receptor-like B,"Chapter IV Endocrine, nutritional and metabolic diseases",Type 2 diabetes without complications,25584,396,1.41 [1.26-1.59],8.076480199671874e-09
FCRLB,Fc receptor-like B,Chapter IX Diseases of the circulatory system,Death due to cardiac causes,19965,2763,1.28 [1.20-1.36],1.0507126335389886e-14
FCRLB,Fc receptor-like B,Chapter IX Diseases of the circulatory system,"Hypertension, essential",20957,2038,1.24 [1.16-1.33],7.76871658903511e-10
FCRLB,Fc receptor-like B,Chapter IX Diseases of the circulatory system,Hypertension,20978,2059,1.24 [1.16-1.33],3.690696631422539e-10
FCRLB,Fc receptor-like B,Chapter X Diseases of the respiratory system,Diseases of the respiratory system,22039,2062,1.21 [1.14-1.29],4.144526686131645e-09
FCRLB,Fc receptor-like B,Chapter XIII Diseases of the musculoskeletal system and connective tissue,Other/unspecified rheumatoid arthritis,26551,184,1.54 [1.34-1.77],2.1969576590994598e-09
