Protein,Protein_definition,Disease_category,Disease,NB_individual,NB_case,OR[95%CI],P_value
ART3,Ecto-ADP-ribosyltransferase 3,Chapter I Certain infectious and parasitic diseases,Other bacterial diseases,26969,119,3.50 [2.32-5.29],2.7073592476755483e-09
ART3,Ecto-ADP-ribosyltransferase 3,"Chapter IV Endocrine, nutritional and metabolic diseases",Type 1 diabetes,25996,124,4.35 [2.89-6.54],1.578532870806781e-12
ART3,Ecto-ADP-ribosyltransferase 3,"Chapter IV Endocrine, nutritional and metabolic diseases",Type 1 diabetes without complications,25982,110,3.61 [2.29-5.67],2.7319136706727344e-08
ART3,Ecto-ADP-ribosyltransferase 3,"Chapter VII Diseases of the eye, adnexa, ear and mastoid process",Diabetic maculopathy,1805,36,7.44 [4.03-13.73],1.3379569535322628e-10
ART3,Ecto-ADP-ribosyltransferase 3,Chapter XIV Diseases of the genitourinary system,Other disorders of kidney and ureter,27484,68,5.14 [3.13-8.44],1.047104426330804e-10
ART3,Ecto-ADP-ribosyltransferase 3,Chapter XIV Diseases of the genitourinary system,Female genital prolapse,21560,802,0.51 [0.42-0.62],1.044009971169302e-11
