Protein,Protein_definition,Disease_category,Disease,NB_individual,NB_case,HR[95%CI],P_value
CGB3_CGB5_CGB8,Choriogonadotropin subunit beta 3,Chapter III Diseases of the blood and blood-forming organs and certain disorders involving the immune mechanism,Other anaemias,20293,1234,1.27 [1.10-1.48],0.0015146538803155
CGB3_CGB5_CGB8,Choriogonadotropin subunit beta 3,Chapter III Diseases of the blood and blood-forming organs and certain disorders involving the immune mechanism,Other and unspecified anaemias,20291,1232,1.27 [1.10-1.48],0.0015722717617523
CGB3_CGB5_CGB8,Choriogonadotropin subunit beta 3,Chapter IX Diseases of the circulatory system,Other pulmonary heart/vessel disease,20038,321,1.48 [1.11-1.99],0.0081558059968845
CGB3_CGB5_CGB8,Choriogonadotropin subunit beta 3,Chapter IX Diseases of the circulatory system,Secondary right heart disease,20037,320,1.49 [1.11-2.00],0.0074113308756751
CGB3_CGB5_CGB8,Choriogonadotropin subunit beta 3,Chapter X Diseases of the respiratory system,Influenza and pneumonia,20374,1804,1.23 [1.09-1.39],0.0010184376111512
CGB3_CGB5_CGB8,Choriogonadotropin subunit beta 3,Chapter X Diseases of the respiratory system,"Pneumonia, organism unspecified",20157,1587,1.26 [1.10-1.43],0.0007309370392621
CGB3_CGB5_CGB8,Choriogonadotropin subunit beta 3,Chapter XI Diseases of the digestive system,Acute peritonitis,20272,78,2.34 [1.31-4.17],0.0040855727219883
CGB3_CGB5_CGB8,Choriogonadotropin subunit beta 3,Chapter XIII Diseases of the musculoskeletal system and connective tissue,Polyarthropathies,16624,1949,1.17 [1.04-1.31],0.0091791224781475
