Protein,Protein_definition,Disease_category,Disease,NB_individual,NB_case,HR[95%CI],P_value
ART5,Ecto-ADP-ribosyltransferase 5,Chapter III Diseases of the blood and blood-forming organs and certain disorders involving the immune mechanism,Diseases of spleen,19490,55,1.42 [1.10-1.84],0.0074474338914992
ART5,Ecto-ADP-ribosyltransferase 5,Chapter III Diseases of the blood and blood-forming organs and certain disorders involving the immune mechanism,Other coagulation defects,19615,93,1.39 [1.13-1.70],0.001786741391112
ART5,Ecto-ADP-ribosyltransferase 5,Chapter IX Diseases of the circulatory system,Varicose veins,18971,314,1.23 [1.07-1.41],0.0030681235398606
ART5,Ecto-ADP-ribosyltransferase 5,Chapter VI Diseases of the nervous system,Cerebral palsy and other paralytic syndromes,19830,284,1.25 [1.08-1.43],0.0020698888862764
ART5,Ecto-ADP-ribosyltransferase 5,Chapter XI Diseases of the digestive system,Other diseases of stomach and duodenum,15668,654,1.16 [1.05-1.29],0.0041680805672171
ART5,Ecto-ADP-ribosyltransferase 5,Chapter XI Diseases of the digestive system,"Other or unspecified ileus, impaction or obstruction",14135,283,1.21 [1.05-1.39],0.0085581187200374
ART5,Ecto-ADP-ribosyltransferase 5,Chapter XIII Diseases of the musculoskeletal system and connective tissue,Impingement syndrome of shoulder,17336,216,1.28 [1.10-1.49],0.0015783983686545
ART5,Ecto-ADP-ribosyltransferase 5,Chapter XIII Diseases of the musculoskeletal system and connective tissue,Other disorders of bone density and structure,19098,131,1.29 [1.07-1.56],0.0079376076782679
