Protein,Protein_definition,Disease_category,Disease,NB_individual,NB_case,HR[95%CI],P_value
DCTN2,Dynactin subunit 2,Chapter IX Diseases of the circulatory system,Abdominal aortic aneurysm (AAA),22403,274,0.85 [0.76-0.96],0.008087845741932
DCTN2,Dynactin subunit 2,Chapter IX Diseases of the circulatory system,"Bradycardia, unspecified, drug-induced",23541,541,0.88 [0.81-0.96],0.0028204256317881
DCTN2,Dynactin subunit 2,Chapter IX Diseases of the circulatory system,Paroxysmal tachycardia,11910,376,0.86 [0.77-0.95],0.0027408370487019
DCTN2,Dynactin subunit 2,Chapter XI Diseases of the digestive system,Other diseases of liver,23302,689,0.89 [0.83-0.96],0.0020139021910807
DCTN2,Dynactin subunit 2,Chapter XII Diseases of the skin and subcutaneous tissue,Seborrhoeic keratosis,21819,265,0.80 [0.71-0.91],0.0004382396217562
