Protein,Protein_definition,Disease_category,Disease,NB_individual,NB_case,HR[95%CI],P_value
CABP2,Calcium-binding protein 2,Chapter II Neoplasms,"Benign neoplasm: Colon, unspecified",19904,64,1.48 [1.10-2.00],0.0091393437248752
CABP2,Calcium-binding protein 2,Chapter II Neoplasms,"Malignant neoplasm of prostate, excluding all cancers (controls excluding all cancers)",16684,1145,0.87 [0.79-0.95],0.0026556659116119
CABP2,Calcium-binding protein 2,Chapter II Neoplasms,Melanocytic naevi,19915,147,0.68 [0.51-0.91],0.0089933360207423
CABP2,Calcium-binding protein 2,Chapter VI Diseases of the nervous system,Postviral fatigue syndrome,19514,22,2.07 [1.45-2.97],6.516841331680607e-05
CABP2,Calcium-binding protein 2,Chapter XI Diseases of the digestive system,Coeliac disease,18643,74,2.16 [1.79-2.61],5.939119429990997e-16
CABP2,Calcium-binding protein 2,Chapter XI Diseases of the digestive system,Intestinal malabsorption,18656,87,2.06 [1.72-2.47],3.809419865507579e-15
CABP2,Calcium-binding protein 2,Chapter XIII Diseases of the musculoskeletal system and connective tissue,"Postprocedural musculoskeletal disorders, not elsewhere classified",19953,37,1.66 [1.17-2.36],0.0044605726335485
