Protein,Protein_definition,Disease_category,Disease,NB_individual,NB_case,HR[95%CI],P_value
MAGEA3,Melanoma-associated antigen 3,Chapter II Neoplasms,Benign neoplasm: Sigmoid colon,20094,614,1.15 [1.04-1.27],0.0058779380509043
MAGEA3,Melanoma-associated antigen 3,"Chapter IV Endocrine, nutritional and metabolic diseases",Type 2 diabetes with ophthalmic complications,2271,266,1.29 [1.12-1.49],0.0004729222243609
MAGEA3,Melanoma-associated antigen 3,Chapter IX Diseases of the circulatory system,Atrial fibrillation and flutter,11822,1909,1.09 [1.03-1.15],0.0030512849370362
MAGEA3,Melanoma-associated antigen 3,"Chapter VII Diseases of the eye, adnexa, ear and mastoid process",Background diabetic retinopathy,20051,246,1.23 [1.06-1.44],0.0075848201803738
MAGEA3,Melanoma-associated antigen 3,"Chapter VII Diseases of the eye, adnexa, ear and mastoid process",Retinal vascular occlusion,19246,76,1.42 [1.10-1.84],0.0079828739159891
MAGEA3,Melanoma-associated antigen 3,Chapter X Diseases of the respiratory system,Lung diseases due to external agents,20186,330,0.87 [0.78-0.97],0.0095332179472558
MAGEA3,Melanoma-associated antigen 3,Chapter XI Diseases of the digestive system,Chronic gastritis,15469,219,0.84 [0.74-0.95],0.0051157955876241
MAGEA3,Melanoma-associated antigen 3,Chapter XIII Diseases of the musculoskeletal system and connective tissue,Bursitis of shoulder,17427,63,1.56 [1.18-2.07],0.0019066256490685
MAGEA3,Melanoma-associated antigen 3,Chapter XIII Diseases of the musculoskeletal system and connective tissue,Trigger finger,17472,108,0.80 [0.68-0.93],0.0048248125251548
