Protein,Protein_definition,Disease_category,Disease,NB_individual,NB_case,HR[95%CI],P_value
AGBL2,Cytosolic carboxypeptidase 2,Chapter IX Diseases of the circulatory system,Endocarditis,15649,70,0.77 [0.63-0.94],0.0094044428523197
AGBL2,Cytosolic carboxypeptidase 2,Chapter XI Diseases of the digestive system,"Diseases of oral cavity, salivary glands and jaws",19602,414,0.87 [0.79-0.96],0.0043480152819372
AGBL2,Cytosolic carboxypeptidase 2,Chapter XI Diseases of the digestive system,Functional dyspepsia,15363,349,0.87 [0.78-0.96],0.0052336699286181
AGBL2,Cytosolic carboxypeptidase 2,Chapter XIII Diseases of the musculoskeletal system and connective tissue,"Primary gonarthrosis, bilateral",18262,37,1.47 [1.10-1.96],0.0087329032094993
AGBL2,Cytosolic carboxypeptidase 2,Chapter XIII Diseases of the musculoskeletal system and connective tissue,Synovial cyst of popliteal space [Baker],17151,31,0.70 [0.54-0.90],0.0052439486121354
AGBL2,Cytosolic carboxypeptidase 2,Chapter XIV Diseases of the genitourinary system,"Redundant prepuce, phimosis and paraphimosis",16320,218,0.82 [0.73-0.92],0.0010712399659415
