Protein,Protein_definition,Disease_category,Disease,NB_individual,NB_case,HR[95%CI],P_value
CSPG5,Chondroitin sulfate proteoglycan 5,"Chapter IV Endocrine, nutritional and metabolic diseases","Disorders of plasma-protein metabolism, not elsewhere classified",14494,51,1.62 [1.15-2.30],0.0061892532166821
CSPG5,Chondroitin sulfate proteoglycan 5,"Chapter IV Endocrine, nutritional and metabolic diseases",Type 2 diabetes with neurological complications,2108,103,1.63 [1.19-2.21],0.0020059424972402
CSPG5,Chondroitin sulfate proteoglycan 5,"Chapter VII Diseases of the eye, adnexa, ear and mastoid process",Diabetic neuropathy,2514,108,1.67 [1.24-2.25],0.0007099925350142
CSPG5,Chondroitin sulfate proteoglycan 5,Chapter X Diseases of the respiratory system,Acute upper respiratory infections,19834,156,0.61 [0.42-0.89],0.009236040200194
CSPG5,Chondroitin sulfate proteoglycan 5,Chapter XI Diseases of the digestive system,Other diseases of anus and rectum,15065,1213,1.15 [1.04-1.28],0.0073625967973666
CSPG5,Chondroitin sulfate proteoglycan 5,Chapter XIV Diseases of the genitourinary system,Dialysis,17751,66,1.61 [1.17-2.22],0.003750158713966
