Protein,Protein_definition,Disease_category,Disease,NB_individual,NB_case,HR[95%CI],P_value
CENPJ,Centromere protein J,"Chapter IV Endocrine, nutritional and metabolic diseases",Dementia in Alzheimer disease,19535,200,0.72 [0.58-0.91],0.0046803048400835
CENPJ,Centromere protein J,Chapter IX Diseases of the circulatory system,Endocarditis,15881,72,1.47 [1.18-1.85],0.0007122590706912
CENPJ,Centromere protein J,Chapter VI Diseases of the nervous system,Alzheimer disease,20203,249,0.74 [0.61-0.91],0.0034036808374344
CENPJ,Centromere protein J,Chapter VI Diseases of the nervous system,Other extrapyramidal and movement disorders in other diseases,19883,108,0.65 [0.47-0.90],0.0098929965941849
CENPJ,Centromere protein J,Chapter VI Diseases of the nervous system,Unspecific neurodegenerative disorder,20203,252,0.74 [0.61-0.90],0.0029775959971458
CENPJ,Centromere protein J,Chapter X Diseases of the respiratory system,Allergic asthma (mode),13260,87,1.38 [1.10-1.72],0.004518498536311
CENPJ,Centromere protein J,Chapter XI Diseases of the digestive system,Other diseases of lip and oral mucosa,19428,152,1.30 [1.09-1.56],0.00406469687046
