Protein,Protein_definition,Disease_category,Disease,NB_individual,NB_case,HR[95%CI],P_value
PPT1,Palmitoyl-protein thioesterase 1,Chapter III Diseases of the blood and blood-forming organs and certain disorders involving the immune mechanism,Sarcoidosis,19935,40,1.41 [1.10-1.80],0.0065064832411211
PPT1,Palmitoyl-protein thioesterase 1,Chapter X Diseases of the respiratory system,Other diseases of pleura,19774,1827,1.09 [1.03-1.15],0.0019993844062367
PPT1,Palmitoyl-protein thioesterase 1,Chapter XI Diseases of the digestive system,Diverticular disease of intestine,16528,2555,1.06 [1.02-1.11],0.0085672305734911
PPT1,Palmitoyl-protein thioesterase 1,Chapter XIII Diseases of the musculoskeletal system and connective tissue,Giant cell arteritis,19742,27,1.49 [1.11-2.00],0.0080102989533606
PPT1,Palmitoyl-protein thioesterase 1,Chapter XIII Diseases of the musculoskeletal system and connective tissue,Internal derangement of knee,14816,530,0.83 [0.72-0.95],0.0053083806055242
PPT1,Palmitoyl-protein thioesterase 1,Chapter XIII Diseases of the musculoskeletal system and connective tissue,Other necrotizing vasculopathies,19761,46,1.49 [1.20-1.85],0.0003083609854394
