Protein,Protein_definition,Disease_category,Disease,NB_individual,NB_case,HR[95%CI],P_value
NENF,Neudesin,Chapter II Neoplasms,Melanocytic naevi,20390,147,0.67 [0.53-0.84],0.0004738236210999
NENF,Neudesin,Chapter II Neoplasms,Melanocytic naevi of trunk,20466,84,0.57 [0.40-0.80],0.0012887140298453
NENF,Neudesin,"Chapter IV Endocrine, nutritional and metabolic diseases",Hypo-osmolality and hyponatraemia,15359,492,1.11 [1.04-1.18],0.0027887097899477
NENF,Neudesin,Chapter VI Diseases of the nervous system,Other extrapyramidal and movement disorders in other diseases,20166,112,1.19 [1.05-1.35],0.0062173654555352
NENF,Neudesin,Chapter X Diseases of the respiratory system,Idiopathic pulmonary fibrosis,19672,305,1.15 [1.06-1.25],0.0005673373062938
NENF,Neudesin,Chapter X Diseases of the respiratory system,Interstitial lung disease,19694,327,1.15 [1.06-1.24],0.0004630643317403
NENF,Neudesin,Chapter X Diseases of the respiratory system,Other respiratory diseases principally affecting the interstitium,20396,400,1.12 [1.04-1.21],0.0020828995624055
NENF,Neudesin,Chapter XI Diseases of the digestive system,Coeliac disease,19085,75,1.56 [1.41-1.73],6.203127786421761e-17
NENF,Neudesin,Chapter XI Diseases of the digestive system,Intestinal malabsorption,19097,87,1.52 [1.37-1.68],3.2906232189187703e-16
