Protein,Protein_definition,Disease_category,Disease,NB_individual,NB_case,HR[95%CI],P_value
TEF,Thyrotroph embryonic factor,Chapter I Certain infectious and parasitic diseases,"Bacterial infection, other or unspecified",18931,130,1.51 [1.16-1.97],0.0023045353525977
TEF,Thyrotroph embryonic factor,Chapter VI Diseases of the nervous system,Other and unspecified degenerative diseases of nervous system,19589,181,1.46 [1.14-1.87],0.0025151125288691
TEF,Thyrotroph embryonic factor,"Chapter VII Diseases of the eye, adnexa, ear and mastoid process",Chalazion,19150,52,1.75 [1.16-2.62],0.0070589803733542
TEF,Thyrotroph embryonic factor,Chapter XI Diseases of the digestive system,Dental caries,19327,184,1.43 [1.11-1.84],0.0056266380478145
TEF,Thyrotroph embryonic factor,Chapter XI Diseases of the digestive system,Diseases of pulp and periapical tissues,19232,89,1.57 [1.13-2.18],0.0073554078511855
TEF,Thyrotroph embryonic factor,Chapter XIII Diseases of the musculoskeletal system and connective tissue,Other enthesopathies,17104,54,1.66 [1.13-2.42],0.0090932452276494
TEF,Thyrotroph embryonic factor,Chapter XIII Diseases of the musculoskeletal system and connective tissue,"Seropositive rheumatoid arthritis, wide",19852,33,1.75 [1.15-2.67],0.0094937824487625
TEF,Thyrotroph embryonic factor,Chapter XIV Diseases of the genitourinary system,"Other chronic cystitis, drug-induced",19858,52,1.74 [1.20-2.51],0.0031716687822835
