Protein,Protein_definition,Disease_category,Disease,NB_individual,NB_case,HR[95%CI],P_value
PGM2,Phosphoglucomutase-2,Chapter VI Diseases of the nervous system,"Disorders of brain, other and unspecified",19565,73,1.43 [1.15-1.79],0.0013338747736104
PGM2,Phosphoglucomutase-2,Chapter VI Diseases of the nervous system,Memory loss,19500,103,1.50 [1.25-1.80],1.004300549142222e-05
PGM2,Phosphoglucomutase-2,"Chapter VII Diseases of the eye, adnexa, ear and mastoid process",Other disorders of eye and adnexa,20000,116,0.54 [0.34-0.84],0.0067152705660208
PGM2,Phosphoglucomutase-2,Chapter XI Diseases of the digestive system,"Inguinal hernia, bilateral",15510,163,1.26 [1.06-1.50],0.0086439419602178
PGM2,Phosphoglucomutase-2,Chapter XI Diseases of the digestive system,Other disorders of teeth and supporting structures,19436,144,1.35 [1.13-1.63],0.0012052899444239
PGM2,Phosphoglucomutase-2,Chapter XIII Diseases of the musculoskeletal system and connective tissue,Cervicalgia,17602,120,0.52 [0.33-0.81],0.0039255399322461
