Protein,Protein_definition,Disease_category,Disease,NB_individual,NB_case,OR[95%CI],P_value
BLVRB,Flavin reductase,Chapter III Diseases of the blood and blood-forming organs and certain disorders involving the immune mechanism,Other anaemias,48235,703,0.84 [0.76-0.93],0.0011408743869263
BLVRB,Flavin reductase,Chapter III Diseases of the blood and blood-forming organs and certain disorders involving the immune mechanism,Other and unspecified anaemias,48235,703,0.84 [0.76-0.93],0.0011408743869263
BLVRB,Flavin reductase,Chapter IX Diseases of the circulatory system,Pulmonary embolism,49834,215,1.25 [1.06-1.47],0.0094901047122553
BLVRB,Flavin reductase,Chapter XIV Diseases of the genitourinary system,Disorders of breast,27453,484,1.20 [1.07-1.34],0.0016286948257717
BLVRB,Flavin reductase,Chapter XIV Diseases of the genitourinary system,Other disorders of breast,27084,115,1.34 [1.07-1.66],0.0092796453913713
