Protein,Protein_definition,Disease_category,Disease,NB_individual,NB_case,OR[95%CI],P_value
PLCB2,"1-phosphatidylinositol 4,5-bisphosphate phosphodiesterase beta-2",Chapter IX Diseases of the circulatory system,Atrial fibrillation and flutter,25252,759,0.88 [0.81-0.95],0.0007359543204842
PLCB2,"1-phosphatidylinositol 4,5-bisphosphate phosphodiesterase beta-2",Chapter IX Diseases of the circulatory system,Other or ill-defined heart diseases,37199,165,0.72 [0.62-0.83],1.6184906581605447e-05
PLCB2,"1-phosphatidylinositol 4,5-bisphosphate phosphodiesterase beta-2",Chapter IX Diseases of the circulatory system,Varicose veins,42696,832,0.90 [0.84-0.96],0.002466310380611
PLCB2,"1-phosphatidylinositol 4,5-bisphosphate phosphodiesterase beta-2",Chapter XI Diseases of the digestive system,Diseases of liver,43231,210,0.80 [0.70-0.91],0.0008193316929277
PLCB2,"1-phosphatidylinositol 4,5-bisphosphate phosphodiesterase beta-2",Chapter XIII Diseases of the musculoskeletal system and connective tissue,Soft tissue disorders,40242,2111,1.07 [1.02-1.12],0.0022182105140531
PLCB2,"1-phosphatidylinositol 4,5-bisphosphate phosphodiesterase beta-2",Chapter XIV Diseases of the genitourinary system,Uterine polyps,18271,273,0.84 [0.75-0.95],0.0051774614374234
