Protein,Protein_definition,Disease_category,Disease,NB_individual,NB_case,OR[95%CI],P_value
DCTN1,Dynactin subunit 1,"Chapter VII Diseases of the eye, adnexa, ear and mastoid process",Disorders of choroid and retina,49879,441,1.19 [1.04-1.35],0.0088555431637691
DCTN1,Dynactin subunit 1,Chapter IX Diseases of the circulatory system,Atrial fibrillation and flutter,29270,888,0.82 [0.74-0.91],9.647709135045632e-05
DCTN1,Dynactin subunit 1,Chapter IX Diseases of the circulatory system,Other or ill-defined heart diseases,43083,186,0.76 [0.62-0.94],0.0096237944883098
DCTN1,Dynactin subunit 1,Chapter XI Diseases of the digestive system,Diseases of liver,50264,253,0.64 [0.54-0.77],9.008364932368002e-07
DCTN1,Dynactin subunit 1,Chapter XI Diseases of the digestive system,Other diseases of liver,50151,140,0.67 [0.53-0.85],0.0008286436682512
DCTN1,Dynactin subunit 1,Chapter XI Diseases of the digestive system,Cholecystitis,48079,202,1.32 [1.09-1.59],0.003967931391917
DCTN1,Dynactin subunit 1,Chapter XIII Diseases of the musculoskeletal system and connective tissue,Soft tissue disorders,46794,2436,1.08 [1.02-1.14],0.0068945070046838
DCTN1,Dynactin subunit 1,"Chapter XV Pregnancy, childbirth and the puerperium",Haemorrhage in early pregnancy,27712,126,0.72 [0.56-0.92],0.0088624463682325
