Protein,Protein_definition,Disease_category,Disease,NB_individual,NB_case,OR[95%CI],P_value
MFAP3,Microfibril-associated glycoprotein 3,Chapter II Neoplasms,Benign lipomatous neoplasm,50004,585,0.79 [0.67-0.94],0.006534847970606
MFAP3,Microfibril-associated glycoprotein 3,Chapter III Diseases of the blood and blood-forming organs and certain disorders involving the immune mechanism,Other and unspecified iron deficiency,47978,382,1.25 [1.07-1.46],0.0054271721657876
MFAP3,Microfibril-associated glycoprotein 3,Chapter XI Diseases of the digestive system,Diseases of liver,48931,244,1.43 [1.20-1.70],7.191845328986305e-05
MFAP3,Microfibril-associated glycoprotein 3,Chapter XI Diseases of the digestive system,Acute pancreatitis,46736,130,0.58 [0.40-0.86],0.0068830021455434
MFAP3,Microfibril-associated glycoprotein 3,Chapter XI Diseases of the digestive system,Acute pancreatitis (for exclusion),50189,130,0.58 [0.39-0.86],0.0066646174368107
MFAP3,Microfibril-associated glycoprotein 3,Chapter XIII Diseases of the musculoskeletal system and connective tissue,Systemic lupus erythematosus,49446,252,1.30 [1.08-1.56],0.0047429959144651
