Protein,Protein_definition,Disease_category,Disease,NB_individual,NB_case,OR[95%CI],P_value
COMMD9,COMM domain-containing protein 9,Chapter II Neoplasms,"Benign neoplasm of colon, rectum, anus and anal canal",42118,584,1.28 [1.08-1.53],0.0055670775457354
COMMD9,COMM domain-containing protein 9,"Chapter VII Diseases of the eye, adnexa, ear and mastoid process",Disorders of lacrimal system,42893,130,1.56 [1.16-2.11],0.0032809452916435
COMMD9,COMM domain-containing protein 9,Chapter IX Diseases of the circulatory system,Other or ill-defined heart diseases,37098,164,0.48 [0.30-0.75],0.001450529543409
COMMD9,COMM domain-containing protein 9,Chapter X Diseases of the respiratory system,Vocal cord dysfunction,20517,109,1.54 [1.12-2.13],0.0081685543193277
COMMD9,COMM domain-containing protein 9,Chapter XIII Diseases of the musculoskeletal system and connective tissue,Pain in limb,38474,428,1.35 [1.11-1.64],0.0027058159012975
