Protein,Protein_definition,Disease_category,Disease,NB_individual,NB_case,OR[95%CI],P_value
CDKL5,Cyclin-dependent kinase-like 5,Chapter II Neoplasms,Benign neoplasm of breast,23369,120,1.39 [1.11-1.75],0.004908109182604
CDKL5,Cyclin-dependent kinase-like 5,Chapter V Mental and behavioural disorders,Other anxiety disorders,40859,111,0.51 [0.32-0.81],0.0039885117584064
CDKL5,Cyclin-dependent kinase-like 5,Chapter VI Diseases of the nervous system,Episodal and paroxysmal disorders,41121,807,1.17 [1.04-1.31],0.0078664546680914
CDKL5,Cyclin-dependent kinase-like 5,Chapter XI Diseases of the digestive system,Diseases of the digestive system,40987,528,1.23 [1.08-1.41],0.0022173539351001
CDKL5,Cyclin-dependent kinase-like 5,Chapter XII Diseases of the skin and subcutaneous tissue,Papulosquamous disorders,42831,152,1.36 [1.09-1.69],0.0063674126066296
CDKL5,Cyclin-dependent kinase-like 5,Chapter XIV Diseases of the genitourinary system,"All dysplastic lesions of the cervix uteri, vagina or vulva",23388,230,1.32 [1.10-1.59],0.0028590780728235
CDKL5,Cyclin-dependent kinase-like 5,Chapter XIV Diseases of the genitourinary system,All dysplastic lesions of the cervix uteri,23397,218,1.30 [1.07-1.58],0.0083460301779723
CDKL5,Cyclin-dependent kinase-like 5,Chapter XIV Diseases of the genitourinary system,"HSIL lesion of the cervix uteri, vagina or vulva",23410,130,1.40 [1.11-1.77],0.0040285044911753
