Protein,Protein_definition,Disease_category,Disease,NB_individual,NB_case,OR[95%CI],P_value
SERPINB5,Serpin B5,Chapter II Neoplasms,"Malignant neoplasm of prostate, excluding all cancers (controls excluding all cancers)",18267,228,1.39 [1.09-1.78],0.0090460177435742
SERPINB5,Serpin B5,"Chapter IV Endocrine, nutritional and metabolic diseases","Other disorders of fluid, electrolyte and acid-base balance",38696,167,1.49 [1.11-1.99],0.0075760069839882
SERPINB5,Serpin B5,Chapter IX Diseases of the circulatory system,Hypertensive Renal Disease,33357,154,1.75 [1.29-2.36],0.0002970251703163
SERPINB5,Serpin B5,Chapter XIV Diseases of the genitourinary system,Chronic kidney disease,45567,136,1.55 [1.12-2.13],0.0075583734243955
SERPINB5,Serpin B5,Chapter VI Diseases of the nervous system,Falls/tendency to fall,45514,1178,0.87 [0.78-0.97],0.0093987306184298
