Protein,Protein_definition,Disease_category,Disease,NB_individual,NB_case,OR[95%CI],P_value
CTLA4,Cytotoxic T-lymphocyte protein 4,Chapter I Certain infectious and parasitic diseases,Other specified/unspecified bacterial intestinal infections,44401,130,0.40 [0.23-0.71],0.0015773473452335
CTLA4,Cytotoxic T-lymphocyte protein 4,Chapter III Diseases of the blood and blood-forming organs and certain disorders involving the immune mechanism,Other anaemias,42019,584,1.37 [1.08-1.73],0.0087612080464299
CTLA4,Cytotoxic T-lymphocyte protein 4,Chapter III Diseases of the blood and blood-forming organs and certain disorders involving the immune mechanism,Other and unspecified anaemias,42019,584,1.37 [1.08-1.73],0.0087612080464299
CTLA4,Cytotoxic T-lymphocyte protein 4,Chapter V Mental and behavioural disorders,Smoking dependency,41598,109,1.86 [1.21-2.83],0.0042178658917883
CTLA4,Cytotoxic T-lymphocyte protein 4,Chapter V Mental and behavioural disorders,Other anxiety disorders,42231,113,0.42 [0.23-0.77],0.0048357497556078
CTLA4,Cytotoxic T-lymphocyte protein 4,"Chapter VII Diseases of the eye, adnexa, ear and mastoid process",Visual disturbances,43824,173,0.52 [0.32-0.85],0.0098861257682536
CTLA4,Cytotoxic T-lymphocyte protein 4,Chapter XIV Diseases of the genitourinary system,Unspecified lump in breast,23652,148,1.65 [1.13-2.42],0.0098990772497083
CTLA4,Cytotoxic T-lymphocyte protein 4,"Chapter XV Pregnancy, childbirth and the puerperium",Perineal laceration during delivery,23747,564,0.65 [0.48-0.88],0.0053560118232947
