Protein,Protein_definition,Disease_category,Disease,NB_individual,NB_case,OR[95%CI],P_value
LTO1,Protein LTO1 homolog,Chapter II Neoplasms,Benign neoplasm of other and ill-defined parts of digestive system,50427,131,0.54 [0.34-0.85],0.0072509201216126
LTO1,Protein LTO1 homolog,Chapter VI Diseases of the nervous system,Other degenerative diseases of the nervous system,39200,264,1.43 [1.18-1.74],0.0002421800751646
LTO1,Protein LTO1 homolog,Chapter VI Diseases of the nervous system,MS-disease / Multiple Sclerosis,50224,209,1.45 [1.18-1.79],0.0004446832042602
LTO1,Protein LTO1 homolog,Chapter XI Diseases of the digestive system,Abscess of anal and rectal regions,35749,141,1.42 [1.09-1.85],0.0085555611978553
LTO1,Protein LTO1 homolog,Chapter XIV Diseases of the genitourinary system,Inflammatory diseases of female pelvic organs,26843,543,1.31 [1.13-1.52],0.000423126951418
LTO1,Protein LTO1 homolog,Chapter XIV Diseases of the genitourinary system,Unspecified/other endometriosis,20381,96,1.56 [1.16-2.11],0.0035697619932674
