Protein,Protein_definition,Disease_category,Disease,NB_individual,NB_case,OR[95%CI],P_value
FKBPL,FK506-binding protein-like,Chapter II Neoplasms,Melanocytic naevi of other and unspecified parts of face,44514,154,1.39 [1.08-1.78],0.0098484623658193
FKBPL,FK506-binding protein-like,Chapter IX Diseases of the circulatory system,Other or ill-defined heart diseases,37113,160,0.70 [0.53-0.91],0.0083934754058167
FKBPL,FK506-binding protein-like,Chapter X Diseases of the respiratory system,Diseases of the respiratory system,35578,3600,1.10 [1.04-1.16],0.0010870854811105
FKBPL,FK506-binding protein-like,Chapter X Diseases of the respiratory system,Chronic lower respiratory diseases,39768,1759,1.12 [1.04-1.22],0.0036355035798176
FKBPL,FK506-binding protein-like,Chapter XI Diseases of the digestive system,Noninfective enteritis and colitis,42879,1324,1.14 [1.04-1.24],0.0047526314831096
FKBPL,FK506-binding protein-like,Chapter XI Diseases of the digestive system,Diseases of liver,43153,210,0.67 [0.53-0.84],0.0006830849569434
FKBPL,FK506-binding protein-like,Chapter XIII Diseases of the musculoskeletal system and connective tissue,Other/unspecified rheumatoid arthritis,43841,227,1.32 [1.07-1.62],0.0098703821757765
FKBPL,FK506-binding protein-like,Chapter XIII Diseases of the musculoskeletal system and connective tissue,"Coxarthrosis, primary",44272,252,1.32 [1.08-1.62],0.0062739269927907
