Protein,Protein_definition,Disease_category,Disease,NB_individual,NB_case,OR[95%CI],P_value
FUCA1,Tissue alpha-L-fucosidase,Chapter III Diseases of the blood and blood-forming organs and certain disorders involving the immune mechanism,Agranulocytosis,50695,140,1.39 [1.13-1.72],0.0022870113651478
FUCA1,Tissue alpha-L-fucosidase,Chapter V Mental and behavioural disorders,"Mental and behavioural disorders due to alcohol, excluding acute intoxication",50984,340,1.19 [1.04-1.35],0.0088892816221899
FUCA1,Tissue alpha-L-fucosidase,Chapter VI Diseases of the nervous system,Neurological diseases,44272,2973,1.06 [1.02-1.11],0.0063479926871463
FUCA1,Tissue alpha-L-fucosidase,Chapter VI Diseases of the nervous system,Epilepsy,48422,308,1.37 [1.19-1.58],1.4535681509624664e-05
FUCA1,Tissue alpha-L-fucosidase,Chapter XI Diseases of the digestive system,"Diseases of oesophagus, stomach and duodenum",43177,4365,1.06 [1.02-1.10],0.0016962743750075
FUCA1,Tissue alpha-L-fucosidase,Chapter XIII Diseases of the musculoskeletal system and connective tissue,Spondylosis,45013,380,1.17 [1.04-1.32],0.0084498150718107
FUCA1,Tissue alpha-L-fucosidase,"Chapter XV Pregnancy, childbirth and the puerperium",Prolonged pregnancy,27198,153,0.78 [0.66-0.92],0.0029177362687462
