Protein,Protein_definition,Disease_category,Disease,NB_individual,NB_case,OR[95%CI],P_value
NDUFS6,"NADH dehydrogenase [ubiquinone] iron-sulfur protein 6, mitochondrial",Chapter I Certain infectious and parasitic diseases,Implicit Sepsis,14816,801,1.16 [1.08-1.26],8.93580229664166e-05
NDUFS6,"NADH dehydrogenase [ubiquinone] iron-sulfur protein 6, mitochondrial",Chapter IX Diseases of the circulatory system,Hypertensive Renal Disease,14213,108,1.44 [1.25-1.67],8.601182249292921e-07
NDUFS6,"NADH dehydrogenase [ubiquinone] iron-sulfur protein 6, mitochondrial",Chapter IX Diseases of the circulatory system,"Hypertension, Pulmonary Arterial",14184,79,1.40 [1.18-1.65],9.340370732385446e-05
NDUFS6,"NADH dehydrogenase [ubiquinone] iron-sulfur protein 6, mitochondrial",Chapter X Diseases of the respiratory system,Diseases of the respiratory system,18049,1950,1.11 [1.05-1.17],6.51493972186497e-05
NDUFS6,"NADH dehydrogenase [ubiquinone] iron-sulfur protein 6, mitochondrial",Chapter XI Diseases of the digestive system,"Other or unspecified ileus, impaction or obstruction",16162,61,1.44 [1.21-1.73],6.758167353211153e-05
NDUFS6,"NADH dehydrogenase [ubiquinone] iron-sulfur protein 6, mitochondrial",Chapter XIII Diseases of the musculoskeletal system and connective tissue,Diseases of the musculoskeletal system and connective tissue,17088,3461,1.13 [1.08-1.18],1.0379442213535544e-08
NDUFS6,"NADH dehydrogenase [ubiquinone] iron-sulfur protein 6, mitochondrial",Chapter XIV Diseases of the genitourinary system,Renal tubulo-interstitial diseases,20426,304,1.27 [1.15-1.40],1.560301761573686e-06
NDUFS6,"NADH dehydrogenase [ubiquinone] iron-sulfur protein 6, mitochondrial",Chapter XIV Diseases of the genitourinary system,Chronic kidney disease,20471,91,1.47 [1.29-1.68],1.4469820785950593e-08
