Protein,Protein_definition,Disease_category,Disease,NB_individual,NB_case,OR[95%CI],P_value
DUT,"Deoxyuridine 5'-triphosphate nucleotidohydrolase, mitochondrial","Chapter IV Endocrine, nutritional and metabolic diseases",Type 2 diabetes,18531,571,1.17 [1.08-1.27],9.623790808191932e-05
DUT,"Deoxyuridine 5'-triphosphate nucleotidohydrolase, mitochondrial","Chapter VII Diseases of the eye, adnexa, ear and mastoid process",Background diabetic retinopathy,20133,41,1.75 [1.33-2.30],6.237087211208581e-05
DUT,"Deoxyuridine 5'-triphosphate nucleotidohydrolase, mitochondrial","Chapter VII Diseases of the eye, adnexa, ear and mastoid process","Diabetic maculopathy, excluding more controls",17942,41,1.75 [1.33-2.30],6.911543982447815e-05
DUT,"Deoxyuridine 5'-triphosphate nucleotidohydrolase, mitochondrial",Chapter X Diseases of the respiratory system,Diseases of the respiratory system,15996,1751,1.12 [1.07-1.18],8.29941384652501e-07
DUT,"Deoxyuridine 5'-triphosphate nucleotidohydrolase, mitochondrial",Chapter XIII Diseases of the musculoskeletal system and connective tissue,Other/unspecified rheumatoid arthritis,20249,59,1.57 [1.25-1.97],9.642842614600654e-05
