Protein,Protein_definition,Disease_category,Disease,NB_individual,NB_case,OR[95%CI],P_value
CTSH,Pro-cathepsin H,Chapter I Certain infectious and parasitic diseases,Implicit Sepsis,14835,800,1.24 [1.13-1.36],3.453300519633596e-06
CTSH,Pro-cathepsin H,Chapter VI Diseases of the nervous system,Neurological diseases,19632,1286,1.16 [1.08-1.24],3.685053139136939e-05
CTSH,Pro-cathepsin H,Chapter VI Diseases of the nervous system,Epilepsy,21510,161,1.51 [1.25-1.82],1.547518789793913e-05
CTSH,Pro-cathepsin H,Chapter X Diseases of the respiratory system,Other respiratory diseases principally affecting the interstitium,22781,99,1.62 [1.28-2.04],5.420289870265592e-05
CTSH,Pro-cathepsin H,Chapter XIV Diseases of the genitourinary system,Renal tubulo-interstitial diseases,20444,296,1.37 [1.19-1.57],8.12804296391868e-06
CTSH,Pro-cathepsin H,Chapter XIV Diseases of the genitourinary system,Unspecified kidney failure,20495,90,1.81 [1.42-2.31],1.2800459915738558e-06
