Protein,Protein_definition,Disease_category,Disease,NB_individual,NB_case,OR[95%CI],P_value
ROBO4,Roundabout homolog 4,Chapter I Certain infectious and parasitic diseases,Implicit bacterial Sepsis,16624,188,4.75 [2.19-10.27],7.70389857928807e-05
ROBO4,Roundabout homolog 4,Chapter III Diseases of the blood and blood-forming organs and certain disorders involving the immune mechanism,Diseases of the blood and blood-forming organs and certain disorders involving the immune mechanism,17741,437,3.23 [1.93-5.40],7.950317838181537e-06
ROBO4,Roundabout homolog 4,Chapter XI Diseases of the digestive system,Diseases of liver,19268,120,9.51 [3.77-23.99],1.8654789425186129e-06
ROBO4,Roundabout homolog 4,Chapter XIV Diseases of the genitourinary system,Genitourinary diseases,15371,1931,2.07 [1.59-2.71],9.201756090016804e-08
ROBO4,Roundabout homolog 4,Chapter XIV Diseases of the genitourinary system,Renal tubulo-interstitial diseases,17760,208,9.79 [4.78-20.05],4.301837437644895e-10
