Protein,Protein_definition,Disease_category,Disease,NB_individual,NB_case,HR[95%CI],P_value
VIM,Vimentin,Chapter III Diseases of the blood and blood-forming organs and certain disorders involving the immune mechanism,Anaemia in chronic diseases classified elsewhere,26419,58,1.40 [1.14-1.72],0.0013555014929721
VIM,Vimentin,"Chapter IV Endocrine, nutritional and metabolic diseases",Disorders of iron metabolism,23777,60,1.39 [1.13-1.69],0.0014530534305313
VIM,Vimentin,"Chapter IV Endocrine, nutritional and metabolic diseases",Disorders of other endocrine glands,27728,278,1.14 [1.03-1.26],0.0097085730937598
VIM,Vimentin,"Chapter IV Endocrine, nutritional and metabolic diseases",Type 2 diabetes without complications,27410,1504,1.06 [1.01-1.10],0.0080933758204654
VIM,Vimentin,Chapter VI Diseases of the nervous system,MS-disease / Multiple Sclerosis,27641,145,0.86 [0.78-0.96],0.0050634200934046
VIM,Vimentin,Chapter VIII Diseases of the ear and mastoid process,Diseases of external ear,27793,96,1.25 [1.06-1.48],0.0078926710392245
VIM,Vimentin,Chapter XI Diseases of the digestive system,"Hepatic failure, not elsewhere classified",27024,56,1.36 [1.11-1.67],0.0033720370147745
