Protein,Protein_definition,Disease_category,Disease,NB_individual,NB_case,HR[95%CI],P_value
PSMD5,26S proteasome non-ATPase regulatory subunit 5,Chapter II Neoplasms,Melanocytic naevi,23733,187,0.64 [0.45-0.89],0.0085778244864363
PSMD5,26S proteasome non-ATPase regulatory subunit 5,"Chapter IV Endocrine, nutritional and metabolic diseases",Acidosis,20544,173,1.46 [1.23-1.74],2.172024745954336e-05
PSMD5,26S proteasome non-ATPase regulatory subunit 5,Chapter IX Diseases of the circulatory system,Other embolism and thrombosis,22824,45,1.54 [1.13-2.09],0.0067069418094652
PSMD5,26S proteasome non-ATPase regulatory subunit 5,Chapter X Diseases of the respiratory system,Other pleural conditions,22726,32,1.61 [1.14-2.28],0.0067655755304538
PSMD5,26S proteasome non-ATPase regulatory subunit 5,Chapter XI Diseases of the digestive system,Diseases of the digestive system,23692,1090,1.14 [1.04-1.25],0.0073444184929795
PSMD5,26S proteasome non-ATPase regulatory subunit 5,Chapter XI Diseases of the digestive system,Intestinal malabsorption,22716,114,1.41 [1.14-1.75],0.0017017255001517
PSMD5,26S proteasome non-ATPase regulatory subunit 5,Chapter XIII Diseases of the musculoskeletal system and connective tissue,Other/unspecified synovitis and tenosynovitis,21033,180,1.30 [1.06-1.58],0.0098792342081043
