Protein,Protein_definition,Disease_category,Disease,NB_individual,NB_case,HR[95%CI],P_value
BTNL10,Butyrophilin-like protein 10,Chapter II Neoplasms,"Malignant neoplasm of intrahepatic ducts, biliary tract and gallbladder, excluding all cancers (controls excluding all cancers)",20503,43,1.85 [1.28-2.69],0.0011105659187717
BTNL10,Butyrophilin-like protein 10,Chapter II Neoplasms,"Malignant neoplasm of rectum, excluding all cancers (controls excluding all cancers)",20545,85,1.63 [1.17-2.27],0.0039839882133655
BTNL10,Butyrophilin-like protein 10,"Chapter IV Endocrine, nutritional and metabolic diseases",Other mental disorders due to brain damage and dysfunction and to physical disease,23522,29,2.10 [1.34-3.27],0.0010792268988741
BTNL10,Butyrophilin-like protein 10,Chapter XII Diseases of the skin and subcutaneous tissue,"Lichen planus, including avohilmo",23743,39,1.90 [1.32-2.72],0.0005283085612456
BTNL10,Butyrophilin-like protein 10,Chapter XII Diseases of the skin and subcutaneous tissue,Papulosquamous disorders,23684,228,1.42 [1.12-1.79],0.0035847500745553
