Protein,Protein_definition,Disease_category,Disease,NB_individual,NB_case,HR[95%CI],P_value
MMP15,Matrix metalloproteinase-15,Chapter I Certain infectious and parasitic diseases,Viral hepatitis,24598,45,1.63 [1.25-2.14],0.0003713779033649
MMP15,Matrix metalloproteinase-15,Chapter VI Diseases of the nervous system,Epilepsy,23239,235,1.27 [1.07-1.51],0.0056244816188984
MMP15,Matrix metalloproteinase-15,"Chapter VII Diseases of the eye, adnexa, ear and mastoid process",Chalazion,23987,68,1.43 [1.10-1.85],0.0078926039351349
MMP15,Matrix metalloproteinase-15,Chapter XI Diseases of the digestive system,Diseases of liver,24519,658,1.20 [1.07-1.35],0.0016315026942312
MMP15,Matrix metalloproteinase-15,Chapter XI Diseases of the digestive system,Other diseases of stomach and duodenum,20301,685,1.19 [1.06-1.33],0.0032392016981399
MMP15,Matrix metalloproteinase-15,Chapter XIII Diseases of the musculoskeletal system and connective tissue,Bursitis of shoulder,21550,87,1.46 [1.17-1.83],0.0008816957397648
MMP15,Matrix metalloproteinase-15,Chapter XIII Diseases of the musculoskeletal system and connective tissue,Seronegative rheumatoid arthritis,20806,43,1.52 [1.14-2.01],0.0039596360766239
MMP15,Matrix metalloproteinase-15,Chapter XIV Diseases of the genitourinary system,Recurrent and persistent haematuria,24485,42,1.54 [1.15-2.05],0.0033075526587296
