Protein,Protein_definition,Disease_category,Disease,NB_individual,NB_case,HR[95%CI],P_value
SERPINB5,Serpin B5,"Chapter IV Endocrine, nutritional and metabolic diseases",Disorders of magnesium metabolism,23835,118,0.64 [0.48-0.84],0.0016869521966788
SERPINB5,Serpin B5,"Chapter VII Diseases of the eye, adnexa, ear and mastoid process",Epiphora,27082,32,0.52 [0.35-0.78],0.0016880175895059
SERPINB5,Serpin B5,Chapter X Diseases of the respiratory system,"Bronchitis, not specified as acute or chronic",24634,43,2.16 [1.32-3.52],0.002022979075734
SERPINB5,Serpin B5,Chapter XIII Diseases of the musculoskeletal system and connective tissue,Other arthrosis,23079,1792,1.13 [1.04-1.23],0.0057595874497694
SERPINB5,Serpin B5,Chapter XIV Diseases of the genitourinary system,Chronic nephritic syndrome,27644,33,2.38 [1.37-4.13],0.0021486619197909
SERPINB5,Serpin B5,Chapter XIV Diseases of the genitourinary system,Dialysis,26463,64,2.47 [1.67-3.66],6.541104386990128e-06
SERPINB5,Serpin B5,Chapter XIV Diseases of the genitourinary system,Endometriosis,11366,140,1.50 [1.13-1.99],0.0052237084574212
