Protein,Protein_definition,Disease_category,Disease,NB_individual,NB_case,HR[95%CI],P_value
MAP1LC3A,Microtubule-associated proteins 1A/1B light chain 3A,Chapter I Certain infectious and parasitic diseases,Candidiasis,23745,257,0.59 [0.40-0.86],0.0059423123255332
MAP1LC3A,Microtubule-associated proteins 1A/1B light chain 3A,"Chapter IV Endocrine, nutritional and metabolic diseases",Disorders of the thyroid gland,23477,1094,0.78 [0.65-0.94],0.0076304882376353
MAP1LC3A,Microtubule-associated proteins 1A/1B light chain 3A,Chapter IX Diseases of the circulatory system,Other diseases of arteries and capillaries,23265,127,0.47 [0.27-0.79],0.0050147348186551
MAP1LC3A,Microtubule-associated proteins 1A/1B light chain 3A,Chapter IX Diseases of the circulatory system,Sequelae of cerebrovascular disease,23227,102,2.53 [1.55-4.12],0.0002061822356378
MAP1LC3A,Microtubule-associated proteins 1A/1B light chain 3A,Chapter VI Diseases of the nervous system,Circumscribed brain atrophy,23714,22,3.78 [1.52-9.43],0.0043564866097197
MAP1LC3A,Microtubule-associated proteins 1A/1B light chain 3A,Chapter VI Diseases of the nervous system,Lesion of plantar nerve,22383,70,2.31 [1.34-3.97],0.0025152655189936
MAP1LC3A,Microtubule-associated proteins 1A/1B light chain 3A,Chapter VIII Diseases of the ear and mastoid process,Benign paroxysmal vertigo,23664,55,0.34 [0.15-0.77],0.0093361855797233
MAP1LC3A,Microtubule-associated proteins 1A/1B light chain 3A,Chapter XII Diseases of the skin and subcutaneous tissue,Other and unspecified psoriasis,23671,133,2.36 [1.52-3.66],0.0001185574931923
MAP1LC3A,Microtubule-associated proteins 1A/1B light chain 3A,Chapter XIII Diseases of the musculoskeletal system and connective tissue,Pain in joint,19097,537,0.69 [0.53-0.90],0.0065091715954511
