Protein,Protein_definition,Disease_category,Disease,NB_individual,NB_case,HR[95%CI],P_value
TEX101,Testis-expressed protein 101,"Chapter IV Endocrine, nutritional and metabolic diseases",Disorders of parathyroid gland,23716,87,1.99 [1.35-2.93],0.0004795099901224
TEX101,Testis-expressed protein 101,"Chapter IV Endocrine, nutritional and metabolic diseases",Hyperparathyroidism,23711,82,1.87 [1.24-2.81],0.002876922521952
TEX101,Testis-expressed protein 101,Chapter IX Diseases of the circulatory system,Hypertensive Renal Disease,18498,42,2.71 [1.71-4.31],2.500396845011088e-05
TEX101,Testis-expressed protein 101,"Chapter VII Diseases of the eye, adnexa, ear and mastoid process",Other cataract,23323,942,0.84 [0.73-0.95],0.0078984910558368
TEX101,Testis-expressed protein 101,Chapter VIII Diseases of the ear and mastoid process,Sensorineural hearing loss,23477,88,1.76 [1.22-2.54],0.0023374135017112
TEX101,Testis-expressed protein 101,Chapter XI Diseases of the digestive system,Diseases of liver,23833,640,0.80 [0.68-0.93],0.0046374045358007
TEX101,Testis-expressed protein 101,Chapter XIV Diseases of the genitourinary system,Chronic kidney disease,23308,550,1.30 [1.11-1.52],0.0014547756841887
TEX101,Testis-expressed protein 101,Chapter XIV Diseases of the genitourinary system,Dialysis,22799,41,3.39 [2.23-5.14],9.822385516236668e-09
