Protein,Protein_definition,Disease_category,Disease,NB_individual,NB_case,HR[95%CI],P_value
S100A3,Protein S100-A3,Chapter II Neoplasms,Lung cancer and mesothelioma,18170,158,2.89 [2.64-3.16],1.1148045655598482e-116
S100A3,Protein S100-A3,Chapter II Neoplasms,Melanocytic naevi,24299,192,1.33 [1.08-1.63],0.0065517833861186
S100A3,Protein S100-A3,Chapter III Diseases of the blood and blood-forming organs and certain disorders involving the immune mechanism,Purpura and other haemorrhagic conditions,24340,167,1.35 [1.09-1.68],0.0069246250511118
S100A3,Protein S100-A3,Chapter III Diseases of the blood and blood-forming organs and certain disorders involving the immune mechanism,"Thrombocytopenia, unspecified",24316,143,1.43 [1.16-1.78],0.0009767121029638
S100A3,Protein S100-A3,Chapter X Diseases of the respiratory system,Emphysema,21795,167,2.03 [1.79-2.30],7.671351395506643e-28
S100A3,Protein S100-A3,Chapter XI Diseases of the digestive system,Chronic pancreatitis,22966,39,1.63 [1.18-2.26],0.0033357626535617
S100A3,Protein S100-A3,Chapter XI Diseases of the digestive system,Fissure and fistula of anal and rectal regions,18854,160,1.36 [1.10-1.68],0.0045002995615767
S100A3,Protein S100-A3,Chapter XI Diseases of the digestive system,Oesophageal obstruction,19648,132,2.94 [2.72-3.18],9.041962236886064e-163
S100A3,Protein S100-A3,Chapter XIV Diseases of the genitourinary system,Female genital prolapse,10252,384,0.61 [0.45-0.84],0.0018484729196833
