Protein,Protein_definition,Disease_category,Disease,NB_individual,NB_case,HR[95%CI],P_value
METAP1,Methionine aminopeptidase 1,Chapter II Neoplasms,Benign lipomatous neoplasm of skin and subcutaneous tissue of limbs,27574,75,1.91 [1.22-2.98],0.0046793222115977
METAP1,Methionine aminopeptidase 1,Chapter VIII Diseases of the ear and mastoid process,Sensorineural hearing loss,27145,98,1.85 [1.21-2.85],0.0049538578697421
METAP1,Methionine aminopeptidase 1,Chapter X Diseases of the respiratory system,Allergic asthma (mode),20499,124,1.80 [1.23-2.65],0.0027531741116173
METAP1,Methionine aminopeptidase 1,Chapter XI Diseases of the digestive system,Coeliac disease,26239,116,2.24 [1.70-2.96],1.1985411621570806e-08
METAP1,Methionine aminopeptidase 1,Chapter XI Diseases of the digestive system,Intestinal malabsorption,26259,136,2.16 [1.63-2.87],7.56548184558647e-08
METAP1,Methionine aminopeptidase 1,Chapter XI Diseases of the digestive system,Other and unspecified abdominal hernia,23816,47,2.22 [1.31-3.78],0.0031556473130963
