Protein,Protein_definition,Disease_category,Disease,NB_individual,NB_case,HR[95%CI],P_value
CEP164,Centrosomal protein of 164 kDa,"Chapter IV Endocrine, nutritional and metabolic diseases","Postprocedural endocrine and metabolic disorders, not elsewhere classified",23826,135,1.26 [1.06-1.51],0.0099887539403382
CEP164,Centrosomal protein of 164 kDa,"Chapter VII Diseases of the eye, adnexa, ear and mastoid process",Background diabetic retinopathy,27728,196,1.23 [1.06-1.44],0.0077351061831133
CEP164,Centrosomal protein of 164 kDa,Chapter X Diseases of the respiratory system,"Asthma, excluding more controls",22106,1775,1.09 [1.02-1.16],0.0066371209998477
CEP164,Centrosomal protein of 164 kDa,Chapter X Diseases of the respiratory system,"Asthma, unspecified (mode)",22219,1746,1.09 [1.03-1.16],0.0043194506235303
CEP164,Centrosomal protein of 164 kDa,Chapter X Diseases of the respiratory system,Chronic lower respiratory diseases,26943,2376,1.08 [1.02-1.14],0.0052792843950074
CEP164,Centrosomal protein of 164 kDa,Chapter XI Diseases of the digestive system,Other diseases of stomach and duodenum,22949,786,1.13 [1.03-1.23],0.0067235189414907
CEP164,Centrosomal protein of 164 kDa,Chapter XIV Diseases of the genitourinary system,Other abnormal uterine and vaginal bleeding,11330,104,1.32 [1.10-1.59],0.0031589881045542
