Protein,Protein_definition,Disease_category,Disease,NB_individual,NB_case,HR[95%CI],P_value
LTO1,Protein LTO1 homolog,Chapter VI Diseases of the nervous system,Migraine,26414,417,1.26 [1.07-1.50],0.0072286498884393
LTO1,Protein LTO1 homolog,Chapter VI Diseases of the nervous system,"Migraine, unspecified, drug-induced",27723,371,1.31 [1.10-1.56],0.0027605115046743
LTO1,Protein LTO1 homolog,Chapter XI Diseases of the digestive system,Acute pancreatitis,26220,168,1.40 [1.09-1.80],0.0085720731091127
LTO1,Protein LTO1 homolog,Chapter XI Diseases of the digestive system,Diaphragmatic hernia,25730,1844,1.15 [1.05-1.26],0.0021505267663375
LTO1,Protein LTO1 homolog,Chapter XIII Diseases of the musculoskeletal system and connective tissue,Other/unspecified seropositive rheumatoid arthritis,27797,37,1.75 [1.18-2.60],0.0055801950421584
