Protein,Protein_definition,Disease_category,Disease,NB_individual,NB_case,HR[95%CI],P_value
BLVRB,Flavin reductase,Chapter III Diseases of the blood and blood-forming organs and certain disorders involving the immune mechanism,Other diseases of blood and blood-forming organs,27815,54,1.80 [1.35-2.41],7.327178936132065e-05
BLVRB,Flavin reductase,"Chapter IV Endocrine, nutritional and metabolic diseases",Disorders of phosphorus metabolism and phosphatases,24239,99,1.45 [1.15-1.83],0.0019693035428266
BLVRB,Flavin reductase,Chapter VI Diseases of the nervous system,Epilepsy,26721,260,1.24 [1.06-1.45],0.0058671150932653
BLVRB,Flavin reductase,Chapter VI Diseases of the nervous system,"Other and unspecified nerve root and plexus disorders, also in other diseases",26951,392,0.82 [0.71-0.94],0.0052597677545131
BLVRB,Flavin reductase,Chapter X Diseases of the respiratory system,"Diseases of vocal cords and larynx+other diseases of upper respiratory tract, no elsewhere classified",27141,387,0.82 [0.71-0.95],0.0069239111827278
