Protein,Protein_definition,Disease_category,Disease,NB_individual,NB_case,HR[95%CI],P_value
SLC44A4,Choline transporter-like protein 4,Chapter III Diseases of the blood and blood-forming organs and certain disorders involving the immune mechanism,Other and unspecified aplastic anaemias,22716,49,1.42 [1.10-1.83],0.0064908586145615
SLC44A4,Choline transporter-like protein 4,"Chapter IV Endocrine, nutritional and metabolic diseases",Other mental disorders due to brain damage and dysfunction and to physical disease,23704,29,1.75 [1.41-2.18],4.960461196441641e-07
SLC44A4,Choline transporter-like protein 4,Chapter IX Diseases of the circulatory system,Abdominal aortic aneurysm (AAA),23283,47,1.48 [1.17-1.88],0.0012033700515814
SLC44A4,Choline transporter-like protein 4,Chapter IX Diseases of the circulatory system,"Bradycardia, unspecified, drug-induced",23909,225,0.65 [0.50-0.85],0.0015803055846813
SLC44A4,Choline transporter-like protein 4,"Chapter VII Diseases of the eye, adnexa, ear and mastoid process","Disorders of ocular muscles, binocular movement, accommodation and refraction",23857,411,1.16 [1.04-1.30],0.0092221912647206
SLC44A4,Choline transporter-like protein 4,Chapter X Diseases of the respiratory system,Acute upper respiratory infections of multiple and unspecified sites,23669,59,0.35 [0.18-0.67],0.0013860676604545
SLC44A4,Choline transporter-like protein 4,Chapter XIII Diseases of the musculoskeletal system and connective tissue,Pain in limb,21286,433,1.20 [1.08-1.34],0.0010204814127047
