Protein,Protein_definition,Disease_category,Disease,NB_individual,NB_case,HR[95%CI],P_value
FGF6,Fibroblast growth factor 6,Chapter II Neoplasms,Lung cancer and mesothelioma,17721,156,0.50 [0.29-0.84],0.0090132935726423
FGF6,Fibroblast growth factor 6,Chapter IX Diseases of the circulatory system,AV-block,21768,159,1.50 [1.21-1.86],0.0002191973741777
FGF6,Fibroblast growth factor 6,Chapter VI Diseases of the nervous system,Circumscribed brain atrophy,23794,22,1.62 [1.16-2.27],0.0047315954745326
FGF6,Fibroblast growth factor 6,Chapter XI Diseases of the digestive system,Cholecystitis,22537,151,1.39 [1.10-1.75],0.0048639784968602
FGF6,Fibroblast growth factor 6,Chapter XI Diseases of the digestive system,"Hepatic failure, not elsewhere classified",23218,48,1.57 [1.12-2.20],0.0091727478464751
FGF6,Fibroblast growth factor 6,Chapter XII Diseases of the skin and subcutaneous tissue,Papulosquamous disorders,23851,231,1.33 [1.08-1.62],0.0061882225069732
FGF6,Fibroblast growth factor 6,Chapter XII Diseases of the skin and subcutaneous tissue,Psoriasis,23808,188,1.41 [1.15-1.72],0.0008720668808304
FGF6,Fibroblast growth factor 6,Chapter XIII Diseases of the musculoskeletal system and connective tissue,Coxarthrosis,18926,674,1.22 [1.07-1.39],0.003464800951135
