Protein,Protein_definition,Disease_category,Disease,NB_individual,NB_case,HR[95%CI],P_value
HTR1A,5-hydroxytryptamine receptor 1A,Chapter II Neoplasms,Lung cancer and mesothelioma,17649,152,1.23 [1.05-1.43],0.0091668159434732
HTR1A,5-hydroxytryptamine receptor 1A,"Chapter IV Endocrine, nutritional and metabolic diseases",Fluid overload,20393,112,1.29 [1.10-1.51],0.0019610738703015
HTR1A,5-hydroxytryptamine receptor 1A,Chapter IX Diseases of the circulatory system,"Hypertension, portal",23691,47,1.38 [1.10-1.74],0.0058090359892756
HTR1A,5-hydroxytryptamine receptor 1A,Chapter VI Diseases of the nervous system,Circumscribed brain atrophy,23714,22,1.62 [1.24-2.12],0.0004601315640435
HTR1A,5-hydroxytryptamine receptor 1A,Chapter X Diseases of the respiratory system,Allergic rhinitis,23718,274,0.77 [0.63-0.94],0.0088098120321086
HTR1A,5-hydroxytryptamine receptor 1A,Chapter X Diseases of the respiratory system,Later onset COPD,22573,177,1.22 [1.05-1.41],0.0089285772081207
HTR1A,5-hydroxytryptamine receptor 1A,Chapter X Diseases of the respiratory system,Vasomotor and allergic rhinitis,22765,274,0.77 [0.63-0.94],0.0088906802819373
HTR1A,5-hydroxytryptamine receptor 1A,Chapter XIV Diseases of the genitourinary system,Urethral stricture,21918,145,0.62 [0.45-0.85],0.0029431468384871
