Protein,Protein_definition,Disease_category,Disease,NB_individual,NB_case,OR[95%CI],P_value
MTR,Methionine synthase,Chapter II Neoplasms,"Non-Hodgkin lymphoma, all, excluding all cancers (controls excluding all cancers)",13958,46,1.56 [1.26-1.95],6.436246371770791e-05
MTR,Methionine synthase,Chapter III Diseases of the blood and blood-forming organs and certain disorders involving the immune mechanism,Diseases of the blood and blood-forming organs and certain disorders involving the immune mechanism,16616,601,1.16 [1.04-1.29],0.0063275624931245
MTR,Methionine synthase,Chapter X Diseases of the respiratory system,Interstitial lung disease,18062,93,1.39 [1.13-1.70],0.0015510414976286
MTR,Methionine synthase,Chapter X Diseases of the respiratory system,"ILD, hospital admissions",19053,93,1.39 [1.14-1.70],0.0013997233688444
MTR,Methionine synthase,Chapter X Diseases of the respiratory system,Idiopathic pulmonary fibrosis,18055,86,1.36 [1.10-1.69],0.0047473310105987
MTR,Methionine synthase,Chapter XI Diseases of the digestive system,Intestinal malabsorption,17987,56,1.45 [1.15-1.83],0.0018180476361106
MTR,Methionine synthase,Chapter XI Diseases of the digestive system,Coeliac disease,17979,48,1.49 [1.18-1.90],0.0009772829855707
MTR,Methionine synthase,Chapter XIII Diseases of the musculoskeletal system and connective tissue,Polyarthropathies,12270,464,1.18 [1.05-1.33],0.005083298141502
