Protein,Protein_definition,Disease_category,Disease,NB_individual,NB_case,OR[95%CI],P_value
CPLX2,Complexin-2,Chapter I Certain infectious and parasitic diseases,"Bacterial, viral and other infectious agents",18043,358,1.44 [1.13-1.83],0.0030245791787082
CPLX2,Complexin-2,Chapter I Certain infectious and parasitic diseases,Other bacterial agents as the cause of diseases classified to other chapters,17943,258,1.61 [1.26-2.06],0.0001291707053961
CPLX2,Complexin-2,Chapter IX Diseases of the circulatory system,Hypertensive Renal Disease,10191,63,2.08 [1.42-3.05],0.0001640682424974
CPLX2,Complexin-2,Chapter X Diseases of the respiratory system,Acute upper respiratory infections,19287,68,1.72 [1.18-2.52],0.0049190751499638
CPLX2,Complexin-2,Chapter XI Diseases of the digestive system,Diseases of the digestive system,18156,272,1.44 [1.11-1.86],0.0053395222760685
CPLX2,Complexin-2,Chapter XIV Diseases of the genitourinary system,Chronic kidney disease,16591,54,2.01 [1.48-2.72],6.794546927972458e-06
