Protein,Protein_definition,Disease_category,Disease,NB_individual,NB_case,OR[95%CI],P_value
SKIV2L,Helicase SKI2W,Chapter II Neoplasms,Other benign neoplasms of skin,19335,147,1.65 [1.25-2.18],0.0004379859802982
SKIV2L,Helicase SKI2W,"Chapter IV Endocrine, nutritional and metabolic diseases",Disorders of other endocrine glands,19181,46,0.24 [0.09-0.65],0.0046934148721063
SKIV2L,Helicase SKI2W,Chapter VI Diseases of the nervous system,Episodal and paroxysmal disorders,18390,374,1.38 [1.12-1.70],0.0022405590368281
SKIV2L,Helicase SKI2W,Chapter XI Diseases of the digestive system,Diseases of appendix,19344,78,0.29 [0.14-0.61],0.0010713236546746
SKIV2L,Helicase SKI2W,Chapter XI Diseases of the digestive system,Acute appendicitis,19333,67,0.34 [0.15-0.75],0.0073089435190418
