Protein,Protein_definition,Disease_category,Disease,NB_individual,NB_case,OR[95%CI],P_value
SULT1A1,Sulfotransferase 1A1,Chapter III Diseases of the blood and blood-forming organs and certain disorders involving the immune mechanism,Agranulocytosis,22716,59,0.72 [0.61-0.86],0.0001435406439677
SULT1A1,Sulfotransferase 1A1,"Chapter IV Endocrine, nutritional and metabolic diseases",Type 2 diabetes,21137,784,1.09 [1.03-1.15],0.0019072925598731
SULT1A1,Sulfotransferase 1A1,"Chapter IV Endocrine, nutritional and metabolic diseases",Type 2 diabetes without complications,21111,758,1.08 [1.02-1.14],0.0053165708331503
SULT1A1,Sulfotransferase 1A1,Chapter IX Diseases of the circulatory system,Paroxysmal tachycardia,9103,145,0.84 [0.75-0.93],0.0016670757146507
SULT1A1,Sulfotransferase 1A1,Chapter IX Diseases of the circulatory system,Atrial fibrillation and flutter,9651,693,0.90 [0.85-0.95],8.498195567412166e-05
SULT1A1,Sulfotransferase 1A1,Chapter IX Diseases of the circulatory system,Other or ill-defined heart diseases,17184,125,0.79 [0.70-0.89],7.416686950797141e-05
SULT1A1,Sulfotransferase 1A1,Chapter XI Diseases of the digestive system,Colonic or urogenital fistula,23208,122,0.85 [0.75-0.96],0.0078705787277306
SULT1A1,Sulfotransferase 1A1,Chapter XIII Diseases of the musculoskeletal system and connective tissue,Spondylopathies,19599,376,0.90 [0.84-0.97],0.004744095236425
SULT1A1,Sulfotransferase 1A1,Chapter XIV Diseases of the genitourinary system,Uterine polyps,9479,152,0.86 [0.77-0.96],0.0053866954201919
