Protein,Protein_definition,Disease_category,Disease,NB_individual,NB_case,OR[95%CI],P_value
CTAG1A_CTAG1B,Cancer/testis antigen 1,Chapter I Certain infectious and parasitic diseases,Other viral diseases,19660,57,1.73 [1.22-2.47],0.0023593585083714
CTAG1A_CTAG1B,Cancer/testis antigen 1,Chapter I Certain infectious and parasitic diseases,"Other viral diseases, not elsewhere classified",19657,54,1.80 [1.27-2.55],0.0010487997528809
CTAG1A_CTAG1B,Cancer/testis antigen 1,Chapter IX Diseases of the circulatory system,"Myocardial infarction, strict",16198,351,0.72 [0.58-0.90],0.0036943552162973
CTAG1A_CTAG1B,Cancer/testis antigen 1,Chapter IX Diseases of the circulatory system,Other arrhythmias,14662,79,1.56 [1.13-2.16],0.0067523639480726
CTAG1A_CTAG1B,Cancer/testis antigen 1,Chapter X Diseases of the respiratory system,Chronic sinusitis,18731,78,0.53 [0.33-0.84],0.0066266254744573
CTAG1A_CTAG1B,Cancer/testis antigen 1,Chapter XI Diseases of the digestive system,Diseases of peritoneum,19347,77,0.54 [0.34-0.86],0.0092087381765643
