Protein,Protein_definition,Disease_category,Disease,NB_individual,NB_case,OR[95%CI],P_value
KDM3A,Lysine-specific demethylase 3A,"Chapter IV Endocrine, nutritional and metabolic diseases",Disorders of the thyroid gland,18120,534,1.16 [1.06-1.26],0.0006367100971881
KDM3A,Lysine-specific demethylase 3A,Chapter XI Diseases of the digestive system,Ulcer of oesophagus,13837,234,1.19 [1.06-1.33],0.0039278831223173
KDM3A,Lysine-specific demethylase 3A,Chapter XI Diseases of the digestive system,Other functional intestinal disorders,12723,264,1.18 [1.06-1.32],0.0027924351713647
KDM3A,Lysine-specific demethylase 3A,Chapter XI Diseases of the digestive system,Constipation,17834,240,1.17 [1.04-1.31],0.0092600354746692
KDM3A,Lysine-specific demethylase 3A,Chapter XIII Diseases of the musculoskeletal system and connective tissue,Spondylosis,16393,206,1.19 [1.05-1.35],0.0073584940865406
KDM3A,Lysine-specific demethylase 3A,Chapter XIV Diseases of the genitourinary system,Other disorders of penis,6866,75,1.34 [1.12-1.61],0.0014563260599791
