Protein,Protein_definition,Disease_category,Disease,NB_individual,NB_case,OR[95%CI],P_value
RANGAP1,Ran GTPase-activating protein 1,Chapter II Neoplasms,Benign neoplasm: Stomach,22639,67,1.53 [1.11-2.12],0.0094960153650761
RANGAP1,Ran GTPase-activating protein 1,Chapter IX Diseases of the circulatory system,Venous thromboembolism,21737,277,1.31 [1.08-1.59],0.0064805966845345
RANGAP1,Ran GTPase-activating protein 1,Chapter X Diseases of the respiratory system,"Diseases of vocal cords and larynx+other diseases of upper respiratory tract, no elsewhere classified",21728,348,0.73 [0.58-0.92],0.0085292675242203
RANGAP1,Ran GTPase-activating protein 1,Chapter XIII Diseases of the musculoskeletal system and connective tissue,Trigger finger,18900,117,0.52 [0.34-0.81],0.0034520932239558
RANGAP1,Ran GTPase-activating protein 1,Chapter XIV Diseases of the genitourinary system,Other obstructive and reflux uropathy,18780,81,1.54 [1.13-2.10],0.0065200165638292
