Protein,Protein_definition,Disease_category,Disease,NB_individual,NB_case,OR[95%CI],P_value
TSPAN15,Tetraspanin-15,Chapter II Neoplasms,Melanocytic naevi,19320,125,0.50 [0.31-0.80],0.0043217303485573
TSPAN15,Tetraspanin-15,Chapter II Neoplasms,Other benign neoplasms of skin,19335,147,1.37 [1.09-1.73],0.0068745999556233
TSPAN15,Tetraspanin-15,"Chapter VII Diseases of the eye, adnexa, ear and mastoid process","Disorders of ocular muscles, binocular movement, accommodation and refraction",18694,58,1.55 [1.14-2.12],0.0053046425158571
TSPAN15,Tetraspanin-15,Chapter XIV Diseases of the genitourinary system,Renal tubulo-interstitial diseases,16545,200,1.33 [1.08-1.63],0.0060673737230358
TSPAN15,Tetraspanin-15,Chapter XIV Diseases of the genitourinary system,Other obstructive and reflux uropathy,16406,61,1.52 [1.11-2.08],0.0084093019257278
