Protein,Protein_definition,Disease_category,Disease,NB_individual,NB_case,OR[95%CI],P_value
FBN2,Fibrillin-2,Chapter I Certain infectious and parasitic diseases,Implicit Sepsis,11352,857,1.17 [1.04-1.32],0.0077686579168928
FBN2,Fibrillin-2,Chapter II Neoplasms,Benign lipomatous neoplasm of skin and subcutaneous tissue of trunk,19583,87,0.63 [0.48-0.83],0.0010198984475053
FBN2,Fibrillin-2,Chapter II Neoplasms,Benign neoplasm of breast,10297,36,0.61 [0.42-0.89],0.0092667104744087
FBN2,Fibrillin-2,Chapter III Diseases of the blood and blood-forming organs and certain disorders involving the immune mechanism,Other and unspecified iron deficiency,18338,160,1.44 [1.13-1.85],0.0033485946891717
FBN2,Fibrillin-2,Chapter III Diseases of the blood and blood-forming organs and certain disorders involving the immune mechanism,Other anaemias,17883,265,1.36 [1.12-1.66],0.0019787315749834
FBN2,Fibrillin-2,Chapter III Diseases of the blood and blood-forming organs and certain disorders involving the immune mechanism,Other and unspecified anaemias,17883,265,1.36 [1.12-1.66],0.0019787315749834
FBN2,Fibrillin-2,Chapter IX Diseases of the circulatory system,Hypertensive Renal Disease,10315,61,1.80 [1.27-2.55],0.0009890996238391
FBN2,Fibrillin-2,Chapter XIV Diseases of the genitourinary system,Acute renal failure,16758,45,2.01 [1.35-2.99],0.0005526786659766
FBN2,Fibrillin-2,Chapter XIV Diseases of the genitourinary system,Chronic kidney disease,16766,53,1.96 [1.35-2.84],0.0003656173801976
