Protein,Protein_definition,Disease_category,Disease,NB_individual,NB_case,OR[95%CI],P_value
STX3,Syntaxin-3,Chapter II Neoplasms,"Malignant neoplasm of colon, excluding all cancers (controls excluding all cancers)",14439,82,1.66 [1.17-2.35],0.0045473652948576
STX3,Syntaxin-3,Chapter VI Diseases of the nervous system,Episodal and paroxysmal disorders,18998,390,1.32 [1.07-1.62],0.0088743223504284
STX3,Syntaxin-3,Chapter XI Diseases of the digestive system,Diseases of the digestive system,18818,281,1.41 [1.12-1.76],0.0030532918779176
STX3,Syntaxin-3,Chapter XI Diseases of the digestive system,Intestinal malabsorption,18595,58,1.93 [1.37-2.72],0.000154350987901
STX3,Syntaxin-3,Chapter XI Diseases of the digestive system,Coeliac disease,18587,50,2.00 [1.40-2.85],0.0001355483839997
STX3,Syntaxin-3,Chapter XII Diseases of the skin and subcutaneous tissue,"Other disorders of skin and subcutaneous tissue, not elsewhere classified",18024,202,1.43 [1.10-1.87],0.0079077044174269
