Protein,Protein_definition,Disease_category,Disease,NB_individual,NB_case,OR[95%CI],P_value
EPHX2,Bifunctional epoxide hydrolase 2,"Chapter IV Endocrine, nutritional and metabolic diseases",Disorders of other endocrine glands,22380,58,1.47 [1.15-1.89],0.0021144053347658
EPHX2,Bifunctional epoxide hydrolase 2,Chapter X Diseases of the respiratory system,Vocal cord dysfunction,7191,75,0.52 [0.33-0.82],0.0052456936111767
EPHX2,Bifunctional epoxide hydrolase 2,Chapter XIII Diseases of the musculoskeletal system and connective tissue,"Other (seronegative) rheumatoid arthritis, wide",22215,176,1.26 [1.06-1.50],0.0090600375907108
EPHX2,Bifunctional epoxide hydrolase 2,Chapter XIII Diseases of the musculoskeletal system and connective tissue,Other/unspecified rheumatoid arthritis,22220,160,1.31 [1.10-1.55],0.0025307831423654
EPHX2,Bifunctional epoxide hydrolase 2,Chapter XIV Diseases of the genitourinary system,Disorders of breast,11729,226,0.70 [0.55-0.88],0.0025885459366315
