Protein,Protein_definition,Disease_category,Disease,NB_individual,NB_case,OR[95%CI],P_value
MORF4L1,Mortality factor 4-like protein 1,Chapter I Certain infectious and parasitic diseases,Mycoses,19275,50,1.78 [1.24-2.57],0.0019858842913331
MORF4L1,Mortality factor 4-like protein 1,Chapter XII Diseases of the skin and subcutaneous tissue,Cellulitis,18805,238,0.54 [0.37-0.81],0.0026715399635516
MORF4L1,Mortality factor 4-like protein 1,Chapter XII Diseases of the skin and subcutaneous tissue,Radiation-related disorders of the skin and subcutaneous tissue,19425,61,1.68 [1.16-2.43],0.0057034103235319
MORF4L1,Mortality factor 4-like protein 1,Chapter XII Diseases of the skin and subcutaneous tissue,Skin changes due to chronic exposure to nonionizing radiation,19424,60,1.72 [1.20-2.47],0.0032325767034982
MORF4L1,Mortality factor 4-like protein 1,Chapter XIV Diseases of the genitourinary system,Ovarian cyst,8057,83,1.56 [1.13-2.17],0.0075841123537969
