Protein,Protein_definition,Disease_category,Disease,NB_individual,NB_case,HR[95%CI],P_value
CNTN3,Contactin-3,Chapter III Diseases of the blood and blood-forming organs and certain disorders involving the immune mechanism,Diseases of the blood and blood-forming organs and certain disorders involving the immune mechanism,22443,3526,0.74 [0.67-0.81],3.8473294643678565e-10
CNTN3,Contactin-3,"Chapter IV Endocrine, nutritional and metabolic diseases",Type 2 diabetes without complications,22355,2147,2.64 [2.32-3.00],3.401864251755396e-50
CNTN3,Contactin-3,Chapter IX Diseases of the circulatory system,Atrial fibrillation and flutter,11738,2856,0.70 [0.63-0.79],6.86976845361318e-10
CNTN3,Contactin-3,Chapter XIII Diseases of the musculoskeletal system and connective tissue,Osteopathies and chondropathies,22769,2251,0.62 [0.55-0.69],4.074769446610742e-17
CNTN3,Contactin-3,Chapter XIII Diseases of the musculoskeletal system and connective tissue,Osteoporosis,22093,1575,0.60 [0.52-0.68],2.1711027477979646e-14
