Protein,Protein_definition,Disease_category,Disease,NB_individual,NB_case,HR[95%CI],P_value
LTA,Lymphotoxin-alpha,Chapter II Neoplasms,"Chronic lymphocytic leukaemia and small lyphocytis leukaemia, excluding all cancers (controls excluding all cancers)",16497,71,2.99 [2.49-3.58],5.845290395144054e-32
LTA,Lymphotoxin-alpha,Chapter II Neoplasms,Lymphoid leukaemia,16498,72,2.93 [2.45-3.51],2.244119015635762e-31
LTA,Lymphotoxin-alpha,Chapter II Neoplasms,"Non-follicular lymphoma, hilmo, excluding all cancers",16549,123,2.21 [1.77-2.76],1.844349114863588e-12
LTA,Lymphotoxin-alpha,Chapter II Neoplasms,"Non-Hodgkin lymphoma, all, excluding all cancers (controls excluding all cancers)",16627,201,2.24 [1.88-2.65],2.811052080888782e-20
LTA,Lymphotoxin-alpha,Chapter III Diseases of the blood and blood-forming organs and certain disorders involving the immune mechanism,Agranulocytosis,22815,396,1.86 [1.58-2.20],2.565734618822899e-13
LTA,Lymphotoxin-alpha,Chapter III Diseases of the blood and blood-forming organs and certain disorders involving the immune mechanism,"Thrombocytopenia, unspecified",22884,296,1.89 [1.55-2.30],2.9173028354349594e-10
LTA,Lymphotoxin-alpha,Chapter XIII Diseases of the musculoskeletal system and connective tissue,Other/unspecified seropositive rheumatoid arthritis,23098,69,2.27 [1.77-2.91],9.401949649243771e-11
LTA,Lymphotoxin-alpha,Chapter XIII Diseases of the musculoskeletal system and connective tissue,Psoriatic arthropathies,13991,64,2.26 [1.75-2.92],5.62296139955019e-10
LTA,Lymphotoxin-alpha,Chapter XIII Diseases of the musculoskeletal system and connective tissue,"Seropositive rheumatoid arthritis, wide",23102,73,2.36 [1.88-2.95],8.860188678497506e-14
