Protein,Protein_definition,Disease_category,Disease,NB_individual,NB_case,HR[95%CI],P_value
TNXB,Tenascin-X,"Chapter IV Endocrine, nutritional and metabolic diseases",Disorders of mineral metabolism,15784,715,0.47 [0.37-0.59],6.243546891580486e-10
TNXB,Tenascin-X,Chapter IX Diseases of the circulatory system,"Hypertension, portal",23034,96,5.45 [3.20-9.29],4.38555054058673e-10
TNXB,Tenascin-X,Chapter IX Diseases of the circulatory system,"Myocardial infarction, strict",19377,922,0.52 [0.42-0.64],4.681923700466981e-10
TNXB,Tenascin-X,Chapter VI Diseases of the nervous system,Extrapyramidal and movement disorders,23149,924,0.49 [0.40-0.60],1.876916431471152e-12
TNXB,Tenascin-X,Chapter VI Diseases of the nervous system,Parkinson's disease,23170,684,0.45 [0.36-0.55],2.8006428349880667e-14
