Protein,Protein_definition,Disease_category,Disease,NB_individual,NB_case,HR[95%CI],P_value
CFB,Complement factor B,Chapter III Diseases of the blood and blood-forming organs and certain disorders involving the immune mechanism,Diseases of the blood and blood-forming organs and certain disorders involving the immune mechanism,19216,2888,1.44 [1.29-1.61],2.433965494404529e-10
CFB,Complement factor B,"Chapter IV Endocrine, nutritional and metabolic diseases",Type 2 diabetes without complications,19140,1808,2.11 [1.83-2.43],1.9531881649345893e-24
CFB,Complement factor B,Chapter IX Diseases of the circulatory system,Hypertension,17121,6740,1.29 [1.20-1.39],1.2566060919631103e-11
CFB,Complement factor B,Chapter IX Diseases of the circulatory system,"Hypertension, essential",17123,6742,1.29 [1.20-1.39],2.0093219041513027e-11
CFB,Complement factor B,Chapter X Diseases of the respiratory system,"COPD, hospital admissions 1, only main diagnosis",19589,1369,1.73 [1.47-2.04],5.899384477785803e-11
CFB,Complement factor B,Chapter X Diseases of the respiratory system,Later onset COPD,19378,1268,1.73 [1.46-2.05],2.605866936831597e-10
