Protein,Protein_definition,Disease_category,Disease,NB_individual,NB_case,OR[95%CI],P_value
GPHA2,Glycoprotein hormone alpha-2,Chapter I Certain infectious and parasitic diseases,"Bacterial, viral and other infectious agents",18635,372,1.44 [1.22-1.70],1.76702600118918e-05
GPHA2,Glycoprotein hormone alpha-2,Chapter III Diseases of the blood and blood-forming organs and certain disorders involving the immune mechanism,Other anaemias,18299,281,1.45 [1.21-1.74],7.36296742709769e-05
GPHA2,Glycoprotein hormone alpha-2,Chapter III Diseases of the blood and blood-forming organs and certain disorders involving the immune mechanism,Other and unspecified anaemias,18299,281,1.45 [1.21-1.74],7.36296742709769e-05
GPHA2,Glycoprotein hormone alpha-2,Chapter IX Diseases of the circulatory system,Hypertensive Renal Disease,10537,64,2.08 [1.59-2.73],8.30457918903615e-08
GPHA2,Glycoprotein hormone alpha-2,Chapter XI Diseases of the digestive system,Inguinal hernia,15882,689,0.53 [0.42-0.67],6.310187977916008e-08
GPHA2,Glycoprotein hormone alpha-2,Chapter XIV Diseases of the genitourinary system,Renal tubulo-interstitial diseases,17042,213,1.53 [1.25-1.89],5.459674665368253e-05
GPHA2,Glycoprotein hormone alpha-2,Chapter XIV Diseases of the genitourinary system,Chronic kidney disease,17133,54,2.11 [1.58-2.83],4.367924007618922e-07
