Protein,Protein_definition,Disease_category,Disease,NB_individual,NB_case,OR[95%CI],P_value
SUMF2,Inactive C-alpha-formylglycine-generating enzyme 2,Chapter III Diseases of the blood and blood-forming organs and certain disorders involving the immune mechanism,Diseases of the blood and blood-forming organs and certain disorders involving the immune mechanism,19823,771,1.30 [1.14-1.48],7.140369453152513e-05
SUMF2,Inactive C-alpha-formylglycine-generating enzyme 2,"Chapter IV Endocrine, nutritional and metabolic diseases",Type 2 diabetes,21137,784,1.31 [1.15-1.49],5.5771978117504416e-05
SUMF2,Inactive C-alpha-formylglycine-generating enzyme 2,Chapter IX Diseases of the circulatory system,Hypertensive Renal Disease,12119,110,2.75 [1.91-3.97],6.22210910759346e-08
SUMF2,Inactive C-alpha-formylglycine-generating enzyme 2,Chapter XIV Diseases of the genitourinary system,Renal tubulo-interstitial diseases,19567,298,2.02 [1.63-2.50],1.1135357853077168e-10
SUMF2,Inactive C-alpha-formylglycine-generating enzyme 2,Chapter XIV Diseases of the genitourinary system,Acute renal failure,19617,66,3.18 [1.99-5.09],1.2712988277206934e-06
SUMF2,Inactive C-alpha-formylglycine-generating enzyme 2,Chapter XIV Diseases of the genitourinary system,Chronic kidney disease,19641,90,2.75 [1.85-4.09],5.64858929673908e-07
