Protein,Protein_definition,Disease_category,Disease,NB_individual,NB_case,OR[95%CI],P_value
SELPLG,P-selectin glycoprotein ligand 1,Chapter III Diseases of the blood and blood-forming organs and certain disorders involving the immune mechanism,Diseases of the blood and blood-forming organs and certain disorders involving the immune mechanism,19625,767,0.65 [0.53-0.80],4.394195563384353e-05
SELPLG,P-selectin glycoprotein ligand 1,"Chapter IV Endocrine, nutritional and metabolic diseases",Type 2 diabetes,20917,775,2.18 [1.70-2.79],9.096117841258231e-10
SELPLG,P-selectin glycoprotein ligand 1,"Chapter IV Endocrine, nutritional and metabolic diseases",Type 2 diabetes without complications,20891,749,2.20 [1.71-2.84],9.259368103758275e-10
SELPLG,P-selectin glycoprotein ligand 1,Chapter X Diseases of the respiratory system,Interstitial lung disease,21462,95,0.37 [0.24-0.57],7.022083045067334e-06
SELPLG,P-selectin glycoprotein ligand 1,Chapter X Diseases of the respiratory system,"ILD, hospital admissions",22631,95,0.37 [0.24-0.57],8.122332398822601e-06
SELPLG,P-selectin glycoprotein ligand 1,Chapter X Diseases of the respiratory system,Idiopathic pulmonary fibrosis,21455,88,0.39 [0.25-0.62],7.119352021438155e-05
SELPLG,P-selectin glycoprotein ligand 1,Chapter XI Diseases of the digestive system,Inguinal hernia,18201,783,0.58 [0.48-0.72],2.8251663986934655e-07
SELPLG,P-selectin glycoprotein ligand 1,Chapter XIII Diseases of the musculoskeletal system and connective tissue,Systemic lupus erythematosus,22372,105,0.34 [0.23-0.50],5.2226834842492336e-08
SELPLG,P-selectin glycoprotein ligand 1,Chapter XIV Diseases of the genitourinary system,Other disorders of  bladder,19326,373,0.56 [0.43-0.75],6.474622424707269e-05
