Protein,Protein_definition,Disease_category,Disease,NB_individual,NB_case,OR[95%CI],P_value
ALDH5A1,"Succinate-semialdehyde dehydrogenase, mitochondrial",Chapter I Certain infectious and parasitic diseases,Certain infectious and parasitic diseases,16594,776,1.34 [1.17-1.54],2.43088036514797e-05
ALDH5A1,"Succinate-semialdehyde dehydrogenase, mitochondrial",Chapter I Certain infectious and parasitic diseases,"Bacterial, viral and other infectious agents",18683,369,1.46 [1.21-1.76],6.162723101909587e-05
ALDH5A1,"Succinate-semialdehyde dehydrogenase, mitochondrial",Chapter III Diseases of the blood and blood-forming organs and certain disorders involving the immune mechanism,Other anaemias,18353,279,1.53 [1.24-1.88],5.888175367801009e-05
ALDH5A1,"Succinate-semialdehyde dehydrogenase, mitochondrial",Chapter III Diseases of the blood and blood-forming organs and certain disorders involving the immune mechanism,Other and unspecified anaemias,18353,279,1.53 [1.24-1.88],5.888175367801009e-05
ALDH5A1,"Succinate-semialdehyde dehydrogenase, mitochondrial",Chapter XI Diseases of the digestive system,Diseases of liver,19327,100,1.88 [1.38-2.55],6.670493804724472e-05
ALDH5A1,"Succinate-semialdehyde dehydrogenase, mitochondrial",Chapter XIII Diseases of the musculoskeletal system and connective tissue,Other/unspecified rheumatoid arthritis,19655,132,1.75 [1.33-2.29],5.347544432101364e-05
