Protein,Protein_definition,Disease_category,Disease,NB_individual,NB_case,OR[95%CI],P_value
ENTPD2,Ectonucleoside triphosphate diphosphohydrolase 2,"Chapter IV Endocrine, nutritional and metabolic diseases",Type 1 diabetes,19902,156,1.75 [1.35-2.25],1.725652512840078e-05
ENTPD2,Ectonucleoside triphosphate diphosphohydrolase 2,"Chapter IV Endocrine, nutritional and metabolic diseases",Type 1 diabetes without complications,19889,143,1.84 [1.43-2.38],2.8438298685767262e-06
ENTPD2,Ectonucleoside triphosphate diphosphohydrolase 2,Chapter X Diseases of the respiratory system,Asthma,14712,841,0.75 [0.65-0.87],9.181685849963669e-05
ENTPD2,Ectonucleoside triphosphate diphosphohydrolase 2,Chapter X Diseases of the respiratory system,"Asthma, excluding more controls",14329,841,0.75 [0.65-0.87],8.512596611956497e-05
ENTPD2,Ectonucleoside triphosphate diphosphohydrolase 2,Chapter XI Diseases of the digestive system,Diseases of liver,21771,123,2.17 [1.67-2.81],5.615313297102885e-09
