Protein,Protein_definition,Disease_category,Disease,NB_individual,NB_case,OR[95%CI],P_value
OFD1,Oral-facial-digital syndrome 1 protein,Chapter II Neoplasms,Benign neoplasm: Sigmoid colon,19215,133,0.68 [0.48-0.96],0.0288722652498353
OFD1,Oral-facial-digital syndrome 1 protein,Chapter V Mental and behavioural disorders,"Alcohol use disorder, ICD-based",19517,70,1.39 [1.06-1.82],0.0186092060024582
OFD1,Oral-facial-digital syndrome 1 protein,Chapter VI Diseases of the nervous system,Neurological diseases,16292,1252,0.90 [0.82-0.99],0.0343957304313946
OFD1,Oral-facial-digital syndrome 1 protein,"Chapter VII Diseases of the eye, adnexa, ear and mastoid process",Diabetic maculopathy,2200,52,1.35 [1.00-1.83],0.0496154571341041
OFD1,Oral-facial-digital syndrome 1 protein,Chapter XI Diseases of the digestive system,Other diseases of lip and oral mucosa,18963,80,1.31 [1.02-1.68],0.0347943102777232
OFD1,Oral-facial-digital syndrome 1 protein,Chapter XIV Diseases of the genitourinary system,Other disorders of penis,6943,78,1.30 [1.02-1.67],0.0357257820061298
