Protein,Protein_definition,Disease_category,Disease,NB_individual,NB_case,HR[95%CI],P_value
PRSS53,Serine protease 53,"Chapter IV Endocrine, nutritional and metabolic diseases",Nontoxic multinodular goitre,41230,75,0.38 [0.21-0.67],0.0008610560988413
PRSS53,Serine protease 53,"Chapter IV Endocrine, nutritional and metabolic diseases",Type 2 diabetes with ophthalmic complications,3892,422,0.65 [0.52-0.81],0.0001125911837529
PRSS53,Serine protease 53,"Chapter VII Diseases of the eye, adnexa, ear and mastoid process",Background diabetic retinopathy,44400,396,0.59 [0.46-0.75],1.4870496402900554e-05
PRSS53,Serine protease 53,Chapter XI Diseases of the digestive system,Alcoholic liver disease,43149,128,2.20 [1.48-3.28],0.0001071369895701
PRSS53,Serine protease 53,Chapter XII Diseases of the skin and subcutaneous tissue,Dermatitis,44148,479,1.53 [1.23-1.90],0.0001361428996554
PRSS53,Serine protease 53,Chapter XII Diseases of the skin and subcutaneous tissue,Other and unspecified dermatitis,44130,461,1.55 [1.24-1.93],0.0001105241760361
PRSS53,Serine protease 53,Chapter XIII Diseases of the musculoskeletal system and connective tissue,Gonarthrosis,33850,2905,1.17 [1.07-1.28],0.0009440214684241
