Protein,Protein_definition,Disease_category,Disease,NB_individual,NB_case,HR[95%CI],P_value
AK1,Adenylate kinase isoenzyme 1,Chapter III Diseases of the blood and blood-forming organs and certain disorders involving the immune mechanism,Other diseases of blood and blood-forming organs,50377,131,1.52 [1.22-1.89],0.0001821868835521
AK1,Adenylate kinase isoenzyme 1,"Chapter IV Endocrine, nutritional and metabolic diseases",Type 2 diabetes with peripheral circulatory complications,46694,125,0.61 [0.47-0.80],0.0002457018913641
AK1,Adenylate kinase isoenzyme 1,Chapter VI Diseases of the nervous system,Migraine,48536,716,1.21 [1.10-1.33],0.0001456780058
AK1,Adenylate kinase isoenzyme 1,Chapter VI Diseases of the nervous system,"Migraine, unspecified, drug-induced",51379,644,1.20 [1.08-1.33],0.0006245347374466
AK1,Adenylate kinase isoenzyme 1,Chapter X Diseases of the respiratory system,Emphysema,44569,632,1.22 [1.10-1.36],0.000170637676569
AK1,Adenylate kinase isoenzyme 1,Chapter XII Diseases of the skin and subcutaneous tissue,Seborrhoeic keratosis,47648,537,0.80 [0.71-0.90],0.000374301746413
