Protein,Protein_definition,Disease_category,Disease,NB_individual,NB_case,HR[95%CI],P_value
GTPBP2,GTP-binding protein 2,Chapter III Diseases of the blood and blood-forming organs and certain disorders involving the immune mechanism,Other and unspecified iron deficiency,43028,1936,1.10 [1.04-1.16],0.0007286714925955
GTPBP2,GTP-binding protein 2,Chapter III Diseases of the blood and blood-forming organs and certain disorders involving the immune mechanism,Purpura and other haemorrhagic conditions,43241,452,0.74 [0.66-0.84],6.518257886499613e-07
GTPBP2,GTP-binding protein 2,Chapter III Diseases of the blood and blood-forming organs and certain disorders involving the immune mechanism,"Thrombocytopenia, unspecified",43167,378,0.65 [0.57-0.74],4.414161291978527e-11
GTPBP2,GTP-binding protein 2,"Chapter IV Endocrine, nutritional and metabolic diseases",Disorders of lipoprotein metabolism and other lipidaemias,39220,5912,1.07 [1.04-1.10],1.3553052034012648e-05
GTPBP2,GTP-binding protein 2,"Chapter IV Endocrine, nutritional and metabolic diseases",Unspecified dementia,42472,555,0.84 [0.75-0.93],0.0007756879748902
GTPBP2,GTP-binding protein 2,Chapter IX Diseases of the circulatory system,"Hypertension, portal",43264,133,0.65 [0.52-0.81],0.0001067431811471
GTPBP2,GTP-binding protein 2,Chapter VI Diseases of the nervous system,Falls/tendency to fall,42573,4253,0.94 [0.91-0.97],0.0009204505484225
GTPBP2,GTP-binding protein 2,Chapter XI Diseases of the digestive system,"Cirrhosis of liver, NAS",43316,185,0.73 [0.61-0.87],0.0006128377167485
