Protein,Protein_definition,Disease_category,Disease,NB_individual,NB_case,HR[95%CI],P_value
SPINT3,Kunitz-type protease inhibitor 3,Chapter I Certain infectious and parasitic diseases,Certain infectious and parasitic diseases,43032,5939,0.97 [0.95-0.99],0.000236961120699
SPINT3,Kunitz-type protease inhibitor 3,"Chapter IV Endocrine, nutritional and metabolic diseases",Type 2 diabetes without complications,43539,3194,0.96 [0.94-0.99],0.0009191508653502
SPINT3,Kunitz-type protease inhibitor 3,Chapter IX Diseases of the circulatory system,"Ischaemic heart disease, wide definition",42587,3820,0.97 [0.95-0.99],0.0007046777405373
SPINT3,Kunitz-type protease inhibitor 3,Chapter XI Diseases of the digestive system,Diaphragmatic hernia,40052,3794,0.96 [0.94-0.98],3.435293968740344e-05
SPINT3,Kunitz-type protease inhibitor 3,Chapter XI Diseases of the digestive system,Hernia,41792,5534,0.97 [0.95-0.99],0.0004927660816778
SPINT3,Kunitz-type protease inhibitor 3,Chapter XIV Diseases of the genitourinary system,Genitourinary diseases,37278,9114,0.98 [0.96-0.99],0.0003364370650776
