Protein,Protein_definition,Disease_category,Disease,NB_individual,NB_case,HR[95%CI],P_value
PDP1,"[Pyruvate dehydrogenase [acetyl-transferring]]-phosphatase 1, mitochondrial",Chapter III Diseases of the blood and blood-forming organs and certain disorders involving the immune mechanism,Other and unspecified iron deficiency,49670,2329,1.14 [1.06-1.21],0.0001386619515648
PDP1,"[Pyruvate dehydrogenase [acetyl-transferring]]-phosphatase 1, mitochondrial","Chapter IV Endocrine, nutritional and metabolic diseases",Disorders of iron metabolism,38401,117,1.44 [1.19-1.75],0.0002272300335473
PDP1,"[Pyruvate dehydrogenase [acetyl-transferring]]-phosphatase 1, mitochondrial",Chapter IX Diseases of the circulatory system,Other arrhythmias,42385,824,1.19 [1.08-1.32],0.0008900373375464
PDP1,"[Pyruvate dehydrogenase [acetyl-transferring]]-phosphatase 1, mitochondrial",Chapter XI Diseases of the digestive system,Coeliac disease,47191,240,1.39 [1.20-1.61],1.4194604707868352e-05
PDP1,"[Pyruvate dehydrogenase [acetyl-transferring]]-phosphatase 1, mitochondrial",Chapter XI Diseases of the digestive system,Intestinal malabsorption,47226,275,1.40 [1.22-1.60],9.381984647070308e-07
