Protein,Protein_definition,Disease_category,Disease,NB_individual,NB_case,HR[95%CI],P_value
RRP15,RRP15-like protein,"Chapter IV Endocrine, nutritional and metabolic diseases",Disorders of the thyroid gland,22692,1941,1.07 [1.02-1.12],0.0054578335507368
RRP15,RRP15-like protein,Chapter VI Diseases of the nervous system,"Disorders of brain, other and unspecified",22956,44,1.46 [1.17-1.81],0.0006469330389402
RRP15,RRP15-like protein,Chapter VI Diseases of the nervous system,"Nerve, nerve root and plexus disorders",22726,1198,0.92 [0.86-0.97],0.0045560684711539
RRP15,RRP15-like protein,Chapter XIII Diseases of the musculoskeletal system and connective tissue,Fibroblastic disorders,20037,152,1.24 [1.06-1.43],0.0053549941731268
RRP15,RRP15-like protein,Chapter XIII Diseases of the musculoskeletal system and connective tissue,Other specified/unspecified inflammatory spondylopathies,20156,170,0.82 [0.70-0.95],0.0097904959056313
