Protein,Protein_definition,Disease_category,Disease,NB_individual,NB_case,HR[95%CI],P_value
LHB,Lutropin subunit beta,Chapter II Neoplasms,Leiomyoma of uterus,26159,574,0.86 [0.78-0.95],0.0022468774662961
LHB,Lutropin subunit beta,"Chapter IV Endocrine, nutritional and metabolic diseases",Type 2 diabetes with ophthalmic complications,1798,185,1.22 [1.05-1.41],0.00810944087207
LHB,Lutropin subunit beta,Chapter IX Diseases of the circulatory system,Endocarditis,23585,62,1.39 [1.16-1.67],0.00042933306238
LHB,Lutropin subunit beta,Chapter XI Diseases of the digestive system,Coeliac disease,25607,149,1.22 [1.06-1.40],0.0045986321388711
LHB,Lutropin subunit beta,Chapter XI Diseases of the digestive system,Intestinal adhesions without obstruction,19399,101,1.29 [1.10-1.52],0.0017736061498296
LHB,Lutropin subunit beta,Chapter XI Diseases of the digestive system,Intestinal malabsorption,25629,171,1.22 [1.07-1.39],0.0025239125473416
LHB,Lutropin subunit beta,Chapter XIII Diseases of the musculoskeletal system and connective tissue,"Neuralgia and neuritis, unspecified",23094,69,0.55 [0.39-0.79],0.0010362680795392
