Protein,Protein_definition,Disease_category,Disease,NB_individual,NB_case,HR[95%CI],P_value
CENPJ,Centromere protein J,Chapter II Neoplasms,"Benign neoplasm of colon, rectum, anus and anal canal",23518,1046,0.86 [0.79-0.95],0.0018145832395387
CENPJ,Centromere protein J,Chapter II Neoplasms,"Malignant neoplasm of pancreas, excluding all cancers (controls excluding all cancers)",19351,92,1.38 [1.13-1.69],0.0014262865546854
CENPJ,Centromere protein J,Chapter III Diseases of the blood and blood-forming organs and certain disorders involving the immune mechanism,Sarcoidosis,23680,53,1.42 [1.11-1.82],0.0046976785148133
CENPJ,Centromere protein J,Chapter IX Diseases of the circulatory system,Aortic aneurysm,22914,78,0.58 [0.38-0.88],0.0097338847937277
CENPJ,Centromere protein J,Chapter IX Diseases of the circulatory system,Left bundle-branch block,20891,267,1.23 [1.08-1.41],0.0024278738209753
CENPJ,Centromere protein J,Chapter XI Diseases of the digestive system,Collagenous colitis,22123,90,1.35 [1.10-1.65],0.0036326228530719
CENPJ,Centromere protein J,Chapter XI Diseases of the digestive system,Other diseases of biliary tract,21899,254,1.23 [1.07-1.41],0.0038425281619374
CENPJ,Centromere protein J,Chapter XIV Diseases of the genitourinary system,Polyp of the female genital tract,18235,549,0.84 [0.74-0.95],0.0074005584434744
