Protein,Protein_definition,Disease_category,Disease,NB_individual,NB_case,HR[95%CI],P_value
PDIA2,Protein disulfide-isomerase A2,"Chapter IV Endocrine, nutritional and metabolic diseases",Hypo-osmolality and hyponatraemia,19146,523,1.27 [1.07-1.50],0.0064258294049171
PDIA2,Protein disulfide-isomerase A2,Chapter IX Diseases of the circulatory system,"Heart failure, strict",23261,705,1.23 [1.05-1.44],0.0093144459287154
PDIA2,Protein disulfide-isomerase A2,"Chapter VII Diseases of the eye, adnexa, ear and mastoid process",Ptosis of eyelid,22464,109,1.56 [1.17-2.09],0.0027987994149535
PDIA2,Protein disulfide-isomerase A2,Chapter X Diseases of the respiratory system,Idiopathic pulmonary fibrosis,21913,195,1.43 [1.11-1.83],0.005685523809522
PDIA2,Protein disulfide-isomerase A2,Chapter X Diseases of the respiratory system,Later onset COPD,22557,607,1.25 [1.06-1.49],0.0089243149030561
PDIA2,Protein disulfide-isomerase A2,Chapter XI Diseases of the digestive system,Ulcerative colitis,21781,145,1.61 [1.27-2.06],0.000111631822282
PDIA2,Protein disulfide-isomerase A2,Chapter XI Diseases of the digestive system,"Ulcerative colitis, NAS",21758,122,1.64 [1.27-2.13],0.0001718178677038
PDIA2,Protein disulfide-isomerase A2,Chapter XIII Diseases of the musculoskeletal system and connective tissue,Other bursopathies,19892,88,1.65 [1.20-2.26],0.0020327239504453
