Protein,Protein_definition,Disease_category,Disease,NB_individual,NB_case,HR[95%CI],P_value
IL2,Interleukin-2,Chapter II Neoplasms,Benign neoplasm: Ascending colon,27214,277,1.57 [1.12-2.21],0.0089386432429403
IL2,Interleukin-2,"Chapter IV Endocrine, nutritional and metabolic diseases",Disorders of iron metabolism,21721,47,0.31 [0.14-0.66],0.0026808704320402
IL2,Interleukin-2,Chapter IX Diseases of the circulatory system,"Myocardial infarction, without ST-elevation",27229,240,0.62 [0.43-0.89],0.0090716819999061
IL2,Interleukin-2,Chapter V Mental and behavioural disorders,"Anxiety disorders, excluding more controls",24192,1848,1.20 [1.05-1.37],0.0065832852850305
IL2,Interleukin-2,Chapter X Diseases of the respiratory system,Lung diseases due to external agents,27226,230,0.54 [0.38-0.78],0.001080497039525
IL2,Interleukin-2,Chapter X Diseases of the respiratory system,Pneumonitis due to solids and liquids,27195,199,0.53 [0.36-0.78],0.0013477324064486
IL2,Interleukin-2,Chapter XI Diseases of the digestive system,Ventral hernia,23427,255,1.63 [1.15-2.31],0.0057353662690762
IL2,Interleukin-2,Chapter XIII Diseases of the musculoskeletal system and connective tissue,Chondropathies,26941,114,0.50 [0.30-0.83],0.0079678332846551
