Protein,Protein_definition,Disease_category,Disease,NB_individual,NB_case,HR[95%CI],P_value
VIM,Vimentin,Chapter II Neoplasms,Carcinoma in situ of breast,22115,137,1.22 [1.06-1.41],0.0060700900949786
VIM,Vimentin,Chapter IX Diseases of the circulatory system,Cerebral atherosclerosis,27276,34,4.71 [3.63-6.11],1.2921525248441116e-31
VIM,Vimentin,Chapter VI Diseases of the nervous system,MS-disease / Multiple Sclerosis,27064,144,0.83 [0.75-0.91],0.0001285198855128
VIM,Vimentin,"Chapter VII Diseases of the eye, adnexa, ear and mastoid process",Other and unspecified visual disturbances,26745,154,1.23 [1.08-1.41],0.0022075826952526
VIM,Vimentin,Chapter VIII Diseases of the ear and mastoid process,Diseases of external ear,27234,117,1.23 [1.05-1.43],0.0089250619907487
VIM,Vimentin,Chapter XIII Diseases of the musculoskeletal system and connective tissue,Cervicalgia,23437,208,1.22 [1.09-1.37],0.0005956827996115
VIM,Vimentin,Chapter XIII Diseases of the musculoskeletal system and connective tissue,Other systemic involvement of connective tissue,26732,503,1.11 [1.03-1.19],0.0055221710127378
VIM,Vimentin,Chapter XIII Diseases of the musculoskeletal system and connective tissue,Sicca syndrome [Sjgren],26386,157,1.21 [1.06-1.38],0.0044291090211191
