Protein,Protein_definition,Disease_category,Disease,NB_individual,NB_case,HR[95%CI],P_value
CA11,Carbonic anhydrase-related protein 11,Chapter III Diseases of the blood and blood-forming organs and certain disorders involving the immune mechanism,Purpura and other haemorrhagic conditions,26922,231,1.46 [1.17-1.82],0.0008593684297847
CA11,Carbonic anhydrase-related protein 11,Chapter III Diseases of the blood and blood-forming organs and certain disorders involving the immune mechanism,"Thrombocytopenia, unspecified",26884,193,1.45 [1.13-1.86],0.0030235478555751
CA11,Carbonic anhydrase-related protein 11,"Chapter IV Endocrine, nutritional and metabolic diseases",Alcohol dependence,25718,64,1.68 [1.23-2.31],0.0013130319018748
CA11,Carbonic anhydrase-related protein 11,Chapter IX Diseases of the circulatory system,Other embolism and thrombosis,25428,44,1.94 [1.40-2.68],7.492186187319714e-05
CA11,Carbonic anhydrase-related protein 11,Chapter XI Diseases of the digestive system,Toxic colitis,25206,66,1.80 [1.34-2.43],9.84675580962687e-05
