Protein,Protein_definition,Disease_category,Disease,NB_individual,NB_case,HR[95%CI],P_value
PXDNL,Peroxidasin-like protein,Chapter III Diseases of the blood and blood-forming organs and certain disorders involving the immune mechanism,Idiopathic thrombocytopenic purpura,23741,46,1.47 [1.11-1.95],0.0065028975590565
PXDNL,Peroxidasin-like protein,"Chapter IV Endocrine, nutritional and metabolic diseases",Type 2 diabetes with neurological complications,1498,38,1.51 [1.11-2.06],0.0088023912441413
PXDNL,Peroxidasin-like protein,Chapter IX Diseases of the circulatory system,Conduction disorders,21553,636,1.19 [1.06-1.32],0.0021491758260694
PXDNL,Peroxidasin-like protein,Chapter IX Diseases of the circulatory system,Endocarditis,20964,47,1.45 [1.10-1.93],0.0094310283563783
PXDNL,Peroxidasin-like protein,Chapter IX Diseases of the circulatory system,Rheumatic valve diseases,24015,504,1.22 [1.09-1.37],0.0007223766864158
PXDNL,Peroxidasin-like protein,"Chapter VII Diseases of the eye, adnexa, ear and mastoid process",Diabetic neuropathy,1781,56,1.46 [1.11-1.93],0.0072828658938695
PXDNL,Peroxidasin-like protein,"Chapter VII Diseases of the eye, adnexa, ear and mastoid process",Visual field defects,23514,40,1.60 [1.22-2.08],0.0005708951065334
PXDNL,Peroxidasin-like protein,Chapter XI Diseases of the digestive system,Collagenous colitis,22424,95,1.43 [1.16-1.75],0.000654995781019
