Protein,Protein_definition,Disease_category,Disease,NB_individual,NB_case,HR[95%CI],P_value
PRDX6,Peroxiredoxin-6,Chapter II Neoplasms,"Other and unspecified types of non-Hodgkin lymphoma, hilmo, excluding all cancers",22851,97,1.45 [1.12-1.88],0.0049741560887357
PRDX6,Peroxiredoxin-6,"Chapter IV Endocrine, nutritional and metabolic diseases",Obesity,27819,2131,0.92 [0.86-0.98],0.0077053015477044
PRDX6,Peroxiredoxin-6,"Chapter IV Endocrine, nutritional and metabolic diseases","Obesity, other/unspecified",27824,2130,0.92 [0.86-0.98],0.008330873247564
PRDX6,Peroxiredoxin-6,"Chapter IV Endocrine, nutritional and metabolic diseases",Type 2 diabetes without complications,27522,1523,0.91 [0.84-0.98],0.00973091234621
PRDX6,Peroxiredoxin-6,Chapter V Mental and behavioural disorders,"Alcohol use disorder, ICD-based",27975,222,0.76 [0.62-0.93],0.0080768563643125
PRDX6,Peroxiredoxin-6,Chapter X Diseases of the respiratory system,Emphysema,24103,279,1.24 [1.05-1.47],0.0099542128605214
PRDX6,Peroxiredoxin-6,Chapter XII Diseases of the skin and subcutaneous tissue,"Ulcer of lower limb, not elsewhere classified",25882,208,1.31 [1.09-1.58],0.0038824110179377
PRDX6,Peroxiredoxin-6,Chapter XIII Diseases of the musculoskeletal system and connective tissue,Other bursopathies,23884,104,1.47 [1.16-1.87],0.0016649705215815
PRDX6,Peroxiredoxin-6,Chapter XIII Diseases of the musculoskeletal system and connective tissue,Synovial cyst of popliteal space [Baker],23846,66,1.57 [1.18-2.09],0.0022345678391822
