Protein,Protein_definition,Disease_category,Disease,NB_individual,NB_case,HR[95%CI],P_value
IL5,Interleukin-5,Chapter II Neoplasms,"Benign neoplasm: Colon, unspecified",27147,64,1.18 [1.05-1.33],0.0066589163294302
IL5,Interleukin-5,"Chapter IV Endocrine, nutritional and metabolic diseases",Other mental disorders due to brain damage and dysfunction and to physical disease,26345,55,1.19 [1.05-1.35],0.0072082300747149
IL5,Interleukin-5,Chapter VI Diseases of the nervous system,Hemiplegia,27106,223,0.88 [0.80-0.97],0.009882964699123
IL5,Interleukin-5,"Chapter VII Diseases of the eye, adnexa, ear and mastoid process",Visual field defects,26592,46,1.23 [1.08-1.40],0.0019678803835022
IL5,Interleukin-5,Chapter XIII Diseases of the musculoskeletal system and connective tissue,Other deformities of toe(s),18588,199,1.11 [1.03-1.19],0.0080176476575941
