Protein,Protein_definition,Disease_category,Disease,NB_individual,NB_case,HR[95%CI],P_value
HIP1,Huntingtin-interacting protein 1,Chapter II Neoplasms,Benign neoplasm of other and unspecified endocrine glands,23426,114,1.69 [1.20-2.37],0.0026276881250669
HIP1,Huntingtin-interacting protein 1,"Chapter IV Endocrine, nutritional and metabolic diseases",Disorders of calcium metabolism,18940,244,1.45 [1.11-1.90],0.0069290257244473
HIP1,Huntingtin-interacting protein 1,Chapter IX Diseases of the circulatory system,Arterial embolism and thrombosis of lower extremity artery,22558,30,2.05 [1.20-3.50],0.0083585695529716
HIP1,Huntingtin-interacting protein 1,Chapter IX Diseases of the circulatory system,Other pulmonary heart/vessel disease,22957,278,1.50 [1.17-1.92],0.0014319583339304
HIP1,Huntingtin-interacting protein 1,Chapter IX Diseases of the circulatory system,Secondary right heart disease,22951,272,1.53 [1.20-1.96],0.0005974531551834
HIP1,Huntingtin-interacting protein 1,Chapter VI Diseases of the nervous system,"Disorders of brain, other and unspecified",22969,45,2.31 [1.54-3.44],4.621021715065357e-05
HIP1,Huntingtin-interacting protein 1,Chapter XI Diseases of the digestive system,Acute peritonitis,22973,73,1.74 [1.18-2.54],0.0046813179585534
HIP1,Huntingtin-interacting protein 1,Chapter XI Diseases of the digestive system,Diseases of peritoneum,23350,450,1.35 [1.10-1.66],0.0044109367217991
HIP1,Huntingtin-interacting protein 1,Chapter XIII Diseases of the musculoskeletal system and connective tissue,Adhesive capsulitis of shoulder,20014,112,0.37 [0.18-0.75],0.0060879771839879
