Protein,Protein_definition,Disease_category,Disease,NB_individual,NB_case,HR[95%CI],P_value
ARHGAP1,Rho GTPase-activating protein 1,Chapter III Diseases of the blood and blood-forming organs and certain disorders involving the immune mechanism,Idiopathic thrombocytopenic purpura,26739,48,2.18 [1.31-3.62],0.0026011541295865
ARHGAP1,Rho GTPase-activating protein 1,Chapter IX Diseases of the circulatory system,Cardiac arrest,16299,128,1.57 [1.14-2.18],0.0064380405110797
ARHGAP1,Rho GTPase-activating protein 1,"Chapter VII Diseases of the eye, adnexa, ear and mastoid process",Other and unspecified disorders of vitreous body,26974,131,0.62 [0.44-0.86],0.0048392904842462
ARHGAP1,Rho GTPase-activating protein 1,Chapter X Diseases of the respiratory system,"Viral pneumonia (unknown virus, not influenza)",26735,164,0.67 [0.50-0.91],0.0097821731080125
ARHGAP1,Rho GTPase-activating protein 1,Chapter XI Diseases of the digestive system,Umbilical hernia,23252,171,0.61 [0.46-0.82],0.0011733534589776
ARHGAP1,Rho GTPase-activating protein 1,Chapter XII Diseases of the skin and subcutaneous tissue,Other and unspecified psoriasis,26910,164,0.59 [0.44-0.80],0.000563425207373
ARHGAP1,Rho GTPase-activating protein 1,Chapter XII Diseases of the skin and subcutaneous tissue,Papulosquamous disorders,27051,305,0.71 [0.57-0.89],0.0023696030030562
ARHGAP1,Rho GTPase-activating protein 1,Chapter XII Diseases of the skin and subcutaneous tissue,Psoriasis,26980,234,0.70 [0.55-0.90],0.0052617121002671
