Protein,Protein_definition,Disease_category,Disease,NB_individual,NB_case,HR[95%CI],P_value
ARL13B,ADP-ribosylation factor-like protein 13B,Chapter I Certain infectious and parasitic diseases,Intestinal infectious diseases,23296,1325,1.10 [1.02-1.18],0.0089689740829502
ARL13B,ADP-ribosylation factor-like protein 13B,"Chapter IV Endocrine, nutritional and metabolic diseases",Disorders of lipoprotein metabolism and other lipidaemias,21378,2682,1.08 [1.02-1.13],0.0035754518869338
ARL13B,ADP-ribosylation factor-like protein 13B,Chapter IX Diseases of the circulatory system,"!Phlebitis/thrombophlebitis venae iliacae [externae/internae/communis], drug-induced",23371,206,0.73 [0.59-0.91],0.0043400296122261
ARL13B,ADP-ribosylation factor-like protein 13B,"Chapter VII Diseases of the eye, adnexa, ear and mastoid process",Retinal detachment with retinal break,22491,80,1.51 [1.18-1.92],0.0008744256435691
ARL13B,ADP-ribosylation factor-like protein 13B,Chapter XI Diseases of the digestive system,Noninfectious colitis NAS,22447,704,1.14 [1.03-1.26],0.0082006342463549
ARL13B,ADP-ribosylation factor-like protein 13B,Chapter XII Diseases of the skin and subcutaneous tissue,Actinic keratosis,23381,214,1.27 [1.07-1.50],0.0050462687211794
ARL13B,ADP-ribosylation factor-like protein 13B,Chapter XII Diseases of the skin and subcutaneous tissue,Nail disorders,22705,40,1.66 [1.22-2.25],0.0010809936173473
ARL13B,ADP-ribosylation factor-like protein 13B,Chapter XIII Diseases of the musculoskeletal system and connective tissue,Fibromyalgia,20236,334,1.20 [1.05-1.37],0.0077482504174848
ARL13B,ADP-ribosylation factor-like protein 13B,Chapter XIV Diseases of the genitourinary system,"Excessive, frequent and irregular menstruation",17776,334,0.80 [0.68-0.95],0.0083555557380107
