Protein,Protein_definition,Disease_category,Disease,NB_individual,NB_case,HR[95%CI],P_value
DENR,Density-regulated protein,Chapter II Neoplasms,Carcinoma in situ of breast,19054,117,0.60 [0.42-0.86],0.0049755062524544
DENR,Density-regulated protein,Chapter III Diseases of the blood and blood-forming organs and certain disorders involving the immune mechanism,Idiopathic thrombocytopenic purpura,23191,45,1.76 [1.28-2.43],0.000571931079241
DENR,Density-regulated protein,Chapter III Diseases of the blood and blood-forming organs and certain disorders involving the immune mechanism,Purpura and other haemorrhagic conditions,23352,206,1.33 [1.09-1.63],0.0045895621316918
DENR,Density-regulated protein,"Chapter IV Endocrine, nutritional and metabolic diseases",Disorders of lipoprotein metabolism and other lipidaemias,21462,2694,1.10 [1.04-1.17],0.0023490677866119
DENR,Density-regulated protein,"Chapter IV Endocrine, nutritional and metabolic diseases",Metabolic disorders,22784,4016,1.09 [1.03-1.15],0.0012202529628314
DENR,Density-regulated protein,Chapter X Diseases of the respiratory system,"Bronchitis, not specified as acute or chronic",20033,61,1.64 [1.19-2.25],0.0023932081615555
DENR,Density-regulated protein,Chapter XI Diseases of the digestive system,Noninfective enteritis and colitis,22754,938,1.16 [1.04-1.28],0.0055734133126679
DENR,Density-regulated protein,Chapter XII Diseases of the skin and subcutaneous tissue,Disorders of skin appendages,23145,399,0.76 [0.63-0.91],0.0027438449799571
DENR,Density-regulated protein,Chapter XIII Diseases of the musculoskeletal system and connective tissue,Other systemic involvement of connective tissue,23031,443,1.21 [1.05-1.40],0.0098012882000568
