Protein,Protein_definition,Disease_category,Disease,NB_individual,NB_case,HR[95%CI],P_value
TBR1,T-box brain protein 1,Chapter II Neoplasms,Benign neoplasm of other and ill-defined parts of digestive system,23489,57,1.53 [1.12-2.09],0.0081774223823731
TBR1,T-box brain protein 1,Chapter II Neoplasms,"Other malignant neoplasms of skin (=non-melanoma skin cancer), excluding all cancers (controls excluding all cancers)",19884,793,1.19 [1.06-1.34],0.0035748182235558
TBR1,T-box brain protein 1,Chapter II Neoplasms,"Squamous cell neoplasms and carcinomas of the skin, excluding all cancers (controls excluding all cancers)",19918,827,1.19 [1.06-1.33],0.0031392133565351
TBR1,T-box brain protein 1,Chapter IX Diseases of the circulatory system,"Other specified cerebrovascular diseases, other cerebrovascular disorders in diseases classified elsewhere",22909,458,0.68 [0.53-0.87],0.0021719474279289
TBR1,T-box brain protein 1,"Chapter VII Diseases of the eye, adnexa, ear and mastoid process",Other strabismus,22800,56,1.62 [1.23-2.14],0.0006441887659624
TBR1,T-box brain protein 1,Chapter XI Diseases of the digestive system,Ventral hernia,20272,215,1.32 [1.09-1.61],0.005193892615736
TBR1,T-box brain protein 1,Chapter XIII Diseases of the musculoskeletal system and connective tissue,Other/unspecified synovitis and tenosynovitis,20160,191,1.43 [1.19-1.72],0.0001759254270205
TBR1,T-box brain protein 1,Chapter XIV Diseases of the genitourinary system,Chronic nephritic syndrome,23407,58,1.52 [1.11-2.07],0.0090697869507294
