Protein,Protein_definition,Disease_category,Disease,NB_individual,NB_case,HR[95%CI],P_value
BCL7B,B-cell CLL/lymphoma 7 protein family member B,Chapter I Certain infectious and parasitic diseases,Candidiasis,23979,409,1.29 [1.08-1.55],0.0043021308652689
BCL7B,B-cell CLL/lymphoma 7 protein family member B,"Chapter IV Endocrine, nutritional and metabolic diseases",Fluid overload,19399,174,0.57 [0.38-0.87],0.0082659433348292
BCL7B,B-cell CLL/lymphoma 7 protein family member B,Chapter VI Diseases of the nervous system,Generalized epilepsy,23768,42,1.85 [1.26-2.71],0.0017300935852975
BCL7B,B-cell CLL/lymphoma 7 protein family member B,Chapter XI Diseases of the digestive system,Coeliac disease,22747,124,1.81 [1.44-2.26],2.12144450884568e-07
BCL7B,B-cell CLL/lymphoma 7 protein family member B,Chapter XI Diseases of the digestive system,Intestinal malabsorption,22773,150,1.64 [1.31-2.06],1.7210454214274004e-05
BCL7B,B-cell CLL/lymphoma 7 protein family member B,Chapter XI Diseases of the digestive system,Other diseases of lip and oral mucosa,23127,205,1.46 [1.17-1.82],0.0007242688568102
