Protein,Protein_definition,Disease_category,Disease,NB_individual,NB_case,HR[95%CI],P_value
NCLN,Nicalin,Chapter I Certain infectious and parasitic diseases,Other infectious diseases,27235,46,1.51 [1.16-1.98],0.0024668448827288
NCLN,Nicalin,Chapter II Neoplasms,"Malignant neoplasm of stomach, excluding all cancers (controls excluding all cancers)",22171,43,1.49 [1.15-1.95],0.0030784163916697
NCLN,Nicalin,Chapter II Neoplasms,"Other and unspecified types of non-Hodgkin lymphoma, hilmo, excluding all cancers",22222,94,1.36 [1.09-1.69],0.0062045250072779
NCLN,Nicalin,Chapter XI Diseases of the digestive system,Coeliac disease,25675,152,1.39 [1.19-1.63],4.058990530406012e-05
NCLN,Nicalin,Chapter XI Diseases of the digestive system,Intestinal malabsorption,25701,178,1.36 [1.17-1.58],9.058027931908168e-05
NCLN,Nicalin,Chapter XII Diseases of the skin and subcutaneous tissue,Follicular cysts of skin and subcutaneous tissue,26640,328,1.21 [1.05-1.39],0.0075025520473226
NCLN,Nicalin,Chapter XIV Diseases of the genitourinary system,"Other cystitis, drug-induced",27223,72,1.49 [1.18-1.87],0.0006701393296704
