Protein,Protein_definition,Disease_category,Disease,NB_individual,NB_case,HR[95%CI],P_value
ARAF,Serine/threonine-protein kinase A-Raf,Chapter III Diseases of the blood and blood-forming organs and certain disorders involving the immune mechanism,Other and unspecified iron deficiency,19503,1166,1.14 [1.06-1.23],0.0007661750577254
ARAF,Serine/threonine-protein kinase A-Raf,Chapter III Diseases of the blood and blood-forming organs and certain disorders involving the immune mechanism,"Thrombocytopenia, unspecified",19592,241,0.68 [0.55-0.85],0.000435393133142
ARAF,Serine/threonine-protein kinase A-Raf,"Chapter IV Endocrine, nutritional and metabolic diseases",Disorders of lipoprotein metabolism and other lipidaemias,16926,3860,1.10 [1.05-1.14],3.524084549251901e-05
ARAF,Serine/threonine-protein kinase A-Raf,Chapter IX Diseases of the circulatory system,"Myocardial infarction, with ST-elevation",19692,165,1.37 [1.16-1.63],0.000313866296015
ARAF,Serine/threonine-protein kinase A-Raf,Chapter VI Diseases of the nervous system,Generalized epilepsy,19493,45,1.67 [1.30-2.13],5.229729961294887e-05
ARAF,Serine/threonine-protein kinase A-Raf,Chapter XIII Diseases of the musculoskeletal system and connective tissue,Sicca syndrome [Sjgren],19136,89,1.49 [1.19-1.86],0.0005276974922137
