Protein,Protein_definition,Disease_category,Disease,NB_individual,NB_case,HR[95%CI],P_value
CRYGD,Gamma-crystallin D,Chapter III Diseases of the blood and blood-forming organs and certain disorders involving the immune mechanism,"Thrombocytopenia, unspecified",19915,240,0.79 [0.70-0.90],0.0003871939388501
CRYGD,Gamma-crystallin D,"Chapter IV Endocrine, nutritional and metabolic diseases",Alcohol dependence,18842,93,1.46 [1.19-1.79],0.0002910547432946
CRYGD,Gamma-crystallin D,"Chapter IV Endocrine, nutritional and metabolic diseases",Depression or dysthymia,17038,1166,1.11 [1.04-1.17],0.0006844572025848
CRYGD,Gamma-crystallin D,Chapter V Mental and behavioural disorders,"Alcohol use disorder, ICD-based",20058,289,1.32 [1.17-1.48],3.4445897442740136e-06
CRYGD,Gamma-crystallin D,Chapter V Mental and behavioural disorders,"Mental and behavioural disorders due to alcohol, excluding acute intoxication",20033,340,1.22 [1.10-1.36],0.0002638489682348
CRYGD,Gamma-crystallin D,Chapter VIII Diseases of the ear and mastoid process,Sensorineural hearing loss,19127,129,0.74 [0.62-0.88],0.0005378181508136
