Protein,Protein_definition,Disease_category,Disease,NB_individual,NB_case,HR[95%CI],P_value
GRHPR,Glyoxylate reductase/hydroxypyruvate reductase,Chapter III Diseases of the blood and blood-forming organs and certain disorders involving the immune mechanism,Folate deficiency anaemia,18739,62,2.23 [1.53-3.25],2.7276693134282857e-05
GRHPR,Glyoxylate reductase/hydroxypyruvate reductase,Chapter III Diseases of the blood and blood-forming organs and certain disorders involving the immune mechanism,Other and unspecified iron deficiency,19861,1184,1.18 [1.08-1.29],0.0001867060712523
GRHPR,Glyoxylate reductase/hydroxypyruvate reductase,Chapter III Diseases of the blood and blood-forming organs and certain disorders involving the immune mechanism,"Thrombocytopenia, unspecified",19949,242,0.69 [0.57-0.84],0.0002863440192564
GRHPR,Glyoxylate reductase/hydroxypyruvate reductase,"Chapter IV Endocrine, nutritional and metabolic diseases",Type 2 diabetes without complications,19462,1849,1.22 [1.13-1.31],5.784939323442682e-08
GRHPR,Glyoxylate reductase/hydroxypyruvate reductase,Chapter V Mental and behavioural disorders,"Alcohol use disorder, ICD-based",20094,289,1.39 [1.16-1.66],0.0002963178347658
GRHPR,Glyoxylate reductase/hydroxypyruvate reductase,Chapter V Mental and behavioural disorders,"Mental and behavioural disorders due to alcohol, excluding acute intoxication",20068,340,1.34 [1.13-1.58],0.0005177552511562
GRHPR,Glyoxylate reductase/hydroxypyruvate reductase,Chapter VIII Diseases of the ear and mastoid process,Sensorineural hearing loss,19162,128,0.62 [0.47-0.81],0.0005775903539289
GRHPR,Glyoxylate reductase/hydroxypyruvate reductase,Chapter XII Diseases of the skin and subcutaneous tissue,Seborrhoeic keratosis,18138,288,0.71 [0.60-0.86],0.0002664705825243
