Protein,Protein_definition,Disease_category,Disease,NB_individual,NB_case,HR[95%CI],P_value
UBAC1,Ubiquitin-associated domain-containing protein 1,"Chapter IV Endocrine, nutritional and metabolic diseases",Hypokalaemia,15657,660,1.48 [1.22-1.79],8.39298926624699e-05
UBAC1,Ubiquitin-associated domain-containing protein 1,Chapter XI Diseases of the digestive system,Crohn's disease NAS,21304,80,2.51 [1.45-4.35],0.0009884299002937
UBAC1,Ubiquitin-associated domain-containing protein 1,Chapter XI Diseases of the digestive system,Noninfective enteritis and colitis,22308,1084,1.30 [1.12-1.52],0.0007772174426087
UBAC1,Ubiquitin-associated domain-containing protein 1,Chapter XI Diseases of the digestive system,Oesophagitis,16632,690,0.70 [0.58-0.85],0.0003428631516607
UBAC1,Ubiquitin-associated domain-containing protein 1,Chapter XII Diseases of the skin and subcutaneous tissue,Seborrhoeic keratosis,20682,341,0.62 [0.47-0.81],0.0006224700005776
UBAC1,Ubiquitin-associated domain-containing protein 1,Chapter XIII Diseases of the musculoskeletal system and connective tissue,Adhesive capsulitis of shoulder,19232,82,0.32 [0.19-0.53],7.655340620741313e-06
