Protein,Protein_definition,Disease_category,Disease,NB_individual,NB_case,HR[95%CI],P_value
SERPINI2,Serpin I2,Chapter II Neoplasms,Benign neoplasm: Caecum,20047,329,1.36 [1.14-1.62],0.0007453101584074
SERPINI2,Serpin I2,Chapter IX Diseases of the circulatory system,"Hypertension, portal",19926,84,1.85 [1.33-2.56],0.0002272858857859
SERPINI2,Serpin I2,Chapter X Diseases of the respiratory system,"COPD, hospital admissions 1, only main diagnosis",19816,1392,0.81 [0.74-0.89],1.669477220095031e-05
SERPINI2,Serpin I2,Chapter X Diseases of the respiratory system,Later onset COPD,19606,1291,0.80 [0.73-0.89],1.4546986878133324e-05
SERPINI2,Serpin I2,Chapter XI Diseases of the digestive system,Alcoholic liver disease,19229,51,2.02 [1.34-3.06],0.000865844990533
SERPINI2,Serpin I2,Chapter XI Diseases of the digestive system,Crohn's disease NAS,18531,62,1.93 [1.33-2.79],0.0005407324163709
SERPINI2,Serpin I2,Chapter XI Diseases of the digestive system,Diseases of liver,19968,790,1.22 [1.08-1.37],0.0009101409287716
SERPINI2,Serpin I2,Chapter XII Diseases of the skin and subcutaneous tissue,Papulosquamous disorders,19990,296,1.38 [1.15-1.66],0.0006679162617175
SERPINI2,Serpin I2,Chapter XIV Diseases of the genitourinary system,Dialysis,17150,71,2.31 [1.66-3.22],6.786049021746913e-07
