Protein,Protein_definition,Disease_category,Disease,NB_individual,NB_case,HR[95%CI],P_value
PF4,Platelet factor 4,Chapter III Diseases of the blood and blood-forming organs and certain disorders involving the immune mechanism,Purpura and other haemorrhagic conditions,19887,293,0.76 [0.68-0.86],5.635833019874509e-06
PF4,Platelet factor 4,Chapter III Diseases of the blood and blood-forming organs and certain disorders involving the immune mechanism,"Thrombocytopenia, unspecified",19832,238,0.68 [0.60-0.78],5.032475712244042e-09
PF4,Platelet factor 4,Chapter V Mental and behavioural disorders,"Alcohol use disorder, ICD-based",19976,290,1.22 [1.09-1.37],0.0006201448352003
PF4,Platelet factor 4,Chapter V Mental and behavioural disorders,"Mental and behavioural disorders due to alcohol, excluding acute intoxication",19951,341,1.21 [1.09-1.35],0.0003723450504272
PF4,Platelet factor 4,"Chapter VII Diseases of the eye, adnexa, ear and mastoid process",Visual disturbances,19803,430,1.17 [1.07-1.28],0.0009509015423723
PF4,Platelet factor 4,Chapter XII Diseases of the skin and subcutaneous tissue,Other and unspecified erythematous conditions,19972,74,0.67 [0.53-0.84],0.0004871096465459
