Protein,Protein_definition,Disease_category,Disease,NB_individual,NB_case,HR[95%CI],P_value
IMPA1,Inositol monophosphatase 1,Chapter III Diseases of the blood and blood-forming organs and certain disorders involving the immune mechanism,Other and unspecified iron deficiency,22618,1428,1.16 [1.07-1.25],0.0002332638201744
IMPA1,Inositol monophosphatase 1,Chapter III Diseases of the blood and blood-forming organs and certain disorders involving the immune mechanism,Purpura and other haemorrhagic conditions,22797,357,0.70 [0.59-0.82],1.7534770921931258e-05
IMPA1,Inositol monophosphatase 1,Chapter III Diseases of the blood and blood-forming organs and certain disorders involving the immune mechanism,"Thrombocytopenia, unspecified",22732,292,0.61 [0.50-0.73],1.1848377706754785e-07
IMPA1,Inositol monophosphatase 1,Chapter IX Diseases of the circulatory system,Cardiomyopathy,16996,203,0.67 [0.53-0.83],0.000285411016256
IMPA1,Inositol monophosphatase 1,Chapter XIII Diseases of the musculoskeletal system and connective tissue,Sciatica+with lumbago,19190,283,1.33 [1.12-1.57],0.0009559962707948
