Protein,Protein_definition,Disease_category,Disease,NB_individual,NB_case,HR[95%CI],P_value
AKT3,RAC-gamma serine/threonine-protein kinase,Chapter III Diseases of the blood and blood-forming organs and certain disorders involving the immune mechanism,Purpura and other haemorrhagic conditions,22388,351,0.67 [0.56-0.80],5.574286412964363e-06
AKT3,RAC-gamma serine/threonine-protein kinase,Chapter III Diseases of the blood and blood-forming organs and certain disorders involving the immune mechanism,"Thrombocytopenia, unspecified",22325,288,0.57 [0.47-0.70],2.13932568399064e-08
AKT3,RAC-gamma serine/threonine-protein kinase,"Chapter IV Endocrine, nutritional and metabolic diseases",Unspecified dementia,21459,623,0.80 [0.70-0.91],0.0008064483002278
AKT3,RAC-gamma serine/threonine-protein kinase,Chapter IX Diseases of the circulatory system,Atrial fibrillation and flutter,11415,2765,0.90 [0.84-0.95],0.0004267004345763
AKT3,RAC-gamma serine/threonine-protein kinase,Chapter XIII Diseases of the musculoskeletal system and connective tissue,Osteopathies and chondropathies,22140,2178,0.88 [0.82-0.94],0.0001995272764791
AKT3,RAC-gamma serine/threonine-protein kinase,Chapter XIII Diseases of the musculoskeletal system and connective tissue,Osteoporosis,21492,1530,0.86 [0.79-0.94],0.0003871893132967
