Protein,Protein_definition,Disease_category,Disease,NB_individual,NB_case,HR[95%CI],P_value
KYAT1,Kynurenine--oxoglutarate transaminase 1,Chapter V Mental and behavioural disorders,"Alcohol use disorder, ICD-based",23068,334,1.35 [1.15-1.58],0.0001796548595078
KYAT1,Kynurenine--oxoglutarate transaminase 1,Chapter V Mental and behavioural disorders,"Mental and behavioural disorders due to alcohol, excluding acute intoxication",23040,393,1.31 [1.13-1.51],0.0003359016674719
KYAT1,Kynurenine--oxoglutarate transaminase 1,"Chapter VII Diseases of the eye, adnexa, ear and mastoid process","Diabetic nephropathy, excluding more controls",2457,78,0.54 [0.37-0.77],0.0008340820424694
KYAT1,Kynurenine--oxoglutarate transaminase 1,Chapter VIII Diseases of the ear and mastoid process,Sensorineural hearing loss,21941,153,0.61 [0.46-0.79],0.000245635853713
KYAT1,Kynurenine--oxoglutarate transaminase 1,Chapter XI Diseases of the digestive system,Alcoholic liver disease,22165,65,1.78 [1.31-2.42],0.0002248459034142
