Protein,Protein_definition,Disease_category,Disease,NB_individual,NB_case,OR[95%CI],P_value
BTN1A1,Butyrophilin subfamily 1 member A1,Chapter XIII Diseases of the musculoskeletal system and connective tissue,Other specified/unspecified disorders of  bone/cartilage,40986,94,1.73 [1.39-2.17],1.5805551206452193e-06
BTN1A1,Butyrophilin subfamily 1 member A1,Chapter XIII Diseases of the musculoskeletal system and connective tissue,Other disorders of bone,41064,172,1.53 [1.24-1.89],7.556956017800845e-05
BTN1A1,Butyrophilin subfamily 1 member A1,Chapter XIV Diseases of the genitourinary system,Renal tubulo-interstitial diseases,40163,376,1.48 [1.26-1.73],2.095140062567924e-06
BTN1A1,Butyrophilin subfamily 1 member A1,"Chapter XV Pregnancy, childbirth and the puerperium",Maternal care related to the fetus and amniotic cavity and possible delivery problems,24015,734,1.35 [1.17-1.55],2.3718875535900184e-05
BTN1A1,Butyrophilin subfamily 1 member A1,"Chapter XV Pregnancy, childbirth and the puerperium",Complications of labour and delivery,24021,1007,1.30 [1.14-1.48],6.720204474656448e-05
