Protein,Protein_definition,Disease_category,Disease,NB_individual,NB_case,OR[95%CI],P_value
MAN2B2,Epididymis-specific alpha-mannosidase,Chapter II Neoplasms,"Malignant neoplasm of breast, excluding all cancers (controls excluding all cancers)",20221,585,1.33 [1.16-1.53],3.627966101861323e-05
MAN2B2,Epididymis-specific alpha-mannosidase,"Chapter IV Endocrine, nutritional and metabolic diseases",Type 2 diabetes,41446,925,1.43 [1.28-1.60],5.036581518098041e-10
MAN2B2,Epididymis-specific alpha-mannosidase,"Chapter IV Endocrine, nutritional and metabolic diseases",Type 2 diabetes without complications,41421,900,1.42 [1.27-1.59],1.3286688883862254e-09
MAN2B2,Epididymis-specific alpha-mannosidase,Chapter XI Diseases of the digestive system,"Diseases of oesophagus, stomach and duodenum",37393,3760,1.13 [1.07-1.20],1.5574763167665924e-05
MAN2B2,Epididymis-specific alpha-mannosidase,Chapter XI Diseases of the digestive system,Ulcer of oesophagus,34002,369,1.41 [1.19-1.67],9.046913429866406e-05
