Protein,Protein_definition,Disease_category,Disease,NB_individual,NB_case,OR[95%CI],P_value
UNC5D,Netrin receptor UNC5D,Chapter IX Diseases of the circulatory system,Hypertensive Renal Disease,16508,33,5.24 [2.92-9.39],2.6991449379709426e-08
UNC5D,Netrin receptor UNC5D,Chapter XIII Diseases of the musculoskeletal system and connective tissue,Rheumatoid arthritis,16072,188,2.41 [1.63-3.55],9.572842054128725e-06
UNC5D,Netrin receptor UNC5D,Chapter XIV Diseases of the genitourinary system,Renal tubulo-interstitial diseases,21539,148,3.08 [2.16-4.40],6.286118939593501e-10
UNC5D,Netrin receptor UNC5D,Chapter XIV Diseases of the genitourinary system,Chronic kidney disease,21713,28,5.51 [3.30-9.19],6.190159545200767e-11
UNC5D,Netrin receptor UNC5D,Chapter XIV Diseases of the genitourinary system,Unspecified kidney failure,21714,29,4.05 [2.34-7.03],6.319121323331236e-07
