Protein,Protein_definition,Disease_category,Disease,NB_individual,NB_case,OR[95%CI],P_value
CNTN3,Contactin-3,Chapter III Diseases of the blood and blood-forming organs and certain disorders involving the immune mechanism,Diseases of the blood and blood-forming organs and certain disorders involving the immune mechanism,24765,1028,0.68 [0.58-0.79],7.442910963153918e-07
CNTN3,Contactin-3,"Chapter IV Endocrine, nutritional and metabolic diseases",Type 2 diabetes,26198,415,3.14 [2.41-4.08],1.5297339802545818e-17
CNTN3,Contactin-3,"Chapter IV Endocrine, nutritional and metabolic diseases",Type 2 diabetes without complications,26189,406,3.21 [2.46-4.19],7.318443008028207e-18
CNTN3,Contactin-3,Chapter X Diseases of the respiratory system,Diseases of the respiratory system,22564,2119,0.76 [0.67-0.85],2.0350204887389903e-06
CNTN3,Contactin-3,Chapter XIII Diseases of the musculoskeletal system and connective tissue,Systemic lupus erythematosus,26941,220,0.42 [0.31-0.57],5.7586848710403386e-08
