Protein,Protein_definition,Disease_category,Disease,NB_individual,NB_case,OR[95%CI],P_value
CA3,Carbonic anhydrase 3,Chapter I Certain infectious and parasitic diseases,Implicit Sepsis,18667,776,1.31 [1.18-1.45],1.910048364704037e-07
CA3,Carbonic anhydrase 3,Chapter I Certain infectious and parasitic diseases,Condition for Implicit Sepsis (Organ dysfunction codes),24784,422,1.34 [1.18-1.53],8.305274642198766e-06
CA3,Carbonic anhydrase 3,"Chapter IV Endocrine, nutritional and metabolic diseases","Other disorders of fluid, electrolyte and acid-base balance",22418,73,1.94 [1.48-2.56],2.1770356486793435e-06
CA3,Carbonic anhydrase 3,Chapter IX Diseases of the circulatory system,Hypertensive Renal Disease,19641,52,2.48 [1.82-3.38],9.951141857381284e-09
CA3,Carbonic anhydrase 3,Chapter X Diseases of the respiratory system,Chronic lower respiratory diseases,25045,1184,1.21 [1.11-1.31],5.1723960658169415e-06
CA3,Carbonic anhydrase 3,Chapter XIII Diseases of the musculoskeletal system and connective tissue,Diseases of the musculoskeletal system and connective tissue,19756,4477,1.12 [1.07-1.18],5.48725096587801e-06
CA3,Carbonic anhydrase 3,Chapter XIV Diseases of the genitourinary system,Renal tubulo-interstitial diseases,25543,207,1.67 [1.40-1.98],4.9625124278245406e-09
CA3,Carbonic anhydrase 3,Chapter XIV Diseases of the genitourinary system,Acute renal failure,25715,38,2.41 [1.70-3.43],8.484106098944719e-07
CA3,Carbonic anhydrase 3,Chapter XIV Diseases of the genitourinary system,Chronic kidney disease,25726,49,2.93 [2.20-3.92],3.128008101923089e-13
