Protein,Protein_definition,Disease_category,Disease,NB_individual,NB_case,OR[95%CI],P_value
MEPE,Matrix extracellular phosphoglycoprotein,Chapter II Neoplasms,"Malignant neoplasm of breast, excluding all cancers (controls excluding all cancers)",23227,679,0.55 [0.43-0.69],4.296895082892306e-07
MEPE,Matrix extracellular phosphoglycoprotein,"Chapter IV Endocrine, nutritional and metabolic diseases",Type 2 diabetes,26213,415,0.49 [0.37-0.66],1.4873141328694062e-06
MEPE,Matrix extracellular phosphoglycoprotein,"Chapter IV Endocrine, nutritional and metabolic diseases",Type 2 diabetes without complications,26205,407,0.50 [0.37-0.66],2.2224156709760725e-06
MEPE,Matrix extracellular phosphoglycoprotein,Chapter XIII Diseases of the musculoskeletal system and connective tissue,Systemic lupus erythematosus,26940,224,0.42 [0.29-0.60],1.538176475427417e-06
MEPE,Matrix extracellular phosphoglycoprotein,Chapter XIII Diseases of the musculoskeletal system and connective tissue,Osteopathies and chondropathies,25249,493,0.54 [0.41-0.70],4.619123897084537e-06
