Protein,Protein_definition,Disease_category,Disease,NB_individual,NB_case,OR[95%CI],P_value
CDAN1,Codanin-1,Chapter I Certain infectious and parasitic diseases,Implicit Sepsis,13126,672,0.60 [0.41-0.88],0.0085254682139686
CDAN1,Codanin-1,Chapter X Diseases of the respiratory system,Nasal polyp,19328,143,0.31 [0.14-0.69],0.0038199375339138
CDAN1,Codanin-1,Chapter XI Diseases of the digestive system,Hernia,17501,1770,0.68 [0.54-0.86],0.0011012961004912
CDAN1,Codanin-1,Chapter XI Diseases of the digestive system,Inguinal hernia,16717,986,0.66 [0.49-0.90],0.0080163856285389
CDAN1,Codanin-1,Chapter XI Diseases of the digestive system,Diaphragmatic hernia,16388,657,0.56 [0.39-0.81],0.0019656554710759
