Protein,Protein_definition,Disease_category,Disease,NB_individual,NB_case,OR[95%CI],P_value
CLSPN,Claspin,Chapter V Mental and behavioural disorders,"Anxiety disorders, excluding more controls",19078,104,0.37 [0.18-0.73],0.0043282908770439
CLSPN,Claspin,Chapter XI Diseases of the digestive system,Acute pancreatitis,21735,71,1.56 [1.14-2.13],0.0053781788039665
CLSPN,Claspin,Chapter XI Diseases of the digestive system,Acute pancreatitis (for exclusion),22959,71,1.56 [1.14-2.13],0.0059620160674337
CLSPN,Claspin,Chapter XIII Diseases of the musculoskeletal system and connective tissue,Lumbar disc prolapse,20302,99,0.37 [0.19-0.75],0.0057398215116674
CLSPN,Claspin,Chapter XIV Diseases of the genitourinary system,Neuromuscular dysfunction of bladder,20230,73,1.58 [1.21-2.06],0.0008981161415295
