Protein,Protein_definition,Disease_category,Disease,NB_individual,NB_case,OR[95%CI],P_value
ACYP1,Acylphosphatase-1,Chapter IX Diseases of the circulatory system,Atrial fibrillation and flutter,10352,512,0.81 [0.70-0.93],0.0036317793985467
ACYP1,Acylphosphatase-1,Chapter IX Diseases of the circulatory system,Other or ill-defined heart diseases,15774,109,0.67 [0.50-0.89],0.006812007739333
ACYP1,Acylphosphatase-1,Chapter XI Diseases of the digestive system,Diseases of liver,19300,120,0.68 [0.52-0.90],0.007207485807632
ACYP1,Acylphosphatase-1,Chapter XII Diseases of the skin and subcutaneous tissue,Atrophic disorders of skin,18364,36,0.45 [0.27-0.75],0.0024590862963892
ACYP1,Acylphosphatase-1,Chapter XII Diseases of the skin and subcutaneous tissue,Scar conditions and fibrosis of skin,18361,33,0.43 [0.25-0.75],0.0027002067790345
