Protein,Protein_definition,Disease_category,Disease,NB_individual,NB_case,OR[95%CI],P_value
TUBB3,Tubulin beta-3 chain,Chapter IX Diseases of the circulatory system,Transient ischemic attack,19101,81,2.18 [1.22-3.89],0.0082204800574146
TUBB3,Tubulin beta-3 chain,"Chapter VII Diseases of the eye, adnexa, ear and mastoid process",Other and unspecified glaucoma,19291,40,2.68 [1.37-5.27],0.0041314121064903
TUBB3,Tubulin beta-3 chain,Chapter XI Diseases of the digestive system,Other diseases of oesophagus,15083,69,2.35 [1.30-4.23],0.0044182631699666
TUBB3,Tubulin beta-3 chain,Chapter XI Diseases of the digestive system,Umbilical hernia,15422,142,1.95 [1.23-3.07],0.004229650823513
TUBB3,Tubulin beta-3 chain,Chapter XII Diseases of the skin and subcutaneous tissue,Psoriasis,19650,64,2.33 [1.28-4.25],0.0058012828945608
TUBB3,Tubulin beta-3 chain,Chapter XIII Diseases of the musculoskeletal system and connective tissue,Lumbar disc prolapse,17487,82,2.16 [1.23-3.79],0.0070656144963866
