Protein,Protein_definition,Disease_category,Disease,NB_individual,NB_case,OR[95%CI],P_value
IL17F,Interleukin-17F,Chapter II Neoplasms,"Malignant melanoma of skin, excluding all cancers (controls excluding all cancers)",18105,49,1.39 [1.10-1.76],0.0062641820756173
IL17F,Interleukin-17F,Chapter XII Diseases of the skin and subcutaneous tissue,Papulosquamous disorders,23028,89,1.36 [1.14-1.63],0.0007055576712878
IL17F,Interleukin-17F,Chapter XII Diseases of the skin and subcutaneous tissue,Psoriasis,23013,74,1.34 [1.09-1.64],0.0050898585422571
IL17F,Interleukin-17F,Chapter XIII Diseases of the musculoskeletal system and connective tissue,Lumbar disc prolapse,20421,99,1.28 [1.07-1.53],0.0078153243257258
IL17F,Interleukin-17F,Chapter XIII Diseases of the musculoskeletal system and connective tissue,Rotator cuff syndrome,20129,83,1.29 [1.07-1.57],0.0092999611396134
IL17F,Interleukin-17F,Chapter XIV Diseases of the genitourinary system,Diseases of male genital organs,20072,1257,1.10 [1.03-1.17],0.0070793684904442
