Protein,Protein_definition,Disease_category,Disease,NB_individual,NB_case,OR[95%CI],P_value
GATD3,"Glutamine amidotransferase-like class 1 domain-containing protein 3B, mitochondrial","Chapter VII Diseases of the eye, adnexa, ear and mastoid process",Background diabetic retinopathy,19639,41,1.61 [1.13-2.30],0.0086216986484644
GATD3,"Glutamine amidotransferase-like class 1 domain-containing protein 3B, mitochondrial",Chapter IX Diseases of the circulatory system,Angina pectoris,17108,750,0.87 [0.79-0.96],0.0061499742864747
GATD3,"Glutamine amidotransferase-like class 1 domain-containing protein 3B, mitochondrial",Chapter X Diseases of the respiratory system,Diseases of the respiratory system,15620,1718,1.10 [1.03-1.17],0.0047823322566153
GATD3,"Glutamine amidotransferase-like class 1 domain-containing protein 3B, mitochondrial",Chapter XIII Diseases of the musculoskeletal system and connective tissue,Other/unspecified rheumatoid arthritis,19766,57,1.52 [1.12-2.07],0.0078828275248126
GATD3,"Glutamine amidotransferase-like class 1 domain-containing protein 3B, mitochondrial",Chapter XIV Diseases of the genitourinary system,Other disorders of kidney and ureter,19565,58,1.61 [1.19-2.18],0.0019731222462618
