Protein,Protein_definition,Disease_category,Disease,NB_individual,NB_case,OR[95%CI],P_value
HDDC2,5'-deoxynucleotidase HDDC2,Chapter I Certain infectious and parasitic diseases,Other specified/unspecified bacterial intestinal infections,20322,57,0.43 [0.23-0.80],0.0072950652867056
HDDC2,5'-deoxynucleotidase HDDC2,"Chapter IV Endocrine, nutritional and metabolic diseases",Type 2 diabetes,18531,571,0.74 [0.61-0.91],0.0031811798209299
HDDC2,5'-deoxynucleotidase HDDC2,"Chapter IV Endocrine, nutritional and metabolic diseases",Type 2 diabetes without complications,18515,555,0.75 [0.61-0.91],0.0036846954186958
HDDC2,5'-deoxynucleotidase HDDC2,"Chapter IV Endocrine, nutritional and metabolic diseases",Disorders of lipoprotein metabolism and other lipidaemias,15927,1060,0.82 [0.71-0.95],0.0082966412846798
HDDC2,5'-deoxynucleotidase HDDC2,Chapter X Diseases of the respiratory system,Other respiratory diseases principally affecting the interstitium,20103,98,1.77 [1.20-2.61],0.004242668704854
HDDC2,5'-deoxynucleotidase HDDC2,Chapter XI Diseases of the digestive system,Cholelithiasis,19384,219,1.44 [1.09-1.89],0.0090472492695779
HDDC2,5'-deoxynucleotidase HDDC2,Chapter XIII Diseases of the musculoskeletal system and connective tissue,Rheumatoid arthritis,14695,71,1.80 [1.16-2.81],0.0091026470842951
HDDC2,5'-deoxynucleotidase HDDC2,Chapter XIV Diseases of the genitourinary system,Other obstructive and reflux uropathy,18039,71,0.46 [0.26-0.80],0.0059632996709739
