Protein,Protein_definition,Disease_category,Disease,NB_individual,NB_case,OR[95%CI],P_value
PDE1C,"Calcium/calmodulin-dependent 3',5'-cyclic nucleotide phosphodiesterase 1C",Chapter XI Diseases of the digestive system,Intestinal malabsorption,18430,27,1.60 [1.12-2.28],0.0097783176953417
PDE1C,"Calcium/calmodulin-dependent 3',5'-cyclic nucleotide phosphodiesterase 1C",Chapter XIII Diseases of the musculoskeletal system and connective tissue,Other/unspecified dorsalgia,17416,100,1.38 [1.09-1.77],0.008591550481821
PDE1C,"Calcium/calmodulin-dependent 3',5'-cyclic nucleotide phosphodiesterase 1C",Chapter XIV Diseases of the genitourinary system,Genitourinary diseases,15272,1907,1.13 [1.04-1.23],0.0032020633044818
PDE1C,"Calcium/calmodulin-dependent 3',5'-cyclic nucleotide phosphodiesterase 1C",Chapter XIV Diseases of the genitourinary system,Diseases of male genital organs,17122,1046,1.19 [1.08-1.31],0.0005676393257321
PDE1C,"Calcium/calmodulin-dependent 3',5'-cyclic nucleotide phosphodiesterase 1C",Chapter XIV Diseases of the genitourinary system,Other disorders of penis,16209,133,1.40 [1.14-1.72],0.0012052140777576
