Protein,Protein_definition,Disease_category,Disease,NB_individual,NB_case,OR[95%CI],P_value
SPRR1B,Cornifin-B,Chapter II Neoplasms,"Malignant neoplasm of colon, excluding all cancers (controls excluding all cancers)",15734,65,1.44 [1.21-1.72],3.401077614990868e-05
SPRR1B,Cornifin-B,"Chapter IV Endocrine, nutritional and metabolic diseases",Obesity,18711,143,1.29 [1.10-1.50],0.0016730809526058
SPRR1B,Cornifin-B,"Chapter IV Endocrine, nutritional and metabolic diseases","Obesity, other/unspecified",18712,143,1.29 [1.10-1.50],0.001623626995283
SPRR1B,Cornifin-B,"Chapter VII Diseases of the eye, adnexa, ear and mastoid process",Senile cataract,17684,118,1.27 [1.09-1.47],0.0019355444014536
SPRR1B,Cornifin-B,Chapter XI Diseases of the digestive system,Intestinal malabsorption,18777,27,1.47 [1.15-1.87],0.0021169047952119
SPRR1B,Cornifin-B,Chapter XI Diseases of the digestive system,Coeliac disease,18771,21,1.53 [1.19-1.98],0.0009550116887934
SPRR1B,Cornifin-B,Chapter XII Diseases of the skin and subcutaneous tissue,Papulosquamous disorders,19955,77,0.56 [0.38-0.83],0.0042766483960993
SPRR1B,Cornifin-B,Chapter XIII Diseases of the musculoskeletal system and connective tissue,Spinal stenosis,17731,81,0.53 [0.36-0.79],0.0019366633211209
SPRR1B,Cornifin-B,Chapter XIII Diseases of the musculoskeletal system and connective tissue,Other enthesopathies,17402,38,0.41 [0.22-0.75],0.004028396182701
