Protein,Protein_definition,Disease_category,Disease,NB_individual,NB_case,OR[95%CI],P_value
PITHD1,PITH domain-containing protein 1,Chapter I Certain infectious and parasitic diseases,"Bacterial, viral and other infectious agents",18681,327,1.19 [1.06-1.34],0.0029279986161667
PITHD1,PITH domain-containing protein 1,Chapter I Certain infectious and parasitic diseases,Other bacterial agents as the cause of diseases classified to other chapters,18578,224,1.22 [1.06-1.40],0.0046971171594446
PITHD1,PITH domain-containing protein 1,Chapter VI Diseases of the nervous system,Cerebral palsy and other paralytic syndromes,19523,76,1.33 [1.09-1.63],0.0059316070468119
PITHD1,PITH domain-containing protein 1,Chapter XIII Diseases of the musculoskeletal system and connective tissue,Diseases of the musculoskeletal system and connective tissue,14656,2970,1.07 [1.02-1.13],0.0082272104588613
PITHD1,PITH domain-containing protein 1,Chapter XIII Diseases of the musculoskeletal system and connective tissue,Hallux valgus (acquired),14156,42,1.45 [1.12-1.88],0.0048136857935602
