Protein,Protein_definition,Disease_category,Disease,NB_individual,NB_case,OR[95%CI],P_value
DDHD2,Phospholipase DDHD2,"Chapter VII Diseases of the eye, adnexa, ear and mastoid process",Disorders of choroid and retina,19673,197,1.32 [1.07-1.63],0.008429935791541
DDHD2,Phospholipase DDHD2,Chapter IX Diseases of the circulatory system,Death due to cardiac causes,13798,3154,0.91 [0.85-0.98],0.0070321165723594
DDHD2,Phospholipase DDHD2,Chapter IX Diseases of the circulatory system,Angina pectoris,17562,772,0.86 [0.77-0.96],0.0060768502585424
DDHD2,Phospholipase DDHD2,Chapter IX Diseases of the circulatory system,Other or ill-defined heart diseases,16160,114,0.63 [0.47-0.83],0.0011322344775737
DDHD2,Phospholipase DDHD2,Chapter XIII Diseases of the musculoskeletal system and connective tissue,Other specified/unspecified arthritis,14772,136,0.70 [0.54-0.91],0.0080456242200742
