Protein,Protein_definition,Disease_category,Disease,NB_individual,NB_case,OR[95%CI],P_value
SLC28A1,Sodium/nucleoside cotransporter 1,Chapter IX Diseases of the circulatory system,Peripheral artery disease,18712,141,1.33 [1.09-1.64],0.0058638334989255
SLC28A1,Sodium/nucleoside cotransporter 1,Chapter X Diseases of the respiratory system,Other acute lower respiratory infections,19050,242,1.27 [1.07-1.50],0.0059064589494499
SLC28A1,Sodium/nucleoside cotransporter 1,Chapter X Diseases of the respiratory system,Unspecified acute lower respiratory infection,19048,240,1.25 [1.06-1.49],0.0096890419088697
SLC28A1,Sodium/nucleoside cotransporter 1,Chapter XI Diseases of the digestive system,Duodenal ulcer,15132,151,1.37 [1.12-1.67],0.0019865349058448
SLC28A1,Sodium/nucleoside cotransporter 1,Chapter XI Diseases of the digestive system,"Duodenal ulcer - Unspecified as acute or chronic, without haemorrhage or perforation, drug-induced",19679,102,1.40 [1.12-1.76],0.0036033517091452
