Protein,Protein_definition,Disease_category,Disease,NB_individual,NB_case,OR[95%CI],P_value
MICALL2,MICAL-like protein 2,Chapter I Certain infectious and parasitic diseases,Implicit Sepsis,12802,650,1.20 [1.08-1.34],0.0005507003717837
MICALL2,MICAL-like protein 2,Chapter IX Diseases of the circulatory system,Hypertensive Renal Disease,12300,58,1.48 [1.13-1.94],0.0045685403577148
MICALL2,MICAL-like protein 2,Chapter XI Diseases of the digestive system,"Postprocedural disorders of digestive system, not elsewhere classified",18615,46,1.49 [1.11-2.01],0.0080125268991558
MICALL2,MICAL-like protein 2,Chapter XIII Diseases of the musculoskeletal system and connective tissue,Arthrosis,15172,886,1.14 [1.04-1.25],0.0039312925964922
MICALL2,MICAL-like protein 2,Chapter XIII Diseases of the musculoskeletal system and connective tissue,"Artrosis, including avohilmo",17218,886,1.13 [1.03-1.24],0.0088914089361894
MICALL2,MICAL-like protein 2,Chapter XIII Diseases of the musculoskeletal system and connective tissue,Gonarthrosis,14772,486,1.18 [1.05-1.33],0.0056123186060042
MICALL2,MICAL-like protein 2,Chapter XIV Diseases of the genitourinary system,Chronic kidney disease,17832,53,1.47 [1.11-1.95],0.0079361795310878
MICALL2,MICAL-like protein 2,Chapter XIV Diseases of the genitourinary system,Other disorders of kidney and ureter,19585,60,1.45 [1.11-1.89],0.0055852470965099
