Protein,Protein_definition,Disease_category,Disease,NB_individual,NB_case,OR[95%CI],P_value
IFT20,Intraflagellar transport protein 20 homolog,Chapter I Certain infectious and parasitic diseases,Implicit Sepsis,12802,650,1.31 [1.10-1.56],0.0022522046919048
IFT20,Intraflagellar transport protein 20 homolog,Chapter V Mental and behavioural disorders,"Mood disorders, excluding more controls",16651,216,1.45 [1.10-1.92],0.0080152362455186
IFT20,Intraflagellar transport protein 20 homolog,Chapter IX Diseases of the circulatory system,Hypertensive Renal Disease,12300,58,1.92 [1.19-3.10],0.0075481872485704
IFT20,Intraflagellar transport protein 20 homolog,Chapter XI Diseases of the digestive system,Intestinal malabsorption,18596,27,2.31 [1.27-4.21],0.006226401057191
IFT20,Intraflagellar transport protein 20 homolog,Chapter XIV Diseases of the genitourinary system,Chronic kidney disease,17832,53,2.25 [1.47-3.45],0.0001899885174652
IFT20,Intraflagellar transport protein 20 homolog,Chapter XIV Diseases of the genitourinary system,Other disorders of kidney and ureter,19585,60,2.02 [1.32-3.08],0.0011291173156333
