Protein,Protein_definition,Disease_category,Disease,NB_individual,NB_case,OR[95%CI],P_value
SPART,Spartin,Chapter I Certain infectious and parasitic diseases,Implicit Sepsis,12857,664,1.16 [1.05-1.29],0.0038510993994682
SPART,Spartin,Chapter IX Diseases of the circulatory system,Atrial fibrillation and flutter,10380,513,0.84 [0.75-0.96],0.0072763996154777
SPART,Spartin,Chapter IX Diseases of the circulatory system,Other or ill-defined heart diseases,15827,110,0.61 [0.47-0.79],0.0001822965869401
SPART,Spartin,Chapter XII Diseases of the skin and subcutaneous tissue,Atrophic disorders of skin,18425,36,0.52 [0.33-0.82],0.004831628400043
SPART,Spartin,Chapter XII Diseases of the skin and subcutaneous tissue,Scar conditions and fibrosis of skin,18422,33,0.54 [0.34-0.86],0.0095085401550808
SPART,Spartin,Chapter XIII Diseases of the musculoskeletal system and connective tissue,Other specified/unspecified arthritis,14471,132,0.70 [0.55-0.88],0.0027490386949138
SPART,Spartin,Chapter XIV Diseases of the genitourinary system,Other disorders of kidney and ureter,19667,60,1.59 [1.18-2.14],0.0025298804004812
