Protein,Protein_definition,Disease_category,Disease,NB_individual,NB_case,HR[95%CI],P_value
CNTNAP2,Contactin-associated protein-like 2,Chapter IX Diseases of the circulatory system,"Hypertension, portal",27629,43,4.25 [2.82-6.39],3.962506049831218e-12
CNTNAP2,Contactin-associated protein-like 2,Chapter IX Diseases of the circulatory system,Other other unspecified disorders of the circulatory system,26517,44,3.74 [2.45-5.72],1.2063372987020475e-09
CNTNAP2,Contactin-associated protein-like 2,Chapter XI Diseases of the digestive system,"Cirrhosis of liver, NAS",27657,71,3.30 [2.27-4.80],4.3676764155160814e-10
CNTNAP2,Contactin-associated protein-like 2,Chapter XI Diseases of the digestive system,Fibrosis and cirrhosis of liver,26911,93,2.88 [2.02-4.10],5.11921157443186e-09
CNTNAP2,Contactin-associated protein-like 2,Chapter XIV Diseases of the genitourinary system,Chronic kidney disease,26885,1503,1.43 [1.28-1.60],1.0639230354849168e-10
