Protein,Protein_definition,Disease_category,Disease,NB_individual,NB_case,HR[95%CI],P_value
PRL,Prolactin,Chapter I Certain infectious and parasitic diseases,Condition for Implicit Sepsis (Organ dysfunction codes),27266,2934,1.13 [1.08-1.17],3.4090687482881546e-08
PRL,Prolactin,"Chapter IV Endocrine, nutritional and metabolic diseases","Other disorders of fluid, electrolyte and acid-base balance",23851,1557,1.18 [1.12-1.25],8.254758278258367e-09
PRL,Prolactin,Chapter IX Diseases of the circulatory system,Hypertensive Renal Disease,19669,103,1.82 [1.51-2.18],1.4527628990662768e-10
PRL,Prolactin,Chapter V Mental and behavioural disorders,"Schizophrenia or delusion, excluding more controls",23102,97,1.80 [1.51-2.15],7.479828115216433e-11
PRL,Prolactin,Chapter X Diseases of the respiratory system,Other acute lower respiratory infections,27798,945,1.23 [1.15-1.32],3.759687416719223e-09
PRL,Prolactin,Chapter X Diseases of the respiratory system,Unspecified acute lower respiratory infection,27772,919,1.24 [1.15-1.33],2.890521894745619e-09
PRL,Prolactin,Chapter XIV Diseases of the genitourinary system,Chronic kidney disease,27168,1531,1.28 [1.21-1.35],5.376143212448392e-18
PRL,Prolactin,Chapter XIV Diseases of the genitourinary system,Dialysis,25690,53,2.01 [1.60-2.52],1.4922399494862815e-09
PRL,Prolactin,Chapter XIV Diseases of the genitourinary system,Renal tubulo-interstitial diseases,27828,2531,1.15 [1.10-1.21],3.8295474367512704e-10
