Protein,Protein_definition,Disease_category,Disease,NB_individual,NB_case,HR[95%CI],P_value
TPR,Nucleoprotein TPR,Chapter I Certain infectious and parasitic diseases,Implicit bacterial Sepsis,21078,775,1.34 [1.22-1.48],5.2355976618162e-10
TPR,Nucleoprotein TPR,Chapter III Diseases of the blood and blood-forming organs and certain disorders involving the immune mechanism,Purpura and other haemorrhagic conditions,23270,198,1.55 [1.33-1.79],9.516321176812536e-09
TPR,Nucleoprotein TPR,"Chapter IV Endocrine, nutritional and metabolic diseases",Alcohol dependence,22240,54,1.79 [1.47-2.18],5.523190549342736e-09
TPR,Nucleoprotein TPR,Chapter XIV Diseases of the genitourinary system,Acute renal failure,22627,1026,1.37 [1.26-1.48],2.7032568815033446e-14
TPR,Nucleoprotein TPR,Chapter XIV Diseases of the genitourinary system,Chronic kidney disease,22745,1144,1.29 [1.19-1.41],1.618946795795432e-09
TPR,Nucleoprotein TPR,Chapter XIV Diseases of the genitourinary system,Renal tubulo-interstitial diseases,23308,1998,1.27 [1.19-1.36],1.6517383965292837e-13
