Protein,Protein_definition,Disease_category,Disease,NB_individual,NB_case,HR[95%CI],P_value
ENG,Endoglin,Chapter IX Diseases of the circulatory system,"Hypertension, Pulmonary Arterial",19791,170,8.42 [4.09-17.33],7.006332353210592e-09
ENG,Endoglin,Chapter XI Diseases of the digestive system,Other inflammatory liver diseases,27290,104,14.38 [5.66-36.52],2.056708499427241e-08
ENG,Endoglin,Chapter XIV Diseases of the genitourinary system,Acute renal failure,27018,1296,2.53 [1.91-3.34],9.695032054343108e-11
ENG,Endoglin,Chapter XIV Diseases of the genitourinary system,Female genital prolapse,21979,1023,0.37 [0.27-0.52],3.2055604269070392e-09
ENG,Endoglin,Chapter XIV Diseases of the genitourinary system,Renal tubulo-interstitial diseases,27923,2542,1.99 [1.63-2.44],2.6122598180420528e-11
