Protein,Protein_definition,Disease_category,Disease,NB_individual,NB_case,HR[95%CI],P_value
MTDH,Protein LYRIC,Chapter III Diseases of the blood and blood-forming organs and certain disorders involving the immune mechanism,Diseases of the blood and blood-forming organs and certain disorders involving the immune mechanism,22669,2526,1.13 [1.08-1.18],7.974275407669166e-09
MTDH,Protein LYRIC,Chapter III Diseases of the blood and blood-forming organs and certain disorders involving the immune mechanism,Other and unspecified iron deficiency,23190,1059,1.21 [1.13-1.29],4.512282840986636e-09
MTDH,Protein LYRIC,"Chapter IV Endocrine, nutritional and metabolic diseases",Metabolic disorders,22784,4016,1.10 [1.06-1.14],1.7541876433078972e-08
MTDH,Protein LYRIC,"Chapter IV Endocrine, nutritional and metabolic diseases",Type 2 diabetes without complications,23132,1273,1.19 [1.12-1.26],3.6817294800628877e-09
MTDH,Protein LYRIC,Chapter X Diseases of the respiratory system,Diseases of the respiratory system,21727,4411,1.09 [1.06-1.13],2.6571098268225693e-08
