Protein,Protein_definition,Disease_category,Disease,NB_individual,NB_case,HR[95%CI],P_value
CR2,Complement receptor type 2,Chapter II Neoplasms,"Non-Hodgkin lymphoma, all, excluding all cancers (controls excluding all cancers)",22773,157,2.72 [2.06-3.58],1.3199687636292497e-12
CR2,Complement receptor type 2,Chapter II Neoplasms,"Other and unspecified types of non-Hodgkin lymphoma, hilmo, excluding all cancers",22714,98,2.73 [1.93-3.85],1.177867546193623e-08
CR2,Complement receptor type 2,"Chapter IV Endocrine, nutritional and metabolic diseases",Type 2 diabetes without complications,27389,1517,1.38 [1.26-1.52],3.127520828326546e-11
CR2,Complement receptor type 2,Chapter IX Diseases of the circulatory system,"Hypertension, portal",27773,46,5.25 [3.65-7.55],3.524140320307469e-19
CR2,Complement receptor type 2,Chapter IX Diseases of the circulatory system,Oesophageal varices,26127,38,4.39 [2.86-6.73],1.2925976902686332e-11
CR2,Complement receptor type 2,Chapter XI Diseases of the digestive system,"Cirrhosis of liver, NAS",27801,74,2.80 [1.93-4.05],4.936069755578768e-08
CR2,Complement receptor type 2,Chapter XIV Diseases of the genitourinary system,Chronic kidney disease,27021,1531,1.33 [1.21-1.46],5.130334484400302e-09
CR2,Complement receptor type 2,Chapter XIV Diseases of the genitourinary system,Renal tubulo-interstitial diseases,27683,2528,1.26 [1.17-1.35],2.0549556572799983e-09
