Protein,Protein_definition,Disease_category,Disease,NB_individual,NB_case,HR[95%CI],P_value
PCDH12,Protocadherin-12,Chapter II Neoplasms,Benign neoplasm of other and unspecified endocrine glands,24155,113,4.23 [3.30-5.43],9.635781053855925e-30
PCDH12,Protocadherin-12,"Chapter IV Endocrine, nutritional and metabolic diseases",Disorders of other endocrine glands,24101,309,3.06 [2.46-3.82],2.817522467379188e-23
PCDH12,Protocadherin-12,"Chapter IV Endocrine, nutritional and metabolic diseases",Disorders of parathyroid gland,23933,141,4.49 [3.60-5.59],5.622032925301804e-41
PCDH12,Protocadherin-12,"Chapter IV Endocrine, nutritional and metabolic diseases",Hyperparathyroidism,23928,136,4.45 [3.56-5.56],3.5480096125919e-39
PCDH12,Protocadherin-12,Chapter IX Diseases of the circulatory system,"Hypertension, portal",24084,35,4.44 [2.83-6.98],1.0457568962834683e-10
