Unnamed: 0,ID,Description,GeneRatio,BgRatio,pvalue,p.adjust,qvalue,geneID,Count
GO:0086030,GO:0086030,adenylate cyclase-activating adrenergic receptor signaling pathway involved in cardiac muscle relaxation,1/2,1/18800,0.0001063829787233,0.0060101587001521,0.000167959721476,CHGA,1
GO:1901899,GO:1901899,positive regulation of relaxation of cardiac muscle,1/2,2/18800,0.0002127602984765,0.0060101587001521,0.000167959721476,CHGA,1
GO:2000707,GO:2000707,positive regulation of dense core granule biogenesis,1/2,2/18800,0.0002127602984765,0.0060101587001521,0.000167959721476,CHGA,1
GO:0061110,GO:0061110,dense core granule biogenesis,1/2,3/18800,0.0003191319592598,0.0060101587001521,0.000167959721476,CHGA,1
GO:1901079,GO:1901079,positive regulation of relaxation of muscle,1/2,3/18800,0.0003191319592598,0.0060101587001521,0.000167959721476,CHGA,1
GO:2000705,GO:2000705,regulation of dense core granule biogenesis,1/2,3/18800,0.0003191319592598,0.0060101587001521,0.000167959721476,CHGA,1
GO:0033366,GO:0033366,protein localization to secretory granule,1/2,4/18800,0.0004254979610727,0.0060101587001521,0.000167959721476,CHGA,1
GO:1900738,GO:1900738,positive regulation of phospholipase C-activating G protein-coupled receptor signaling pathway,1/2,4/18800,0.0004254979610727,0.0060101587001521,0.000167959721476,CHGA,1
GO:0060452,GO:0060452,positive regulation of cardiac muscle contraction,1/2,9/18800,0.0009572430855873,0.0090140390559471,0.0002519060751545,CHGA,1
GO:0002551,GO:0002551,mast cell chemotaxis,1/2,11/18800,0.0011699015226022,0.0098964518324105,0.0002765659571237,CHGA,1
GO:0097531,GO:0097531,mast cell migration,1/2,12/18800,0.0012762222526546,0.0098964518324105,0.0002765659571237,CHGA,1
GO:0033604,GO:0033604,negative regulation of catecholamine secretion,1/2,13/18800,0.001382537323737,0.0098964518324105,0.0002765659571237,CHGA,1
GO:0045989,GO:0045989,positive regulation of striated muscle contraction,1/2,14/18800,0.0014888467358493,0.0098964518324105,0.0002765659571237,CHGA,1
GO:0055119,GO:0055119,relaxation of cardiac muscle,1/2,17/18800,0.0018077410183654,0.0107513018460682,0.0003004555709194,CHGA,1
GO:0002026,GO:0002026,regulation of the force of heart contraction,1/2,26/18800,0.002764118281529,0.0141021746241048,0.0003940989648096,CHGA,1
GO:0051953,GO:0051953,negative regulation of amine transport,1/2,27/18800,0.0028703541270301,0.0141021746241048,0.0003940989648096,CHGA,1
GO:0046676,GO:0046676,negative regulation of insulin secretion,1/2,34/18800,0.0036138465943748,0.0160117427402015,0.0004474637002385,CHGA,1
GO:0090278,GO:0090278,negative regulation of peptide hormone secretion,1/2,39/18800,0.0041447428733759,0.0160117427402015,0.0004474637002385,CHGA,1
GO:0002792,GO:0002792,negative regulation of peptide secretion,1/2,40/18800,0.0042509051522658,0.0160117427402015,0.0004474637002385,CHGA,1
GO:0031640,GO:0031640,killing of cells of another organism,1/2,46/18800,0.0048877599872331,0.017259902454917,0.0004823447355822,CHGA,1
GO:0043303,GO:0043303,mast cell degranulation,1/2,50/18800,0.0053122166978099,0.0176735132973843,0.0004939034922417,CHGA,1
GO:0002279,GO:0002279,mast cell activation involved in immune response,1/2,52/18800,0.0055244110992771,0.0176735132973843,0.0004939034922417,CHGA,1
GO:0002448,GO:0002448,mast cell mediated immunity,1/2,52/18800,0.0055244110992771,0.0176735132973843,0.0004939034922417,CHGA,1
GO:0050832,GO:0050832,defense response to fungus,1/2,53/18800,0.005630499811556,0.0176735132973843,0.0004939034922417,CHGA,1
GO:0050432,GO:0050432,catecholamine secretion,1/2,57/18800,0.0060547980709702,0.0180050574215693,0.000503168814762,CHGA,1
GO:0045576,GO:0045576,mast cell activation,1/2,65/18800,0.0069031229592335,0.0190256803510584,0.0005316911136765,CHGA,1
GO:0043299,GO:0043299,leukocyte degranulation,1/2,76/18800,0.0080689783182217,0.0201640566734052,0.0005635041455073,CHGA,1
GO:0032418,GO:0032418,lysosome localization,1/2,79/18800,0.0083868200323012,0.0201640566734052,0.0005635041455073,CHGA,1
GO:1990849,GO:1990849,vacuolar localization,1/2,79/18800,0.0083868200323012,0.0201640566734052,0.0005635041455073,CHGA,1
GO:0050829,GO:0050829,defense response to Gram-negative bacterium,1/2,87/18800,0.0092341489418291,0.0212950781719734,0.0005951116396452,CHGA,1
GO:1904950,GO:1904950,negative regulation of establishment of protein localization,1/2,128/18800,0.0135710251677036,0.0264401007577673,0.0007388942922524,CHGA,1
GO:0060048,GO:0060048,cardiac muscle contraction,1/2,138/18800,0.0146273568195681,0.0275481886768532,0.0007698608852404,CHGA,1
GO:1903531,GO:1903531,negative regulation of secretion by cell,1/2,143/18800,0.0151553104341219,0.0280745914599307,0.0007845717222151,CHGA,1
GO:0006941,GO:0006941,striated muscle contraction,1/2,178/18800,0.018847024456937,0.0307368402694067,0.0008589708505656,CHGA,1
GO:0008217,GO:0008217,regulation of blood pressure,1/2,183/18800,0.0193738462774726,0.0307368402694067,0.0008589708505656,CHGA,1
GO:0001906,GO:0001906,cell killing,1/2,185/18800,0.0195845353928963,0.0307368402694067,0.0008589708505656,CHGA,1
GO:1903828,GO:1903828,negative regulation of protein localization,1/2,199/18800,0.0210587253962126,0.0325977530105756,0.0009109758642918,CHGA,1
GO:1901215,GO:1901215,negative regulation of neuron death,1/2,209/18800,0.0221110391793136,0.0336309606026273,0.0009398498538228,CHGA,1
GO:0042886,GO:0042886,amide transport,1/2,287/18800,0.0302996651021499,0.0364144577869718,0.001017637385756,CHGA,1
GO:0009914,GO:0009914,hormone transport,1/2,290/18800,0.0306139246881622,0.0364144577869718,0.001017637385756,CHGA,1
GO:0035592,GO:0035592,establishment of protein localization to extracellular region,1/2,351/18800,0.0369928232941317,0.0415004439434563,0.0011597702080146,CHGA,1
GO:0070997,GO:0070997,neuron death,1/2,353/18800,0.037201610995605,0.0415004439434563,0.0011597702080146,CHGA,1
GO:0071692,GO:0071692,protein localization to extracellular region,1/2,359/18800,0.0378278382847433,0.0415004439434563,0.0011597702080146,CHGA,1
GO:0051656,GO:0051656,establishment of organelle localization,1/2,404/18800,0.0425180492851023,0.045325844992609,0.0012666747552662,CHGA,1
