Protein,Protein_definition,Disease_category,Disease,NB_individual,NB_case,HR[95%CI],P_value
MEPE,Matrix extracellular phosphoglycoprotein,"Chapter IV Endocrine, nutritional and metabolic diseases",Disorders of parathyroid gland,27497,186,13.01 [7.52-22.52],5.070335779889503e-20
MEPE,Matrix extracellular phosphoglycoprotein,"Chapter IV Endocrine, nutritional and metabolic diseases",Hyperparathyroidism,27487,176,15.19 [8.63-26.73],4.087532484053412e-21
MEPE,Matrix extracellular phosphoglycoprotein,Chapter IX Diseases of the circulatory system,Hypertensive Renal Disease,19493,105,28.19 [13.72-57.94],1.0400733748270464e-19
MEPE,Matrix extracellular phosphoglycoprotein,"Chapter VII Diseases of the eye, adnexa, ear and mastoid process",Background diabetic retinopathy,27646,176,0.32 [0.22-0.45],2.5344600237070714e-10
MEPE,Matrix extracellular phosphoglycoprotein,Chapter XIII Diseases of the musculoskeletal system and connective tissue,Osteoporosis,26587,1831,0.61 [0.53-0.70],1.4456414909896214e-11
MEPE,Matrix extracellular phosphoglycoprotein,Chapter XIV Diseases of the genitourinary system,Chronic kidney disease,26930,1517,4.48 [3.70-5.44],1.0070885008852641e-52
MEPE,Matrix extracellular phosphoglycoprotein,Chapter XIV Diseases of the genitourinary system,Chronic nephritic syndrome,27613,82,16.18 [7.24-36.15],1.1564696761623738e-11
MEPE,Matrix extracellular phosphoglycoprotein,Chapter XIV Diseases of the genitourinary system,Renal tubulo-interstitial diseases,27592,2517,1.89 [1.64-2.17],8.804302388857029e-19
