Protein,Protein_definition,Disease_category,Disease,NB_individual,NB_case,HR[95%CI],P_value
TGFBR1,TGF-beta receptor type-1,Chapter I Certain infectious and parasitic diseases,Condition for Implicit Sepsis (Organ dysfunction codes),22907,2419,1.59 [1.37-1.84],4.717721351265906e-10
TGFBR1,TGF-beta receptor type-1,Chapter IX Diseases of the circulatory system,Hypertensive Renal Disease,16538,63,3.23 [2.27-4.59],5.937825788492763e-11
TGFBR1,TGF-beta receptor type-1,Chapter XIV Diseases of the genitourinary system,Acute renal failure,22709,1024,2.03 [1.69-2.43],4.5383397558714944e-14
TGFBR1,TGF-beta receptor type-1,Chapter XIV Diseases of the genitourinary system,Chronic kidney disease,22830,1145,2.14 [1.82-2.52],2.3076194188001047e-20
TGFBR1,TGF-beta receptor type-1,Chapter XIV Diseases of the genitourinary system,Renal tubulo-interstitial diseases,23390,1999,1.87 [1.62-2.15],5.1626132023847015e-18
