Protein,Protein_definition,Disease_category,Disease,NB_individual,NB_case,HR[95%CI],P_value
CES2,Cocaine esterase,"Chapter IV Endocrine, nutritional and metabolic diseases",Other disorders of glucose regulation and pancreatic internal secretion,27653,190,1.87 [1.54-2.26],2.551014921469189e-10
CES2,Cocaine esterase,"Chapter IV Endocrine, nutritional and metabolic diseases",Type 1 diabetes without complications,25807,142,2.19 [1.77-2.71],7.252269976971494e-13
CES2,Cocaine esterase,"Chapter IV Endocrine, nutritional and metabolic diseases",Type 2 diabetes without complications,27175,1510,1.69 [1.58-1.82],4.404010987530674e-47
CES2,Cocaine esterase,"Chapter VII Diseases of the eye, adnexa, ear and mastoid process",Background diabetic retinopathy,27520,176,1.91 [1.56-2.33],2.621610518604501e-10
CES2,Cocaine esterase,Chapter XIV Diseases of the genitourinary system,Renal tubulo-interstitial diseases,27466,2496,1.21 [1.14-1.29],6.050905638677754e-10
