Protein,Protein_definition,Disease_category,Disease,NB_individual,NB_case,HR[95%CI],P_value
BLNK,B-cell linker protein,Chapter II Neoplasms,"Chronic lymphocytic leukaemia and small lyphocytis leukaemia, excluding all cancers (controls excluding all cancers)",34646,90,2.66 [2.27-3.12],3.0916769753716205e-33
BLNK,B-cell linker protein,Chapter II Neoplasms,Lymphoid leukaemia,34643,87,2.64 [2.24-3.11],1.9053608545819224e-31
BLNK,B-cell linker protein,Chapter II Neoplasms,"Non-Hodgkin lymphoma, all, excluding all cancers (controls excluding all cancers)",34825,269,1.85 [1.53-2.25],4.0241516589180494e-10
BLNK,B-cell linker protein,Chapter II Neoplasms,"Other and unspecified types of non-Hodgkin lymphoma, hilmo, excluding all cancers",34724,168,1.95 [1.56-2.44],4.619533679683174e-09
BLNK,B-cell linker protein,Chapter XIV Diseases of the genitourinary system,Chronic kidney disease,41676,2263,1.29 [1.18-1.41],1.63498406700533e-08
BLNK,B-cell linker protein,Chapter XIV Diseases of the genitourinary system,Renal tubulo-interstitial diseases,43133,4237,1.21 [1.13-1.29],5.970888840428402e-08
