Protein,Protein_definition,Disease_category,Disease,NB_individual,NB_case,HR[95%CI],P_value
DHPS,Deoxyhypusine synthase,Chapter II Neoplasms,"Chronic lymphocytic leukaemia and small lyphocytis leukaemia, excluding all cancers (controls excluding all cancers)",35512,93,2.05 [1.67-2.53],1.2468412202574258e-11
DHPS,Deoxyhypusine synthase,Chapter II Neoplasms,Lymphoid leukaemia,35511,92,1.96 [1.57-2.44],2.048201130197258e-09
DHPS,Deoxyhypusine synthase,"Chapter IV Endocrine, nutritional and metabolic diseases",Type 2 diabetes without complications,43518,3190,1.29 [1.21-1.37],2.283410011410899e-14
DHPS,Deoxyhypusine synthase,Chapter IX Diseases of the circulatory system,Oesophageal varices,41849,89,2.00 [1.56-2.56],5.412824126693588e-08
DHPS,Deoxyhypusine synthase,Chapter XI Diseases of the digestive system,"Cirrhosis of liver, NAS",44330,185,1.81 [1.51-2.18],2.7667107011315407e-10
DHPS,Deoxyhypusine synthase,Chapter XI Diseases of the digestive system,Diseases of liver,44373,1451,1.32 [1.20-1.46],4.024369553564337e-08
DHPS,Deoxyhypusine synthase,Chapter XI Diseases of the digestive system,Fibrosis and cirrhosis of liver,43144,222,1.77 [1.49-2.10],7.999638394463127e-11
