Protein,Protein_definition,Disease_category,Disease,NB_individual,NB_case,OR[95%CI],P_value
MMP15,Matrix metalloproteinase-15,Chapter I Certain infectious and parasitic diseases,Implicit Sepsis,16114,647,1.25 [1.10-1.41],0.0004729419199188
MMP15,Matrix metalloproteinase-15,Chapter X Diseases of the respiratory system,Early onset COPD,23294,139,1.43 [1.16-1.77],0.000762934226843
MMP15,Matrix metalloproteinase-15,Chapter XI Diseases of the digestive system,Hernia,21681,1062,1.20 [1.08-1.32],0.0004966302447657
MMP15,Matrix metalloproteinase-15,Chapter XI Diseases of the digestive system,Diaphragmatic hernia,21469,850,1.23 [1.10-1.37],0.0001919366510075
MMP15,Matrix metalloproteinase-15,Chapter XI Diseases of the digestive system,Diseases of liver,23521,90,1.51 [1.20-1.90],0.0003733481676479
MMP15,Matrix metalloproteinase-15,Chapter XII Diseases of the skin and subcutaneous tissue,Seborrhoeic keratosis,22297,85,1.56 [1.25-1.94],9.962751374829526e-05
