Protein,Protein_definition,Disease_category,Disease,NB_individual,NB_case,OR[95%CI],P_value
SERPINC1,Antithrombin-III,"Chapter IV Endocrine, nutritional and metabolic diseases",Disorders of lipoprotein metabolism and other lipidaemias,19925,608,2.77 [1.62-4.73],0.0002094587919755
SERPINC1,Antithrombin-III,"Chapter IV Endocrine, nutritional and metabolic diseases",Pure hypercholesterolaemia,19883,566,2.98 [1.71-5.19],0.0001178387894059
SERPINC1,Antithrombin-III,Chapter VI Diseases of the nervous system,Epilepsy,22800,117,7.05 [2.26-22.01],0.0007702255562412
SERPINC1,Antithrombin-III,Chapter IX Diseases of the circulatory system,"Hypertension, essential",18715,1784,1.90 [1.34-2.68],0.0002720102069318
SERPINC1,Antithrombin-III,Chapter IX Diseases of the circulatory system,Hypertension,18729,1798,1.91 [1.36-2.70],0.0002080371494091
