Protein,Protein_definition,Disease_category,Disease,NB_individual,NB_case,OR[95%CI],P_value
IL34,Interleukin-34,"Chapter IV Endocrine, nutritional and metabolic diseases",Volume depletion,21604,49,4.36 [2.23-8.49],1.5600627186159524e-05
IL34,Interleukin-34,Chapter V Mental and behavioural disorders,"Anxiety disorders, excluding more controls",22366,141,0.51 [0.35-0.75],0.000521024862319
IL34,Interleukin-34,Chapter V Mental and behavioural disorders,Other anxiety disorders,25173,70,0.39 [0.24-0.64],0.0001630603642881
IL34,Interleukin-34,Chapter XI Diseases of the digestive system,Diseases of liver,26276,100,2.76 [1.67-4.56],7.691021303869464e-05
IL34,Interleukin-34,Chapter XI Diseases of the digestive system,Other diseases of liver,26226,50,3.45 [1.75-6.82],0.0003580524108155
IL34,Interleukin-34,Chapter XIV Diseases of the genitourinary system,Acute renal failure,24804,35,4.62 [2.13-10.01],0.0001042250909668
