Protein,Protein_definition,Disease_category,Disease,NB_individual,NB_case,OR[95%CI],P_value
NENF,Neudesin,Chapter III Diseases of the blood and blood-forming organs and certain disorders involving the immune mechanism,Diseases of the blood and blood-forming organs and certain disorders involving the immune mechanism,21511,895,1.11 [1.05-1.16],0.0001708892385826
NENF,Neudesin,Chapter II Neoplasms,Leiomyoma of uterus,23583,871,1.09 [1.04-1.15],0.0008612553109328
NENF,Neudesin,"Chapter IV Endocrine, nutritional and metabolic diseases",Disorders of the thyroid gland,22084,761,1.13 [1.07-1.19],9.485042306996044e-06
NENF,Neudesin,Chapter XI Diseases of the digestive system,Diseases of the digestive system,22881,258,1.22 [1.12-1.32],3.303518400558296e-06
NENF,Neudesin,Chapter XI Diseases of the digestive system,Intestinal malabsorption,22712,89,1.50 [1.35-1.67],1.0830118954848961e-13
NENF,Neudesin,Chapter XI Diseases of the digestive system,Coeliac disease,22699,76,1.51 [1.34-1.70],3.474613879253725e-12
NENF,Neudesin,Chapter XIII Diseases of the musculoskeletal system and connective tissue,Systemic lupus erythematosus,23328,209,1.19 [1.08-1.31],0.000390649798312
