Protein,Protein_definition,Disease_category,Disease,NB_individual,NB_case,OR[95%CI],P_value
MECR,"Enoyl-[acyl-carrier-protein] reductase, mitochondrial",Chapter IX Diseases of the circulatory system,Death due to cardiac causes,17346,2355,1.11 [1.05-1.17],6.208060642790953e-05
MECR,"Enoyl-[acyl-carrier-protein] reductase, mitochondrial",Chapter X Diseases of the respiratory system,Diseases of the respiratory system,19189,1814,1.11 [1.06-1.17],5.821978487098258e-05
MECR,"Enoyl-[acyl-carrier-protein] reductase, mitochondrial",Chapter XI Diseases of the digestive system,Diseases of the digestive system,22408,249,1.29 [1.14-1.47],9.810751846042344e-05
MECR,"Enoyl-[acyl-carrier-protein] reductase, mitochondrial",Chapter XIII Diseases of the musculoskeletal system and connective tissue,Rheumatoid arthritis,16135,189,1.30 [1.12-1.51],0.0006297243626773
MECR,"Enoyl-[acyl-carrier-protein] reductase, mitochondrial",Chapter XIII Diseases of the musculoskeletal system and connective tissue,"Other (seronegative) rheumatoid arthritis, wide",23085,181,1.34 [1.15-1.56],0.0001584888982831
MECR,"Enoyl-[acyl-carrier-protein] reductase, mitochondrial",Chapter XIII Diseases of the musculoskeletal system and connective tissue,Other/unspecified rheumatoid arthritis,23100,166,1.35 [1.15-1.58],0.0001791566031716
