Protein,Protein_definition,Disease_category,Disease,NB_individual,NB_case,OR[95%CI],P_value
PARP1,Poly [ADP-ribose] polymerase 1,Chapter II Neoplasms,Benign neoplasm: Rectum,27460,59,1.48 [1.18-1.87],0.0007629665954103
PARP1,Poly [ADP-ribose] polymerase 1,"Chapter IV Endocrine, nutritional and metabolic diseases",Metabolic disorders,22986,922,1.17 [1.07-1.29],0.0007149198924243
PARP1,Poly [ADP-ribose] polymerase 1,Chapter X Diseases of the respiratory system,Other respiratory disorders and diseases,26543,92,1.42 [1.16-1.74],0.0006235752582739
PARP1,Poly [ADP-ribose] polymerase 1,Chapter XI Diseases of the digestive system,Gastrointestinal diseases,19180,6051,1.11 [1.06-1.17],2.272868763599668e-05
PARP1,Poly [ADP-ribose] polymerase 1,Chapter XIII Diseases of the musculoskeletal system and connective tissue,Other intervertebral disc disorders,23876,243,1.33 [1.15-1.53],7.31295877220633e-05
PARP1,Poly [ADP-ribose] polymerase 1,Chapter XIII Diseases of the musculoskeletal system and connective tissue,Lumbar disc prolapse,23735,102,1.39 [1.14-1.70],0.0009542279810835
