Protein,Protein_definition,Disease_category,Disease,NB_individual,NB_case,OR[95%CI],P_value
GNPDA2,Glucosamine-6-phosphate isomerase 2,Chapter I Certain infectious and parasitic diseases,Implicit Sepsis,15761,639,0.66 [0.53-0.83],0.0002570697357848
GNPDA2,Glucosamine-6-phosphate isomerase 2,Chapter V Mental and behavioural disorders,Any mental disorder,19987,515,0.66 [0.52-0.84],0.0006529176317757
GNPDA2,Glucosamine-6-phosphate isomerase 2,Chapter V Mental and behavioural disorders,"Mood disorders, excluding more controls",19788,316,0.55 [0.40-0.74],9.32994607482002e-05
GNPDA2,Glucosamine-6-phosphate isomerase 2,Chapter XI Diseases of the digestive system,Diseases of liver,23024,89,0.28 [0.16-0.49],1.0784572265705322e-05
GNPDA2,Glucosamine-6-phosphate isomerase 2,Chapter XIII Diseases of the musculoskeletal system and connective tissue,Systemic lupus erythematosus,22965,206,0.47 [0.32-0.68],6.523389995767374e-05
GNPDA2,Glucosamine-6-phosphate isomerase 2,Chapter XIII Diseases of the musculoskeletal system and connective tissue,Osteopathies and chondropathies,21526,415,0.63 [0.48-0.82],0.0007504231993186
