Protein,Protein_definition,Disease_category,Disease,NB_individual,NB_case,OR[95%CI],P_value
CCL8,C-C motif chemokine 8,Chapter I Certain infectious and parasitic diseases,Explicit Sepsis,25207,84,1.71 [1.26-2.34],0.0006760911338973
CCL8,C-C motif chemokine 8,Chapter IX Diseases of the circulatory system,Venous thromboembolism,27265,221,1.40 [1.15-1.71],0.0009461581238546
CCL8,C-C motif chemokine 8,Chapter X Diseases of the respiratory system,Influenza and pneumonia,26298,205,1.49 [1.22-1.83],0.0001369612790309
CCL8,C-C motif chemokine 8,Chapter XIII Diseases of the musculoskeletal system and connective tissue,Systemic lupus erythematosus,27127,226,1.68 [1.39-2.02],9.846660756411541e-08
CCL8,C-C motif chemokine 8,Chapter XIII Diseases of the musculoskeletal system and connective tissue,Other systemic involvement of connective tissue,26996,95,2.38 [1.80-3.14],8.967329970825022e-10
