Protein,Protein_definition,Disease_category,Disease,Method,Nb_SNP,OR[95%CI],P_value
LGALS4,Galectin-4,Chapter I Certain infectious and parasitic diseases,"Bacterial, viral and other infectious agents",Inverse variance weighted,19,0.80 [0.70-0.91],0.0009291242744243
LGALS4,Galectin-4,"Chapter IV Endocrine, nutritional and metabolic diseases",Pure hypercholesterolaemia,Inverse variance weighted,19,0.90 [0.85-0.95],0.0001580330456992
LGALS4,Galectin-4,"Chapter IV Endocrine, nutritional and metabolic diseases",Disorders of lipoprotein metabolism and other lipidaemias,Inverse variance weighted,19,0.92 [0.88-0.96],8.30720401887156e-05
LGALS4,Galectin-4,"Chapter IV Endocrine, nutritional and metabolic diseases",Metabolic disorders,Inverse variance weighted,19,0.94 [0.90-0.97],0.0006693187288455
LGALS4,Galectin-4,Chapter XIII Diseases of the musculoskeletal system and connective tissue,"Other soft tissue disorders, not elsewhere classified",Inverse variance weighted,19,0.92 [0.88-0.97],0.0006596752529341
