Protein,Protein_definition,Disease_category,Disease,NB_individual,NB_case,OR[95%CI],P_value
CPA2,Carboxypeptidase A2,"Chapter IV Endocrine, nutritional and metabolic diseases",Type 2 diabetes,21617,698,2.42 [2.20-2.67],5.354790840597152e-70
CPA2,Carboxypeptidase A2,"Chapter IV Endocrine, nutritional and metabolic diseases",Type 2 diabetes without complications,21590,671,2.42 [2.19-2.68],8.728808810536068e-68
CPA2,Carboxypeptidase A2,"Chapter VII Diseases of the eye, adnexa, ear and mastoid process",Background diabetic retinopathy,23455,70,2.20 [1.68-2.88],7.765850336655455e-09
CPA2,Carboxypeptidase A2,"Chapter VII Diseases of the eye, adnexa, ear and mastoid process","Diabetic maculopathy, excluding more controls",20919,70,2.64 [2.00-3.48],5.345203945889363e-12
CPA2,Carboxypeptidase A2,Chapter XI Diseases of the digestive system,Coeliac disease,22175,28,3.33 [2.26-4.91],1.248031787280704e-09
