Protein,Protein_definition,Disease_category,Disease,NB_individual,NB_case,OR[95%CI],P_value
SETMAR,Histone-lysine N-methyltransferase SETMAR,"Chapter IV Endocrine, nutritional and metabolic diseases",Type 2 diabetes,21204,685,0.46 [0.36-0.58],3.9454578457293356e-11
SETMAR,Histone-lysine N-methyltransferase SETMAR,"Chapter IV Endocrine, nutritional and metabolic diseases",Type 2 diabetes without complications,21178,659,0.46 [0.37-0.59],1.3068703487691368e-10
SETMAR,Histone-lysine N-methyltransferase SETMAR,Chapter IX Diseases of the circulatory system,Death due to cardiac causes,15804,3703,1.40 [1.24-1.59],5.501795462123917e-08
SETMAR,Histone-lysine N-methyltransferase SETMAR,Chapter IX Diseases of the circulatory system,Atrial fibrillation and flutter,12044,594,2.12 [1.67-2.68],6.403590345395195e-10
SETMAR,Histone-lysine N-methyltransferase SETMAR,Chapter X Diseases of the respiratory system,Diseases of the respiratory system,18226,1975,1.50 [1.31-1.72],2.4798199612200518e-09
SETMAR,Histone-lysine N-methyltransferase SETMAR,Chapter XIII Diseases of the musculoskeletal system and connective tissue,Diseases of the musculoskeletal system and connective tissue,17268,3492,1.37 [1.23-1.54],3.446814284219544e-08
