Protein,Protein_definition,Disease_category,Disease,NB_individual,NB_case,OR[95%CI],P_value
OPTC,Opticin,Chapter II Neoplasms,"Non-Hodgkin lymphoma, all, excluding all cancers (controls excluding all cancers)",24385,49,2.08 [1.60-2.70],4.6210211157310376e-08
OPTC,Opticin,Chapter III Diseases of the blood and blood-forming organs and certain disorders involving the immune mechanism,Diseases of the blood and blood-forming organs and certain disorders involving the immune mechanism,25948,819,1.38 [1.23-1.56],5.4992644631951536e-08
OPTC,Opticin,Chapter IX Diseases of the circulatory system,Hypertensive Renal Disease,21868,50,2.25 [1.76-2.88],1.3578103401089338e-10
OPTC,Opticin,Chapter XI Diseases of the digestive system,Inguinal hernia,24648,401,0.51 [0.41-0.64],2.1894775247460512e-09
OPTC,Opticin,Chapter XIII Diseases of the musculoskeletal system and connective tissue,Systemic lupus erythematosus,27810,151,2.00 [1.68-2.37],6.1079343590149855e-15
OPTC,Opticin,Chapter XIV Diseases of the genitourinary system,Genitourinary diseases,23837,4418,1.40 [1.31-1.48],2.7276456711203006e-26
OPTC,Opticin,Chapter XIV Diseases of the genitourinary system,Renal tubulo-interstitial diseases,26658,213,1.85 [1.57-2.18],2.437738353270314e-13
OPTC,Opticin,Chapter XIV Diseases of the genitourinary system,Chronic kidney disease,26812,50,2.43 [1.94-3.04],6.779693140847758e-15
OPTC,Opticin,Chapter XIV Diseases of the genitourinary system,Unspecified kidney failure,26817,55,2.05 [1.60-2.64],2.0603216710666683e-08
