Protein,Protein_definition,Disease_category,Disease,NB_individual,NB_case,OR[95%CI],P_value
LYZL2,Lysozyme-like protein 2,Chapter II Neoplasms,"Malignant neoplasm of breast, excluding all cancers (controls excluding all cancers)",11503,254,2.37 [1.92-2.92],6.327856090808067e-16
LYZL2,Lysozyme-like protein 2,"Chapter IV Endocrine, nutritional and metabolic diseases",Disorders of the thyroid gland,22656,366,0.41 [0.30-0.56],1.2892909657189708e-08
LYZL2,Lysozyme-like protein 2,Chapter IX Diseases of the circulatory system,"Ischaemic heart disease, wide definition",22453,491,1.65 [1.38-1.98],5.8973871355432373e-08
LYZL2,Lysozyme-like protein 2,Chapter IX Diseases of the circulatory system,Coronary atherosclerosis,22321,368,1.80 [1.48-2.19],4.678022106837072e-09
LYZL2,Lysozyme-like protein 2,Chapter XI Diseases of the digestive system,Inguinal hernia,20731,336,2.09 [1.74-2.52],5.258794106640168e-15
LYZL2,Lysozyme-like protein 2,Chapter XIV Diseases of the genitourinary system,Genitourinary diseases,20125,3740,0.56 [0.50-0.61],4.64093048632795e-31
