Protein,Protein_definition,Disease_category,Disease,NB_individual,NB_case,OR[95%CI],P_value
IGF2R,Cation-independent mannose-6-phosphate receptor,"Chapter IV Endocrine, nutritional and metabolic diseases",Metabolic disorders,24842,702,2.31 [1.75-3.05],3.954626374736858e-09
IGF2R,Cation-independent mannose-6-phosphate receptor,Chapter IX Diseases of the circulatory system,Death due to cardiac causes,22154,1970,1.87 [1.56-2.24],1.7439832007547865e-11
IGF2R,Cation-independent mannose-6-phosphate receptor,Chapter IX Diseases of the circulatory system,"Hypertension, essential",23226,1308,2.02 [1.62-2.51],2.5314472327070916e-10
IGF2R,Cation-independent mannose-6-phosphate receptor,Chapter IX Diseases of the circulatory system,Hypertension,23249,1331,2.05 [1.65-2.54],7.475934853322145e-11
IGF2R,Cation-independent mannose-6-phosphate receptor,Chapter X Diseases of the respiratory system,Diseases of the respiratory system,23968,1953,1.68 [1.41-2.00],6.605736362608973e-09
IGF2R,Cation-independent mannose-6-phosphate receptor,Chapter XI Diseases of the digestive system,Diseases of liver,27570,123,6.48 [3.57-11.74],7.58555237365631e-10
