Protein,Protein_definition,Disease_category,Disease,NB_individual,NB_case,OR[95%CI],P_value
ENO3,Beta-enolase,Chapter III Diseases of the blood and blood-forming organs and certain disorders involving the immune mechanism,Diseases of the blood and blood-forming organs and certain disorders involving the immune mechanism,22040,702,0.62 [0.55-0.71],5.692336019676277e-13
ENO3,Beta-enolase,"Chapter IV Endocrine, nutritional and metabolic diseases",Disorders of the thyroid gland,22835,373,0.57 [0.48-0.69],1.139243752345086e-09
ENO3,Beta-enolase,Chapter XIII Diseases of the musculoskeletal system and connective tissue,Systemic lupus erythematosus,23581,143,0.40 [0.30-0.55],3.6052132325385035e-09
ENO3,Beta-enolase,Chapter XIV Diseases of the genitourinary system,Genitourinary diseases,20256,3775,0.64 [0.61-0.68],2.22923920169095e-47
ENO3,Beta-enolase,Chapter XIV Diseases of the genitourinary system,Other diseases of urinary system,22614,755,0.71 [0.63-0.80],4.337365223019904e-08
