Protein,Protein_definition,Disease_category,Disease,NB_individual,NB_case,OR[95%CI],P_value
SEMA4C,Semaphorin-4C,"Chapter IV Endocrine, nutritional and metabolic diseases",Type 1 diabetes,20245,152,2.35 [1.66-3.34],1.6368449805497905e-06
SEMA4C,Semaphorin-4C,Chapter IX Diseases of the circulatory system,Hypertensive Renal Disease,11948,108,2.39 [1.65-3.48],4.598604710677512e-06
SEMA4C,Semaphorin-4C,Chapter IX Diseases of the circulatory system,Atrial fibrillation and flutter,9525,689,1.88 [1.49-2.37],1.309450524903994e-07
SEMA4C,Semaphorin-4C,Chapter XI Diseases of the digestive system,Diseases of liver,22149,125,2.40 [1.80-3.19],1.8771969701906598e-09
SEMA4C,Semaphorin-4C,Chapter XIV Diseases of the genitourinary system,Genitourinary diseases,16788,4069,1.31 [1.17-1.46],3.414102740738233e-06
SEMA4C,Semaphorin-4C,Chapter XIV Diseases of the genitourinary system,Chronic kidney disease,19391,88,2.43 [1.74-3.38],1.5801078328153637e-07
