Protein,Protein_definition,Disease_category,Disease,NB_individual,NB_case,OR[95%CI],P_value
DPP7,Dipeptidyl peptidase 2,"Chapter IV Endocrine, nutritional and metabolic diseases",Type 2 diabetes,20816,778,1.31 [1.17-1.45],1.457341073318183e-06
DPP7,Dipeptidyl peptidase 2,"Chapter IV Endocrine, nutritional and metabolic diseases",Type 2 diabetes without complications,20790,752,1.29 [1.16-1.44],5.934480305498136e-06
DPP7,Dipeptidyl peptidase 2,Chapter X Diseases of the respiratory system,Diseases of the respiratory system,16937,2149,1.19 [1.11-1.27],1.4866697408297785e-06
DPP7,Dipeptidyl peptidase 2,Chapter X Diseases of the respiratory system,Chronic lower respiratory diseases,19904,1127,1.24 [1.13-1.36],2.472943649878798e-06
DPP7,Dipeptidyl peptidase 2,Chapter XI Diseases of the digestive system,Hernia,19370,2062,1.17 [1.09-1.25],6.096410649109519e-06
