Protein,Protein_definition,Disease_category,Disease,NB_individual,NB_case,OR[95%CI],P_value
OPTC,Opticin,Chapter IX Diseases of the circulatory system,Hypertensive Renal Disease,21868,50,2.25 [1.76-2.88],1.3578103401089338e-10
OPTC,Opticin,Chapter XIII Diseases of the musculoskeletal system and connective tissue,Systemic lupus erythematosus,27810,151,2.00 [1.68-2.37],6.1079343590149855e-15
OPTC,Opticin,Chapter XIV Diseases of the genitourinary system,Genitourinary diseases,23837,4418,1.40 [1.31-1.48],2.7276456711203006e-26
OPTC,Opticin,Chapter XIV Diseases of the genitourinary system,Renal tubulo-interstitial diseases,26658,213,1.85 [1.57-2.18],2.437738353270314e-13
OPTC,Opticin,Chapter XIV Diseases of the genitourinary system,Chronic kidney disease,26812,50,2.43 [1.94-3.04],6.779693140847758e-15
