Protein,Protein_definition,Disease_category,Disease,NB_individual,NB_case,OR[95%CI],P_value
CXCL8,Interleukin-8,Chapter I Certain infectious and parasitic diseases,Implicit Sepsis,20147,496,1.38 [1.25-1.51],2.6435795265987167e-11
CXCL8,Interleukin-8,"Chapter IV Endocrine, nutritional and metabolic diseases",Type 2 diabetes,26500,327,1.41 [1.27-1.57],1.3893953974021703e-10
CXCL8,Interleukin-8,"Chapter IV Endocrine, nutritional and metabolic diseases",Type 2 diabetes without complications,26490,317,1.42 [1.28-1.58],8.642188727234497e-11
CXCL8,Interleukin-8,Chapter XI Diseases of the digestive system,Ulcerative colitis,26599,132,1.56 [1.35-1.80],8.5524068009394e-10
CXCL8,Interleukin-8,Chapter XI Diseases of the digestive system,"Ulcerative colitis, NAS",26582,115,1.64 [1.42-1.88],1.1036120886410122e-11
