Protein,Protein_definition,Disease_category,Disease,NB_individual,NB_case,OR[95%CI],P_value
OSM,Oncostatin-M,Chapter I Certain infectious and parasitic diseases,Implicit Sepsis,20206,502,1.45 [1.30-1.61],1.5616698004126268e-11
OSM,Oncostatin-M,"Chapter IV Endocrine, nutritional and metabolic diseases",Metabolic disorders,24694,709,1.37 [1.25-1.50],2.0940194066343575e-11
OSM,Oncostatin-M,Chapter V Mental and behavioural disorders,"Substance abuse, excluding more controls",23962,292,1.59 [1.38-1.83],7.079428582731823e-11
OSM,Oncostatin-M,Chapter IX Diseases of the circulatory system,Death due to cardiac causes,22032,1978,1.34 [1.26-1.42],1.2830786469842216e-21
OSM,Oncostatin-M,Chapter IX Diseases of the circulatory system,"Hypertension, essential",23110,1315,1.38 [1.29-1.49],6.579050425137216e-19
OSM,Oncostatin-M,Chapter IX Diseases of the circulatory system,Hypertension,23134,1339,1.38 [1.28-1.48],7.706082172402251e-19
OSM,Oncostatin-M,Chapter X Diseases of the respiratory system,Diseases of the respiratory system,23842,1964,1.22 [1.15-1.29],7.720176095717835e-12
