Protein,Protein_definition,Disease_category,Disease,NB_individual,NB_case,HR[95%CI],P_value
INSL5,Insulin-like peptide INSL5,"Chapter IV Endocrine, nutritional and metabolic diseases",Alcohol dependence,22820,128,1.77 [1.54-2.04],1.879347494778532e-15
INSL5,Insulin-like peptide INSL5,"Chapter IV Endocrine, nutritional and metabolic diseases",Type 2 diabetes without complications,24170,1348,1.18 [1.13-1.24],1.4166838406944093e-11
INSL5,Insulin-like peptide INSL5,Chapter IX Diseases of the circulatory system,Hypertensive Renal Disease,18937,40,2.24 [1.77-2.83],2.1516826883206237e-11
INSL5,Insulin-like peptide INSL5,Chapter V Mental and behavioural disorders,"Alcohol use disorder, ICD-based",24387,333,1.56 [1.43-1.71],3.8765391627327295e-22
INSL5,Insulin-like peptide INSL5,Chapter V Mental and behavioural disorders,"Mental and behavioural disorders due to alcohol, excluding acute intoxication",24331,386,1.49 [1.37-1.62],7.308242471245667e-20
INSL5,Insulin-like peptide INSL5,Chapter XI Diseases of the digestive system,Diverticular disease of intestine,20890,2171,1.15 [1.11-1.20],4.1778298685021406e-12
INSL5,Insulin-like peptide INSL5,Chapter XIII Diseases of the musculoskeletal system and connective tissue,Gout,19086,347,1.36 [1.24-1.49],1.6021138700845468e-10
INSL5,Insulin-like peptide INSL5,Chapter XIII Diseases of the musculoskeletal system and connective tissue,"Gout, unspecified",24483,337,1.35 [1.23-1.48],6.908724100188442e-10
