Protein,Protein_definition,Disease_category,Disease,NB_individual,NB_case,HR[95%CI],P_value
ENG,Endoglin,Chapter II Neoplasms,"Malignant neoplasm of intrahepatic ducts, biliary tract and gallbladder, excluding all cancers (controls excluding all cancers)",24801,53,49.83 [15.14-164.00],1.2702982263296283e-10
ENG,Endoglin,Chapter IX Diseases of the circulatory system,Other pulmonary heart/vessel disease,28230,158,14.11 [6.64-29.96],5.704624171096169e-12
ENG,Endoglin,Chapter IX Diseases of the circulatory system,Secondary right heart disease,28226,154,14.40 [6.72-30.86],6.865883079886388e-12
ENG,Endoglin,Chapter XIV Diseases of the genitourinary system,Acute renal failure,28101,893,3.16 [2.25-4.44],3.632751830358507e-11
ENG,Endoglin,Chapter XIV Diseases of the genitourinary system,Renal tubulo-interstitial diseases,28477,1594,2.47 [1.91-3.19],5.026674603205539e-12
