Protein,Protein_definition,Disease_category,Disease,NB_individual,NB_case,HR[95%CI],P_value
PRSS22,Brain-specific serine protease 4,Chapter IX Diseases of the circulatory system,Hypertensive Renal Disease,18501,41,2.81 [2.08-3.80],1.6630543288734325e-11
PRSS22,Brain-specific serine protease 4,Chapter XI Diseases of the digestive system,"Cirrhosis of liver, NAS",23796,73,2.65 [2.04-3.44],2.965956044624774e-13
PRSS22,Brain-specific serine protease 4,Chapter XIV Diseases of the genitourinary system,Chronic kidney disease,23294,549,2.02 [1.77-2.30],3.338446107844278e-26
PRSS22,Brain-specific serine protease 4,Chapter XIV Diseases of the genitourinary system,Dialysis,22789,44,2.79 [2.12-3.66],1.6072125128503645e-13
PRSS22,Brain-specific serine protease 4,Chapter XIV Diseases of the genitourinary system,Renal tubulo-interstitial diseases,23769,1294,1.57 [1.40-1.76],6.154516509355839e-15
