Protein,Protein_definition,Disease_category,Disease,NB_individual,NB_case,OR[95%CI],P_value
SOX9,Transcription factor SOX-9,"Chapter IV Endocrine, nutritional and metabolic diseases","Other disorders of fluid, electrolyte and acid-base balance",20432,61,5.09 [2.60-9.97],2.15633395277225e-06
SOX9,Transcription factor SOX-9,Chapter IX Diseases of the circulatory system,Hypertensive Renal Disease,18487,31,8.70 [4.01-18.89],4.569818457855972e-08
SOX9,Transcription factor SOX-9,Chapter XIV Diseases of the genitourinary system,Renal tubulo-interstitial diseases,22643,159,5.82 [3.69-9.19],4.203837530279085e-14
SOX9,Transcription factor SOX-9,Chapter XIV Diseases of the genitourinary system,Unspecified kidney failure,22795,37,9.19 [4.18-20.22],3.4910085414808886e-08
SOX9,Transcription factor SOX-9,Chapter XIV Diseases of the genitourinary system,Other disorders of kidney and ureter,23678,48,5.51 [2.66-11.41],4.380984510709593e-06
