Protein,Protein_definition,Disease_category,Disease,NB_individual,NB_case,OR[95%CI],P_value
VNN2,Vascular non-inflammatory molecule 2,Chapter I Certain infectious and parasitic diseases,Implicit Sepsis,20228,499,1.73 [1.44-2.09],6.8532354498862395e-09
VNN2,Vascular non-inflammatory molecule 2,"Chapter IV Endocrine, nutritional and metabolic diseases",Type 1 diabetes,26382,116,2.59 [1.73-3.86],3.281897983170187e-06
VNN2,Vascular non-inflammatory molecule 2,Chapter V Mental and behavioural disorders,"Substance abuse, excluding more controls",24013,293,1.80 [1.41-2.29],2.029578083406381e-06
VNN2,Vascular non-inflammatory molecule 2,Chapter XI Diseases of the digestive system,Crohn's disease NAS,26635,81,2.98 [1.84-4.82],8.787402842453588e-06
VNN2,Vascular non-inflammatory molecule 2,Chapter XIV Diseases of the genitourinary system,Genitourinary diseases,23837,4418,1.24 [1.16-1.32],5.5760345641247286e-11
