Protein,Protein_definition,Disease_category,Disease,NB_individual,NB_case,OR[95%CI],P_value
RBP1,Retinol-binding protein 1,Chapter III Diseases of the blood and blood-forming organs and certain disorders involving the immune mechanism,Diseases of the blood and blood-forming organs and certain disorders involving the immune mechanism,22017,702,1.23 [1.14-1.34],3.620183653044257e-07
RBP1,Retinol-binding protein 1,Chapter XI Diseases of the digestive system,Diseases of the digestive system,22851,249,1.34 [1.18-1.51],3.3665379169785973e-06
RBP1,Retinol-binding protein 1,Chapter XI Diseases of the digestive system,Intestinal malabsorption,22663,61,1.79 [1.53-2.09],3.966961343679006e-13
RBP1,Retinol-binding protein 1,Chapter XI Diseases of the digestive system,Coeliac disease,22652,50,1.78 [1.50-2.12],7.944820087577688e-11
RBP1,Retinol-binding protein 1,Chapter XIV Diseases of the genitourinary system,Chronic kidney disease,22788,30,1.80 [1.45-2.24],1.2958498721108202e-07
