Protein,Protein_definition,Disease_category,Disease,NB_individual,NB_case,OR[95%CI],P_value
TALDO1,Transaldolase,"Chapter IV Endocrine, nutritional and metabolic diseases",Metabolic disorders,21478,621,1.46 [1.24-1.72],4.657438749889609e-06
TALDO1,Transaldolase,Chapter IX Diseases of the circulatory system,Death due to cardiac causes,19142,1748,1.40 [1.26-1.55],4.1661556391667975e-10
TALDO1,Transaldolase,Chapter IX Diseases of the circulatory system,"Hypertension, essential",20076,1178,1.40 [1.23-1.58],1.7436469169084857e-07
TALDO1,Transaldolase,Chapter IX Diseases of the circulatory system,Hypertension,20092,1194,1.37 [1.21-1.55],6.529577161040647e-07
TALDO1,Transaldolase,Chapter X Diseases of the respiratory system,Diseases of the respiratory system,20747,1732,1.27 [1.15-1.41],2.1786862784760075e-06
