Protein,Protein_definition,Disease_category,Disease,NB_individual,NB_case,OR[95%CI],P_value
KLF4,Krueppel-like factor 4,"Chapter IV Endocrine, nutritional and metabolic diseases",Metabolic disorders,20887,606,1.56 [1.33-1.83],6.661680906532658e-08
KLF4,Krueppel-like factor 4,"Chapter IV Endocrine, nutritional and metabolic diseases",Disorders of lipoprotein metabolism and other lipidaemias,20752,471,1.54 [1.28-1.85],3.385701224677018e-06
KLF4,Krueppel-like factor 4,Chapter IX Diseases of the circulatory system,Coronary atherosclerosis,22410,372,1.61 [1.33-1.96],1.4098541518364648e-06
KLF4,Krueppel-like factor 4,Chapter XIII Diseases of the musculoskeletal system and connective tissue,Polyarthropathies,18487,308,1.67 [1.36-2.06],1.547535824677662e-06
KLF4,Krueppel-like factor 4,Chapter XIV Diseases of the genitourinary system,Unspecified kidney failure,22707,37,2.38 [1.65-3.45],3.833072818100524e-06
