Protein,Protein_definition,Disease_category,Disease,NB_individual,NB_case,OR[95%CI],P_value
CD5L,CD5 antigen-like,Chapter II Neoplasms,"Malignant neoplasm of breast, excluding all cancers (controls excluding all cancers)",20130,582,0.67 [0.57-0.80],1.1659140844256784e-05
CD5L,CD5 antigen-like,Chapter II Neoplasms,"Non-Hodgkin lymphoma, all, excluding all cancers (controls excluding all cancers)",19595,47,0.30 [0.16-0.55],9.424525941862457e-05
CD5L,CD5 antigen-like,Chapter III Diseases of the blood and blood-forming organs and certain disorders involving the immune mechanism,Diseases of the blood and blood-forming organs and certain disorders involving the immune mechanism,21540,899,1.33 [1.16-1.53],4.524741711226263e-05
CD5L,CD5 antigen-like,Chapter IX Diseases of the circulatory system,Rheumatic valve diseases,23625,69,2.38 [1.54-3.68],9.072158575679348e-05
CD5L,CD5 antigen-like,Chapter XI Diseases of the digestive system,Diseases of liver,23427,91,2.87 [2.01-4.08],5.097358746133695e-09
CD5L,CD5 antigen-like,Chapter XIII Diseases of the musculoskeletal system and connective tissue,Other systemic involvement of connective tissue,23235,83,2.24 [1.50-3.33],7.894785334711643e-05
