Protein,Protein_definition,Disease_category,Disease,NB_individual,NB_case,OR[95%CI],P_value
GIGYF2,GRB10-interacting GYF protein 2,Chapter III Diseases of the blood and blood-forming organs and certain disorders involving the immune mechanism,Diseases of the blood and blood-forming organs and certain disorders involving the immune mechanism,21599,898,1.21 [1.12-1.31],3.829106136318725e-06
GIGYF2,GRB10-interacting GYF protein 2,"Chapter IV Endocrine, nutritional and metabolic diseases",Metabolic disorders,20080,776,1.22 [1.11-1.33],2.199238878981852e-05
GIGYF2,GRB10-interacting GYF protein 2,"Chapter IV Endocrine, nutritional and metabolic diseases",Type 2 diabetes,22813,358,1.31 [1.15-1.49],7.0240921884327e-05
GIGYF2,GRB10-interacting GYF protein 2,"Chapter IV Endocrine, nutritional and metabolic diseases",Type 2 diabetes without complications,22803,348,1.30 [1.14-1.49],9.37625089547591e-05
GIGYF2,GRB10-interacting GYF protein 2,Chapter X Diseases of the respiratory system,Diseases of the respiratory system,19661,1850,1.13 [1.07-1.20],4.7278403795772966e-05
GIGYF2,GRB10-interacting GYF protein 2,Chapter XI Diseases of the digestive system,Diseases of the digestive system,22973,260,1.39 [1.20-1.61],7.312597639283182e-06
