Protein,Protein_definition,Disease_category,Disease,NB_individual,NB_case,OR[95%CI],P_value
SART1,U4/U6.U5 tri-snRNP-associated protein 1,Chapter I Certain infectious and parasitic diseases,Implicit bacterial Sepsis,16541,196,1.68 [1.35-2.09],3.665120525591352e-06
SART1,U4/U6.U5 tri-snRNP-associated protein 1,Chapter IX Diseases of the circulatory system,Death due to cardiac causes,13379,3052,1.34 [1.21-1.49],5.2689932524009934e-08
SART1,U4/U6.U5 tri-snRNP-associated protein 1,Chapter IX Diseases of the circulatory system,"Hypertension, essential",14145,1988,1.34 [1.20-1.50],3.7738925753056923e-07
SART1,U4/U6.U5 tri-snRNP-associated protein 1,Chapter IX Diseases of the circulatory system,Hypertension,14169,2012,1.34 [1.20-1.50],2.8976949910207495e-07
SART1,U4/U6.U5 tri-snRNP-associated protein 1,Chapter X Diseases of the respiratory system,Diseases of the respiratory system,15516,1693,1.31 [1.18-1.46],6.869000010657039e-07
SART1,U4/U6.U5 tri-snRNP-associated protein 1,Chapter XIV Diseases of the genitourinary system,Renal tubulo-interstitial diseases,17644,208,1.65 [1.34-2.05],3.749484166401336e-06
