Protein,Protein_definition,Disease_category,Disease,NB_individual,NB_case,OR[95%CI],P_value
ECHS1,"Enoyl-CoA hydratase, mitochondrial",Chapter I Certain infectious and parasitic diseases,Implicit Sepsis,12795,646,1.23 [1.13-1.34],9.145209841874148e-07
ECHS1,"Enoyl-CoA hydratase, mitochondrial",Chapter V Mental and behavioural disorders,"Alcohol use disorder, ICD-based",19589,170,1.39 [1.20-1.61],6.967538046848913e-06
ECHS1,"Enoyl-CoA hydratase, mitochondrial",Chapter IX Diseases of the circulatory system,"Hypertension, essential",14219,1997,1.13 [1.07-1.19],6.729976488505232e-06
ECHS1,"Enoyl-CoA hydratase, mitochondrial",Chapter X Diseases of the respiratory system,Diseases of the respiratory system,15620,1718,1.14 [1.08-1.20],8.028910531594396e-07
ECHS1,"Enoyl-CoA hydratase, mitochondrial",Chapter XI Diseases of the digestive system,Diseases of liver,19268,120,1.49 [1.26-1.77],2.667838328278355e-06
