Protein,Protein_definition,Disease_category,Disease,NB_individual,NB_case,OR[95%CI],P_value
LAMA1,Laminin subunit alpha-1,Chapter II Neoplasms,"Malignant neoplasm of breast, excluding all cancers (controls excluding all cancers)",19609,570,0.76 [0.63-0.92],0.0042485234592639
LAMA1,Laminin subunit alpha-1,Chapter II Neoplasms,Benign neoplasm: Sigmoid colon,23030,100,0.40 [0.22-0.72],0.002387842015292
LAMA1,Laminin subunit alpha-1,"Chapter VII Diseases of the eye, adnexa, ear and mastoid process",Visual disturbances,22939,89,0.41 [0.22-0.76],0.0049729338153618
LAMA1,Laminin subunit alpha-1,Chapter XIII Diseases of the musculoskeletal system and connective tissue,Internal derangement of knee,16148,313,0.71 [0.54-0.92],0.0095516602323453
LAMA1,Laminin subunit alpha-1,Chapter XIII Diseases of the musculoskeletal system and connective tissue,Meniscus derangement,16101,266,0.65 [0.48-0.87],0.0045203105579092
LAMA1,Laminin subunit alpha-1,Chapter XIV Diseases of the genitourinary system,Polyp of the female genital tract,18259,817,1.19 [1.07-1.32],0.0014889839241273
