Protein,Protein_definition,Disease_category,Disease,NB_individual,NB_case,OR[95%CI],P_value
PSTPIP2,Proline-serine-threonine phosphatase-interacting protein 2,Chapter II Neoplasms,Melanocytic naevi of other and unspecified parts of face,22795,107,1.30 [1.07-1.57],0.0073467763239224
PSTPIP2,Proline-serine-threonine phosphatase-interacting protein 2,Chapter IX Diseases of the circulatory system,Atrial fibrillation and flutter,13839,226,0.85 [0.76-0.96],0.0089631068507692
PSTPIP2,Proline-serine-threonine phosphatase-interacting protein 2,Chapter XI Diseases of the digestive system,Diseases of liver,22176,84,0.75 [0.62-0.89],0.0014762340559102
PSTPIP2,Proline-serine-threonine phosphatase-interacting protein 2,Chapter XI Diseases of the digestive system,Coeliac disease,21515,69,1.20 [1.06-1.36],0.0046853542757067
PSTPIP2,Proline-serine-threonine phosphatase-interacting protein 2,Chapter XIII Diseases of the musculoskeletal system and connective tissue,Dorsopathies,20323,862,0.91 [0.86-0.97],0.0037846841032559
PSTPIP2,Proline-serine-threonine phosphatase-interacting protein 2,Chapter XIII Diseases of the musculoskeletal system and connective tissue,Other/unspecified dorsalgia,19581,120,0.80 [0.68-0.93],0.0037327689365635
PSTPIP2,Proline-serine-threonine phosphatase-interacting protein 2,"Chapter XV Pregnancy, childbirth and the puerperium",Pregnancy with abortive outcome,22822,362,1.15 [1.03-1.27],0.0091740377889531
PSTPIP2,Proline-serine-threonine phosphatase-interacting protein 2,"Chapter XV Pregnancy, childbirth and the puerperium",Medical abortion,22593,133,1.32 [1.11-1.57],0.0016108584276958
