Protein,Protein_definition,Disease_category,Disease,NB_individual,NB_case,OR[95%CI],P_value
KCNIP4,Kv channel-interacting protein 4,Chapter II Neoplasms,Benign neoplasm: Sigmoid colon,26618,104,1.36 [1.08-1.72],0.0098873009307847
KCNIP4,Kv channel-interacting protein 4,"Chapter VII Diseases of the eye, adnexa, ear and mastoid process",Diseases of middle ear and mastoid,26969,126,1.33 [1.07-1.64],0.0086451371045753
KCNIP4,Kv channel-interacting protein 4,Chapter X Diseases of the respiratory system,Other diseases of pleura,25379,189,1.30 [1.08-1.56],0.0046190818918471
KCNIP4,Kv channel-interacting protein 4,Chapter XI Diseases of the digestive system,Oesophageal obstruction,20299,42,0.37 [0.17-0.79],0.0098935325431205
KCNIP4,Kv channel-interacting protein 4,Chapter XI Diseases of the digestive system,Other diseases of intestines,21451,2159,1.11 [1.03-1.19],0.0089567267131486
KCNIP4,Kv channel-interacting protein 4,Chapter XIII Diseases of the musculoskeletal system and connective tissue,Other intervertebral disc disorders,23333,235,1.35 [1.16-1.57],0.0001166183424207
