Protein,Protein_definition,Disease_category,Disease,NB_individual,NB_case,OR[95%CI],P_value
MRPL28,"39S ribosomal protein L28, mitochondrial",Chapter II Neoplasms,"Malignant melanoma of skin, excluding all cancers (controls excluding all cancers)",19663,57,0.91 [0.91-0.91],0.0
MRPL28,"39S ribosomal protein L28, mitochondrial",Chapter II Neoplasms,Other benign neoplasms of skin,24030,196,1.38 [1.10-1.73],0.0061545898274563
MRPL28,"39S ribosomal protein L28, mitochondrial",Chapter III Diseases of the blood and blood-forming organs and certain disorders involving the immune mechanism,Other anaemias,22740,390,1.32 [1.10-1.57],0.002607472212237
MRPL28,"39S ribosomal protein L28, mitochondrial",Chapter III Diseases of the blood and blood-forming organs and certain disorders involving the immune mechanism,Other and unspecified anaemias,22740,390,1.32 [1.10-1.57],0.002607472212237
MRPL28,"39S ribosomal protein L28, mitochondrial","Chapter VII Diseases of the eye, adnexa, ear and mastoid process",Disorders of lacrimal system,23243,94,1.48 [1.10-1.99],0.0091115672563795
MRPL28,"39S ribosomal protein L28, mitochondrial",Chapter XI Diseases of the digestive system,"Postprocedural disorders of digestive system, not elsewhere classified",22746,33,1.65 [1.13-2.39],0.0087055103775981
MRPL28,"39S ribosomal protein L28, mitochondrial",Chapter XIII Diseases of the musculoskeletal system and connective tissue,Other deformities of toe(s),16433,101,1.48 [1.12-1.94],0.0054745243779836
MRPL28,"39S ribosomal protein L28, mitochondrial",Chapter XIV Diseases of the genitourinary system,Unspecified renal colic,23874,33,1.70 [1.16-2.50],0.0068803628853715
