Protein,Protein_definition,Disease_category,Disease,NB_individual,NB_case,OR[95%CI],P_value
UROS,Uroporphyrinogen-III synthase,Chapter XI Diseases of the digestive system,Noninfectious colitis NAS,22494,659,1.14 [1.03-1.26],0.0095569091440643
UROS,Uroporphyrinogen-III synthase,Chapter XII Diseases of the skin and subcutaneous tissue,Infections of the skin and subcutaneous tissue,22818,283,1.32 [1.15-1.50],4.699634288696688e-05
UROS,Uroporphyrinogen-III synthase,Chapter XII Diseases of the skin and subcutaneous tissue,Cellulitis,22718,183,1.34 [1.14-1.57],0.0004009255358688
UROS,Uroporphyrinogen-III synthase,Chapter XIV Diseases of the genitourinary system,Urethral stricture,20670,78,0.52 [0.35-0.77],0.0009696382122184
UROS,Uroporphyrinogen-III synthase,Chapter XIV Diseases of the genitourinary system,Disorders of breast,23268,417,1.22 [1.09-1.37],0.0007615169013305
