Protein,Protein_definition,Disease_category,Disease,NB_individual,NB_case,OR[95%CI],P_value
DRG2,Developmentally-regulated GTP-binding protein 2,Chapter III Diseases of the blood and blood-forming organs and certain disorders involving the immune mechanism,Diseases of the blood and blood-forming organs and certain disorders involving the immune mechanism,24663,1034,1.15 [1.04-1.27],0.0054212378531193
DRG2,Developmentally-regulated GTP-binding protein 2,Chapter IX Diseases of the circulatory system,"Hypertension, essential",21369,2074,1.11 [1.03-1.20],0.0060491667452415
DRG2,Developmentally-regulated GTP-binding protein 2,Chapter IX Diseases of the circulatory system,Hypertension,21390,2095,1.11 [1.03-1.20],0.0083900931291186
DRG2,Developmentally-regulated GTP-binding protein 2,Chapter XIV Diseases of the genitourinary system,Inflammatory disease of cervix uteri,26845,133,0.68 [0.51-0.90],0.0081328169050371
DRG2,Developmentally-regulated GTP-binding protein 2,Chapter XIV Diseases of the genitourinary system,Irregular menses,27532,472,1.23 [1.07-1.42],0.0035798071053552
DRG2,Developmentally-regulated GTP-binding protein 2,"Chapter XV Pregnancy, childbirth and the puerperium",Haemorrhage in early pregnancy,27361,124,0.57 [0.41-0.78],0.0005195157238038
