Protein,Protein_definition,Disease_category,Disease,NB_individual,NB_case,OR[95%CI],P_value
IRAK1,Interleukin-1 receptor-associated kinase 1,Chapter II Neoplasms,Benign neoplasm: Rectum,26955,58,1.64 [1.19-2.24],0.0023097528975333
IRAK1,Interleukin-1 receptor-associated kinase 1,"Chapter IV Endocrine, nutritional and metabolic diseases",Metabolic disorders,22568,894,1.15 [1.05-1.25],0.0027754233382846
IRAK1,Interleukin-1 receptor-associated kinase 1,Chapter IX Diseases of the circulatory system,Death due to cardiac causes,20045,2753,1.08 [1.02-1.15],0.0086451793820377
IRAK1,Interleukin-1 receptor-associated kinase 1,Chapter IX Diseases of the circulatory system,"Hypertension, essential",21050,2028,1.12 [1.05-1.20],0.0004711800779538
IRAK1,Interleukin-1 receptor-associated kinase 1,Chapter IX Diseases of the circulatory system,Hypertension,21071,2049,1.12 [1.05-1.20],0.0005826472069471
IRAK1,Interleukin-1 receptor-associated kinase 1,Chapter XI Diseases of the digestive system,Oesophagitis,20641,284,1.28 [1.10-1.49],0.0013462466680241
IRAK1,Interleukin-1 receptor-associated kinase 1,Chapter XIII Diseases of the musculoskeletal system and connective tissue,Soft tissue disorders,24430,1327,1.14 [1.06-1.23],0.0003634816542192
IRAK1,Interleukin-1 receptor-associated kinase 1,Chapter XIII Diseases of the musculoskeletal system and connective tissue,"Other soft tissue disorders, not elsewhere classified",23642,539,1.19 [1.06-1.32],0.0024169424631115
IRAK1,Interleukin-1 receptor-associated kinase 1,"Chapter XV Pregnancy, childbirth and the puerperium",Haemorrhage in early pregnancy,26937,125,0.66 [0.52-0.85],0.001211669137319
