Protein,Protein_definition,Disease_category,Disease,NB_individual,NB_case,OR[95%CI],P_value
DDHD2,Phospholipase DDHD2,Chapter II Neoplasms,Benign neoplasm: Rectum,23940,55,1.70 [1.16-2.49],0.0068246958444649
DDHD2,Phospholipase DDHD2,Chapter II Neoplasms,Melanocytic naevi of other and unspecified parts of face,24129,108,1.46 [1.11-1.92],0.0067512538140265
DDHD2,Phospholipase DDHD2,Chapter XI Diseases of the digestive system,Diseases of liver,23487,87,0.56 [0.41-0.78],0.0004475518852315
DDHD2,Phospholipase DDHD2,Chapter XI Diseases of the digestive system,Diseases of the digestive system,22973,260,1.28 [1.07-1.54],0.0060373078304428
DDHD2,Phospholipase DDHD2,Chapter XIII Diseases of the musculoskeletal system and connective tissue,Osteopathies and chondropathies,21957,420,0.80 [0.69-0.93],0.0031297543932661
DDHD2,Phospholipase DDHD2,Chapter XIV Diseases of the genitourinary system,Unspecified/other endometriosis,18093,87,1.50 [1.10-2.03],0.00970193093586
DDHD2,Phospholipase DDHD2,Chapter XIV Diseases of the genitourinary system,Irregular menses,24073,409,1.21 [1.05-1.39],0.0094661567570736
