Protein,Protein_definition,Disease_category,Disease,NB_individual,NB_case,OR[95%CI],P_value
LMOD2,Leiomodin-2,Chapter II Neoplasms,Leiomyoma of uterus,22955,851,1.15 [1.04-1.26],0.0041352725023358
LMOD2,Leiomodin-2,"Chapter IV Endocrine, nutritional and metabolic diseases",Disorders of the thyroid gland,21501,750,1.19 [1.08-1.32],0.000625265384959
LMOD2,Leiomodin-2,Chapter V Mental and behavioural disorders,Other anxiety disorders,21809,65,0.53 [0.33-0.86],0.0099356604565367
LMOD2,Leiomodin-2,Chapter XI Diseases of the digestive system,Intestinal malabsorption,22098,91,1.46 [1.16-1.83],0.0011428449355326
LMOD2,Leiomodin-2,Chapter XI Diseases of the digestive system,Coeliac disease,22085,78,1.47 [1.16-1.87],0.0016308325478502
LMOD2,Leiomodin-2,Chapter XIII Diseases of the musculoskeletal system and connective tissue,Other systemic involvement of connective tissue,22577,82,1.41 [1.09-1.81],0.0077950702296162
LMOD2,Leiomodin-2,"Chapter XV Pregnancy, childbirth and the puerperium",False labour,22809,113,1.35 [1.09-1.67],0.005463599669785
