Protein,Protein_definition,Disease_category,Disease,NB_individual,NB_case,OR[95%CI],P_value
YES1,Tyrosine-protein kinase Yes,Chapter II Neoplasms,Benign neoplasm: Rectum,27379,58,1.34 [1.09-1.64],0.005161035507129
YES1,Tyrosine-protein kinase Yes,Chapter V Mental and behavioural disorders,Depression or dysthymia,22880,301,1.14 [1.04-1.25],0.0040865405164453
YES1,Tyrosine-protein kinase Yes,Chapter IX Diseases of the circulatory system,Death due to cardiac causes,20346,2811,1.05 [1.02-1.09],0.0029494767229655
YES1,Tyrosine-protein kinase Yes,Chapter IX Diseases of the circulatory system,"Hypertension, essential",21369,2074,1.08 [1.04-1.12],0.0001832407693062
YES1,Tyrosine-protein kinase Yes,Chapter IX Diseases of the circulatory system,Hypertension,21390,2095,1.07 [1.03-1.12],0.0002751746314716
YES1,Tyrosine-protein kinase Yes,Chapter XIII Diseases of the musculoskeletal system and connective tissue,Soft tissue disorders,24830,1326,1.07 [1.02-1.12],0.0027002044257082
YES1,Tyrosine-protein kinase Yes,Chapter XIII Diseases of the musculoskeletal system and connective tissue,Ganglion,23646,142,1.21 [1.06-1.39],0.0038261848850402
YES1,Tyrosine-protein kinase Yes,Chapter XIV Diseases of the genitourinary system,Other obstructive and reflux uropathy,25016,46,1.46 [1.16-1.85],0.0014557804018454
YES1,Tyrosine-protein kinase Yes,"Chapter XV Pregnancy, childbirth and the puerperium",Haemorrhage in early pregnancy,27361,124,0.78 [0.67-0.90],0.000712707604292
