Protein,Protein_definition,Disease_category,Disease,NB_individual,NB_case,OR[95%CI],P_value
RRP15,RRP15-like protein,Chapter II Neoplasms,"Benign neoplasm of colon, rectum, anus and anal canal",22424,244,1.21 [1.07-1.36],0.0017715388296752
RRP15,RRP15-like protein,Chapter X Diseases of the respiratory system,Other diseases of upper respiratory tract,22771,481,0.88 [0.80-0.97],0.0091531694161119
RRP15,RRP15-like protein,Chapter XI Diseases of the digestive system,Umbilical hernia,20022,64,1.34 [1.09-1.65],0.0051488734779993
RRP15,RRP15-like protein,Chapter XI Diseases of the digestive system,"Disorders of gallbladder, biliary tract and pancreas",22079,730,0.89 [0.83-0.97],0.0049374250043588
RRP15,RRP15-like protein,Chapter XIII Diseases of the musculoskeletal system and connective tissue,Other/unspecified rheumatoid arthritis,22947,165,1.21 [1.05-1.39],0.0097407567148311
RRP15,RRP15-like protein,Chapter XIV Diseases of the genitourinary system,Urolithiasis,23216,104,1.27 [1.07-1.50],0.0056380427873731
RRP15,RRP15-like protein,Chapter XIV Diseases of the genitourinary system,Calculus of kidney and ureter,23191,79,1.33 [1.11-1.59],0.002362817064797
