Protein,Protein_definition,Disease_category,Disease,NB_individual,NB_case,OR[95%CI],P_value
LXN,Latexin,Chapter I Certain infectious and parasitic diseases,Certain infectious and parasitic diseases,23969,979,0.88 [0.81-0.97],0.0074148309405085
LXN,Latexin,Chapter I Certain infectious and parasitic diseases,"Bacterial, viral and other infectious agents",26146,436,0.79 [0.69-0.90],0.0006676656945759
LXN,Latexin,Chapter I Certain infectious and parasitic diseases,Other bacterial agents as the cause of diseases classified to other chapters,26013,303,0.76 [0.64-0.90],0.001252395265166
LXN,Latexin,Chapter VI Diseases of the nervous system,Other sleep disorders,25795,93,1.39 [1.09-1.76],0.007084126781161
LXN,Latexin,Chapter IX Diseases of the circulatory system,Pulmonary embolism,26667,98,1.36 [1.08-1.72],0.0090057704709432
LXN,Latexin,Chapter XIV Diseases of the genitourinary system,Other disorders of urethra and urinary system,24961,982,0.88 [0.81-0.97],0.0069898699514557
