Protein,Protein_definition,Disease_category,Disease,NB_individual,NB_case,OR[95%CI],P_value
RBM25,RNA-binding protein 25,Chapter XI Diseases of the digestive system,Diseases of liver,22671,83,1.67 [1.17-2.37],0.0044770991545269
RBM25,RNA-binding protein 25,Chapter XI Diseases of the digestive system,Intestinal malabsorption,21994,86,1.89 [1.38-2.59],8.108230186633361e-05
RBM25,RNA-binding protein 25,Chapter XII Diseases of the skin and subcutaneous tissue,Seborrhoeic keratosis,21493,78,0.47 [0.29-0.78],0.0033132845336307
RBM25,RNA-binding protein 25,Chapter XIII Diseases of the musculoskeletal system and connective tissue,Cervicalgia,19984,70,1.65 [1.14-2.40],0.0082778069261217
RBM25,RNA-binding protein 25,Chapter XIV Diseases of the genitourinary system,Other female pelvic inflammatory diseases,22753,212,1.40 [1.09-1.80],0.0082083552436069
