Protein,Protein_definition,Disease_category,Disease,NB_individual,NB_case,OR[95%CI],P_value
SCGB2A2,Mammaglobin-A,Chapter I Certain infectious and parasitic diseases,Implicit viral Sepsis,20672,49,2.07 [1.25-3.41],0.0045051099915484
SCGB2A2,Mammaglobin-A,Chapter II Neoplasms,"Non-Hodgkin lymphoma, all, excluding all cancers (controls excluding all cancers)",19086,47,1.95 [1.23-3.09],0.0043188624165704
SCGB2A2,Mammaglobin-A,Chapter II Neoplasms,"Benign neoplasm of colon, rectum, anus and anal canal",22429,253,0.48 [0.30-0.77],0.0022658402702496
SCGB2A2,Mammaglobin-A,Chapter II Neoplasms,"Benign neoplasm: Colon, unspecified",23401,80,0.25 [0.11-0.59],0.0015333940777725
SCGB2A2,Mammaglobin-A,Chapter II Neoplasms,Benign lipomatous neoplasm of skin and subcutaneous tissue of limbs,23400,92,1.73 [1.16-2.59],0.0071363981601077
SCGB2A2,Mammaglobin-A,Chapter V Mental and behavioural disorders,"Alcohol use disorder, ICD-based",23265,37,1.96 [1.22-3.15],0.0055979222970011
SCGB2A2,Mammaglobin-A,Chapter VI Diseases of the nervous system,"Other and unspecified nerve root and plexus disorders, also in other diseases",21661,102,1.67 [1.14-2.46],0.0087416342615354
SCGB2A2,Mammaglobin-A,Chapter XIII Diseases of the musculoskeletal system and connective tissue,Lumbar disc prolapse,20084,89,1.79 [1.20-2.68],0.0043872453488583
SCGB2A2,Mammaglobin-A,Chapter XIII Diseases of the musculoskeletal system and connective tissue,Other/unspecified dorsalgia,20124,129,1.67 [1.15-2.42],0.0070747934182647
