Protein,Protein_definition,Disease_category,Disease,NB_individual,NB_case,OR[95%CI],P_value
IL9,Interleukin-9,Chapter II Neoplasms,"Malignant melanoma of skin, excluding all cancers (controls excluding all cancers)",19317,58,1.13 [1.13-1.13],0.0
IL9,Interleukin-9,Chapter II Neoplasms,Benign neoplasm of breast,23700,117,1.36 [1.11-1.68],0.0034672389141312
IL9,Interleukin-9,Chapter IX Diseases of the circulatory system,Rheumatic valve diseases,23266,69,1.44 [1.12-1.86],0.0042965787919641
IL9,Interleukin-9,Chapter XI Diseases of the digestive system,Coeliac disease,22395,75,1.42 [1.11-1.82],0.0054986327505735
IL9,Interleukin-9,Chapter XIII Diseases of the musculoskeletal system and connective tissue,Other hammer toe(s) (acquired),16143,91,1.49 [1.22-1.83],0.0001362416111636
IL9,Interleukin-9,Chapter XIV Diseases of the genitourinary system,Dysplasia of cervi uteri,17855,169,1.32 [1.10-1.58],0.0029084578386587
IL9,Interleukin-9,Chapter XIV Diseases of the genitourinary system,"All dysplastic lesions of the cervix uteri, vagina or vulva",23718,232,1.28 [1.09-1.51],0.002267318646102
IL9,Interleukin-9,Chapter XIV Diseases of the genitourinary system,All dysplastic lesions of the cervix uteri,23727,220,1.28 [1.09-1.51],0.0029503183828542
