Protein,Protein_definition,Disease_category,Disease,NB_individual,NB_case,OR[95%CI],P_value
PDE1C,"Calcium/calmodulin-dependent 3',5'-cyclic nucleotide phosphodiesterase 1C","Chapter VII Diseases of the eye, adnexa, ear and mastoid process",Background diabetic retinopathy,23116,29,1.56 [1.15-2.12],0.0045649131727073
PDE1C,"Calcium/calmodulin-dependent 3',5'-cyclic nucleotide phosphodiesterase 1C","Chapter VII Diseases of the eye, adnexa, ear and mastoid process","Diabetic maculopathy, excluding more controls",21644,29,1.56 [1.15-2.12],0.004406940348476
PDE1C,"Calcium/calmodulin-dependent 3',5'-cyclic nucleotide phosphodiesterase 1C",Chapter XI Diseases of the digestive system,Diseases of liver,22671,83,1.41 [1.10-1.79],0.0058934526211263
PDE1C,"Calcium/calmodulin-dependent 3',5'-cyclic nucleotide phosphodiesterase 1C",Chapter XIII Diseases of the musculoskeletal system and connective tissue,Other deformities of toe(s),15865,93,1.41 [1.13-1.75],0.0026189228439189
PDE1C,"Calcium/calmodulin-dependent 3',5'-cyclic nucleotide phosphodiesterase 1C",Chapter XIV Diseases of the genitourinary system,Other noninflammatory disorders of vulva and perineum,17505,121,1.37 [1.13-1.66],0.0014215544122014
