Protein,Protein_definition,Disease_category,Disease,NB_individual,NB_case,OR[95%CI],P_value
MSLNL,Mesothelin-like protein,Chapter I Certain infectious and parasitic diseases,Streptococcus and staphylococcus as the cause of diseases classified to other chapters,22161,113,1.61 [1.13-2.29],0.0083151783070412
MSLNL,Mesothelin-like protein,Chapter II Neoplasms,Benign neoplasm: Stomach,23534,45,0.28 [0.11-0.67],0.0042218405335951
MSLNL,Mesothelin-like protein,"Chapter IV Endocrine, nutritional and metabolic diseases",Volume depletion,18835,46,0.30 [0.13-0.72],0.0071812396683346
MSLNL,Mesothelin-like protein,Chapter X Diseases of the respiratory system,"Asthma, unspecified (mode)",17494,844,0.77 [0.64-0.94],0.0095569184123503
MSLNL,Mesothelin-like protein,Chapter VI Diseases of the nervous system,Falls/tendency to fall,21076,534,1.31 [1.08-1.58],0.0070425598497982
