Protein,Protein_definition,Disease_category,Disease,NB_individual,NB_case,OR[95%CI],P_value
B3GAT3,Galactosylgalactosylxylosylprotein 3-beta-glucuronosyltransferase 3,Chapter I Certain infectious and parasitic diseases,Streptococcus and staphylococcus as the cause of diseases classified to other chapters,22080,113,0.29 [0.11-0.74],0.009971256402284
B3GAT3,Galactosylgalactosylxylosylprotein 3-beta-glucuronosyltransferase 3,Chapter II Neoplasms,"Non-Hodgkin lymphoma, all, excluding all cancers (controls excluding all cancers)",19086,47,2.76 [1.32-5.78],0.0069061299176193
B3GAT3,Galactosylgalactosylxylosylprotein 3-beta-glucuronosyltransferase 3,Chapter V Mental and behavioural disorders,Alcohol dependence,22208,22,4.81 [1.95-11.85],0.0006304271696305
B3GAT3,Galactosylgalactosylxylosylprotein 3-beta-glucuronosyltransferase 3,Chapter V Mental and behavioural disorders,Other anxiety disorders,21820,64,0.15 [0.05-0.51],0.0022043202000025
B3GAT3,Galactosylgalactosylxylosylprotein 3-beta-glucuronosyltransferase 3,Chapter XII Diseases of the skin and subcutaneous tissue,Scar conditions and fibrosis of skin,21613,94,0.16 [0.06-0.46],0.0006384186618966
B3GAT3,Galactosylgalactosylxylosylprotein 3-beta-glucuronosyltransferase 3,Chapter XIV Diseases of the genitourinary system,Other disorders of kidney and ureter,23142,50,0.12 [0.03-0.49],0.0031347433417896
B3GAT3,Galactosylgalactosylxylosylprotein 3-beta-glucuronosyltransferase 3,"Chapter XV Pregnancy, childbirth and the puerperium",Long labour,22638,191,0.37 [0.17-0.77],0.0086367186073687
