Protein,Protein_definition,Disease_category,Disease,NB_individual,NB_case,OR[95%CI],P_value
WAS,Wiskott-Aldrich syndrome protein,"Chapter IV Endocrine, nutritional and metabolic diseases",Type 1 diabetes,25401,119,0.68 [0.53-0.87],0.0025800398683108
WAS,Wiskott-Aldrich syndrome protein,Chapter V Mental and behavioural disorders,Alcohol dependence,25782,23,0.51 [0.31-0.85],0.0092535339549957
WAS,Wiskott-Aldrich syndrome protein,"Chapter VII Diseases of the eye, adnexa, ear and mastoid process",Background diabetic retinopathy,26952,34,0.53 [0.34-0.83],0.0051454176248409
WAS,Wiskott-Aldrich syndrome protein,"Chapter VII Diseases of the eye, adnexa, ear and mastoid process",Diabetic maculopathy,1747,34,0.50 [0.29-0.84],0.0089732182430619
WAS,Wiskott-Aldrich syndrome protein,"Chapter VII Diseases of the eye, adnexa, ear and mastoid process","Diabetic maculopathy, excluding more controls",25239,34,0.54 [0.35-0.84],0.0056147668438145
WAS,Wiskott-Aldrich syndrome protein,Chapter XI Diseases of the digestive system,Coeliac disease,25608,85,1.38 [1.08-1.76],0.0094709111189436
WAS,Wiskott-Aldrich syndrome protein,Chapter XII Diseases of the skin and subcutaneous tissue,Radiation-related disorders of the skin and subcutaneous tissue,26944,55,0.61 [0.43-0.86],0.0050422388332674
WAS,Wiskott-Aldrich syndrome protein,Chapter XII Diseases of the skin and subcutaneous tissue,Skin changes due to chronic exposure to nonionizing radiation,26941,52,0.60 [0.42-0.85],0.0044909641028551
