Protein,Protein_definition,Disease_category,Disease,NB_individual,NB_case,OR[95%CI],P_value
IFNAR1,Interferon alpha/beta receptor 1,Chapter II Neoplasms,Leiomyoma of uterus,23593,880,1.45 [1.16-1.81],0.0012276667242128
IFNAR1,Interferon alpha/beta receptor 1,Chapter IX Diseases of the circulatory system,Hypertensive Renal Disease,16883,34,3.06 [1.54-6.11],0.0014639997763919
IFNAR1,Interferon alpha/beta receptor 1,Chapter XI Diseases of the digestive system,Other functional intestinal disorders,17544,334,1.59 [1.13-2.25],0.0083831889640791
IFNAR1,Interferon alpha/beta receptor 1,Chapter XI Diseases of the digestive system,Constipation,22616,299,1.64 [1.15-2.35],0.0064230267237611
IFNAR1,Interferon alpha/beta receptor 1,Chapter XIV Diseases of the genitourinary system,HSIL lesion of the cervix uteri,24075,122,0.40 [0.21-0.77],0.0060069302020085
