Protein,Protein_definition,Disease_category,Disease,NB_individual,NB_case,OR[95%CI],P_value
STXBP3,Syntaxin-binding protein 3,Chapter XIII Diseases of the musculoskeletal system and connective tissue,Dorsopathies,24132,1014,0.81 [0.70-0.93],0.0028417298469706
STXBP3,Syntaxin-binding protein 3,Chapter XIII Diseases of the musculoskeletal system and connective tissue,Ganglion,23168,143,1.48 [1.14-1.92],0.0031378659601703
STXBP3,Syntaxin-binding protein 3,Chapter XIV Diseases of the genitourinary system,Erosion and ectropion of cervix uteri,20287,95,1.56 [1.15-2.11],0.0043605628391005
STXBP3,Syntaxin-binding protein 3,"Chapter XV Pregnancy, childbirth and the puerperium",Delivery,27137,332,0.71 [0.55-0.92],0.0095642459538458
STXBP3,Syntaxin-binding protein 3,"Chapter XV Pregnancy, childbirth and the puerperium",Single spontaneous delivery,27056,251,0.61 [0.45-0.84],0.0020579115885048
