Protein,Protein_definition,Disease_category,Disease,NB_individual,NB_case,OR[95%CI],P_value
LPP,Lipoma-preferred partner,Chapter IX Diseases of the circulatory system,Atrial fibrillation and flutter,14238,235,0.75 [0.61-0.91],0.0043753350619585
LPP,Lipoma-preferred partner,Chapter X Diseases of the respiratory system,Nasal polyp,22373,70,1.56 [1.13-2.17],0.0077516528028646
LPP,Lipoma-preferred partner,Chapter XI Diseases of the digestive system,Umbilical hernia,20030,64,1.62 [1.15-2.30],0.0063081378787114
LPP,Lipoma-preferred partner,Chapter XIII Diseases of the musculoskeletal system and connective tissue,Gonarthrosis,16236,401,1.22 [1.05-1.42],0.0085786973883436
LPP,Lipoma-preferred partner,Chapter XIV Diseases of the genitourinary system,Irregular menses,23345,396,1.23 [1.06-1.42],0.0047312253386385
LPP,Lipoma-preferred partner,"Chapter XV Pregnancy, childbirth and the puerperium",Medical abortion,23180,134,1.39 [1.09-1.78],0.0078258696189586
