Protein,Protein_definition,Disease_category,Disease,NB_individual,NB_case,OR[95%CI],P_value
ANGPTL1,Angiopoietin-related protein 1,Chapter I Certain infectious and parasitic diseases,Implicit Sepsis,14924,800,2.44 [1.94-3.07],2.7371865609878573e-14
ANGPTL1,Angiopoietin-related protein 1,Chapter III Diseases of the blood and blood-forming organs and certain disorders involving the immune mechanism,Diseases of the blood and blood-forming organs and certain disorders involving the immune mechanism,20617,548,2.28 [1.75-2.95],6.648477114556377e-10
ANGPTL1,Angiopoietin-related protein 1,Chapter IX Diseases of the circulatory system,Atrial fibrillation and flutter,11990,590,3.31 [2.52-4.33],3.940730955363862e-18
ANGPTL1,Angiopoietin-related protein 1,Chapter X Diseases of the respiratory system,Diseases of the respiratory system,18197,1979,1.65 [1.42-1.91],2.3432704299347575e-11
ANGPTL1,Angiopoietin-related protein 1,Chapter XI Diseases of the digestive system,Diseases of liver,22506,140,4.56 [2.82-7.37],6.528276470880805e-10
ANGPTL1,Angiopoietin-related protein 1,Chapter XIV Diseases of the genitourinary system,Renal tubulo-interstitial diseases,20578,302,3.19 [2.28-4.46],1.5094968597822714e-11
ANGPTL1,Angiopoietin-related protein 1,Chapter XIV Diseases of the genitourinary system,Chronic kidney disease,20630,92,5.91 [3.42-10.23],2.0840585144375967e-10
ANGPTL1,Angiopoietin-related protein 1,Chapter XIV Diseases of the genitourinary system,Unspecified kidney failure,20630,92,5.67 [3.28-9.82],5.632866534360121e-10
