Protein,Protein_definition,Disease_category,Disease,NB_individual,NB_case,OR[95%CI],P_value
APOF,Apolipoprotein F,"Chapter IV Endocrine, nutritional and metabolic diseases",Type 2 diabetes,18618,576,0.43 [0.34-0.54],1.025067668349837e-12
APOF,Apolipoprotein F,"Chapter IV Endocrine, nutritional and metabolic diseases",Type 2 diabetes without complications,18602,560,0.43 [0.34-0.54],1.853021003307254e-12
APOF,Apolipoprotein F,Chapter IX Diseases of the circulatory system,Death due to cardiac causes,13841,3165,0.61 [0.53-0.71],1.6668833427540095e-10
APOF,Apolipoprotein F,Chapter XI Diseases of the digestive system,Diseases of liver,19835,121,0.23 [0.15-0.35],8.744910715802489e-12
APOF,Apolipoprotein F,Chapter XI Diseases of the digestive system,Other diseases of liver,19783,69,0.18 [0.10-0.30],2.0272165256244399e-10
