Protein,Protein_definition,Disease_category,Disease,NB_individual,NB_case,OR[95%CI],P_value
MSTN,Growth/differentiation factor 8,Chapter V Mental and behavioural disorders,"Mental and behavioural disorders due to alcohol, excluding acute intoxication",22721,256,0.53 [0.44-0.65],8.798272268647291e-10
MSTN,Growth/differentiation factor 8,Chapter IX Diseases of the circulatory system,Hypertensive Renal Disease,14269,106,2.60 [1.92-3.52],5.593807015802345e-10
MSTN,Growth/differentiation factor 8,Chapter X Diseases of the respiratory system,Early onset COPD,21992,191,0.48 [0.38-0.61],9.4026310795593e-10
MSTN,Growth/differentiation factor 8,Chapter X Diseases of the respiratory system,"COPD, hospital admissions 1, only main diagnosis",22025,224,0.48 [0.39-0.60],3.2477910451743905e-11
MSTN,Growth/differentiation factor 8,Chapter X Diseases of the respiratory system,"Other chronic obstructive pulmonary disease, including avohilmo",22025,224,0.48 [0.39-0.60],3.2477910451743905e-11
MSTN,Growth/differentiation factor 8,Chapter XIV Diseases of the genitourinary system,Unspecified kidney failure,20574,90,2.73 [1.98-3.77],8.644719108403602e-10
