Protein,Protein_definition,Disease_category,Disease,NB_individual,NB_case,OR[95%CI],P_value
MOG,Myelin-oligodendrocyte glycoprotein,Chapter I Certain infectious and parasitic diseases,Implicit Sepsis,20500,505,1.83 [1.44-2.34],1.0237444490291782e-06
MOG,Myelin-oligodendrocyte glycoprotein,Chapter III Diseases of the blood and blood-forming organs and certain disorders involving the immune mechanism,Diseases of the blood and blood-forming organs and certain disorders involving the immune mechanism,26292,830,1.47 [1.21-1.78],7.75539914714544e-05
MOG,Myelin-oligodendrocyte glycoprotein,Chapter I Certain infectious and parasitic diseases,Condition for Implicit Sepsis (Organ dysfunction codes),26189,366,1.91 [1.44-2.54],7.335188427228323e-06
MOG,Myelin-oligodendrocyte glycoprotein,"Chapter IV Endocrine, nutritional and metabolic diseases",Disorders of other endocrine glands,28314,107,3.05 [1.87-4.97],8.374381172940842e-06
MOG,Myelin-oligodendrocyte glycoprotein,"Chapter IV Endocrine, nutritional and metabolic diseases","Other disorders of fluid, electrolyte and acid-base balance",24432,80,3.31 [1.84-5.97],6.664597505339436e-05
MOG,Myelin-oligodendrocyte glycoprotein,Chapter V Mental and behavioural disorders,"Mental and behavioural disorders due to alcohol, excluding acute intoxication",28138,231,0.49 [0.34-0.69],6.125766364020877e-05
MOG,Myelin-oligodendrocyte glycoprotein,"Chapter VII Diseases of the eye, adnexa, ear and mastoid process",Background diabetic retinopathy,28329,25,6.54 [2.78-15.40],1.7481813578167585e-05
MOG,Myelin-oligodendrocyte glycoprotein,"Chapter VII Diseases of the eye, adnexa, ear and mastoid process","Diabetic maculopathy, excluding more controls",26556,25,6.94 [2.85-16.91],2.023997599213969e-05
MOG,Myelin-oligodendrocyte glycoprotein,Chapter XIV Diseases of the genitourinary system,Other disorders of kidney and ureter,28265,53,9.26 [5.16-16.63],9.008464114132709e-14
