Protein,Protein_definition,Disease_category,Disease,NB_individual,NB_case,OR[95%CI],P_value
SORT1,Sortilin,Chapter III Diseases of the blood and blood-forming organs and certain disorders involving the immune mechanism,Diseases of the blood and blood-forming organs and certain disorders involving the immune mechanism,26025,819,1.44 [1.22-1.70],1.2136166548817332e-05
SORT1,Sortilin,"Chapter IV Endocrine, nutritional and metabolic diseases",Metabolic disorders,24808,708,1.46 [1.23-1.74],2.2271748448431213e-05
SORT1,Sortilin,Chapter VI Diseases of the nervous system,Epilepsy,26609,170,0.41 [0.28-0.60],3.8099812460224895e-06
SORT1,Sortilin,Chapter IX Diseases of the circulatory system,Death due to cardiac causes,22150,1990,1.28 [1.14-1.43],2.929559130552985e-05
SORT1,Sortilin,Chapter XI Diseases of the digestive system,"Diseases of oesophagus, stomach and duodenum",24289,1753,1.26 [1.12-1.41],8.47528009192977e-05
SORT1,Sortilin,Chapter XI Diseases of the digestive system,Diaphragmatic hernia,24920,603,1.49 [1.24-1.80],3.115348204826456e-05
