Protein,Protein_definition,Disease_category,Disease,NB_individual,NB_case,OR[95%CI],P_value
GZMH,Granzyme H,"Chapter IV Endocrine, nutritional and metabolic diseases",Metabolic disorders,24418,701,1.20 [1.11-1.29],2.638942824197672e-06
GZMH,Granzyme H,"Chapter IV Endocrine, nutritional and metabolic diseases",Disorders of lipoprotein metabolism and other lipidaemias,24258,541,1.23 [1.13-1.34],9.559296265786714e-07
GZMH,Granzyme H,"Chapter IV Endocrine, nutritional and metabolic diseases",Pure hypercholesterolaemia,24212,495,1.23 [1.13-1.35],1.7326904615951846e-06
GZMH,Granzyme H,Chapter IX Diseases of the circulatory system,"Ischaemic heart disease, wide definition",26323,566,1.21 [1.11-1.32],7.368428444645092e-06
GZMH,Granzyme H,Chapter IX Diseases of the circulatory system,Coronary atherosclerosis,26171,425,1.25 [1.14-1.37],3.5248802732292976e-06
GZMH,Granzyme H,Chapter X Diseases of the respiratory system,Other respiratory disorders and diseases,26985,85,1.44 [1.25-1.67],9.462288715630444e-07
GZMH,Granzyme H,Chapter XIV Diseases of the genitourinary system,Genitourinary diseases,23519,4367,0.86 [0.83-0.90],7.345739640427895e-12
GZMH,Granzyme H,"Chapter XV Pregnancy, childbirth and the puerperium",Complications of labour and delivery,15394,1182,1.18 [1.10-1.27],1.6054802925844802e-05
