Protein,Protein_definition,Disease_category,Disease,NB_individual,NB_case,OR[95%CI],P_value
CIT,Citron Rho-interacting kinase,Chapter IX Diseases of the circulatory system,Death due to cardiac causes,18695,1717,1.28 [1.16-1.42],1.3872542385570928e-06
CIT,Citron Rho-interacting kinase,Chapter XI Diseases of the digestive system,Other diseases of oesophagus,19117,57,2.09 [1.47-2.96],3.42879405545599e-05
CIT,Citron Rho-interacting kinase,Chapter XIII Diseases of the musculoskeletal system and connective tissue,Polyarthropathies,18581,308,1.58 [1.32-1.90],8.859570139520912e-07
CIT,Citron Rho-interacting kinase,Chapter XIII Diseases of the musculoskeletal system and connective tissue,Other/unspecified rheumatoid arthritis,23649,96,1.77 [1.34-2.35],7.026821854643476e-05
CIT,Citron Rho-interacting kinase,Chapter XIV Diseases of the genitourinary system,Chronic kidney disease,22788,30,2.52 [1.76-3.60],3.655607132223869e-07
