Protein,Protein_definition,Disease_category,Disease,NB_individual,NB_case,OR[95%CI],P_value
ARSB,Arylsulfatase B,Chapter IX Diseases of the circulatory system,"Ischaemic heart disease, wide definition",46859,2389,0.84 [0.78-0.90],1.2398671434374003e-06
ARSB,Arylsulfatase B,Chapter IX Diseases of the circulatory system,Coronary atherosclerosis,46330,1895,0.83 [0.77-0.90],7.521287397535045e-06
ARSB,Arylsulfatase B,Chapter IX Diseases of the circulatory system,Other or ill-defined heart diseases,42535,185,0.52 [0.40-0.67],3.973806516134812e-07
ARSB,Arylsulfatase B,Chapter X Diseases of the respiratory system,Diseases of the respiratory system,40854,4113,1.14 [1.08-1.20],1.7465193515383777e-06
ARSB,Arylsulfatase B,Chapter XI Diseases of the digestive system,Gastrointestinal diseases,34867,11598,1.09 [1.05-1.13],6.2945489854434325e-06
