Protein,Protein_definition,Disease_category,Disease,NB_individual,NB_case,OR[95%CI],P_value
CES2,Cocaine esterase,"Chapter IV Endocrine, nutritional and metabolic diseases",Type 2 diabetes,47469,1110,1.68 [1.54-1.83],2.7380922578384746e-30
CES2,Cocaine esterase,"Chapter IV Endocrine, nutritional and metabolic diseases",Type 2 diabetes without complications,47432,1073,1.68 [1.54-1.84],8.172403304544511e-30
CES2,Cocaine esterase,Chapter V Mental and behavioural disorders,Any mental disorder,43353,1302,1.24 [1.14-1.35],7.86562860163672e-07
CES2,Cocaine esterase,Chapter VI Diseases of the nervous system,Epilepsy,47918,302,1.62 [1.39-1.90],1.2333104759606118e-09
CES2,Cocaine esterase,Chapter XI Diseases of the digestive system,Ulcer of oesophagus,38842,402,0.66 [0.56-0.79],4.944877459793298e-06
