Protein,Protein_definition,Disease_category,Disease,Method,Nb_SNP,OR[95%CI],P_value
AFP,Alpha-fetoprotein,"Chapter VII Diseases of the eye, adnexa, ear and mastoid process","Diabetic maculopathy, excluding more controls",Inverse variance weighted,70,0.93 [0.84-1.04],0.195834555691823
AFP,Alpha-fetoprotein,Chapter IX Diseases of the circulatory system,Coronary atherosclerosis,Inverse variance weighted,70,1.02 [0.98-1.06],0.377285917749516
AFP,Alpha-fetoprotein,Chapter IX Diseases of the circulatory system,"Ischaemic heart disease, wide definition",Inverse variance weighted,70,1.01 [0.98-1.05],0.581681031923495
AFP,Alpha-fetoprotein,Chapter XIV Diseases of the genitourinary system,Other disorders of urethra and urinary system,Inverse variance weighted,70,0.98 [0.94-1.01],0.169011552797363
AFP,Alpha-fetoprotein,Chapter XIV Diseases of the genitourinary system,Other diseases of urinary system,Inverse variance weighted,70,0.98 [0.95-1.00],0.0798664266480047
