Protein,Protein_definition,Disease_category,Disease,Method,Nb_SNP,OR[95%CI],P_value
CNTN3,Contactin-3,Chapter X Diseases of the respiratory system,Early onset COPD,Inverse variance weighted,34,0.93 [0.86-1.02],0.117868701136676
CNTN3,Contactin-3,Chapter III Diseases of the blood and blood-forming organs and certain disorders involving the immune mechanism,Other and unspecified iron deficiency,Inverse variance weighted,34,1.07 [0.98-1.17],0.128237223705765
CNTN3,Contactin-3,Chapter III Diseases of the blood and blood-forming organs and certain disorders involving the immune mechanism,Other and unspecified anaemias,Inverse variance weighted,34,1.04 [0.97-1.12],0.241442795817826
CNTN3,Contactin-3,Chapter IX Diseases of the circulatory system,Atrial fibrillation and flutter,Inverse variance weighted,34,0.98 [0.93-1.05],0.625120267804424
CNTN3,Contactin-3,Chapter XIV Diseases of the genitourinary system,Chronic kidney disease,Inverse variance weighted,34,1.01 [0.94-1.08],0.777081939307829
