Protein,Protein_definition,Disease_category,Disease,Method,Nb_SNP,OR[95%CI],P_value
HMOX1,Heme oxygenase 1,Chapter II Neoplasms,"Malignant neoplasm of breast, excluding all cancers (controls excluding all cancers)",Inverse variance weighted,21,1.03 [0.96-1.10],0.42399015083184
HMOX1,Heme oxygenase 1,"Chapter IV Endocrine, nutritional and metabolic diseases",Disorders of lipoprotein metabolism and other lipidaemias,Inverse variance weighted,21,1.01 [0.89-1.14],0.867238047217574
HMOX1,Heme oxygenase 1,Chapter IX Diseases of the circulatory system,Angina pectoris,Inverse variance weighted,21,1.04 [0.95-1.14],0.395760316902598
HMOX1,Heme oxygenase 1,Chapter IX Diseases of the circulatory system,Major coronary heart disease event,Inverse variance weighted,21,1.04 [0.97-1.12],0.288251488790557
HMOX1,Heme oxygenase 1,Chapter IX Diseases of the circulatory system,Coronary atherosclerosis,Inverse variance weighted,21,1.02 [0.93-1.12],0.64681027027284
HMOX1,Heme oxygenase 1,Chapter IX Diseases of the circulatory system,"Ischaemic heart disease, wide definition",Inverse variance weighted,21,1.01 [0.94-1.09],0.727194968124182
HMOX1,Heme oxygenase 1,Chapter XI Diseases of the digestive system,Diseases of liver,Inverse variance weighted,21,1.01 [0.94-1.09],0.764406738570945
HMOX1,Heme oxygenase 1,Chapter XIII Diseases of the musculoskeletal system and connective tissue,Rheumatoid arthritis,Inverse variance weighted,21,1.01 [0.92-1.11],0.832657256186272
