Protein,Protein_definition,Disease_category,Disease,Method,Nb_SNP,OR[95%CI],P_value
RNASE6,Ribonuclease K6,"Chapter IV Endocrine, nutritional and metabolic diseases",Acidosis,Inverse variance weighted,20,0.60 [0.43-0.83],0.0023449775809572
RNASE6,Ribonuclease K6,"Chapter IV Endocrine, nutritional and metabolic diseases",Disorders of mineral metabolism,Inverse variance weighted,20,0.82 [0.72-0.94],0.0033744344118831
RNASE6,Ribonuclease K6,Chapter VI Diseases of the nervous system,Sleep apnoea,Inverse variance weighted,20,0.95 [0.92-0.98],0.0036748824360391
RNASE6,Ribonuclease K6,Chapter IX Diseases of the circulatory system,Other peripheral vascular diseases,Inverse variance weighted,20,0.80 [0.70-0.92],0.0021313530998376
RNASE6,Ribonuclease K6,Chapter VI Diseases of the nervous system,Other degenerative diseases of the nervous system,Inverse variance weighted,20,0.92 [0.87-0.98],0.0062736692712295
