Protein,Protein_definition,Disease_category,Disease,Method,Nb_SNP,OR[95%CI],P_value
FGF23,Fibroblast growth factor 23,Chapter III Diseases of the blood and blood-forming organs and certain disorders involving the immune mechanism,Other coagulation defects,Inverse variance weighted,17,1.44 [1.10-1.87],0.0070813098098452
FGF23,Fibroblast growth factor 23,"Chapter IV Endocrine, nutritional and metabolic diseases",Hyperparathyroidism,Inverse variance weighted,17,1.28 [1.08-1.53],0.00558358417015
FGF23,Fibroblast growth factor 23,"Chapter IV Endocrine, nutritional and metabolic diseases",Vitamin D deficiency,Inverse variance weighted,17,0.39 [0.22-0.67],0.0007384490796401
FGF23,Fibroblast growth factor 23,Chapter IX Diseases of the circulatory system,"Atherosclerosis, excluding cerebral and coronary sclerosis",Inverse variance weighted,17,1.24 [1.07-1.43],0.0033325642508321
FGF23,Fibroblast growth factor 23,Chapter IX Diseases of the circulatory system,Death due to cardiac causes,Inverse variance weighted,17,1.21 [1.11-1.33],3.27555037075759e-05
FGF23,Fibroblast growth factor 23,Chapter XIV Diseases of the genitourinary system,Chronic kidney disease,Inverse variance weighted,17,1.22 [1.08-1.38],0.0017834313326701
