Protein,Protein_definition,Disease_category,Disease,Method,Nb_SNP,OR[95%CI],P_value
RSPO3,R-spondin-3,Chapter II Neoplasms,Leiomyoma of uterus,Inverse variance weighted,11,1.22 [1.09-1.36],0.0006245059838757
RSPO3,R-spondin-3,Chapter VI Diseases of the nervous system,Falls/tendency to fall,Inverse variance weighted,11,0.88 [0.83-0.94],0.0001639093628878
RSPO3,R-spondin-3,Chapter X Diseases of the respiratory system,Influenza and pneumonia,Inverse variance weighted,11,0.92 [0.87-0.97],0.0042286287222654
RSPO3,R-spondin-3,Chapter V Mental and behavioural disorders,Any mental disorder,Inverse variance weighted,11,0.93 [0.89-0.98],0.0036876371615247
RSPO3,R-spondin-3,Chapter XIII Diseases of the musculoskeletal system and connective tissue,Coxarthrosis,Inverse variance weighted,11,1.15 [1.05-1.26],0.0027497663975279
