Protein,Protein_definition,Disease_category,Disease,NB_individual,NB_case,HR[95%CI],P_value
ENTR1,Endosome-associated-trafficking regulator 1,Chapter II Neoplasms,Lymphoid leukaemia,19173,34,2.40 [1.65-3.49],4.851544945091131e-06
ENTR1,Endosome-associated-trafficking regulator 1,"Chapter IV Endocrine, nutritional and metabolic diseases",Type 2 diabetes without complications,23193,1284,1.30 [1.20-1.42],3.931766676922271e-10
ENTR1,Endosome-associated-trafficking regulator 1,Chapter IX Diseases of the circulatory system,"Hypertension, portal",23504,34,2.32 [1.60-3.36],7.754226044811664e-06
ENTR1,Endosome-associated-trafficking regulator 1,Chapter XI Diseases of the digestive system,"Cirrhosis of liver, NAS",23535,65,2.01 [1.51-2.68],2.068651496785096e-06
ENTR1,Endosome-associated-trafficking regulator 1,Chapter XI Diseases of the digestive system,Nonalcoholic fatty liver disease,23589,300,1.57 [1.34-1.83],1.3300592390182096e-08
