Protein,Protein_definition,Disease_category,Disease,NB_individual,NB_case,HR[95%CI],P_value
ST3GAL1,"CMP-N-acetylneuraminate-beta-galactosamide-alpha-2,3-sialyltransferase 1","Chapter IV Endocrine, nutritional and metabolic diseases",Type 2 diabetes without complications,27175,1510,0.70 [0.62-0.79],4.9965160445053755e-09
ST3GAL1,"CMP-N-acetylneuraminate-beta-galactosamide-alpha-2,3-sialyltransferase 1",Chapter IX Diseases of the circulatory system,"Heart failure, strict",27567,864,1.34 [1.18-1.52],3.954890319886956e-06
ST3GAL1,"CMP-N-acetylneuraminate-beta-galactosamide-alpha-2,3-sialyltransferase 1",Chapter IX Diseases of the circulatory system,Hypertensive Renal Disease,19399,104,2.02 [1.60-2.55],3.386295880405961e-09
ST3GAL1,"CMP-N-acetylneuraminate-beta-galactosamide-alpha-2,3-sialyltransferase 1",Chapter V Mental and behavioural disorders,"Alcohol use disorder, ICD-based",27620,219,1.61 [1.31-1.97],4.45413548898061e-06
ST3GAL1,"CMP-N-acetylneuraminate-beta-galactosamide-alpha-2,3-sialyltransferase 1",Chapter XIV Diseases of the genitourinary system,Chronic kidney disease,26810,1504,1.32 [1.20-1.46],1.3089299507221528e-08
ST3GAL1,"CMP-N-acetylneuraminate-beta-galactosamide-alpha-2,3-sialyltransferase 1",Chapter XIV Diseases of the genitourinary system,Renal tubulo-interstitial diseases,27466,2496,1.20 [1.11-1.30],4.676057262244752e-06
