Protein,Protein_definition,Disease_category,Disease,NB_individual,NB_case,HR[95%CI],P_value
CRYBB2,Beta-crystallin B2,Chapter I Certain infectious and parasitic diseases,Implicit bacterial Sepsis,21706,796,1.18 [1.10-1.26],3.4796469425886662e-06
CRYBB2,Beta-crystallin B2,"Chapter IV Endocrine, nutritional and metabolic diseases","Other disorders of fluid, electrolyte and acid-base balance",20598,1306,1.16 [1.09-1.22],2.0486139324574725e-07
CRYBB2,Beta-crystallin B2,Chapter VI Diseases of the nervous system,Cerebral palsy and other paralytic syndromes,24103,237,1.28 [1.15-1.42],6.567907366634756e-06
CRYBB2,Beta-crystallin B2,"Chapter VII Diseases of the eye, adnexa, ear and mastoid process",Other cataract,22585,2239,1.40 [1.34-1.46],2.4589248668846722e-57
CRYBB2,Beta-crystallin B2,"Chapter VII Diseases of the eye, adnexa, ear and mastoid process",Senile cataract,22186,1840,1.35 [1.29-1.42],1.2606964283948189e-33
CRYBB2,Beta-crystallin B2,"Chapter VII Diseases of the eye, adnexa, ear and mastoid process",Visual impairment including blindness (binocular or monocular),23705,149,1.37 [1.21-1.54],2.191459089069534e-07
CRYBB2,Beta-crystallin B2,Chapter X Diseases of the respiratory system,Vocal cord dysfunction,11637,90,1.52 [1.27-1.83],4.634389530491009e-06
CRYBB2,Beta-crystallin B2,Chapter XIII Diseases of the musculoskeletal system and connective tissue,Deforming dorsopathies,21125,514,1.21 [1.11-1.31],5.043559502956576e-06
CRYBB2,Beta-crystallin B2,Chapter XIV Diseases of the genitourinary system,Chronic kidney disease,23437,1171,1.15 [1.09-1.22],1.0076594611673772e-06
