Protein,Protein_definition,Disease_category,Disease,NB_individual,NB_case,HR[95%CI],P_value
BAX,Apoptosis regulator BAX,Chapter III Diseases of the blood and blood-forming organs and certain disorders involving the immune mechanism,Diseases of the blood and blood-forming organs and certain disorders involving the immune mechanism,26067,2923,1.11 [1.07-1.15],6.562979233359904e-08
BAX,Apoptosis regulator BAX,Chapter III Diseases of the blood and blood-forming organs and certain disorders involving the immune mechanism,Other anaemias,26492,1513,1.13 [1.07-1.18],5.669185342262857e-06
BAX,Apoptosis regulator BAX,Chapter III Diseases of the blood and blood-forming organs and certain disorders involving the immune mechanism,Other and unspecified anaemias,26492,1513,1.13 [1.07-1.18],5.669185342262857e-06
BAX,Apoptosis regulator BAX,Chapter III Diseases of the blood and blood-forming organs and certain disorders involving the immune mechanism,Other and unspecified iron deficiency,26663,1258,1.15 [1.09-1.22],4.969104135500943e-07
BAX,Apoptosis regulator BAX,"Chapter IV Endocrine, nutritional and metabolic diseases",Metabolic disorders,26177,4622,1.08 [1.05-1.11],8.351612725854391e-07
BAX,Apoptosis regulator BAX,Chapter IX Diseases of the circulatory system,Cardiac arrest,16279,124,1.48 [1.25-1.76],6.158209653964675e-06
BAX,Apoptosis regulator BAX,Chapter X Diseases of the respiratory system,Diseases of the respiratory system,25017,5115,1.07 [1.04-1.10],1.4620269114207186e-06
BAX,Apoptosis regulator BAX,Chapter XIV Diseases of the genitourinary system,Acute renal failure,26005,1236,1.15 [1.08-1.21],2.6015765542939167e-06
