Protein,Protein_definition,Disease_category,Disease,NB_individual,NB_case,HR[95%CI],P_value
OTUD7B,OTU domain-containing protein 7B,Chapter III Diseases of the blood and blood-forming organs and certain disorders involving the immune mechanism,Diseases of the blood and blood-forming organs and certain disorders involving the immune mechanism,23289,2588,1.17 [1.10-1.24],3.0059268731251537e-07
OTUD7B,OTU domain-containing protein 7B,Chapter III Diseases of the blood and blood-forming organs and certain disorders involving the immune mechanism,Other and unspecified iron deficiency,23821,1085,1.27 [1.16-1.39],1.875963561807136e-07
OTUD7B,OTU domain-containing protein 7B,"Chapter IV Endocrine, nutritional and metabolic diseases",Disorders of lipoprotein metabolism and other lipidaemias,22066,2762,1.15 [1.09-1.22],9.617113589357882e-07
OTUD7B,OTU domain-containing protein 7B,"Chapter IV Endocrine, nutritional and metabolic diseases",Metabolic disorders,23411,4107,1.13 [1.08-1.19],1.4648655335492877e-07
OTUD7B,OTU domain-containing protein 7B,Chapter X Diseases of the respiratory system,Diseases of the respiratory system,22337,4526,1.13 [1.08-1.18],7.535501555043356e-08
OTUD7B,OTU domain-containing protein 7B,Chapter XI Diseases of the digestive system,Noninfective enteritis and colitis,23383,959,1.24 [1.13-1.36],8.493460327691033e-06
