Protein,Protein_definition,Disease_category,Disease,NB_individual,NB_case,HR[95%CI],P_value
ENO3,Beta-enolase,"Chapter IV Endocrine, nutritional and metabolic diseases",Disorders of lipoprotein metabolism and other lipidaemias,21518,2678,1.20 [1.13-1.28],5.453323228905489e-09
ENO3,Beta-enolase,"Chapter IV Endocrine, nutritional and metabolic diseases",Type 2 diabetes without complications,23193,1284,1.46 [1.34-1.58],3.323106403238186e-20
ENO3,Beta-enolase,Chapter XI Diseases of the digestive system,Nonalcoholic fatty liver disease,23589,300,1.52 [1.29-1.78],2.79498231600924e-07
ENO3,Beta-enolase,Chapter XIII Diseases of the musculoskeletal system and connective tissue,Osteopathies and chondropathies,23196,2184,0.83 [0.77-0.90],3.303534652225852e-06
ENO3,Beta-enolase,Chapter XIII Diseases of the musculoskeletal system and connective tissue,Osteoporosis,22581,1569,0.77 [0.70-0.85],7.339335365050801e-08
