Protein,Protein_definition,Disease_category,Disease,NB_individual,NB_case,HR[95%CI],P_value
TLR3,Toll-like receptor 3,"Chapter IV Endocrine, nutritional and metabolic diseases",Type 2 diabetes without complications,27577,1520,1.43 [1.32-1.55],1.2760796175847645e-17
TLR3,Toll-like receptor 3,Chapter IX Diseases of the circulatory system,"Hypertension, portal",27961,42,3.70 [2.10-6.51],5.628211779208744e-06
TLR3,Toll-like receptor 3,Chapter XI Diseases of the digestive system,Diseases of liver,27972,829,1.31 [1.18-1.46],4.942345307920211e-07
TLR3,Toll-like receptor 3,Chapter XI Diseases of the digestive system,Fibrosis and cirrhosis of liver,27237,94,2.39 [1.67-3.43],1.936384522376144e-06
TLR3,Toll-like receptor 3,Chapter XI Diseases of the digestive system,Other diseases of liver,27840,697,1.32 [1.18-1.49],2.2538041046389817e-06
