Protein,Protein_definition,Disease_category,Disease,NB_individual,NB_case,HR[95%CI],P_value
FCRL3,Fc receptor-like protein 3,Chapter II Neoplasms,"Chronic lymphocytic leukaemia and small lyphocytis leukaemia, excluding all cancers (controls excluding all cancers)",22160,32,5.93 [4.39-8.02],4.237893939511018e-31
FCRL3,Fc receptor-like protein 3,Chapter II Neoplasms,Lymphoid leukaemia,22164,36,5.52 [4.10-7.42],1.639683095564883e-29
FCRL3,Fc receptor-like protein 3,Chapter II Neoplasms,"Non-follicular lymphoma, hilmo, excluding all cancers",22209,81,2.22 [1.59-3.08],2.191683284506283e-06
FCRL3,Fc receptor-like protein 3,Chapter II Neoplasms,"Non-Hodgkin lymphoma, all, excluding all cancers (controls excluding all cancers)",22280,152,2.17 [1.70-2.76],3.5283833827443165e-10
FCRL3,Fc receptor-like protein 3,Chapter II Neoplasms,"Other and unspecified types of non-Hodgkin lymphoma, hilmo, excluding all cancers",22222,94,2.36 [1.75-3.20],2.1594203419859435e-08
