Protein,Protein_definition,Disease_category,Disease,NB_individual,NB_case,HR[95%CI],P_value
RPL14,60S ribosomal protein L14,Chapter I Certain infectious and parasitic diseases,Implicit bacterial Sepsis,21191,779,1.39 [1.22-1.59],1.5482173608324838e-06
RPL14,60S ribosomal protein L14,"Chapter IV Endocrine, nutritional and metabolic diseases",Type 2 diabetes without complications,23193,1284,1.36 [1.21-1.52],7.297924718914504e-08
RPL14,60S ribosomal protein L14,Chapter XIV Diseases of the genitourinary system,Acute renal failure,22768,1026,1.37 [1.22-1.55],2.816824382708586e-07
RPL14,60S ribosomal protein L14,Chapter XIV Diseases of the genitourinary system,Chronic kidney disease,22883,1141,1.32 [1.17-1.49],4.223121648921805e-06
RPL14,60S ribosomal protein L14,Chapter XIV Diseases of the genitourinary system,Renal tubulo-interstitial diseases,23453,2005,1.29 [1.18-1.41],4.6193540178351154e-08
