Protein,Protein_definition,Disease_category,Disease,NB_individual,NB_case,HR[95%CI],P_value
HS6ST1,Heparan-sulfate 6-O-sulfotransferase 1,Chapter XI Diseases of the digestive system,"Cirrhosis of liver, NAS",23730,135,2.06 [1.67-2.53],9.640198390870839e-12
HS6ST1,Heparan-sulfate 6-O-sulfotransferase 1,Chapter XI Diseases of the digestive system,Fibrosis and cirrhosis of liver,23082,158,2.03 [1.67-2.47],1.2785852183140857e-12
HS6ST1,Heparan-sulfate 6-O-sulfotransferase 1,Chapter XIII Diseases of the musculoskeletal system and connective tissue,Gout,18029,986,1.59 [1.42-1.78],3.7425131516624805e-15
HS6ST1,Heparan-sulfate 6-O-sulfotransferase 1,Chapter XIII Diseases of the musculoskeletal system and connective tissue,"Gout, unspecified",23796,972,1.60 [1.42-1.79],2.402805192780197e-15
HS6ST1,Heparan-sulfate 6-O-sulfotransferase 1,Chapter XIV Diseases of the genitourinary system,Dialysis,21157,108,2.15 [1.74-2.67],2.2484008129570072e-12
