Protein,Protein_definition,Disease_category,Disease,NB_individual,NB_case,HR[95%CI],P_value
MMP1,Interstitial collagenase,Chapter III Diseases of the blood and blood-forming organs and certain disorders involving the immune mechanism,Other anaemias,22563,1412,1.19 [1.13-1.26],2.9578374699679877e-10
MMP1,Interstitial collagenase,Chapter III Diseases of the blood and blood-forming organs and certain disorders involving the immune mechanism,Other and unspecified anaemias,22562,1411,1.19 [1.13-1.26],3.431500590724108e-10
MMP1,Interstitial collagenase,"Chapter IV Endocrine, nutritional and metabolic diseases","Other disorders of fluid, electrolyte and acid-base balance",18099,1563,1.17 [1.12-1.24],7.474781063982461e-10
MMP1,Interstitial collagenase,Chapter XIV Diseases of the genitourinary system,Chronic kidney disease,21643,1492,1.18 [1.12-1.24],8.394670034829422e-10
MMP1,Interstitial collagenase,Chapter XIV Diseases of the genitourinary system,Renal tubulo-interstitial diseases,22641,2745,1.13 [1.09-1.18],1.9203049456724807e-10
