Protein,Protein_definition,Disease_category,Disease,NB_individual,NB_case,HR[95%CI],P_value
GLB1,Beta-galactosidase,"Chapter IV Endocrine, nutritional and metabolic diseases",Type 2 diabetes without complications,22750,2153,1.47 [1.35-1.61],7.2516434030926455e-19
GLB1,Beta-galactosidase,Chapter V Mental and behavioural disorders,"Alcohol use disorder, ICD-based",23329,492,1.91 [1.61-2.27],9.614006545023713e-14
GLB1,Beta-galactosidase,Chapter V Mental and behavioural disorders,"Mental and behavioural disorders due to alcohol, excluding acute intoxication",23267,581,1.73 [1.47-2.02],2.1487542912947265e-11
GLB1,Beta-galactosidase,Chapter XI Diseases of the digestive system,Alcoholic liver disease,22642,110,3.18 [2.27-4.46],1.9532411912798803e-11
GLB1,Beta-galactosidase,Chapter XI Diseases of the digestive system,Diseases of liver,23384,852,1.53 [1.33-1.75],9.4396726457431e-10
