Protein,Protein_definition,Disease_category,Disease,NB_individual,NB_case,HR[95%CI],P_value
ACAN,Aggrecan core protein,"Chapter IV Endocrine, nutritional and metabolic diseases",Type 2 diabetes without complications,22706,2139,0.50 [0.44-0.58],7.659071547716284e-22
ACAN,Aggrecan core protein,Chapter IX Diseases of the circulatory system,Hypertensive Renal Disease,14434,163,5.84 [3.51-9.74],1.2432422567878084e-11
ACAN,Aggrecan core protein,Chapter XIII Diseases of the musculoskeletal system and connective tissue,Arthrosis,20045,3323,1.46 [1.30-1.63],7.705799692791729e-11
ACAN,Aggrecan core protein,Chapter XIV Diseases of the genitourinary system,Chronic kidney disease,22175,1528,1.94 [1.65-2.29],4.407580332809791e-15
ACAN,Aggrecan core protein,Chapter XIV Diseases of the genitourinary system,Dialysis,20748,101,15.63 [8.30-29.46],1.777575838286475e-17
