Protein,Protein_definition,Disease_category,Disease,NB_individual,NB_case,HR[95%CI],P_value
LTA,Lymphotoxin-alpha,Chapter II Neoplasms,"Non-follicular lymphoma, hilmo, excluding all cancers",18457,101,2.61 [2.03-3.36],6.636582786687546e-14
LTA,Lymphotoxin-alpha,Chapter II Neoplasms,"Non-Hodgkin lymphoma, all, excluding all cancers (controls excluding all cancers)",18524,168,2.40 [1.93-2.98],3.5243964161123235e-15
LTA,Lymphotoxin-alpha,Chapter III Diseases of the blood and blood-forming organs and certain disorders involving the immune mechanism,Agranulocytosis,23425,307,2.00 [1.64-2.43],7.552966695379341e-12
LTA,Lymphotoxin-alpha,Chapter XI Diseases of the digestive system,"Cirrhosis of liver, NAS",23495,133,2.31 [1.80-2.97],4.0982652233889806e-11
LTA,Lymphotoxin-alpha,Chapter XI Diseases of the digestive system,Fibrosis and cirrhosis of liver,22858,156,2.39 [1.91-2.98],1.552534553965439e-14
