Protein,Protein_definition,Disease_category,Disease,NB_individual,NB_case,HR[95%CI],P_value
S100G,Protein S100-G,"Chapter IV Endocrine, nutritional and metabolic diseases",Disorders of parathyroid gland,20318,71,2.56 [1.91-3.44],4.0523038066316785e-10
S100G,Protein S100-G,"Chapter IV Endocrine, nutritional and metabolic diseases",Hyperparathyroidism,20313,66,2.68 [1.99-3.60],5.785718761049673e-11
S100G,Protein S100-G,Chapter IX Diseases of the circulatory system,Hypertensive Renal Disease,12651,104,2.58 [2.00-3.32],3.48276498197476e-13
S100G,Protein S100-G,Chapter XI Diseases of the digestive system,Coeliac disease,19115,76,2.57 [1.91-3.46],5.03209438129776e-10
S100G,Protein S100-G,Chapter XIV Diseases of the genitourinary system,Chronic kidney disease,19379,1152,1.42 [1.29-1.57],7.794427667364954e-12
