Protein,Protein_definition,Disease_category,Disease,NB_individual,NB_case,HR[95%CI],P_value
EZR,Ezrin,Chapter II Neoplasms,"Chronic lymphocytic leukaemia and small lyphocytis leukaemia, excluding all cancers (controls excluding all cancers)",18597,71,6.73 [4.62-9.81],2.933980458920329e-23
EZR,Ezrin,Chapter II Neoplasms,Lymphoid leukaemia,18591,65,6.50 [4.35-9.70],5.0735962952003214e-20
EZR,Ezrin,"Chapter IV Endocrine, nutritional and metabolic diseases",Type 2 diabetes without complications,23155,2176,1.68 [1.46-1.93],4.993478803189487e-13
EZR,Ezrin,Chapter X Diseases of the respiratory system,Idiopathic pulmonary fibrosis,23006,337,2.91 [2.15-3.94],4.7460346550736666e-12
EZR,Ezrin,Chapter X Diseases of the respiratory system,Interstitial lung disease,23035,366,3.03 [2.27-4.04],4.1829192657946804e-14
EZR,Ezrin,Chapter X Diseases of the respiratory system,Other respiratory diseases principally affecting the interstitium,23847,449,2.72 [2.08-3.56],2.555700675105656e-13
EZR,Ezrin,Chapter XIV Diseases of the genitourinary system,Chronic kidney disease,22602,1547,1.71 [1.44-2.03],5.837789961071392e-10
