Protein,Protein_definition,Disease_category,Disease,NB_individual,NB_case,HR[95%CI],P_value
JCHAIN,Immunoglobulin J chain,Chapter I Certain infectious and parasitic diseases,Implicit bacterial Sepsis,44709,2166,1.22 [1.15-1.30],9.423259210635784e-11
JCHAIN,Immunoglobulin J chain,Chapter II Neoplasms,"Non-Hodgkin lymphoma, all, excluding all cancers (controls excluding all cancers)",40496,312,1.63 [1.40-1.89],2.174042015998756e-10
JCHAIN,Immunoglobulin J chain,"Chapter IV Endocrine, nutritional and metabolic diseases",Hyperkalaemia,39097,586,1.45 [1.30-1.63],9.111384907626423e-11
JCHAIN,Immunoglobulin J chain,Chapter X Diseases of the respiratory system,"COPD, hospital admissions 1, only main diagnosis",50155,2325,1.24 [1.17-1.31],7.688168754066475e-13
JCHAIN,Immunoglobulin J chain,Chapter X Diseases of the respiratory system,Later onset COPD,48595,1710,1.25 [1.17-1.34],1.1540818398912803e-10
JCHAIN,Immunoglobulin J chain,Chapter XIV Diseases of the genitourinary system,Acute renal failure,48501,3085,1.22 [1.16-1.29],7.580974202157075e-15
JCHAIN,Immunoglobulin J chain,Chapter XIV Diseases of the genitourinary system,Chronic kidney disease,48413,2997,1.30 [1.24-1.37],3.961454521889167e-24
JCHAIN,Immunoglobulin J chain,Chapter XIV Diseases of the genitourinary system,Renal tubulo-interstitial diseases,50052,5226,1.18 [1.14-1.23],9.923857778768624e-17
