Protein,Protein_definition,Disease_category,Disease,NB_individual,NB_case,HR[95%CI],P_value
HMCN2,Hemicentin-2,"Chapter IV Endocrine, nutritional and metabolic diseases",Type 1 diabetes without complications,39814,262,2.02 [1.63-2.50],7.65360380629287e-11
HMCN2,Hemicentin-2,"Chapter IV Endocrine, nutritional and metabolic diseases",Type 2 diabetes without complications,42685,3133,1.30 [1.23-1.38],6.772515303530331e-18
HMCN2,Hemicentin-2,Chapter V Mental and behavioural disorders,"Mental and behavioural disorders due to alcohol, excluding acute intoxication",43452,715,0.69 [0.61-0.77],4.363967603090453e-10
HMCN2,Hemicentin-2,Chapter XIV Diseases of the genitourinary system,Chronic kidney disease,41895,2277,1.36 [1.26-1.46],5.79111136993086e-17
HMCN2,Hemicentin-2,Chapter XIV Diseases of the genitourinary system,Renal tubulo-interstitial diseases,43357,4260,1.19 [1.13-1.25],1.525875022142014e-10
