Protein,Protein_definition,Disease_category,Disease,NB_individual,NB_case,HR[95%CI],P_value
BMP4,Bone morphogenetic protein 4,"Chapter IV Endocrine, nutritional and metabolic diseases",Type 2 diabetes without complications,49774,3640,1.21 [1.14-1.29],3.37484763651302e-10
BMP4,Bone morphogenetic protein 4,Chapter IX Diseases of the circulatory system,"Hypertension, Pulmonary Arterial",33880,345,1.73 [1.46-2.06],5.503725428432731e-10
BMP4,Bone morphogenetic protein 4,Chapter XI Diseases of the digestive system,"Cirrhosis of liver, NAS",50751,202,2.17 [1.76-2.67],2.6045228380067884e-13
BMP4,Bone morphogenetic protein 4,Chapter XI Diseases of the digestive system,Fibrosis and cirrhosis of liver,49375,245,2.05 [1.69-2.49],5.340826503405585e-13
BMP4,Bone morphogenetic protein 4,Chapter XIV Diseases of the genitourinary system,Chronic kidney disease,48876,3013,1.34 [1.26-1.43],1.7533341889825709e-19
BMP4,Bone morphogenetic protein 4,Chapter XIV Diseases of the genitourinary system,Renal tubulo-interstitial diseases,50540,5279,1.21 [1.15-1.27],2.0194773588769162e-13
