Protein,Protein_definition,Disease_category,Disease,NB_individual,NB_case,HR[95%CI],P_value
IL7,Interleukin-7,Chapter II Neoplasms,"Chronic lymphocytic leukaemia and small lyphocytis leukaemia, excluding all cancers (controls excluding all cancers)",18427,71,0.52 [0.37-0.73],0.0002141381641812
IL7,Interleukin-7,Chapter II Neoplasms,Lymphoid leukaemia,18420,64,0.50 [0.34-0.72],0.0001811530137281
IL7,Interleukin-7,Chapter III Diseases of the blood and blood-forming organs and certain disorders involving the immune mechanism,Purpura and other haemorrhagic conditions,23543,309,0.65 [0.55-0.76],2.0275752958697605e-07
IL7,Interleukin-7,Chapter III Diseases of the blood and blood-forming organs and certain disorders involving the immune mechanism,"Thrombocytopenia, unspecified",23486,252,0.59 [0.50-0.71],2.3315918705155417e-08
IL7,Interleukin-7,"Chapter IV Endocrine, nutritional and metabolic diseases",Alcohol dependence,21699,189,1.40 [1.15-1.69],0.0006770435293768
