Protein,Protein_definition,Disease_category,Disease,NB_individual,NB_case,HR[95%CI],P_value
IFNAR1,Interferon alpha/beta receptor 1,Chapter II Neoplasms,"Haemangioma and lymphangioma, any site",20471,79,2.91 [1.70-4.97],9.112797639373774e-05
IFNAR1,Interferon alpha/beta receptor 1,Chapter II Neoplasms,"Haemangioma, any site",20471,76,3.05 [1.81-5.17],3.136962932867874e-05
IFNAR1,Interferon alpha/beta receptor 1,Chapter IX Diseases of the circulatory system,"Hypertension, portal",20299,99,3.20 [1.98-5.18],2.264403685153496e-06
IFNAR1,Interferon alpha/beta receptor 1,Chapter VIII Diseases of the ear and mastoid process,Mnire disease,20333,47,0.31 [0.15-0.61],0.0007522931975812
IFNAR1,Interferon alpha/beta receptor 1,Chapter XI Diseases of the digestive system,"Cirrhosis of liver, NAS",20320,120,3.02 [1.89-4.81],3.490145054585444e-06
IFNAR1,Interferon alpha/beta receptor 1,Chapter XI Diseases of the digestive system,Fibrosis and cirrhosis of liver,19768,139,2.45 [1.51-3.99],0.0003124219861142
IFNAR1,Interferon alpha/beta receptor 1,Chapter XIV Diseases of the genitourinary system,Chronic nephritic syndrome,20294,49,3.32 [1.74-6.34],0.0002864025591729
IFNAR1,Interferon alpha/beta receptor 1,Chapter XIV Diseases of the genitourinary system,Dialysis,18260,68,2.98 [1.61-5.52],0.0005364510204492
