Protein,Protein_definition,Disease_category,Disease,NB_individual,NB_case,HR[95%CI],P_value
MDH1,"Malate dehydrogenase, cytoplasmic",Chapter III Diseases of the blood and blood-forming organs and certain disorders involving the immune mechanism,"Thrombocytopenia, unspecified",20292,213,0.53 [0.37-0.76],0.0005023210153294
MDH1,"Malate dehydrogenase, cytoplasmic","Chapter IV Endocrine, nutritional and metabolic diseases",Disorders of phosphorus metabolism and phosphatases,14994,129,1.93 [1.38-2.69],0.0001170217126112
MDH1,"Malate dehydrogenase, cytoplasmic","Chapter IV Endocrine, nutritional and metabolic diseases",Other and/or unspecified nontoxic goitre,19739,13,3.62 [1.88-6.95],0.0001154740580049
MDH1,"Malate dehydrogenase, cytoplasmic","Chapter VII Diseases of the eye, adnexa, ear and mastoid process",Diplopia,20036,83,2.11 [1.38-3.22],0.0005528759913434
MDH1,"Malate dehydrogenase, cytoplasmic",Chapter XII Diseases of the skin and subcutaneous tissue,Lupus erythematosus,18742,21,3.03 [1.62-5.67],0.0004966995371003
