Protein,Protein_definition,Disease_category,Disease,NB_individual,NB_case,HR[95%CI],P_value
AMPD3,AMP deaminase 3,Chapter III Diseases of the blood and blood-forming organs and certain disorders involving the immune mechanism,Other anaemias,20218,1224,0.88 [0.81-0.95],0.0008864378105822
AMPD3,AMP deaminase 3,Chapter III Diseases of the blood and blood-forming organs and certain disorders involving the immune mechanism,Other and unspecified anaemias,20216,1222,0.88 [0.81-0.95],0.0009537390756883
AMPD3,AMP deaminase 3,Chapter X Diseases of the respiratory system,"Diseases of vocal cords and larynx+other diseases of upper respiratory tract, no elsewhere classified",19531,346,0.78 [0.68-0.91],0.0009881178684989
AMPD3,AMP deaminase 3,Chapter XIII Diseases of the musculoskeletal system and connective tissue,Spondylosis,18609,683,0.84 [0.76-0.93],0.0009960230218911
AMPD3,AMP deaminase 3,Chapter XIV Diseases of the genitourinary system,Chronic nephritic syndrome,20306,49,0.45 [0.31-0.65],2.611244569162617e-05
AMPD3,AMP deaminase 3,Chapter XIV Diseases of the genitourinary system,Dialysis,18280,68,0.58 [0.42-0.80],0.0008752287727517
