Protein,Protein_definition,Disease_category,Disease,NB_individual,NB_case,HR[95%CI],P_value
DEFB104A_DEFB104B,Beta-defensin 104,"Chapter IV Endocrine, nutritional and metabolic diseases",Alcohol dependence,18215,157,0.51 [0.35-0.72],0.0001688949279139
DEFB104A_DEFB104B,Beta-defensin 104,"Chapter IV Endocrine, nutritional and metabolic diseases","Other disorders of fluid, electrolyte and acid-base balance",15753,1310,0.82 [0.74-0.91],0.0002550141181103
DEFB104A_DEFB104B,Beta-defensin 104,Chapter VI Diseases of the nervous system,Falls/tendency to fall,19442,1764,0.84 [0.77-0.92],0.0002483499073383
DEFB104A_DEFB104B,Beta-defensin 104,Chapter X Diseases of the respiratory system,"COPD, hospital admissions 1, only main diagnosis",19719,1088,0.80 [0.72-0.91],0.0003033481270965
DEFB104A_DEFB104B,Beta-defensin 104,Chapter XIII Diseases of the musculoskeletal system and connective tissue,Osteopathies and chondropathies,19664,697,0.78 [0.67-0.90],0.0008945019577852
DEFB104A_DEFB104B,Beta-defensin 104,Chapter XIV Diseases of the genitourinary system,Unspecified renal colic,19244,64,1.66 [1.24-2.22],0.0005865720383718
