Protein,Protein_definition,Disease_category,Disease,NB_individual,NB_case,HR[95%CI],P_value
EVI2B,Protein EVI2B,Chapter II Neoplasms,Benign lipomatous neoplasm of spermatic cord,19806,103,1.60 [1.22-2.10],0.0006929462378204
EVI2B,Protein EVI2B,Chapter VIII Diseases of the ear and mastoid process,Tinnitus,19050,69,1.69 [1.24-2.28],0.0007375043810128
EVI2B,Protein EVI2B,Chapter XIII Diseases of the musculoskeletal system and connective tissue,"Neuralgia and neuritis, unspecified",17092,42,1.96 [1.42-2.70],4.3116637872128224e-05
EVI2B,Protein EVI2B,Chapter XIII Diseases of the musculoskeletal system and connective tissue,Other systemic involvement of connective tissue,19709,160,0.41 [0.24-0.69],0.0008926800775969
EVI2B,Protein EVI2B,Chapter XIII Diseases of the musculoskeletal system and connective tissue,Polymyalgia rheumatica,19684,135,0.38 [0.21-0.67],0.0009591803159745
