Protein,Protein_definition,Disease_category,Disease,NB_individual,NB_case,HR[95%CI],P_value
IL17F,Interleukin-17F,Chapter I Certain infectious and parasitic diseases,Explicit Sepsis,21013,1098,1.12 [1.05-1.19],0.0008249737174861
IL17F,Interleukin-17F,Chapter I Certain infectious and parasitic diseases,Intestinal infectious diseases,23178,1223,1.11 [1.05-1.18],0.0007202290474105
IL17F,Interleukin-17F,Chapter I Certain infectious and parasitic diseases,Other septicaemia,23045,1060,1.12 [1.05-1.20],0.0008782274517243
IL17F,Interleukin-17F,"Chapter IV Endocrine, nutritional and metabolic diseases",Other and/or unspecified nontoxic goitre,22435,22,1.65 [1.32-2.07],1.464020667045122e-05
IL17F,Interleukin-17F,Chapter IX Diseases of the circulatory system,Other disorders of veins,21946,94,1.36 [1.15-1.62],0.000427590650049
IL17F,Interleukin-17F,Chapter XIV Diseases of the genitourinary system,Recurrent and persistent haematuria,23041,59,1.42 [1.17-1.74],0.0005250062455254
