Protein,Protein_definition,Disease_category,Disease,NB_individual,NB_case,HR[95%CI],P_value
ATXN2L,Ataxin-2-like protein,Chapter III Diseases of the blood and blood-forming organs and certain disorders involving the immune mechanism,"Thrombocytopenia, unspecified",20332,209,0.52 [0.37-0.74],0.0002243083997766
ATXN2L,Ataxin-2-like protein,"Chapter IV Endocrine, nutritional and metabolic diseases",Disorders of lipoprotein metabolism and other lipidaemias,18192,3296,1.12 [1.05-1.20],0.0009332187967632
ATXN2L,Ataxin-2-like protein,"Chapter IV Endocrine, nutritional and metabolic diseases",Type 2 diabetes without complications,19874,1884,1.15 [1.06-1.25],0.0006183543657465
ATXN2L,Ataxin-2-like protein,Chapter IX Diseases of the circulatory system,Sequelae of cerebrovascular disease,19309,185,1.52 [1.21-1.91],0.0003245949800941
ATXN2L,Ataxin-2-like protein,Chapter X Diseases of the respiratory system,Other diseases of pleura,20276,1883,1.16 [1.07-1.27],0.0006943103425356
ATXN2L,Ataxin-2-like protein,Chapter X Diseases of the respiratory system,Other respiratory disorders and diseases,20413,1199,1.22 [1.10-1.36],0.000233501577677
