Protein,Protein_definition,Disease_category,Disease,NB_individual,NB_case,HR[95%CI],P_value
DOK2,Docking protein 2,Chapter III Diseases of the blood and blood-forming organs and certain disorders involving the immune mechanism,Purpura and other haemorrhagic conditions,23569,312,0.80 [0.74-0.87],2.352612114168302e-07
DOK2,Docking protein 2,Chapter III Diseases of the blood and blood-forming organs and certain disorders involving the immune mechanism,"Thrombocytopenia, unspecified",23509,252,0.77 [0.70-0.84],1.61497348621368e-08
DOK2,Docking protein 2,"Chapter IV Endocrine, nutritional and metabolic diseases",Disorders of lipoprotein metabolism and other lipidaemias,20969,3876,1.05 [1.02-1.07],0.0001479319192752
DOK2,Docking protein 2,Chapter IX Diseases of the circulatory system,Hypertension,21168,6742,1.03 [1.01-1.05],0.0005510278150311
DOK2,Docking protein 2,Chapter IX Diseases of the circulatory system,"Hypertension, essential",21191,6765,1.03 [1.01-1.05],0.000775994455901
