Protein,Protein_definition,Disease_category,Disease,NB_individual,NB_case,HR[95%CI],P_value
ATXN10,Ataxin-10,Chapter III Diseases of the blood and blood-forming organs and certain disorders involving the immune mechanism,Purpura and other haemorrhagic conditions,23050,312,0.72 [0.63-0.82],1.4069021873744386e-06
ATXN10,Ataxin-10,Chapter III Diseases of the blood and blood-forming organs and certain disorders involving the immune mechanism,"Thrombocytopenia, unspecified",22991,253,0.69 [0.60-0.80],8.762618932442501e-07
ATXN10,Ataxin-10,Chapter IX Diseases of the circulatory system,Hypotension,23061,1208,1.13 [1.05-1.21],0.0007026801767558
ATXN10,Ataxin-10,Chapter X Diseases of the respiratory system,Other diseases of pleura,22931,2145,1.11 [1.05-1.17],0.0002358961913652
ATXN10,Ataxin-10,Chapter X Diseases of the respiratory system,Other respiratory disorders and diseases,23083,1363,1.13 [1.06-1.21],0.0003478545789443
