Protein,Protein_definition,Disease_category,Disease,NB_individual,NB_case,HR[95%CI],P_value
ITPA,Inosine triphosphate pyrophosphatase,Chapter III Diseases of the blood and blood-forming organs and certain disorders involving the immune mechanism,Folate deficiency anaemia,18854,51,1.93 [1.37-2.71],0.0001629319602544
ITPA,Inosine triphosphate pyrophosphatase,"Chapter IV Endocrine, nutritional and metabolic diseases",Depression,19614,919,1.17 [1.07-1.29],0.0008010132886266
ITPA,Inosine triphosphate pyrophosphatase,"Chapter VII Diseases of the eye, adnexa, ear and mastoid process",Disorders of vitreous body,19790,124,1.49 [1.18-1.89],0.000810544846412
ITPA,Inosine triphosphate pyrophosphatase,Chapter XI Diseases of the digestive system,Other inflammatory liver diseases,19091,79,0.55 [0.39-0.76],0.0004168449645116
ITPA,Inosine triphosphate pyrophosphatase,Chapter XII Diseases of the skin and subcutaneous tissue,Seborrhoeic keratosis,18375,219,0.69 [0.57-0.85],0.0004027061701394
