Protein,Protein_definition,Disease_category,Disease,NB_individual,NB_case,HR[95%CI],P_value
PECR,Peroxisomal trans-2-enoyl-CoA reductase,Chapter III Diseases of the blood and blood-forming organs and certain disorders involving the immune mechanism,Idiopathic thrombocytopenic purpura,23641,29,2.78 [1.58-4.89],0.0003961970154376
PECR,Peroxisomal trans-2-enoyl-CoA reductase,Chapter IX Diseases of the circulatory system,Coronary atherosclerosis,23309,1167,1.33 [1.13-1.58],0.0008385970695119
PECR,Peroxisomal trans-2-enoyl-CoA reductase,Chapter XI Diseases of the digestive system,Embedded and impacted teeth,23825,69,2.23 [1.41-3.52],0.0005524141413088
PECR,Peroxisomal trans-2-enoyl-CoA reductase,Chapter XI Diseases of the digestive system,Impacted teeth,23834,65,2.29 [1.45-3.61],0.0003859721916255
PECR,Peroxisomal trans-2-enoyl-CoA reductase,Chapter XI Diseases of the digestive system,Intestinal malabsorption,22709,113,2.04 [1.39-3.00],0.0002989759574005
PECR,Peroxisomal trans-2-enoyl-CoA reductase,Chapter XIII Diseases of the musculoskeletal system and connective tissue,Polymyalgia rheumatica,23515,77,2.46 [1.69-3.59],2.743394887205677e-06
PECR,Peroxisomal trans-2-enoyl-CoA reductase,Chapter XIV Diseases of the genitourinary system,Other diseases of urinary system,23188,1329,1.33 [1.13-1.56],0.000436156998398
