Protein,Protein_definition,Disease_category,Disease,NB_individual,NB_case,HR[95%CI],P_value
PAIP2B,Polyadenylate-binding protein-interacting protein 2B,Chapter II Neoplasms,Melanocytic naevi,23504,191,0.55 [0.41-0.74],8.993953874527254e-05
PAIP2B,Polyadenylate-binding protein-interacting protein 2B,Chapter III Diseases of the blood and blood-forming organs and certain disorders involving the immune mechanism,Idiopathic thrombocytopenic purpura,23411,27,2.03 [1.42-2.89],9.020343398751674e-05
PAIP2B,Polyadenylate-binding protein-interacting protein 2B,"Chapter IV Endocrine, nutritional and metabolic diseases",Hypo-osmolality and hyponatraemia,20431,260,1.39 [1.15-1.68],0.0007233224846596
PAIP2B,Polyadenylate-binding protein-interacting protein 2B,Chapter IX Diseases of the circulatory system,Angina pectoris,22617,698,0.77 [0.66-0.90],0.0007235989771565
PAIP2B,Polyadenylate-binding protein-interacting protein 2B,Chapter IX Diseases of the circulatory system,Other pulmonary heart/vessel disease,23314,137,1.64 [1.31-2.06],1.7273702652741356e-05
PAIP2B,Polyadenylate-binding protein-interacting protein 2B,Chapter IX Diseases of the circulatory system,Secondary right heart disease,23311,134,1.66 [1.32-2.08],1.2680225712723828e-05
PAIP2B,Polyadenylate-binding protein-interacting protein 2B,Chapter XI Diseases of the digestive system,Coeliac disease,22478,93,1.85 [1.47-2.32],9.47742479045024e-08
PAIP2B,Polyadenylate-binding protein-interacting protein 2B,Chapter XI Diseases of the digestive system,Intestinal malabsorption,22497,112,1.78 [1.43-2.21],1.958679702716871e-07
PAIP2B,Polyadenylate-binding protein-interacting protein 2B,Chapter XII Diseases of the skin and subcutaneous tissue,Pruritus,23340,52,1.77 [1.29-2.44],0.0004214939605648
