Protein,Protein_definition,Disease_category,Disease,NB_individual,NB_case,HR[95%CI],P_value
CDH22,Cadherin-22,Chapter II Neoplasms,Benign lipomatous neoplasm of skin and subcutaneous tissue of limbs,24097,63,2.44 [1.56-3.82],9.744634338739683e-05
CDH22,Cadherin-22,Chapter II Neoplasms,"Malignant neoplasm of oesophagus, excluding all cancers (controls excluding all cancers)",20876,62,2.47 [1.51-4.03],0.0003087077536153
CDH22,Cadherin-22,Chapter III Diseases of the blood and blood-forming organs and certain disorders involving the immune mechanism,Other coagulation defects,23929,93,2.14 [1.38-3.33],0.0007456267856846
CDH22,Cadherin-22,"Chapter IV Endocrine, nutritional and metabolic diseases","Hyperlipidaemia, other/unspecified",20914,342,0.47 [0.31-0.71],0.0003305953255723
CDH22,Cadherin-22,Chapter VI Diseases of the nervous system,Postviral fatigue syndrome,23732,56,2.27 [1.40-3.66],0.0008052452005814
