Protein,Protein_definition,Disease_category,Disease,NB_individual,NB_case,HR[95%CI],P_value
AKT2,RAC-beta serine/threonine-protein kinase,"Chapter IV Endocrine, nutritional and metabolic diseases",Disorders of lipoprotein metabolism and other lipidaemias,23050,2132,1.08 [1.05-1.12],2.117839549690047e-06
AKT2,RAC-beta serine/threonine-protein kinase,"Chapter IV Endocrine, nutritional and metabolic diseases",Metabolic disorders,23963,3045,1.07 [1.04-1.09],5.31078953990936e-06
AKT2,RAC-beta serine/threonine-protein kinase,Chapter IX Diseases of the circulatory system,Hypertension,23348,4399,1.04 [1.02-1.06],0.0007799222360764
AKT2,RAC-beta serine/threonine-protein kinase,Chapter IX Diseases of the circulatory system,"Hypertension, essential",23356,4407,1.04 [1.02-1.06],0.0009131399514433
AKT2,RAC-beta serine/threonine-protein kinase,Chapter XI Diseases of the digestive system,Ulcerative colitis,23279,134,1.28 [1.12-1.46],0.0002217685565215
AKT2,RAC-beta serine/threonine-protein kinase,Chapter XIV Diseases of the genitourinary system,Irregular menses,13275,108,0.79 [0.68-0.91],0.0009992509129757
