Protein,Protein_definition,Disease_category,Disease,NB_individual,NB_case,HR[95%CI],P_value
MMUT,"Methylmalonyl-CoA mutase, mitochondrial",Chapter III Diseases of the blood and blood-forming organs and certain disorders involving the immune mechanism,Idiopathic thrombocytopenic purpura,23540,28,2.42 [1.72-3.39],3.013164399061786e-07
MMUT,"Methylmalonyl-CoA mutase, mitochondrial","Chapter IV Endocrine, nutritional and metabolic diseases",Other and/or unspecified nontoxic goitre,22403,31,2.15 [1.40-3.30],0.0004899342633735
MMUT,"Methylmalonyl-CoA mutase, mitochondrial",Chapter VI Diseases of the nervous system,Inflammatory diseases of the central nervous system,23822,59,1.84 [1.30-2.59],0.0005364060271623
MMUT,"Methylmalonyl-CoA mutase, mitochondrial",Chapter XI Diseases of the digestive system,Fibrosis and cirrhosis of liver,23186,90,1.75 [1.31-2.33],0.0001329109261755
MMUT,"Methylmalonyl-CoA mutase, mitochondrial",Chapter XI Diseases of the digestive system,Intestinal malabsorption,22618,116,1.62 [1.23-2.13],0.0005853169545168
MMUT,"Methylmalonyl-CoA mutase, mitochondrial",Chapter XI Diseases of the digestive system,Ulcerative colitis,22568,129,1.66 [1.28-2.14],0.0001057636546539
