Protein,Protein_definition,Disease_category,Disease,NB_individual,NB_case,HR[95%CI],P_value
RALY,RNA-binding protein Raly,Chapter II Neoplasms,"Chronic lymphocytic leukaemia and small lyphocytis leukaemia, excluding all cancers (controls excluding all cancers)",21126,29,2.08 [1.56-2.79],7.77335174438631e-07
RALY,RNA-binding protein Raly,Chapter II Neoplasms,Lymphoid leukaemia,21124,27,2.10 [1.58-2.78],2.750822414671193e-07
RALY,RNA-binding protein Raly,"Chapter IV Endocrine, nutritional and metabolic diseases",Alcohol dependence,22799,125,1.43 [1.16-1.77],0.0008202610319136
RALY,RNA-binding protein Raly,"Chapter IV Endocrine, nutritional and metabolic diseases",Type 2 diabetes without complications,24147,1349,1.29 [1.19-1.40],5.718354701346641e-10
RALY,RNA-binding protein Raly,Chapter VIII Diseases of the ear and mastoid process,Sensorineural hearing loss,24031,88,1.57 [1.23-2.01],0.0003050142488375
RALY,RNA-binding protein Raly,Chapter XI Diseases of the digestive system,Palatinal maxillary canine,24374,83,1.56 [1.20-2.03],0.0008150207573724
RALY,RNA-binding protein Raly,Chapter XIII Diseases of the musculoskeletal system and connective tissue,Seronegative rheumatoid arthritis,20724,43,1.73 [1.30-2.31],0.0001738570966502
