Protein,Protein_definition,Disease_category,Disease,NB_individual,NB_case,HR[95%CI],P_value
IL9,Interleukin-9,"Chapter IV Endocrine, nutritional and metabolic diseases","Disorders of plasma-protein metabolism, not elsewhere classified",20606,34,1.68 [1.25-2.25],0.000509343836655
IL9,Interleukin-9,Chapter IX Diseases of the circulatory system,Other diseases of pericardium,21942,114,1.41 [1.15-1.72],0.0009416816379768
IL9,Interleukin-9,Chapter VI Diseases of the nervous system,Lesion of plantar nerve,22705,70,1.56 [1.27-1.91],1.854046794272573e-05
IL9,Interleukin-9,Chapter X Diseases of the respiratory system,Pulmonary oedema,23975,34,1.74 [1.36-2.22],1.0587157489257584e-05
IL9,Interleukin-9,Chapter XII Diseases of the skin and subcutaneous tissue,Infections of the skin and subcutaneous tissue,23823,701,1.22 [1.10-1.35],0.0001769433777889
IL9,Interleukin-9,Chapter XIII Diseases of the musculoskeletal system and connective tissue,Systemic lupus erythematosus,23805,140,1.36 [1.13-1.63],0.000884164318546
