Protein,Protein_definition,Disease_category,Disease,NB_individual,NB_case,HR[95%CI],P_value
RPE,Ribulose-phosphate 3-epimerase,Chapter III Diseases of the blood and blood-forming organs and certain disorders involving the immune mechanism,Diseases of the blood and blood-forming organs and certain disorders involving the immune mechanism,23468,1935,1.11 [1.04-1.17],0.0006890175743011
RPE,Ribulose-phosphate 3-epimerase,"Chapter IV Endocrine, nutritional and metabolic diseases",Disorders of lipoprotein metabolism and other lipidaemias,22664,2092,1.10 [1.04-1.17],0.0004752377016517
RPE,Ribulose-phosphate 3-epimerase,"Chapter IV Endocrine, nutritional and metabolic diseases",Type 2 diabetes without complications,23816,1324,1.13 [1.06-1.22],0.0003899252714533
RPE,Ribulose-phosphate 3-epimerase,"Chapter VII Diseases of the eye, adnexa, ear and mastoid process",Retinal detachment with retinal break,23627,109,1.42 [1.16-1.74],0.0008419091823137
RPE,Ribulose-phosphate 3-epimerase,Chapter XI Diseases of the digestive system,Coeliac disease,22923,94,1.83 [1.52-2.20],2.1411718630854622e-10
RPE,Ribulose-phosphate 3-epimerase,Chapter XI Diseases of the digestive system,Intestinal malabsorption,22942,113,1.75 [1.47-2.09],5.234484192102551e-10
