Protein,Protein_definition,Disease_category,Disease,NB_individual,NB_case,HR[95%CI],P_value
TSNAX,Translin-associated protein X,Chapter III Diseases of the blood and blood-forming organs and certain disorders involving the immune mechanism,Idiopathic thrombocytopenic purpura,23540,28,3.39 [1.77-6.48],0.0002252152978038
TSNAX,Translin-associated protein X,"Chapter IV Endocrine, nutritional and metabolic diseases",Disorders of lipoprotein metabolism and other lipidaemias,22349,2077,1.24 [1.12-1.37],3.481537272838461e-05
TSNAX,Translin-associated protein X,"Chapter IV Endocrine, nutritional and metabolic diseases",Metabolic disorders,23238,2966,1.20 [1.10-1.31],3.160030337572316e-05
TSNAX,Translin-associated protein X,"Chapter VII Diseases of the eye, adnexa, ear and mastoid process",Retinal detachment with retinal break,23302,104,2.08 [1.39-3.10],0.0003622547237184
TSNAX,Translin-associated protein X,Chapter XI Diseases of the digestive system,Coeliac disease,22599,97,2.06 [1.35-3.12],0.0007172163610821
TSNAX,Translin-associated protein X,Chapter XIII Diseases of the musculoskeletal system and connective tissue,Osteoporosis,23117,574,1.39 [1.15-1.68],0.0006900591644005
TSNAX,Translin-associated protein X,Chapter XIV Diseases of the genitourinary system,"Excessive, frequent and irregular menstruation",9927,330,0.59 [0.44-0.78],0.0002093822622207
