Protein,Protein_definition,Disease_category,Disease,NB_individual,NB_case,HR[95%CI],P_value
PDCL2,Phosducin-like protein 2,Chapter I Certain infectious and parasitic diseases,Implicit Sepsis,30181,3190,1.09 [1.03-1.16],0.0052288697797372
PDCL2,Phosducin-like protein 2,Chapter II Neoplasms,Benign lipomatous neoplasm of skin and subcutaneous tissue of limbs,43042,96,1.44 [1.13-1.83],0.003190265061283
PDCL2,Phosducin-like protein 2,Chapter II Neoplasms,Benign neoplasm: Transverse colon,43138,700,1.20 [1.07-1.35],0.0024829540617572
PDCL2,Phosducin-like protein 2,Chapter IX Diseases of the circulatory system,"Other specified cerebrovascular diseases, other cerebrovascular disorders in diseases classified elsewhere",41736,1001,1.15 [1.04-1.27],0.0067826945072042
PDCL2,Phosducin-like protein 2,Chapter XI Diseases of the digestive system,Crohn's disease NAS,40391,137,0.54 [0.36-0.83],0.0043054384596251
PDCL2,Phosducin-like protein 2,Chapter XII Diseases of the skin and subcutaneous tissue,Other and unspecified erythematous conditions,43040,134,0.57 [0.37-0.86],0.0082557849781988
PDCL2,Phosducin-like protein 2,Chapter XIII Diseases of the musculoskeletal system and connective tissue,Hallux valgus (acquired),30465,557,1.22 [1.07-1.38],0.0019200803722131
PDCL2,Phosducin-like protein 2,Chapter XIV Diseases of the genitourinary system,Hydrocele,16250,174,1.35 [1.10-1.65],0.0040449220714438
