Protein,Protein_definition,Disease_category,Disease,NB_individual,NB_case,HR[95%CI],P_value
MRPS16,"28S ribosomal protein S16, mitochondrial",Chapter II Neoplasms,"Benign neoplasm of colon, rectum, anus and anal canal",42928,2425,0.81 [0.70-0.94],0.0057498616886043
MRPS16,"28S ribosomal protein S16, mitochondrial",Chapter III Diseases of the blood and blood-forming organs and certain disorders involving the immune mechanism,Agranulocytosis,42989,583,1.34 [1.07-1.68],0.0098048621584349
MRPS16,"28S ribosomal protein S16, mitochondrial",Chapter III Diseases of the blood and blood-forming organs and certain disorders involving the immune mechanism,Idiopathic thrombocytopenic purpura,42791,86,1.83 [1.18-2.84],0.0066058330517712
MRPS16,"28S ribosomal protein S16, mitochondrial",Chapter V Mental and behavioural disorders,Vascular dementia,42699,212,0.40 [0.21-0.75],0.0041911610355402
MRPS16,"28S ribosomal protein S16, mitochondrial",Chapter VI Diseases of the nervous system,Vascular dementia (undefined),42632,205,0.41 [0.22-0.78],0.0067062211427836
MRPS16,"28S ribosomal protein S16, mitochondrial",Chapter XI Diseases of the digestive system,Coeliac disease,40789,206,2.38 [1.94-2.92],5.882611868726032e-17
MRPS16,"28S ribosomal protein S16, mitochondrial",Chapter XI Diseases of the digestive system,Hernia,40750,5397,1.12 [1.03-1.22],0.0096654364914065
MRPS16,"28S ribosomal protein S16, mitochondrial",Chapter XI Diseases of the digestive system,Intestinal malabsorption,40829,246,2.20 [1.79-2.69],4.6300138779884927e-14
MRPS16,"28S ribosomal protein S16, mitochondrial",Chapter XIV Diseases of the genitourinary system,Other noninflammatory disorders of vagina,17612,101,1.78 [1.20-2.66],0.0045954456868903
