Protein,Protein_definition,Disease_category,Disease,NB_individual,NB_case,HR[95%CI],P_value
PGM2,Phosphoglucomutase-2,Chapter II Neoplasms,"Non-Hodgkin lymphoma, all, excluding all cancers (controls excluding all cancers)",34892,262,1.29 [1.13-1.49],0.0002848827103421
PGM2,Phosphoglucomutase-2,Chapter II Neoplasms,"Other and unspecified types of non-Hodgkin lymphoma, hilmo, excluding all cancers",34791,161,1.35 [1.14-1.59],0.0004566203729664
PGM2,Phosphoglucomutase-2,"Chapter IV Endocrine, nutritional and metabolic diseases",Obesity,43256,3246,0.91 [0.86-0.97],0.0040956528058265
PGM2,Phosphoglucomutase-2,"Chapter IV Endocrine, nutritional and metabolic diseases","Obesity, other/unspecified",43257,3241,0.91 [0.86-0.97],0.0038936474945739
PGM2,Phosphoglucomutase-2,Chapter VI Diseases of the nervous system,Memory loss,42521,194,1.35 [1.15-1.58],0.0001824167541788
PGM2,Phosphoglucomutase-2,Chapter VI Diseases of the nervous system,MS-disease / Multiple Sclerosis,43265,183,0.61 [0.44-0.85],0.0040317301802001
PGM2,Phosphoglucomutase-2,"Chapter VII Diseases of the eye, adnexa, ear and mastoid process",Epiphora,41862,97,1.35 [1.09-1.67],0.0063486329896441
PGM2,Phosphoglucomutase-2,Chapter XI Diseases of the digestive system,"Inguinal hernia, bilateral",35574,170,1.26 [1.06-1.50],0.0080753098279822
