Protein,Protein_definition,Disease_category,Disease,NB_individual,NB_case,HR[95%CI],P_value
COPE,Coatomer subunit epsilon,Chapter X Diseases of the respiratory system,All influenza (not pneumonia),46366,225,1.30 [1.08-1.57],0.0063755957090891
COPE,Coatomer subunit epsilon,Chapter XII Diseases of the skin and subcutaneous tissue,"Cutaneous abscess, furuncle and carbuncle",48050,339,1.27 [1.08-1.49],0.0034283665505227
COPE,Coatomer subunit epsilon,Chapter XIII Diseases of the musculoskeletal system and connective tissue,"Gout, unspecified",50169,1147,1.15 [1.04-1.27],0.0054224921327604
COPE,Coatomer subunit epsilon,Chapter XIII Diseases of the musculoskeletal system and connective tissue,Other specified/unspecified soft tissue disorders,44047,1075,1.15 [1.04-1.28],0.0055078254859099
COPE,Coatomer subunit epsilon,Chapter XIII Diseases of the musculoskeletal system and connective tissue,"Seropositive rheumatoid arthritis, wide",50277,109,1.45 [1.15-1.83],0.0015719442103857
COPE,Coatomer subunit epsilon,Chapter XIV Diseases of the genitourinary system,Other specified disorders of kidney and ureter,49567,307,1.33 [1.14-1.56],0.0003633914940917
