Protein,Protein_definition,Disease_category,Disease,NB_individual,NB_case,HR[95%CI],P_value
HCG22,Protein PBMUCL2,"Chapter IV Endocrine, nutritional and metabolic diseases",Hyperkalaemia,33560,446,1.18 [1.04-1.33],0.008478398508845
HCG22,Protein PBMUCL2,Chapter IX Diseases of the circulatory system,Other aneurysm,41286,121,1.30 [1.07-1.57],0.0068621306212246
HCG22,Protein PBMUCL2,Chapter VI Diseases of the nervous system,Cerebral palsy and other paralytic syndromes,43183,504,1.19 [1.06-1.34],0.0024801595889043
HCG22,Protein PBMUCL2,Chapter VI Diseases of the nervous system,Hemiplegia,43075,396,1.22 [1.08-1.38],0.0013134157833049
HCG22,Protein PBMUCL2,"Chapter VII Diseases of the eye, adnexa, ear and mastoid process",Other strabismus,42070,91,1.34 [1.09-1.66],0.0066874549208185
HCG22,Protein PBMUCL2,Chapter XI Diseases of the digestive system,Oesophageal obstruction,32836,308,0.68 [0.51-0.91],0.0091751308522615
HCG22,Protein PBMUCL2,Chapter XIV Diseases of the genitourinary system,Pain and other conditions associated with female genital organs and menstrual cycle,17532,90,0.43 [0.23-0.80],0.0079839731904585
