Protein,Protein_definition,Disease_category,Disease,NB_individual,NB_case,HR[95%CI],P_value
MLLT1,Protein ENL,Chapter II Neoplasms,Benign lipomatous neoplasm of skin and subcutaneous tissue of trunk,43002,105,0.59 [0.42-0.84],0.0036388501049471
MLLT1,Protein ENL,Chapter IX Diseases of the circulatory system,Other other unspecified disorders of the circulatory system,41181,88,1.45 [1.19-1.77],0.0002227401877273
MLLT1,Protein ENL,Chapter X Diseases of the respiratory system,Interstitial lung disease,41021,544,1.18 [1.06-1.31],0.0025447522548591
MLLT1,Protein ENL,Chapter X Diseases of the respiratory system,Other respiratory diseases principally affecting the interstitium,43020,674,1.16 [1.05-1.27],0.0032454699817102
MLLT1,Protein ENL,Chapter X Diseases of the respiratory system,Pleural effusion,41109,1624,1.11 [1.05-1.19],0.0009042311634743
MLLT1,Protein ENL,Chapter XII Diseases of the skin and subcutaneous tissue,Lupus erythematosus,39662,104,1.37 [1.13-1.66],0.0013144022974785
