Protein,Protein_definition,Disease_category,Disease,NB_individual,NB_case,HR[95%CI],P_value
CD82,CD82 antigen,Chapter VI Diseases of the nervous system,Other facial nerve disorders,40987,163,1.45 [1.14-1.85],0.0025830571175343
CD82,CD82 antigen,"Chapter VII Diseases of the eye, adnexa, ear and mastoid process",Corneal degeneration,43536,250,1.34 [1.07-1.68],0.009764610623901
CD82,CD82 antigen,"Chapter VII Diseases of the eye, adnexa, ear and mastoid process",Disorders of lacrimal system,42547,371,1.33 [1.11-1.60],0.0019297992940325
CD82,CD82 antigen,Chapter X Diseases of the respiratory system,Other diseases of pleura,43566,3366,1.12 [1.04-1.21],0.0028765902094201
CD82,CD82 antigen,Chapter X Diseases of the respiratory system,Other respiratory disorders and diseases,43785,2197,1.14 [1.04-1.25],0.0046741340013967
CD82,CD82 antigen,Chapter XIII Diseases of the musculoskeletal system and connective tissue,Other specified/unspecified disorders of  bone/cartilage,40597,197,0.53 [0.35-0.82],0.0045644268395141
CD82,CD82 antigen,Chapter XIII Diseases of the musculoskeletal system and connective tissue,Synovial cyst of popliteal space [Baker],37612,87,1.54 [1.15-2.07],0.0037146334628463
CD82,CD82 antigen,Chapter XIV Diseases of the genitourinary system,Uterine polyps,17805,119,1.54 [1.17-2.02],0.0017612133046509
