Protein,Protein_definition,Disease_category,Disease,NB_individual,NB_case,HR[95%CI],P_value
AOC1,Amiloride-sensitive amine oxidase [copper-containing],Chapter II Neoplasms,Benign lipomatous neoplasm of skin and subcutaneous tissue of trunk,50349,123,1.40 [1.17-1.68],0.0003082316278331
AOC1,Amiloride-sensitive amine oxidase [copper-containing],Chapter II Neoplasms,"Malignant neoplasm of prostate, excluding all cancers (controls excluding all cancers)",19412,1356,0.87 [0.78-0.96],0.0042854981486581
AOC1,Amiloride-sensitive amine oxidase [copper-containing],Chapter IX Diseases of the circulatory system,"Atherosclerosis, excluding cerebral and coronary sclerosis",48413,395,1.24 [1.09-1.40],0.0010331362850067
AOC1,Amiloride-sensitive amine oxidase [copper-containing],Chapter X Diseases of the respiratory system,Emphysema,43761,609,1.16 [1.04-1.29],0.0086546863260166
AOC1,Amiloride-sensitive amine oxidase [copper-containing],Chapter XI Diseases of the digestive system,"Duodenal ulcer - Unspecified as acute or chronic, without haemorrhage or perforation, drug-induced",50385,319,0.73 [0.59-0.91],0.0056659633980793
AOC1,Amiloride-sensitive amine oxidase [copper-containing],Chapter XI Diseases of the digestive system,Gastro-oesophageal reflux disease,42750,4884,0.94 [0.89-0.98],0.0079564273735842
AOC1,Amiloride-sensitive amine oxidase [copper-containing],Chapter XIII Diseases of the musculoskeletal system and connective tissue,"Other (seronegative) rheumatoid arthritis, wide",50268,878,1.14 [1.04-1.25],0.0054852910407449
AOC1,Amiloride-sensitive amine oxidase [copper-containing],Chapter XIII Diseases of the musculoskeletal system and connective tissue,Other/unspecified rheumatoid arthritis,50292,854,1.14 [1.04-1.25],0.0063620550311446
