Protein,Protein_definition,Disease_category,Disease,NB_individual,NB_case,OR[95%CI],P_value
AMOTL2,Angiomotin-like protein 2,Chapter I Certain infectious and parasitic diseases,Implicit Sepsis,13058,671,1.31 [1.13-1.51],0.0002473557687305
AMOTL2,Angiomotin-like protein 2,"Chapter IV Endocrine, nutritional and metabolic diseases","Other disorders of fluid, electrolyte and acid-base balance",14888,82,1.71 [1.27-2.31],0.000391160347183
AMOTL2,Angiomotin-like protein 2,Chapter IX Diseases of the circulatory system,Hypertensive Renal Disease,12541,63,1.98 [1.46-2.69],1.1739814759482108e-05
AMOTL2,Angiomotin-like protein 2,Chapter X Diseases of the respiratory system,Other respiratory diseases principally affecting the interstitium,20008,97,1.69 [1.27-2.23],0.0002729829526035
AMOTL2,Angiomotin-like protein 2,Chapter XIV Diseases of the genitourinary system,Chronic kidney disease,18168,54,2.19 [1.66-2.89],3.687908796597997e-08
AMOTL2,Angiomotin-like protein 2,Chapter XIV Diseases of the genitourinary system,Other disorders of kidney and ureter,19962,59,1.96 [1.47-2.62],5.46296260693722e-06
