Protein,Protein_definition,Disease_category,Disease,NB_individual,NB_case,OR[95%CI],P_value
LTA,Lymphotoxin-alpha,Chapter III Diseases of the blood and blood-forming organs and certain disorders involving the immune mechanism,Diseases of the blood and blood-forming organs and certain disorders involving the immune mechanism,20948,565,1.48 [1.22-1.78],4.343771185401269e-05
LTA,Lymphotoxin-alpha,Chapter IX Diseases of the circulatory system,Atrial fibrillation and flutter,12169,601,1.54 [1.26-1.89],2.6873088331868446e-05
LTA,Lymphotoxin-alpha,Chapter X Diseases of the respiratory system,Influenza and pneumonia,21569,249,1.59 [1.23-2.05],0.0003928968809594
LTA,Lymphotoxin-alpha,Chapter XIII Diseases of the musculoskeletal system and connective tissue,Rheumatoid arthritis,16985,88,2.54 [1.83-3.52],2.850770393874389e-08
LTA,Lymphotoxin-alpha,Chapter XIII Diseases of the musculoskeletal system and connective tissue,"Other (seronegative) rheumatoid arthritis, wide",23422,85,2.50 [1.82-3.42],1.1561709007597941e-08
LTA,Lymphotoxin-alpha,Chapter XIII Diseases of the musculoskeletal system and connective tissue,Other/unspecified rheumatoid arthritis,23427,75,2.30 [1.61-3.29],4.589346918480393e-06
