Protein,Protein_definition,Disease_category,Disease,NB_individual,NB_case,OR[95%CI],P_value
GAS2,Growth arrest-specific protein 2,Chapter I Certain infectious and parasitic diseases,Implicit bacterial Sepsis,16807,198,1.42 [1.17-1.72],0.0003726044959514
GAS2,Growth arrest-specific protein 2,"Chapter VII Diseases of the eye, adnexa, ear and mastoid process",Senile cataract,17684,118,1.54 [1.25-1.88],3.971717259576934e-05
GAS2,Growth arrest-specific protein 2,Chapter XII Diseases of the skin and subcutaneous tissue,Dermatitis and eczema,19814,85,1.68 [1.36-2.08],1.3555010146408544e-06
GAS2,Growth arrest-specific protein 2,Chapter XIII Diseases of the musculoskeletal system and connective tissue,Other specified/unspecified arthritis,14549,136,1.50 [1.21-1.86],0.0001741714628732
GAS2,Growth arrest-specific protein 2,Chapter XIII Diseases of the musculoskeletal system and connective tissue,Other deformities of toe(s),14434,21,2.13 [1.48-3.08],4.913216347182368e-05
GAS2,Growth arrest-specific protein 2,Chapter XIII Diseases of the musculoskeletal system and connective tissue,Other specified/unspecified disorders of  bone/cartilage,19285,44,1.65 [1.25-2.20],0.0004803842761731
