Protein,Protein_definition,Disease_category,Disease,NB_individual,NB_case,OR[95%CI],P_value
MYO9B,Unconventional myosin-IXb,Chapter IX Diseases of the circulatory system,Atrial fibrillation and flutter,11998,599,0.78 [0.68-0.89],0.0002496971299951
MYO9B,Unconventional myosin-IXb,Chapter IX Diseases of the circulatory system,Other or ill-defined heart diseases,18255,125,0.59 [0.44-0.80],0.0004606876021176
MYO9B,Unconventional myosin-IXb,Chapter XI Diseases of the digestive system,Dental caries,22571,104,1.45 [1.17-1.79],0.0006551266596006
MYO9B,Unconventional myosin-IXb,Chapter XII Diseases of the skin and subcutaneous tissue,"Other disorders of skin and subcutaneous tissue, not elsewhere classified",21430,175,1.33 [1.13-1.58],0.0008267145901821
MYO9B,Unconventional myosin-IXb,Chapter XIII Diseases of the musculoskeletal system and connective tissue,Other/unspecified rheumatoid arthritis,23044,75,1.54 [1.22-1.96],0.0003803029533888
