Protein,Protein_definition,Disease_category,Disease,NB_individual,NB_case,OR[95%CI],P_value
SDHB,Succinate dehydrogenase,Chapter III Diseases of the blood and blood-forming organs and certain disorders involving the immune mechanism,Other anaemias,19180,201,1.37 [1.15-1.62],0.0003246311790399
SDHB,Succinate dehydrogenase,Chapter III Diseases of the blood and blood-forming organs and certain disorders involving the immune mechanism,Other and unspecified anaemias,19180,201,1.37 [1.15-1.62],0.0003246311790399
SDHB,Succinate dehydrogenase,Chapter V Mental and behavioural disorders,"Alcohol use disorder, ICD-based",20078,178,1.39 [1.15-1.67],0.0005482252530316
SDHB,Succinate dehydrogenase,Chapter XI Diseases of the digestive system,Diaphragmatic hernia,16387,656,1.21 [1.09-1.36],0.0006267584921112
SDHB,Succinate dehydrogenase,Chapter XI Diseases of the digestive system,Diseases of liver,19750,121,1.78 [1.50-2.12],5.5192598844753935e-11
