Protein,Protein_definition,Disease_category,Disease,NB_individual,NB_case,HR[95%CI],P_value
MELTF,Melanotransferrin,Chapter III Diseases of the blood and blood-forming organs and certain disorders involving the immune mechanism,Other and unspecified iron deficiency,20373,909,1.57 [1.30-1.90],2.190763286752952e-06
MELTF,Melanotransferrin,"Chapter IV Endocrine, nutritional and metabolic diseases",Type 2 diabetes with renal complications,2122,60,6.66 [3.06-14.49],1.7121420240208508e-06
MELTF,Melanotransferrin,Chapter IX Diseases of the circulatory system,Hypertensive Renal Disease,12681,101,2.14 [1.51-3.02],1.6480142484301845e-05
MELTF,Melanotransferrin,"Chapter VII Diseases of the eye, adnexa, ear and mastoid process","Diabetic nephropathy, excluding more controls",2122,60,6.28 [2.90-13.62],3.2514531906282184e-06
MELTF,Melanotransferrin,"Chapter VII Diseases of the eye, adnexa, ear and mastoid process",Other disorders of optic [2nd] nerve and visual pathways,20551,46,2.76 [1.77-4.28],6.479874335165297e-06
MELTF,Melanotransferrin,Chapter XI Diseases of the digestive system,Chronic pancreatitis,19277,50,3.04 [1.96-4.72],6.953159377630146e-07
MELTF,Melanotransferrin,Chapter XIII Diseases of the musculoskeletal system and connective tissue,Other arthrosis,16279,1611,1.36 [1.18-1.57],2.3416606126285648e-05
MELTF,Melanotransferrin,Chapter XIV Diseases of the genitourinary system,Dialysis,18329,66,2.45 [1.65-3.66],1.060973714200065e-05
