Protein,Protein_definition,Disease_category,Disease,NB_individual,NB_case,HR[95%CI],P_value
FGF19,Fibroblast growth factor 19,"Chapter IV Endocrine, nutritional and metabolic diseases",Alcohol dependence,21800,190,1.62 [1.38-1.90],4.1323888821079536e-09
FGF19,Fibroblast growth factor 19,"Chapter IV Endocrine, nutritional and metabolic diseases",Type 2 diabetes without complications,23025,2168,0.89 [0.85-0.93],1.4078575130007857e-06
FGF19,Fibroblast growth factor 19,Chapter IX Diseases of the circulatory system,Hypertensive Renal Disease,14663,169,1.43 [1.20-1.70],4.396456033838773e-05
FGF19,Fibroblast growth factor 19,Chapter V Mental and behavioural disorders,"Alcohol use disorder, ICD-based",23619,497,1.42 [1.28-1.57],1.0066422804060316e-11
FGF19,Fibroblast growth factor 19,Chapter V Mental and behavioural disorders,"Mental and behavioural disorders due to alcohol, excluding acute intoxication",23556,585,1.36 [1.24-1.49],1.5284368350812128e-10
FGF19,Fibroblast growth factor 19,Chapter X Diseases of the respiratory system,Pleural effusion,22467,1123,1.17 [1.10-1.26],2.674474564888868e-06
FGF19,Fibroblast growth factor 19,Chapter XI Diseases of the digestive system,Crohn disease,22418,93,0.59 [0.47-0.75],1.740080445908708e-05
FGF19,Fibroblast growth factor 19,Chapter XI Diseases of the digestive system,Crohn's disease NAS,22403,78,0.54 [0.41-0.70],3.3933766851812706e-06
FGF19,Fibroblast growth factor 19,Chapter XIV Diseases of the genitourinary system,Dialysis,21037,105,1.80 [1.45-2.24],8.567733524242303e-08
