Protein,Protein_definition,Disease_category,Disease,NB_individual,NB_case,HR[95%CI],P_value
SNCA,Alpha-synuclein,Chapter III Diseases of the blood and blood-forming organs and certain disorders involving the immune mechanism,Purpura and other haemorrhagic conditions,19961,258,0.78 [0.70-0.86],2.0524181208012213e-06
SNCA,Alpha-synuclein,Chapter III Diseases of the blood and blood-forming organs and certain disorders involving the immune mechanism,"Thrombocytopenia, unspecified",19912,209,0.73 [0.65-0.82],1.43618425699245e-07
SNCA,Alpha-synuclein,"Chapter IV Endocrine, nutritional and metabolic diseases",Disorders of lipoprotein metabolism and other lipidaemias,17819,3220,1.07 [1.04-1.10],5.159781828352029e-06
SNCA,Alpha-synuclein,Chapter IX Diseases of the circulatory system,Atrial fibrillation and flutter,11778,1911,0.92 [0.88-0.95],1.0428875771210355e-05
SNCA,Alpha-synuclein,Chapter XIV Diseases of the genitourinary system,Chronic nephritic syndrome,19901,46,0.59 [0.46-0.76],3.417769048429168e-05
