Protein,Protein_definition,Disease_category,Disease,NB_individual,NB_case,HR[95%CI],P_value
CTRC,Chymotrypsin-C,"Chapter IV Endocrine, nutritional and metabolic diseases",Type 1 diabetes without complications,20913,168,0.44 [0.37-0.52],4.520814372302191e-21
CTRC,Chymotrypsin-C,"Chapter IV Endocrine, nutritional and metabolic diseases",Type 2 diabetes without complications,22907,2162,0.88 [0.83-0.93],1.3698165021668588e-05
CTRC,Chymotrypsin-C,"Chapter VII Diseases of the eye, adnexa, ear and mastoid process",Background diabetic retinopathy,23497,291,0.72 [0.62-0.83],9.78847976280158e-06
CTRC,Chymotrypsin-C,Chapter XIV Diseases of the genitourinary system,Chronic kidney disease,22370,1549,1.15 [1.08-1.24],4.321207743680565e-05
CTRC,Chymotrypsin-C,Chapter XIV Diseases of the genitourinary system,Glomerular disorders in diseases classified elsewhere,23462,103,0.60 [0.47-0.76],2.36336888254088e-05
