Protein,Protein_definition,Disease_category,Disease,NB_individual,NB_case,OR[95%CI],P_value
DKK3,Dickkopf-related protein 3,Chapter I Certain infectious and parasitic diseases,Implicit bacterial Sepsis,24446,198,3.53 [2.36-5.28],8.298015019427391e-10
DKK3,Dickkopf-related protein 3,Chapter I Certain infectious and parasitic diseases,Implicit Sepsis,18699,777,1.96 [1.58-2.43],7.90116483447747e-10
DKK3,Dickkopf-related protein 3,Chapter II Neoplasms,"Malignant neoplasm of breast, excluding all cancers (controls excluding all cancers)",23502,678,2.26 [1.80-2.84],1.5111422004094942e-12
DKK3,Dickkopf-related protein 3,Chapter IX Diseases of the circulatory system,Atrial fibrillation and flutter,17046,284,4.74 [3.34-6.72],2.7501376791845064e-18
DKK3,Dickkopf-related protein 3,Chapter IX Diseases of the circulatory system,"Heart failure, strict",27242,105,5.31 [3.18-8.87],1.903296941069451e-10
DKK3,Dickkopf-related protein 3,Chapter XIV Diseases of the genitourinary system,Renal tubulo-interstitial diseases,25588,207,6.39 [4.35-9.37],2.4130167058854485e-21
