Protein,Protein_definition,Disease_category,Disease,NB_individual,NB_case,OR[95%CI],P_value
GAL,Galanin peptides,Chapter IX Diseases of the circulatory system,Death due to cardiac causes,20526,2821,0.79 [0.74-0.84],1.867355607041513e-13
GAL,Galanin peptides,Chapter IX Diseases of the circulatory system,"Ischaemic heart disease, wide definition",26195,736,0.69 [0.61-0.77],2.3437388082983382e-11
GAL,Galanin peptides,Chapter X Diseases of the respiratory system,Diseases of the respiratory system,22686,2129,0.80 [0.75-0.86],5.4901217875905645e-11
GAL,Galanin peptides,Chapter XIII Diseases of the musculoskeletal system and connective tissue,Diseases of the musculoskeletal system and connective tissue,19652,4459,0.84 [0.79-0.88],1.63696142099236e-12
GAL,Galanin peptides,Chapter XIII Diseases of the musculoskeletal system and connective tissue,Systemic lupus erythematosus,27070,224,0.45 [0.37-0.54],4.589362501090628e-16
