Protein,Protein_definition,Disease_category,Disease,NB_individual,NB_case,OR[95%CI],P_value
SLC39A14,Zinc transporter ZIP14,Chapter I Certain infectious and parasitic diseases,Implicit Sepsis,18020,748,1.74 [1.47-2.06],1.5032054331697992e-10
SLC39A14,Zinc transporter ZIP14,Chapter IX Diseases of the circulatory system,Hypertensive Renal Disease,18985,47,3.64 [2.64-5.01],3.017491812953487e-15
SLC39A14,Zinc transporter ZIP14,Chapter XIV Diseases of the genitourinary system,Renal tubulo-interstitial diseases,24673,195,2.70 [2.17-3.34],1.6133647788662969e-19
SLC39A14,Zinc transporter ZIP14,Chapter XIV Diseases of the genitourinary system,Chronic kidney disease,24852,44,3.73 [2.77-5.04],7.300536538233212e-18
SLC39A14,Zinc transporter ZIP14,Chapter XIV Diseases of the genitourinary system,Unspecified kidney failure,24849,41,3.25 [2.32-4.56],9.38052410460473e-12
