Protein,Protein_definition,Disease_category,Disease,NB_individual,NB_case,HR[95%CI],P_value
ACOT13,Acyl-coenzyme A thioesterase 13,Chapter III Diseases of the blood and blood-forming organs and certain disorders involving the immune mechanism,Other and unspecified iron deficiency,44048,1986,1.11 [1.07-1.16],1.6203912937428934e-08
ACOT13,Acyl-coenzyme A thioesterase 13,Chapter III Diseases of the blood and blood-forming organs and certain disorders involving the immune mechanism,"Thrombocytopenia, unspecified",44190,388,0.80 [0.74-0.87],3.783579848924489e-07
ACOT13,Acyl-coenzyme A thioesterase 13,Chapter IX Diseases of the circulatory system,Hypertension,40614,11244,1.04 [1.02-1.05],8.469227210060872e-06
ACOT13,Acyl-coenzyme A thioesterase 13,Chapter X Diseases of the respiratory system,Bronchiectasis,38609,600,1.18 [1.10-1.26],3.550427908674263e-06
ACOT13,Acyl-coenzyme A thioesterase 13,Chapter X Diseases of the respiratory system,Diseases of the respiratory system,41001,9023,1.04 [1.02-1.06],3.1789850286524948e-06
