Protein,Protein_definition,Disease_category,Disease,NB_individual,NB_case,HR[95%CI],P_value
LRRC59,Leucine-rich repeat-containing protein 59,Chapter I Certain infectious and parasitic diseases,Certain infectious and parasitic diseases,43219,5954,1.14 [1.09-1.20],1.109820171930599e-07
LRRC59,Leucine-rich repeat-containing protein 59,Chapter III Diseases of the blood and blood-forming organs and certain disorders involving the immune mechanism,Other and unspecified iron deficiency,44239,1994,1.22 [1.13-1.33],2.1121824943730173e-06
LRRC59,Leucine-rich repeat-containing protein 59,"Chapter IV Endocrine, nutritional and metabolic diseases",Disorders of lipoprotein metabolism and other lipidaemias,40332,6070,1.13 [1.08-1.19],5.075180477921227e-07
LRRC59,Leucine-rich repeat-containing protein 59,"Chapter IV Endocrine, nutritional and metabolic diseases",Metabolic disorders,42835,8573,1.12 [1.08-1.17],3.9110834099121455e-08
LRRC59,Leucine-rich repeat-containing protein 59,"Chapter IV Endocrine, nutritional and metabolic diseases",Type 2 diabetes without complications,43722,3201,1.19 [1.11-1.27],3.157938516426747e-07
LRRC59,Leucine-rich repeat-containing protein 59,Chapter X Diseases of the respiratory system,Bronchiectasis,38770,605,1.46 [1.27-1.68],1.8076874408632562e-07
LRRC59,Leucine-rich repeat-containing protein 59,Chapter XI Diseases of the digestive system,Noninfective enteritis and colitis,43459,1727,1.24 [1.13-1.35],3.2747140294288563e-06
