Protein,Protein_definition,Disease_category,Disease,NB_individual,NB_case,HR[95%CI],P_value
TPSD1,Tryptase delta,Chapter IX Diseases of the circulatory system,Other pulmonary heart/vessel disease,43642,606,1.42 [1.22-1.65],6.40676059356994e-06
TPSD1,Tryptase delta,Chapter XI Diseases of the digestive system,Coeliac disease,41957,205,1.65 [1.33-2.04],5.968107121571672e-06
TPSD1,Tryptase delta,Chapter XIV Diseases of the genitourinary system,Chronic kidney disease,42837,2323,1.37 [1.27-1.49],2.655538453429447e-15
TPSD1,Tryptase delta,Chapter XIV Diseases of the genitourinary system,Dialysis,40630,116,1.87 [1.47-2.38],3.439775671804417e-07
TPSD1,Tryptase delta,Chapter XIV Diseases of the genitourinary system,Renal tubulo-interstitial diseases,44333,4350,1.21 [1.13-1.29],4.499022354514285e-08
