Protein,Protein_definition,Disease_category,Disease,NB_individual,NB_case,HR[95%CI],P_value
KIFBP,KIF-binding protein,Chapter III Diseases of the blood and blood-forming organs and certain disorders involving the immune mechanism,Other and unspecified iron deficiency,50629,2367,1.12 [1.07-1.17],6.468950778134255e-07
KIFBP,KIF-binding protein,Chapter III Diseases of the blood and blood-forming organs and certain disorders involving the immune mechanism,"Thrombocytopenia, unspecified",50808,456,0.79 [0.72-0.87],2.98185261823838e-06
KIFBP,KIF-binding protein,"Chapter IV Endocrine, nutritional and metabolic diseases",Disorders of lipoprotein metabolism and other lipidaemias,46058,7026,1.07 [1.04-1.10],2.942984560794249e-07
KIFBP,KIF-binding protein,"Chapter IV Endocrine, nutritional and metabolic diseases",Metabolic disorders,48937,9905,1.06 [1.03-1.08],9.070236597051108e-07
KIFBP,KIF-binding protein,Chapter X Diseases of the respiratory system,Diseases of the respiratory system,47175,10434,1.05 [1.03-1.07],9.580594766770033e-06
