Protein,Protein_definition,Disease_category,Disease,Method,Nb_SNP,OR[95%CI],P_value
SMPDL3A,Acid sphingomyelinase-like phosphodiesterase 3a,Chapter V Mental and behavioural disorders,"Alcohol use disorder, ICD-based",Inverse variance weighted,83,1.00 [0.97-1.03],0.866768876991104
SMPDL3A,Acid sphingomyelinase-like phosphodiesterase 3a,"Chapter IV Endocrine, nutritional and metabolic diseases",Acute alcohol intoxication,Inverse variance weighted,83,1.01 [0.97-1.04],0.633336261582378
SMPDL3A,Acid sphingomyelinase-like phosphodiesterase 3a,"Chapter IV Endocrine, nutritional and metabolic diseases",Alcohol dependence,Inverse variance weighted,83,0.99 [0.96-1.02],0.543848010678477
SMPDL3A,Acid sphingomyelinase-like phosphodiesterase 3a,Chapter XI Diseases of the digestive system,Alcoholic liver disease,Inverse variance weighted,83,1.01 [0.95-1.08],0.73172600763264
SMPDL3A,Acid sphingomyelinase-like phosphodiesterase 3a,Chapter V Mental and behavioural disorders,"Substance abuse, excluding more controls",Inverse variance weighted,83,1.00 [0.97-1.03],0.959311400087574
