Protein,Protein_definition,Disease_category,Disease,Method,Nb_SNP,OR[95%CI],P_value
KLK7,Kallikrein-7,Chapter X Diseases of the respiratory system,"Asthma, unspecified (mode)",Inverse variance weighted,18,0.99 [0.93-1.06],0.878468020540647
KLK7,Kallikrein-7,Chapter X Diseases of the respiratory system,"Asthma, excluding more controls",Inverse variance weighted,18,0.98 [0.92-1.03],0.398913964097154
KLK7,Kallikrein-7,Chapter X Diseases of the respiratory system,Chronic lower respiratory diseases,Inverse variance weighted,18,0.99 [0.95-1.04],0.706351111804798
KLK7,Kallikrein-7,Chapter XII Diseases of the skin and subcutaneous tissue,"Ulcer of lower limb, not elsewhere classified",Inverse variance weighted,18,0.98 [0.82-1.19],0.874200381906697
KLK7,Kallikrein-7,Chapter XIII Diseases of the musculoskeletal system and connective tissue,Osteoporosis,Inverse variance weighted,18,0.96 [0.86-1.06],0.408122433335197
