Protein,Protein_definition,Disease_category,Disease,Method,Nb_SNP,OR[95%CI],P_value
LGALS8,Galectin-8,Chapter III Diseases of the blood and blood-forming organs and certain disorders involving the immune mechanism,Other and unspecified iron deficiency,Inverse variance weighted,15,0.98 [0.89-1.08],0.691728056869789
LGALS8,Galectin-8,"Chapter IV Endocrine, nutritional and metabolic diseases",Disorders of lipoprotein metabolism and other lipidaemias,Inverse variance weighted,15,0.95 [0.86-1.05],0.279743528864105
LGALS8,Galectin-8,"Chapter IV Endocrine, nutritional and metabolic diseases",Metabolic disorders,Inverse variance weighted,15,0.96 [0.89-1.02],0.183050215894766
LGALS8,Galectin-8,Chapter IX Diseases of the circulatory system,"Hypertension, essential",Inverse variance weighted,15,0.99 [0.96-1.03],0.792525370233587
LGALS8,Galectin-8,Chapter IX Diseases of the circulatory system,Hypertension,Inverse variance weighted,15,1.00 [0.96-1.03],0.799882475858013
