Protein,Protein_definition,Disease_category,Disease,Method,Nb_SNP,OR[95%CI],P_value
BMP4,Bone morphogenetic protein 4,Chapter XI Diseases of the digestive system,"Cirrhosis of liver, NAS",Inverse variance weighted,5,1.57 [0.65-3.80],0.317536467795418
BMP4,Bone morphogenetic protein 4,Chapter IX Diseases of the circulatory system,"Hypertension, Pulmonary Arterial",Inverse variance weighted,5,4.58 [0.99-21.13],0.0507853535519887
BMP4,Bone morphogenetic protein 4,Chapter XI Diseases of the digestive system,Fibrosis and cirrhosis of liver,Inverse variance weighted,5,1.38 [0.77-2.47],0.284216359327026
BMP4,Bone morphogenetic protein 4,Chapter XIV Diseases of the genitourinary system,Chronic kidney disease,Inverse variance weighted,5,0.94 [0.73-1.21],0.629229020188321
BMP4,Bone morphogenetic protein 4,Chapter XIV Diseases of the genitourinary system,Renal tubulo-interstitial diseases,Inverse variance weighted,5,1.07 [0.92-1.25],0.357154321064259
