Protein,Protein_definition,Disease_category,Disease,Method,Nb_SNP,OR[95%CI],P_value
SNAP29,Synaptosomal-associated protein 29,Chapter III Diseases of the blood and blood-forming organs and certain disorders involving the immune mechanism,Purpura and other haemorrhagic conditions,Inverse variance weighted,2,1.39 [0.78-2.48],0.262874108920682
SNAP29,Synaptosomal-associated protein 29,Chapter III Diseases of the blood and blood-forming organs and certain disorders involving the immune mechanism,"Thrombocytopenia, unspecified",Inverse variance weighted,2,1.26 [0.55-2.90],0.586394211624571
SNAP29,Synaptosomal-associated protein 29,"Chapter IV Endocrine, nutritional and metabolic diseases",Disorders of lipoprotein metabolism and other lipidaemias,Inverse variance weighted,2,0.93 [0.50-1.73],0.824848550281007
SNAP29,Synaptosomal-associated protein 29,"Chapter IV Endocrine, nutritional and metabolic diseases",Metabolic disorders,Inverse variance weighted,2,0.93 [0.52-1.68],0.819633236316177
SNAP29,Synaptosomal-associated protein 29,Chapter IX Diseases of the circulatory system,Hypertension,Inverse variance weighted,2,0.96 [0.83-1.11],0.564274268051507
