Protein,Protein_definition,Disease_category,Disease,Method,Nb_SNP,OR[95%CI],P_value
GALNT2,Polypeptide N-acetylgalactosaminyltransferase 2,"Chapter IV Endocrine, nutritional and metabolic diseases",Disorders of lipoprotein metabolism and other lipidaemias,Inverse variance weighted,37,1.02 [0.96-1.08],0.467311826041883
GALNT2,Polypeptide N-acetylgalactosaminyltransferase 2,"Chapter IV Endocrine, nutritional and metabolic diseases",Metabolic disorders,Inverse variance weighted,37,1.03 [0.98-1.07],0.242515438499311
GALNT2,Polypeptide N-acetylgalactosaminyltransferase 2,Chapter IX Diseases of the circulatory system,Angina pectoris,Inverse variance weighted,37,1.03 [0.98-1.08],0.314571619995244
GALNT2,Polypeptide N-acetylgalactosaminyltransferase 2,Chapter V Mental and behavioural disorders,Any mental disorder,Inverse variance weighted,37,1.00 [0.97-1.03],0.959799895003551
GALNT2,Polypeptide N-acetylgalactosaminyltransferase 2,Chapter XIV Diseases of the genitourinary system,Chronic kidney disease,Inverse variance weighted,37,1.00 [0.94-1.06],0.881646194413353
