Protein,Protein_definition,Disease_category,Disease,method,nsnp,OR [95% CI],Pvalue,QTL_type
B4GAT1,"Beta-1,4-glucuronyltransferase 1",Chapter XIV Diseases of the genitourinary system,N14_CHRONKIDNEYDIS,Wald ratio,1,1.09 [1.01-1.17],0.0263923337631041,trans
B4GAT1,"Beta-1,4-glucuronyltransferase 1",Chapter X Diseases of the respiratory system,J10_RESPIRATORY,Inverse variance weighted,15,0.92 [0.84-1.01],0.0825006673691974,trans
B4GAT1,"Beta-1,4-glucuronyltransferase 1",Chapter V Mental and behavioural disorders,ALCOHOLMENTAL,Wald ratio,1,0.91 [0.8-1.03],0.120092124049522,trans
B4GAT1,"Beta-1,4-glucuronyltransferase 1",Chapter XIV Diseases of the genitourinary system,N14_DIALYSIS,Inverse variance weighted,4,0.97 [0.93-1.02],0.279717369759439,trans
B4GAT1,"Beta-1,4-glucuronyltransferase 1",Chapter V Mental and behavioural disorders,AUD,Inverse variance weighted,6,0.99 [0.93-1.05],0.797475040387902,trans
