Protein,Protein_definition,Disease_category,Disease,method,nsnp,OR [95% CI],Pvalue,QTL_type
BMP4,Bone morphogenetic protein 4,Chapter XI Diseases of the digestive system,K11_FIBROCHIRLIV,Inverse variance weighted,2,1.1 [1.06-1.14],3.43395733311705e-07,trans
BMP4,Bone morphogenetic protein 4,Chapter XIV Diseases of the genitourinary system,N14_CHRONKIDNEYDIS,Wald ratio,1,1.08 [1-1.16],0.0611968077259011,trans
BMP4,Bone morphogenetic protein 4,"Chapter IV Endocrine, nutritional and metabolic diseases",E4_DM2NOCOMP,Inverse variance weighted,69,1.02 [0.99-1.05],0.123174405512252,trans
BMP4,Bone morphogenetic protein 4,Chapter XI Diseases of the digestive system,CHIRHEP_NAS,Inverse variance weighted,2,1.04 [0.95-1.15],0.389299634651784,trans
BMP4,Bone morphogenetic protein 4,Chapter XIV Diseases of the genitourinary system,N14_RENALTUB,Wald ratio,1,0.88 [0.64-1.21],0.437758274740606,trans
