Protein,Protein_definition,Disease_category,Disease,method,nsnp,OR [95% CI],Pvalue,QTL_type
DSG4,Desmoglein-4,Chapter XIV Diseases of the genitourinary system,N14_CHRONKIDNEYDIS,Wald ratio,1,1.08 [1-1.16],0.0466261639949456,trans
DSG4,Desmoglein-4,"Chapter IV Endocrine, nutritional and metabolic diseases",E4_DM2NOCOMP,Inverse variance weighted,69,0.97 [0.94-1],0.088787749528108,trans
DSG4,Desmoglein-4,Chapter XIV Diseases of the genitourinary system,N14_DIALYSIS,Inverse variance weighted,4,1.03 [0.98-1.08],0.25700203353395,trans
DSG4,Desmoglein-4,"Chapter VII Diseases of the eye, adnexa, ear and mastoid process",DM_BCKGRND_RETINA,Inverse variance weighted,3,0.96 [0.85-1.07],0.420543040446565,trans
DSG4,Desmoglein-4,Chapter XIV Diseases of the genitourinary system,N14_RENALTUB,Wald ratio,1,0.97 [0.72-1.32],0.855300542585571,trans
