Protein,Protein_definition,Disease_category,Disease,method,nsnp,OR [95% CI],Pvalue,QTL_type
PADI2,Protein-arginine deiminase type-2,Chapter IX Diseases of the circulatory system,I9_HEARTFAIL,Inverse variance weighted,4,1.12 [0.99-1.26],0.0632065840451499,trans
PADI2,Protein-arginine deiminase type-2,"Chapter IV Endocrine, nutritional and metabolic diseases",E4_DM1NOCOMP,Inverse variance weighted,3,0.98 [0.94-1.02],0.305910705016965,trans
PADI2,Protein-arginine deiminase type-2,Chapter X Diseases of the respiratory system,J10_INFLUPNEU,Inverse variance weighted,3,1.07 [0.86-1.34],0.528920336993312,trans
PADI2,Protein-arginine deiminase type-2,Chapter X Diseases of the respiratory system,J10_PNEUMONAS,Wald ratio,1,1.04 [0.82-1.31],0.763614538547769,trans
PADI2,Protein-arginine deiminase type-2,Chapter XIV Diseases of the genitourinary system,N14_RENALTUB,Wald ratio,1,1.03 [0.75-1.42],0.855870645892506,trans
PADI2,Protein-arginine deiminase type-2,Chapter XIV Diseases of the genitourinary system,N14_CHRONKIDNEYDIS,Wald ratio,1,1 [0.93-1.09],0.907098917477624,trans
