Protein,Protein_definition,Disease_category,Disease,method,nsnp,OR [95% CI],Pvalue,QTL_type
PLXDC2,Plexin domain-containing protein 2,Chapter IX Diseases of the circulatory system,I9_HYPTENSPOR,Wald ratio,1,1.09 [1.05-1.12],1.81157097846573e-06,trans
PLXDC2,Plexin domain-containing protein 2,"Chapter IV Endocrine, nutritional and metabolic diseases",E4_DM2NOCOMP,Inverse variance weighted,69,1.04 [1.01-1.07],0.00374179893442202,trans
PLXDC2,Plexin domain-containing protein 2,Chapter XI Diseases of the digestive system,CHIRHEP_NAS,Inverse variance weighted,2,1.05 [0.99-1.12],0.0964988442697102,trans
PLXDC2,Plexin domain-containing protein 2,"Chapter VII Diseases of the eye, adnexa, ear and mastoid process",DM_MACULOPATHY_EXMORE,Inverse variance weighted,8,1.01 [0.98-1.05],0.494152029269995,trans
PLXDC2,Plexin domain-containing protein 2,Chapter IX Diseases of the circulatory system,I9_HEARTFAIL,Inverse variance weighted,4,1.02 [0.88-1.19],0.757297626312981,trans
PLXDC2,Plexin domain-containing protein 2,"Chapter IV Endocrine, nutritional and metabolic diseases",E4_DM1NOCOMP,Inverse variance weighted,3,1 [0.95-1.06],0.915244883924243,trans
