Protein,Protein_definition,Disease_category,Disease,method,nsnp,OR [95% CI],Pvalue,QTL_type
SUMF2,Inactive C-alpha-formylglycine-generating enzyme 2,Chapter XIV Diseases of the genitourinary system,N14_CHRONKIDNEYDIS,Wald ratio,1,1.08 [1-1.16],0.0408807912495572,trans
SUMF2,Inactive C-alpha-formylglycine-generating enzyme 2,Chapter XIII Diseases of the musculoskeletal system and connective tissue,M13_GOUT,Inverse variance weighted,24,1.02 [0.99-1.05],0.208129532943383,trans
SUMF2,Inactive C-alpha-formylglycine-generating enzyme 2,"Chapter IV Endocrine, nutritional and metabolic diseases",E4_DM2NOCOMP,Inverse variance weighted,69,1 [0.97-1.04],0.907690466838162,trans
SUMF2,Inactive C-alpha-formylglycine-generating enzyme 2,Chapter XIV Diseases of the genitourinary system,N14_DIALYSIS,Inverse variance weighted,4,1 [0.94-1.06],0.93023531385226,trans
SUMF2,Inactive C-alpha-formylglycine-generating enzyme 2,Chapter XIV Diseases of the genitourinary system,N14_RENALTUB,Wald ratio,1,0.99 [0.74-1.33],0.950760338738672,trans
