Protein,Protein_definition,Disease_category,Disease,method,nsnp,OR [95% CI],Pvalue,QTL_type
TNN,Tenascin-N,Chapter V Mental and behavioural disorders,ALCOHOLMENTAL,Wald ratio,1,0.88 [0.8-0.96],0.0059111033735886,trans
TNN,Tenascin-N,Chapter IX Diseases of the circulatory system,I9_HEARTFAIL,Inverse variance weighted,4,1.13 [1.03-1.23],0.00696253083742636,trans
TNN,Tenascin-N,"Chapter IV Endocrine, nutritional and metabolic diseases",E4_DM2NOCOMP,Inverse variance weighted,69,1.02 [1-1.04],0.106285965708516,trans
TNN,Tenascin-N,Chapter XIV Diseases of the genitourinary system,N14_CHRONKIDNEYDIS,Wald ratio,1,0.98 [0.93-1.03],0.443035230944587,trans
TNN,Tenascin-N,Chapter IX Diseases of the circulatory system,I9_K_CARDIAC,Inverse variance weighted,2,1.01 [0.92-1.11],0.900701754913744,trans
