Protein,Protein_definition,Disease_category,Disease,NB_individual,NB_case,OR[95%CI],P_value
DNPEP,Aspartyl aminopeptidase,Chapter IX Diseases of the circulatory system,Death due to cardiac causes,19156,1744,1.17 [1.08-1.28],0.00028822963195
DNPEP,Aspartyl aminopeptidase,Chapter IX Diseases of the circulatory system,"Hypertension, essential",20093,1167,1.20 [1.08-1.33],0.0004739565791457
DNPEP,Aspartyl aminopeptidase,Chapter IX Diseases of the circulatory system,Hypertension,20109,1183,1.19 [1.08-1.32],0.0007896744044553
DNPEP,Aspartyl aminopeptidase,Chapter XI Diseases of the digestive system,Diseases of liver,23900,109,1.71 [1.26-2.32],0.0005269687904945
DNPEP,Aspartyl aminopeptidase,Chapter XII Diseases of the skin and subcutaneous tissue,Papulosquamous disorders,24315,76,1.87 [1.30-2.67],0.0006671990381795
