Protein,Protein_definition,Disease_category,Disease,NB_individual,NB_case,OR[95%CI],P_value
CD2AP,CD2-associated protein,Chapter I Certain infectious and parasitic diseases,Condition for Implicit Sepsis (Organ dysfunction codes),25965,365,1.30 [1.13-1.50],0.0002146937963782
CD2AP,CD2-associated protein,"Chapter IV Endocrine, nutritional and metabolic diseases",Metabolic disorders,24838,710,1.27 [1.14-1.41],5.7335271723336684e-06
CD2AP,CD2-associated protein,"Chapter IV Endocrine, nutritional and metabolic diseases",Disorders of lipoprotein metabolism and other lipidaemias,24673,545,1.27 [1.13-1.43],6.704196366681031e-05
CD2AP,CD2-associated protein,"Chapter IV Endocrine, nutritional and metabolic diseases",Pure hypercholesterolaemia,24628,500,1.26 [1.11-1.42],0.0002675506205619
CD2AP,CD2-associated protein,Chapter IX Diseases of the circulatory system,Death due to cardiac causes,22172,1992,1.14 [1.06-1.22],0.000150361992101
CD2AP,CD2-associated protein,Chapter X Diseases of the respiratory system,Other respiratory disorders and diseases,27472,83,1.64 [1.24-2.16],0.0005630672681172
CD2AP,CD2-associated protein,"Chapter XV Pregnancy, childbirth and the puerperium",Single spontaneous delivery,15601,261,0.72 [0.60-0.87],0.0007462164212598
