Protein,Protein_definition,Disease_category,Disease,NB_individual,NB_case,OR[95%CI],P_value
IL33,Interleukin-33,Chapter I Certain infectious and parasitic diseases,Implicit Sepsis,19944,490,1.46 [1.19-1.79],0.000322269128038
IL33,Interleukin-33,Chapter III Diseases of the blood and blood-forming organs and certain disorders involving the immune mechanism,Diseases of the blood and blood-forming organs and certain disorders involving the immune mechanism,25594,804,1.33 [1.13-1.56],0.0004664782784483
IL33,Interleukin-33,"Chapter IV Endocrine, nutritional and metabolic diseases",Metabolic disorders,24387,696,1.37 [1.15-1.64],0.000464667441575
IL33,Interleukin-33,Chapter X Diseases of the respiratory system,Diseases of the respiratory system,23525,1938,1.25 [1.12-1.39],4.300295259029602e-05
IL33,Interleukin-33,Chapter XI Diseases of the digestive system,Other diseases of intestines,22892,1654,1.27 [1.14-1.43],3.337706072656649e-05
IL33,Interleukin-33,Chapter XIV Diseases of the genitourinary system,Genitourinary diseases,23501,4350,1.18 [1.09-1.27],3.2845129533090866e-05
IL33,Interleukin-33,Chapter XIV Diseases of the genitourinary system,Renal tubulo-interstitial diseases,26271,210,1.98 [1.50-2.63],1.649783319362555e-06
IL33,Interleukin-33,Chapter XIV Diseases of the genitourinary system,Chronic kidney disease,26423,48,2.46 [1.49-4.05],0.0004260552357179
IL33,Interleukin-33,Chapter XIV Diseases of the genitourinary system,Unspecified kidney failure,26429,54,2.54 [1.55-4.15],0.0002127306643677
