Protein,Protein_definition,Disease_category,Disease,NB_individual,NB_case,OR[95%CI],P_value
PGLYRP4,Peptidoglycan recognition protein 4,"Chapter IV Endocrine, nutritional and metabolic diseases",Volume depletion,20311,39,1.56 [1.21-2.02],0.0006610024367114
PGLYRP4,Peptidoglycan recognition protein 4,Chapter VI Diseases of the nervous system,"Nerve, nerve root and plexus disorders",22859,530,0.72 [0.61-0.85],0.0001483504833871
PGLYRP4,Peptidoglycan recognition protein 4,Chapter VI Diseases of the nervous system,Carpal tunnel syndrome,22614,285,0.65 [0.51-0.82],0.0004351093642394
PGLYRP4,Peptidoglycan recognition protein 4,Chapter X Diseases of the respiratory system,Nasal polyp,22595,94,1.41 [1.15-1.73],0.0009546892960314
PGLYRP4,Peptidoglycan recognition protein 4,Chapter XIV Diseases of the genitourinary system,Genitourinary diseases,20181,3780,0.87 [0.82-0.93],7.088450844845085e-06
