Protein,Protein_definition,Disease_category,Disease,NB_individual,NB_case,OR[95%CI],P_value
ARSA,Arylsulfatase A,Chapter I Certain infectious and parasitic diseases,Implicit Sepsis,20303,497,1.34 [1.14-1.58],0.0003946483132721
ARSA,Arylsulfatase A,Chapter IX Diseases of the circulatory system,Death due to cardiac causes,22154,1970,1.18 [1.07-1.29],0.0005023837802518
ARSA,Arylsulfatase A,Chapter XI Diseases of the digestive system,Oesophageal obstruction,22609,31,2.79 [1.54-5.06],0.0007342142790219
ARSA,Arylsulfatase A,Chapter XI Diseases of the digestive system,Diseases of liver,27570,123,2.21 [1.62-3.01],4.363121114217289e-07
ARSA,Arylsulfatase A,Chapter XI Diseases of the digestive system,Other diseases of liver,27512,65,2.13 [1.39-3.28],0.0005577866983868
ARSA,Arylsulfatase A,Chapter XIV Diseases of the genitourinary system,Genitourinary diseases,23931,4434,0.89 [0.83-0.95],0.0003385524015798
