Protein,Protein_definition,Disease_category,Disease,NB_individual,NB_case,HR[95%CI],P_value
ITGB5,Integrin beta-5,Chapter III Diseases of the blood and blood-forming organs and certain disorders involving the immune mechanism,"Thrombocytopenia, unspecified",51203,463,0.57 [0.46-0.72],2.296646030181288e-06
ITGB5,Integrin beta-5,"Chapter IV Endocrine, nutritional and metabolic diseases",Alcohol dependence,48219,257,1.72 [1.33-2.22],3.0207506274297733e-05
ITGB5,Integrin beta-5,Chapter IX Diseases of the circulatory system,"Hypertension, portal",51331,156,2.04 [1.50-2.77],6.0968069825710365e-06
ITGB5,Integrin beta-5,Chapter V Mental and behavioural disorders,"Mental and behavioural disorders due to alcohol, excluding acute intoxication",51342,848,1.35 [1.17-1.57],6.38575405110369e-05
ITGB5,Integrin beta-5,Chapter VI Diseases of the nervous system,Parkinson's disease,51632,850,0.69 [0.58-0.82],2.8288450273593748e-05
