Protein,Protein_definition,Disease_category,Disease,Method,Nb_SNP,OR[95%CI],P_value
GAST,Gastrin,Chapter X Diseases of the respiratory system,"Asthma, unspecified (mode)",Inverse variance weighted,9,1.13 [1.01-1.27],0.0271523921521417
GAST,Gastrin,"Chapter IV Endocrine, nutritional and metabolic diseases",Obesity,Inverse variance weighted,9,0.87 [0.77-0.98],0.0208516760221149
GAST,Gastrin,Chapter IX Diseases of the circulatory system,"Heart failure, strict",Inverse variance weighted,9,0.86 [0.75-0.98],0.0279852677495071
GAST,Gastrin,Chapter X Diseases of the respiratory system,"Asthma, excluding more controls",Inverse variance weighted,9,1.09 [1.01-1.19],0.0346279713757516
GAST,Gastrin,Chapter XI Diseases of the digestive system,Other gastritis (incl. Duodenitis),Inverse variance weighted,9,0.74 [0.59-0.92],0.0072716822584877
