Protein,Protein_definition,Disease_category,Disease,Method,Nb_SNP,OR[95%CI],P_value
IL15,Interleukin-15,Chapter I Certain infectious and parasitic diseases,Other septicaemia,Inverse variance weighted,35,1.08 [1.00-1.17],0.0462388398523955
IL15,Interleukin-15,Chapter III Diseases of the blood and blood-forming organs and certain disorders involving the immune mechanism,Other and unspecified anaemias,Inverse variance weighted,35,0.92 [0.84-1.00],0.0421953370902139
IL15,Interleukin-15,Chapter IX Diseases of the circulatory system,Other or ill-defined heart diseases,Inverse variance weighted,35,1.24 [1.01-1.53],0.0402214214475537
IL15,Interleukin-15,Chapter X Diseases of the respiratory system,Other acute lower respiratory infections,Inverse variance weighted,35,0.92 [0.87-0.98],0.0116851915352925
IL15,Interleukin-15,Chapter XIII Diseases of the musculoskeletal system and connective tissue,Low back pain,Inverse variance weighted,35,0.92 [0.87-0.97],0.0009488245946768
IL15,Interleukin-15,Chapter XIV Diseases of the genitourinary system,Other disorders of urethra and urinary system,Inverse variance weighted,35,0.91 [0.87-0.95],9.30935819411262e-05
IL15,Interleukin-15,Chapter XIV Diseases of the genitourinary system,Other diseases of urinary system,Inverse variance weighted,35,0.95 [0.91-0.99],0.014952466480701
