Protein,Protein_definition,Disease_category,Disease,Method,Nb_SNP,OR[95%CI],P_value
RNASE6,Ribonuclease K6,"Chapter VII Diseases of the eye, adnexa, ear and mastoid process","Diabetic maculopathy, excluding more controls",Inverse variance weighted,20,1.12 [1.01-1.25],0.0285880243305233
RNASE6,Ribonuclease K6,"Chapter IV Endocrine, nutritional and metabolic diseases",Disorders of the thyroid gland,Inverse variance weighted,20,0.96 [0.93-0.99],0.0156095746434802
RNASE6,Ribonuclease K6,Chapter V Mental and behavioural disorders,Depression,Inverse variance weighted,20,1.04 [1.00-1.07],0.0291068070059223
RNASE6,Ribonuclease K6,Chapter IX Diseases of the circulatory system,Other peripheral vascular diseases,Inverse variance weighted,20,0.80 [0.70-0.92],0.0021313530998376
RNASE6,Ribonuclease K6,Chapter IX Diseases of the circulatory system,Secondary right heart disease,Inverse variance weighted,20,1.25 [1.03-1.51],0.0221336952528053
RNASE6,Ribonuclease K6,Chapter X Diseases of the respiratory system,Other acute lower respiratory infections,Inverse variance weighted,20,1.05 [1.01-1.10],0.0231909399982594
RNASE6,Ribonuclease K6,Chapter XI Diseases of the digestive system,Other diseases of biliary tract,Inverse variance weighted,20,1.26 [1.11-1.44],0.0004445585942306
RNASE6,Ribonuclease K6,Chapter XIII Diseases of the musculoskeletal system and connective tissue,Osteoporosis,Inverse variance weighted,20,0.93 [0.86-1.00],0.0499040904768056
RNASE6,Ribonuclease K6,Chapter XIV Diseases of the genitourinary system,Unspecified kidney failure,Inverse variance weighted,20,1.14 [1.00-1.28],0.0419989217445846
