Protein,Protein_definition,Disease_category,Disease,Method,Nb_SNP,OR[95%CI],P_value
PTGDS,Prostaglandin-H2 D-isomerase,"Chapter IV Endocrine, nutritional and metabolic diseases",Volume depletion,Inverse variance weighted,9,1.65 [1.04-2.60],0.0322735006212716
PTGDS,Prostaglandin-H2 D-isomerase,Chapter XI Diseases of the digestive system,"Crohn disease (strict definition, require KELA, min 2 HDR)",Inverse variance weighted,9,0.37 [0.20-0.71],0.0027011656607458
PTGDS,Prostaglandin-H2 D-isomerase,Chapter XI Diseases of the digestive system,Noninfective enteritis and colitis,Inverse variance weighted,9,0.82 [0.69-0.99],0.0364139612788774
PTGDS,Prostaglandin-H2 D-isomerase,Chapter XI Diseases of the digestive system,Other diseases of anus and rectum,Inverse variance weighted,9,0.73 [0.55-0.96],0.0237979975925412
PTGDS,Prostaglandin-H2 D-isomerase,Chapter V Mental and behavioural disorders,Any mental disorder,Inverse variance weighted,9,0.91 [0.83-1.00],0.0454039003316686
PTGDS,Prostaglandin-H2 D-isomerase,Chapter XII Diseases of the skin and subcutaneous tissue,Other disorders of skin and subcutaneous tissue,Inverse variance weighted,9,1.20 [1.03-1.41],0.0194158140728216
