Protein,Protein_definition,Disease_category,Disease,Method,Nb_SNP,OR[95%CI],P_value
PHOSPHO1,Phosphoethanolamine/phosphocholine phosphatase,Chapter IX Diseases of the circulatory system,Atrial fibrillation and flutter,Inverse variance weighted,5,1.22 [1.04-1.44],0.0168352787590796
PHOSPHO1,Phosphoethanolamine/phosphocholine phosphatase,Chapter X Diseases of the respiratory system,Other diseases of pleura,Inverse variance weighted,5,1.30 [1.00-1.68],0.0474998584604025
PHOSPHO1,Phosphoethanolamine/phosphocholine phosphatase,Chapter XI Diseases of the digestive system,Diseases of liver,Inverse variance weighted,5,1.32 [1.04-1.66],0.0198077914671824
PHOSPHO1,Phosphoethanolamine/phosphocholine phosphatase,Chapter XIII Diseases of the musculoskeletal system and connective tissue,Arthropathies,Inverse variance weighted,5,0.91 [0.83-0.99],0.0308709538081391
PHOSPHO1,Phosphoethanolamine/phosphocholine phosphatase,Chapter XIII Diseases of the musculoskeletal system and connective tissue,Arthrosis,Inverse variance weighted,5,0.90 [0.81-1.00],0.0494376886597108
