Protein,Protein_definition,Disease_category,Disease,Method,Nb_SNP,OR[95%CI],P_value
IL17C,Interleukin-17C,Chapter IX Diseases of the circulatory system,"Hypertension, essential",Inverse variance weighted,8,1.08 [1.00-1.16],0.044298288422293
IL17C,Interleukin-17C,Chapter X Diseases of the respiratory system,Other diseases of pleura,Inverse variance weighted,8,0.87 [0.75-0.99],0.0401503752381085
IL17C,Interleukin-17C,Chapter XI Diseases of the digestive system,Noninfective enteritis and colitis,Inverse variance weighted,8,0.84 [0.73-0.97],0.0171241593465791
IL17C,Interleukin-17C,Chapter V Mental and behavioural disorders,Any mental disorder,Inverse variance weighted,8,1.08 [1.01-1.15],0.022731774741779
IL17C,Interleukin-17C,Chapter V Mental and behavioural disorders,"Substance abuse, excluding more controls",Inverse variance weighted,8,1.21 [1.07-1.37],0.0032781816842502
