Protein,Protein_definition,Disease_category,Disease,Method,Nb_SNP,OR[95%CI],P_value
CXCL13,C-X-C motif chemokine 13,Chapter X Diseases of the respiratory system,Early onset COPD,Inverse variance weighted,2,0.56 [0.34-0.89],0.0156766922238372
CXCL13,C-X-C motif chemokine 13,"Chapter IV Endocrine, nutritional and metabolic diseases",Disorders of the thyroid gland,Inverse variance weighted,2,0.79 [0.66-0.96],0.0157854765545362
CXCL13,C-X-C motif chemokine 13,Chapter IX Diseases of the circulatory system,Hypertension,Inverse variance weighted,2,1.25 [1.01-1.54],0.0371639492546236
CXCL13,C-X-C motif chemokine 13,Chapter IX Diseases of the circulatory system,DVT of lower extremities,Inverse variance weighted,2,0.58 [0.38-0.88],0.0113478413220935
CXCL13,C-X-C motif chemokine 13,Chapter X Diseases of the respiratory system,Chronic lower respiratory diseases,Inverse variance weighted,2,0.73 [0.59-0.90],0.0028287011425199
CXCL13,C-X-C motif chemokine 13,Chapter XI Diseases of the digestive system,Diaphragmatic hernia,Inverse variance weighted,2,1.46 [1.01-2.13],0.0461558795797299
CXCL13,C-X-C motif chemokine 13,Chapter XI Diseases of the digestive system,"Diseases of oesophagus, stomach and duodenum",Inverse variance weighted,2,1.36 [1.13-1.63],0.0009655647152613
CXCL13,C-X-C motif chemokine 13,Chapter XIII Diseases of the musculoskeletal system and connective tissue,Gout,Inverse variance weighted,2,1.72 [1.10-2.70],0.0177008079936367
