Protein,Protein_definition,Disease_category,Disease,Method,Nb_SNP,OR[95%CI],P_value
CD300LG,CMRF35-like molecule 9,Chapter III Diseases of the blood and blood-forming organs and certain disorders involving the immune mechanism,Other and unspecified anaemias,Inverse variance weighted,24,1.07 [1.01-1.13],0.0190303815512842
CD300LG,CMRF35-like molecule 9,Chapter X Diseases of the respiratory system,Influenza and pneumonia,Inverse variance weighted,24,1.04 [1.00-1.08],0.0378639292957468
CD300LG,CMRF35-like molecule 9,Chapter XIII Diseases of the musculoskeletal system and connective tissue,Arthropathies,Inverse variance weighted,24,1.05 [1.03-1.07],2.96981256117017e-05
CD300LG,CMRF35-like molecule 9,Chapter XIII Diseases of the musculoskeletal system and connective tissue,Polyarthropathies,Inverse variance weighted,24,1.08 [1.03-1.13],0.0021109617316715
CD300LG,CMRF35-like molecule 9,Chapter XIV Diseases of the genitourinary system,Acute renal failure,Inverse variance weighted,24,1.11 [1.01-1.22],0.0278933201698931
CD300LG,CMRF35-like molecule 9,Chapter XIV Diseases of the genitourinary system,Renal tubulo-interstitial diseases,Inverse variance weighted,24,1.05 [1.00-1.10],0.0410765332088601
