Protein,Protein_definition,Disease_category,Disease,NB_individual,NB_case,OR[95%CI],P_value
SCPEP1,Retinoid-inducible serine carboxypeptidase,"Chapter IV Endocrine, nutritional and metabolic diseases",Type 2 diabetes,17718,629,1.74 [1.49-2.04],3.529624229693177e-12
SCPEP1,Retinoid-inducible serine carboxypeptidase,"Chapter IV Endocrine, nutritional and metabolic diseases",Type 2 diabetes without complications,17699,610,1.73 [1.47-2.02],1.6466102327111647e-11
SCPEP1,Retinoid-inducible serine carboxypeptidase,Chapter IX Diseases of the circulatory system,"Hypertension, essential",12821,2574,1.34 [1.23-1.47],1.0559316742195824e-10
SCPEP1,Retinoid-inducible serine carboxypeptidase,Chapter IX Diseases of the circulatory system,Hypertension,12846,2599,1.35 [1.23-1.47],7.136357947352097e-11
SCPEP1,Retinoid-inducible serine carboxypeptidase,Chapter X Diseases of the respiratory system,Diseases of the respiratory system,14485,1826,1.40 [1.28-1.55],5.043286664246095e-12
