Protein,Protein_definition,Disease_category,Disease,NB_individual,NB_case,HR[95%CI],P_value
APLP1,Amyloid-like protein 1,Chapter I Certain infectious and parasitic diseases,"Bacterial, viral and other infectious agents",23341,1403,0.75 [0.68-0.82],2.0329904734478446e-09
APLP1,Amyloid-like protein 1,Chapter I Certain infectious and parasitic diseases,Other bacterial agents as the cause of diseases classified to other chapters,22827,889,0.71 [0.63-0.80],1.1340975481762922e-08
APLP1,Amyloid-like protein 1,"Chapter IV Endocrine, nutritional and metabolic diseases",Type 2 diabetes without complications,22943,2160,0.81 [0.75-0.88],6.724874693834106e-08
APLP1,Amyloid-like protein 1,Chapter IX Diseases of the circulatory system,Death due to cardiac causes,19966,7737,0.90 [0.86-0.93],7.701976949313892e-08
APLP1,Amyloid-like protein 1,Chapter IX Diseases of the circulatory system,Hypertension,21168,6742,0.89 [0.85-0.93],4.570159888910881e-08
APLP1,Amyloid-like protein 1,Chapter V Mental and behavioural disorders,Smoking dependency,23084,1520,0.77 [0.70-0.84],2.0287633239038304e-08
APLP1,Amyloid-like protein 1,Chapter V Mental and behavioural disorders,"Substance abuse, excluding more controls",21289,1860,0.78 [0.72-0.85],3.4291348850627316e-09
APLP1,Amyloid-like protein 1,Chapter X Diseases of the respiratory system,Other diseases of pleura,23449,2192,0.80 [0.74-0.86],4.685845418926761e-09
