Protein,Protein_definition,Disease_category,Disease,NB_individual,NB_case,OR[95%CI],P_value
SPRR1B,Cornifin-B,Chapter I Certain infectious and parasitic diseases,Other viral diseases,19691,57,1.42 [1.20-1.69],5.458357422297537e-05
SPRR1B,Cornifin-B,Chapter I Certain infectious and parasitic diseases,"Other viral diseases, not elsewhere classified",19688,54,1.45 [1.22-1.72],1.9375208218491355e-05
SPRR1B,Cornifin-B,Chapter II Neoplasms,"Malignant neoplasm of colon, excluding all cancers (controls excluding all cancers)",14197,83,1.39 [1.18-1.64],0.0001024430643663
SPRR1B,Cornifin-B,"Chapter IV Endocrine, nutritional and metabolic diseases",Disorders of the thyroid gland,18348,534,1.18 [1.08-1.28],0.0001310875589614
SPRR1B,Cornifin-B,Chapter XI Diseases of the digestive system,Diaphragmatic hernia,15950,942,1.14 [1.06-1.22],0.0001709180951228
SPRR1B,Cornifin-B,Chapter XI Diseases of the digestive system,Intestinal malabsorption,18295,54,1.42 [1.18-1.70],0.000229031794234
SPRR1B,Cornifin-B,Chapter XI Diseases of the digestive system,Coeliac disease,18289,48,1.45 [1.20-1.75],0.0001001359961674
SPRR1B,Cornifin-B,Chapter XII Diseases of the skin and subcutaneous tissue,Papulosquamous disorders,19514,81,0.44 [0.29-0.67],0.0001387113440714
