Protein,Protein_definition,Disease_category,Disease,NB_individual,NB_case,OR[95%CI],P_value
TGM2,Protein-glutamine gamma-glutamyltransferase 2,Chapter III Diseases of the blood and blood-forming organs and certain disorders involving the immune mechanism,Other and unspecified iron deficiency,21544,197,0.75 [0.64-0.88],0.0005437687251278
TGM2,Protein-glutamine gamma-glutamyltransferase 2,Chapter III Diseases of the blood and blood-forming organs and certain disorders involving the immune mechanism,Other anaemias,21010,352,0.79 [0.70-0.89],0.0001340611458966
TGM2,Protein-glutamine gamma-glutamyltransferase 2,Chapter III Diseases of the blood and blood-forming organs and certain disorders involving the immune mechanism,Other and unspecified anaemias,21010,352,0.79 [0.70-0.89],0.0001340611458966
TGM2,Protein-glutamine gamma-glutamyltransferase 2,"Chapter IV Endocrine, nutritional and metabolic diseases",Disorders of the thyroid gland,21388,647,0.84 [0.76-0.92],0.0001116444348291
TGM2,Protein-glutamine gamma-glutamyltransferase 2,Chapter IX Diseases of the circulatory system,Atrial fibrillation and flutter,9542,689,1.18 [1.08-1.30],0.0003350017120698
TGM2,Protein-glutamine gamma-glutamyltransferase 2,Chapter X Diseases of the respiratory system,Other respiratory diseases principally affecting the interstitium,22552,127,1.43 [1.17-1.75],0.0004745532122734
TGM2,Protein-glutamine gamma-glutamyltransferase 2,Chapter XI Diseases of the digestive system,Intestinal malabsorption,21357,75,0.52 [0.41-0.67],3.0142211592217854e-07
TGM2,Protein-glutamine gamma-glutamyltransferase 2,Chapter XI Diseases of the digestive system,Coeliac disease,21346,64,0.44 [0.34-0.56],9.850393678459568e-11
TGM2,Protein-glutamine gamma-glutamyltransferase 2,Chapter XIII Diseases of the musculoskeletal system and connective tissue,Diseases of the musculoskeletal system and connective tissue,15102,4432,0.93 [0.89-0.97],0.0003189924159474
