Protein,Protein_definition,Disease_category,Disease,NB_individual,NB_case,OR[95%CI],P_value
MUC16,Mucin-16,Chapter I Certain infectious and parasitic diseases,Certain infectious and parasitic diseases,18855,903,1.07 [1.03-1.10],0.0001884521433044
MUC16,Mucin-16,Chapter IX Diseases of the circulatory system,Death due to cardiac causes,14209,4571,1.04 [1.02-1.06],3.1083914109523394e-05
MUC16,Mucin-16,Chapter X Diseases of the respiratory system,Diseases of the respiratory system,16983,2150,1.06 [1.04-1.09],9.797022986818249e-08
MUC16,Mucin-16,Chapter X Diseases of the respiratory system,"Pneumonia, organism unspecified",20462,232,1.13 [1.05-1.21],0.0006157429067066
MUC16,Mucin-16,Chapter X Diseases of the respiratory system,Other respiratory diseases principally affecting the interstitium,22485,122,1.19 [1.08-1.32],0.0005253458954779
