Protein,Protein_definition,Disease_category,Disease,NB_individual,NB_case,OR[95%CI],P_value
PPP1R12A,Protein phosphatase 1 regulatory subunit 12A,Chapter IX Diseases of the circulatory system,Atrial fibrillation and flutter,9592,691,0.83 [0.77-0.89],1.5032412769770786e-06
PPP1R12A,Protein phosphatase 1 regulatory subunit 12A,Chapter IX Diseases of the circulatory system,Other or ill-defined heart diseases,17108,122,0.71 [0.60-0.85],0.0001284789185746
PPP1R12A,Protein phosphatase 1 regulatory subunit 12A,Chapter XIII Diseases of the musculoskeletal system and connective tissue,Other/unspecified rheumatoid arthritis,22735,163,1.28 [1.11-1.47],0.000556719999647
PPP1R12A,Protein phosphatase 1 regulatory subunit 12A,Chapter XIII Diseases of the musculoskeletal system and connective tissue,Other systemic involvement of connective tissue,22482,73,1.43 [1.17-1.76],0.000485261605906
PPP1R12A,Protein phosphatase 1 regulatory subunit 12A,Chapter XIV Diseases of the genitourinary system,Uterine polyps,9444,152,0.75 [0.64-0.88],0.0002997349762446
