Protein,Protein_definition,Disease_category,Disease,NB_individual,NB_case,OR[95%CI],P_value
PMM2,Phosphomannomutase 2,Chapter III Diseases of the blood and blood-forming organs and certain disorders involving the immune mechanism,Other anaemias,17755,265,1.39 [1.15-1.68],0.0007960336104613
PMM2,Phosphomannomutase 2,Chapter III Diseases of the blood and blood-forming organs and certain disorders involving the immune mechanism,Other and unspecified anaemias,17755,265,1.39 [1.15-1.68],0.0007960336104613
PMM2,Phosphomannomutase 2,Chapter IX Diseases of the circulatory system,Atrial fibrillation and flutter,8188,561,0.73 [0.63-0.85],3.877231735034246e-05
PMM2,Phosphomannomutase 2,Chapter IX Diseases of the circulatory system,Other or ill-defined heart diseases,14509,108,0.51 [0.37-0.72],0.0001087758395388
PMM2,Phosphomannomutase 2,Chapter XI Diseases of the digestive system,Intestinal malabsorption,17987,56,1.91 [1.31-2.79],0.0008211067948909
PMM2,Phosphomannomutase 2,Chapter XIII Diseases of the musculoskeletal system and connective tissue,Other/unspecified rheumatoid arthritis,19031,132,1.55 [1.20-2.02],0.0009416907444007
