"Unnamed: 0","ID","Description","GeneRatio","BgRatio","pvalue","p.adjust","qvalue","geneID","Count"
"R-HSA-5668541","R-HSA-5668541","TNFR2 non-canonical NF-kB pathway","5/34","102/10891",1.46420341805629e-05,0.00156617748993779,0.0012415442090475,"TNFRSF11A/TNFRSF12A/TNFRSF1A/TNFRSF1B/TNFRSF4",5
"R-HSA-8957275","R-HSA-8957275","Post-translational protein phosphorylation","5/34","108/10891",1.93355245671332e-05,0.00156617748993779,0.0012415442090475,"CKAP4/FSTL3/IGFBP4/IGFBP7/SHISA5",5
"R-HSA-381426","R-HSA-381426","Regulation of Insulin-like Growth Factor (IGF) transport and uptake by Insulin-like Growth Factor Binding Proteins (IGFBPs)","5/34","125/10891",3.91715144099984e-05,0.00211526177813992,0.00167681570456835,"CKAP4/FSTL3/IGFBP4/IGFBP7/SHISA5",5
"R-HSA-5669034","R-HSA-5669034","TNFs bind their physiological receptors","3/34","29/10891",9.60972983473181e-05,0.00389194058306638,0.00308522905220337,"TNFRSF1A/TNFRSF1B/TNFRSF4",3
"R-HSA-5676594","R-HSA-5676594","TNF receptor superfamily (TNFSF) members mediating non-canonical NF-kB pathway","2/34","18/10891",0.00140274837935889,0.0454490474912282,0.0360284846909021,"TNFRSF11A/TNFRSF12A",2
