"Unnamed: 0","ID","Description","GeneRatio","BgRatio","pvalue","p.adjust","qvalue","geneID","Count"
"R-HSA-5669034","R-HSA-5669034","TNFs bind their physiological receptors","7/67","29/10891",3.39061640224049e-10,9.96841222258704e-08,9.81494221701195e-08,"CD27/TNFRSF14/TNFRSF1A/TNFRSF1B/TNFRSF4/TNFRSF8/TNFRSF9",7
"R-HSA-5668541","R-HSA-5668541","TNFR2 non-canonical NF-kB pathway","9/67","102/10891",1.05683581702962e-08,1.55354865103353e-06,1.52963078780602e-06,"CD27/TNFRSF11A/TNFRSF12A/TNFRSF14/TNFRSF1A/TNFRSF1B/TNFRSF4/TNFRSF8/TNFRSF9",9
"R-HSA-381426","R-HSA-381426","Regulation of Insulin-like Growth Factor (IGF) transport and uptake by Insulin-like Growth Factor Binding Proteins (IGFBPs)","8/67","125/10891",8.89685883591508e-07,8.71892165919678e-05,8.58468835044438e-05,"CKAP4/CSF1/CST3/FGF23/FSTL3/IGFBP2/IGFBP4/SHISA5",8
"R-HSA-8957275","R-HSA-8957275","Post-translational protein phosphorylation","7/67","108/10891",4.13397965819759e-06,0.00030384750487752,0.00029916958052745,"CKAP4/CSF1/CST3/FGF23/FSTL3/IGFBP4/SHISA5",7
"R-HSA-198933","R-HSA-198933","Immunoregulatory interactions between a Lymphoid and a non-Lymphoid cell","6/67","134/10891",0.00016726530212999,0.00983519976524364,0.00968378064963122,"B2M/COLEC12/KLRB1/LAIR1/NECTIN2/NPDC1",6
"R-HSA-3928663","R-HSA-3928663","EPHA-mediated growth cone collapse","3/67","30/10891",0.00080226528864881,0.0393109991437917,0.0387057814698987,"EFNA1/EFNA4/EPHA2",3
