Protein,Protein_definition,Disease_category,Disease,NB_individual,NB_case,HR[95%CI],P_value
DCLRE1C,Protein artemis,Chapter IX Diseases of the circulatory system,Angina pectoris,16838,1277,0.76 [0.64-0.92],0.0036165159050682
DCLRE1C,Protein artemis,"Chapter VII Diseases of the eye, adnexa, ear and mastoid process",Stenosis and insufficiency of lacrimal passages,18438,79,2.33 [1.41-3.86],0.0010077215431401
DCLRE1C,Protein artemis,Chapter XI Diseases of the digestive system,Abscess of anal and rectal regions,12431,50,2.60 [1.32-5.08],0.0054416940099419
DCLRE1C,Protein artemis,Chapter XIV Diseases of the genitourinary system,Endometriosis,7835,33,2.96 [1.50-5.82],0.0017208857087403
DCLRE1C,Protein artemis,Chapter XIV Diseases of the genitourinary system,Genitourinary diseases,16057,5144,1.13 [1.04-1.23],0.005342031881673
