Protein,Protein_definition,Disease_category,Disease,NB_individual,NB_case,HR[95%CI],P_value
EPHA10,Ephrin type-A receptor 10,Chapter IX Diseases of the circulatory system,Hypotension,22466,1611,1.08 [1.02-1.15],0.0094091142771241
EPHA10,Ephrin type-A receptor 10,Chapter IX Diseases of the circulatory system,Other intracranial haemorrhages,20629,88,1.38 [1.14-1.67],0.0010829060957784
EPHA10,Ephrin type-A receptor 10,Chapter IX Diseases of the circulatory system,Paroxysmal tachycardia,9094,410,1.17 [1.05-1.30],0.0058144497165555
EPHA10,Ephrin type-A receptor 10,Chapter XI Diseases of the digestive system,Acute appendicitis,22534,125,1.30 [1.10-1.55],0.0026197264154159
EPHA10,Ephrin type-A receptor 10,Chapter XII Diseases of the skin and subcutaneous tissue,Other and unspecified erythematous conditions,22556,93,1.31 [1.08-1.60],0.0066356034025003
EPHA10,Ephrin type-A receptor 10,Chapter XIV Diseases of the genitourinary system,Chronic kidney disease,21249,2281,1.09 [1.04-1.15],0.0006477055733864
