Protein,Protein_definition,Disease_category,Disease,NB_individual,NB_case,HR[95%CI],P_value
TMEM132A,Transmembrane protein 132A,Chapter II Neoplasms,Carcinoma in situ of breast,7776,44,1.82 [1.27-2.61],0.0010515918720967
TMEM132A,Transmembrane protein 132A,"Chapter IV Endocrine, nutritional and metabolic diseases",Alcohol dependence,18403,92,1.50 [1.12-2.02],0.0065142843370805
TMEM132A,Transmembrane protein 132A,"Chapter IV Endocrine, nutritional and metabolic diseases","Delirium, not induced by alcohol and other psychoactive substances",19027,743,1.17 [1.05-1.31],0.0045348440436806
TMEM132A,Transmembrane protein 132A,"Chapter IV Endocrine, nutritional and metabolic diseases",Other and/or unspecified nontoxic goitre,17737,51,1.77 [1.27-2.47],0.0007307485874834
TMEM132A,Transmembrane protein 132A,Chapter IX Diseases of the circulatory system,Other aneurysm,18297,86,1.49 [1.10-2.01],0.0099395058641937
TMEM132A,Transmembrane protein 132A,Chapter XI Diseases of the digestive system,Other functional intestinal disorders,14299,1781,0.90 [0.84-0.97],0.0054241228361294
TMEM132A,Transmembrane protein 132A,Chapter XIII Diseases of the musculoskeletal system and connective tissue,Other disorders of the musculoskeletal system and connective tissue,19639,91,1.47 [1.10-1.96],0.0092289380062339
TMEM132A,Transmembrane protein 132A,Chapter XIII Diseases of the musculoskeletal system and connective tissue,"Soft tissue disorders related to use, overuse and pressure",16470,124,0.68 [0.51-0.89],0.0060948074453987
