Protein,Protein_definition,Disease_category,Disease,NB_individual,NB_case,HR[95%CI],P_value
B3GAT3,Galactosylgalactosylxylosylprotein 3-beta-glucuronosyltransferase 3,"Chapter IV Endocrine, nutritional and metabolic diseases",Alkalosis,12902,60,2.60 [1.34-5.03],0.004738336425891
B3GAT3,Galactosylgalactosylxylosylprotein 3-beta-glucuronosyltransferase 3,Chapter XI Diseases of the digestive system,Gastric ulcer,13894,357,1.82 [1.21-2.72],0.0037656669150007
B3GAT3,Galactosylgalactosylxylosylprotein 3-beta-glucuronosyltransferase 3,Chapter XIII Diseases of the musculoskeletal system and connective tissue,Kyphosis,16174,63,3.15 [1.94-5.11],3.193943148455199e-06
B3GAT3,Galactosylgalactosylxylosylprotein 3-beta-glucuronosyltransferase 3,Chapter XIII Diseases of the musculoskeletal system and connective tissue,Other specified/unspecified inflammatory spondylopathies,16273,162,2.16 [1.30-3.58],0.0030273486928001
B3GAT3,Galactosylgalactosylxylosylprotein 3-beta-glucuronosyltransferase 3,Chapter XIII Diseases of the musculoskeletal system and connective tissue,Spondyloarthritis,18313,221,1.96 [1.23-3.14],0.0049589676563425
