Protein,Protein_definition,Disease_category,Disease,NB_individual,NB_case,HR[95%CI],P_value
GET3,ATPase GET3,Chapter I Certain infectious and parasitic diseases,"Bacterial infection, other or unspecified",19047,154,1.47 [1.18-1.83],0.0006080751299555
GET3,ATPase GET3,Chapter II Neoplasms,Lung cancer and mesothelioma,12855,436,1.24 [1.06-1.45],0.0060651234186113
GET3,ATPase GET3,Chapter IX Diseases of the circulatory system,Atrial fibrillation and flutter,10302,2419,0.87 [0.80-0.94],0.0003071075901227
GET3,ATPase GET3,Chapter XI Diseases of the digestive system,Abscess of anal and rectal regions,12902,53,1.67 [1.20-2.31],0.0020758804757004
GET3,ATPase GET3,Chapter XI Diseases of the digestive system,Acute peritonitis,19748,93,1.56 [1.19-2.05],0.001320200212315
