Protein,Protein_definition,Disease_category,Disease,NB_individual,NB_case,HR[95%CI],P_value
PGLYRP4,Peptidoglycan recognition protein 4,Chapter IX Diseases of the circulatory system,Cerebral atherosclerosis,19475,59,1.47 [1.12-1.93],0.0056105311210653
PGLYRP4,Peptidoglycan recognition protein 4,Chapter VI Diseases of the nervous system,"Other and unspecified polyneuropathies, also in other diseases",19414,280,1.26 [1.08-1.47],0.002939661108315
PGLYRP4,Peptidoglycan recognition protein 4,Chapter VIII Diseases of the ear and mastoid process,Diseases of middle ear and mastoid,19368,95,1.39 [1.10-1.75],0.0055730176018979
PGLYRP4,Peptidoglycan recognition protein 4,Chapter X Diseases of the respiratory system,Other diseases of upper respiratory tract,19016,634,1.16 [1.04-1.30],0.0077265785552231
PGLYRP4,Peptidoglycan recognition protein 4,Chapter XI Diseases of the digestive system,Acute peritonitis,19080,92,1.39 [1.11-1.75],0.004901080647157
