Protein,Protein_definition,Disease_category,Disease,NB_individual,NB_case,HR[95%CI],P_value
PDIA2,Protein disulfide-isomerase A2,Chapter II Neoplasms,Benign lipomatous neoplasm of spermatic cord,9203,69,0.38 [0.19-0.76],0.0057797868713861
PDIA2,Protein disulfide-isomerase A2,"Chapter VII Diseases of the eye, adnexa, ear and mastoid process",Corneal degeneration,19171,192,1.42 [1.11-1.82],0.0052786419484162
PDIA2,Protein disulfide-isomerase A2,Chapter XI Diseases of the digestive system,Ulcerative colitis,18015,135,1.55 [1.20-2.01],0.0008577465895293
PDIA2,Protein disulfide-isomerase A2,Chapter XI Diseases of the digestive system,"Ulcerative colitis, NAS",17988,108,1.62 [1.23-2.12],0.0004821120398117
PDIA2,Protein disulfide-isomerase A2,Chapter XIII Diseases of the musculoskeletal system and connective tissue,Myalgia,16200,57,0.35 [0.16-0.76],0.0074984611501803
