Protein,Protein_definition,Disease_category,Disease,NB_individual,NB_case,HR[95%CI],P_value
SLC12A2,Solute carrier family 12 member 2,Chapter I Certain infectious and parasitic diseases,Intestinal infectious diseases,19330,1358,1.25 [1.06-1.47],0.009267063637774
SLC12A2,Solute carrier family 12 member 2,Chapter VI Diseases of the nervous system,"Other and unspecified polyneuropathies, also in other diseases",19414,280,1.57 [1.22-2.03],0.0005634531889764
SLC12A2,Solute carrier family 12 member 2,Chapter VI Diseases of the nervous system,Small fibre neuropathy,19182,48,1.90 [1.23-2.95],0.004105867292251
SLC12A2,Solute carrier family 12 member 2,"Chapter VII Diseases of the eye, adnexa, ear and mastoid process",Chalazion,18426,33,2.15 [1.42-3.25],0.0003146753232209
SLC12A2,Solute carrier family 12 member 2,Chapter XI Diseases of the digestive system,Gastric ulcer,13894,357,1.45 [1.14-1.85],0.0027994418802284
SLC12A2,Solute carrier family 12 member 2,Chapter XII Diseases of the skin and subcutaneous tissue,Pruritus,18992,65,1.81 [1.20-2.72],0.0045846645407675
