Protein,Protein_definition,Disease_category,Disease,NB_individual,NB_case,HR[95%CI],P_value
APOB,Apolipoprotein B-100,Chapter VI Diseases of the nervous system,"Other and unspecified polyneuropathies, also in other diseases",20108,292,2.00 [1.21-3.30],0.0065349507498564
APOB,Apolipoprotein B-100,Chapter X Diseases of the respiratory system,Pollen allergy,20168,171,2.40 [1.32-4.37],0.0043078646995251
APOB,Apolipoprotein B-100,Chapter XIII Diseases of the musculoskeletal system and connective tissue,Other disorders of the musculoskeletal system and connective tissue,20159,93,3.10 [1.38-6.92],0.0059344047839044
APOB,Apolipoprotein B-100,Chapter XIII Diseases of the musculoskeletal system and connective tissue,Other systemic involvement of connective tissue,19844,428,0.59 [0.40-0.87],0.0077252391199088
APOB,Apolipoprotein B-100,Chapter XIII Diseases of the musculoskeletal system and connective tissue,Polymyalgia rheumatica,19735,319,0.55 [0.35-0.85],0.0069842735243296
