Protein,Protein_definition,Disease_category,Disease,NB_individual,NB_case,HR[95%CI],P_value
F11,Coagulation factor XI,"Chapter IV Endocrine, nutritional and metabolic diseases",Disorders of lipoprotein metabolism and other lipidaemias,22765,2121,1.28 [1.16-1.41],3.074565560455248e-07
F11,Coagulation factor XI,"Chapter IV Endocrine, nutritional and metabolic diseases",Hypo-osmolality and hyponatraemia,20911,267,0.38 [0.25-0.57],3.433935644689059e-06
F11,Coagulation factor XI,Chapter IX Diseases of the circulatory system,"Hypertension, portal",24140,49,0.34 [0.21-0.54],7.704870972864873e-06
F11,Coagulation factor XI,Chapter XI Diseases of the digestive system,"Cirrhosis of liver, NAS",24168,77,0.35 [0.22-0.55],3.7479648927077567e-06
F11,Coagulation factor XI,Chapter XI Diseases of the digestive system,Fibrosis and cirrhosis of liver,23627,94,0.35 [0.23-0.54],1.652549016457978e-06
