Protein,Protein_definition,Disease_category,Disease,NB_individual,NB_case,HR[95%CI],P_value
PXN,Paxillin,"Chapter IV Endocrine, nutritional and metabolic diseases",Type 2 diabetes without complications,27256,1485,1.31 [1.21-1.41],4.150197117403722e-12
PXN,Paxillin,Chapter IX Diseases of the circulatory system,Hypertensive Renal Disease,21467,60,1.84 [1.43-2.38],2.547499480447666e-06
PXN,Paxillin,Chapter XIV Diseases of the genitourinary system,Acute renal failure,27105,860,1.28 [1.16-1.41],1.4664396830573027e-06
PXN,Paxillin,Chapter XIV Diseases of the genitourinary system,Chronic kidney disease,26937,692,1.33 [1.19-1.48],2.617429040417914e-07
PXN,Paxillin,Chapter XIV Diseases of the genitourinary system,Dialysis,26304,59,2.05 [1.60-2.63],1.2105733263405418e-08
