Protein,Protein_definition,Disease_category,Disease,NB_individual,NB_case,HR[95%CI],P_value
PQBP1,Polyglutamine-binding protein 1,Chapter II Neoplasms,"Chronic lymphocytic leukaemia and small lyphocytis leukaemia, excluding all cancers (controls excluding all cancers)",23902,31,2.05 [1.65-2.54],8.262811223680702e-11
PQBP1,Polyglutamine-binding protein 1,Chapter II Neoplasms,Lymphoid leukaemia,23900,29,2.19 [1.79-2.67],1.3453860808389281e-14
PQBP1,Polyglutamine-binding protein 1,"Chapter IV Endocrine, nutritional and metabolic diseases",Type 2 diabetes without complications,27226,1477,1.20 [1.12-1.29],1.7059068258067857e-07
PQBP1,Polyglutamine-binding protein 1,Chapter IX Diseases of the circulatory system,Other pulmonary heart/vessel disease,27205,159,1.47 [1.25-1.73],4.545156031449826e-06
PQBP1,Polyglutamine-binding protein 1,Chapter IX Diseases of the circulatory system,Secondary right heart disease,27201,155,1.47 [1.24-1.73],6.052671271093256e-06
PQBP1,Polyglutamine-binding protein 1,Chapter XIV Diseases of the genitourinary system,Acute renal failure,27082,846,1.26 [1.16-1.37],6.700864287071788e-08
PQBP1,Polyglutamine-binding protein 1,Chapter XIV Diseases of the genitourinary system,Renal tubulo-interstitial diseases,27442,1518,1.18 [1.10-1.26],4.552047166577119e-06
