Protein,Protein_definition,Disease_category,Disease,NB_individual,NB_case,HR[95%CI],P_value
TADA3,Transcriptional adapter 3,Chapter II Neoplasms,Lung cancer and mesothelioma,18170,158,0.31 [0.21-0.46],1.3190850855706253e-08
TADA3,Transcriptional adapter 3,"Chapter IV Endocrine, nutritional and metabolic diseases",Disorders of lipoprotein metabolism and other lipidaemias,22976,2127,1.26 [1.14-1.39],6.517610909754131e-06
TADA3,Transcriptional adapter 3,"Chapter IV Endocrine, nutritional and metabolic diseases",Metabolic disorders,23883,3034,1.21 [1.11-1.31],1.4310999756162426e-05
TADA3,Transcriptional adapter 3,"Chapter IV Endocrine, nutritional and metabolic diseases",Type 2 diabetes without complications,24147,1349,1.32 [1.17-1.50],1.1770967991668191e-05
TADA3,Transcriptional adapter 3,Chapter IX Diseases of the circulatory system,Hypertension,23279,4386,1.17 [1.09-1.25],2.0923362409200468e-05
TADA3,Transcriptional adapter 3,Chapter IX Diseases of the circulatory system,"Hypertension, essential",23288,4395,1.16 [1.09-1.25],2.5339448749088425e-05
TADA3,Transcriptional adapter 3,Chapter X Diseases of the respiratory system,Emphysema,21795,167,0.41 [0.28-0.60],4.838502876012277e-06
TADA3,Transcriptional adapter 3,Chapter XI Diseases of the digestive system,Other diseases of pancreas,23003,76,8.17 [5.61-11.91],8.327387396298057e-28
