Protein,Protein_definition,Disease_category,Disease,NB_individual,NB_case,HR[95%CI],P_value
HMCN2,Hemicentin-2,"Chapter IV Endocrine, nutritional and metabolic diseases",Type 1 diabetes without complications,22454,106,2.44 [1.75-3.40],1.491113902795144e-07
HMCN2,Hemicentin-2,"Chapter IV Endocrine, nutritional and metabolic diseases",Type 2 diabetes without complications,23669,1321,1.30 [1.19-1.43],9.415076910323813e-09
HMCN2,Hemicentin-2,Chapter V Mental and behavioural disorders,"Alcohol use disorder, ICD-based",23892,332,0.68 [0.57-0.80],9.592370361550626e-06
HMCN2,Hemicentin-2,Chapter V Mental and behavioural disorders,"Mental and behavioural disorders due to alcohol, excluding acute intoxication",23839,387,0.67 [0.57-0.79],8.809354214076198e-07
HMCN2,Hemicentin-2,Chapter XI Diseases of the digestive system,Diverticular disease of intestine,20445,2130,0.86 [0.80-0.92],2.9482936416047483e-05
HMCN2,Hemicentin-2,Chapter XIV Diseases of the genitourinary system,Chronic kidney disease,23381,560,1.43 [1.24-1.65],7.606314158117171e-07
