Protein,Protein_definition,Disease_category,Disease,NB_individual,NB_case,HR[95%CI],P_value
FCRL3,Fc receptor-like protein 3,Chapter II Neoplasms,"Chronic lymphocytic leukaemia and small lyphocytis leukaemia, excluding all cancers (controls excluding all cancers)",24040,30,5.93 [4.57-7.69],4.704588902991389e-41
FCRL3,Fc receptor-like protein 3,Chapter II Neoplasms,Lymphoid leukaemia,24039,29,4.96 [3.78-6.51],6.202815332080199e-31
FCRL3,Fc receptor-like protein 3,Chapter II Neoplasms,"Non-follicular lymphoma, hilmo, excluding all cancers",24070,60,2.20 [1.51-3.22],4.109246826033757e-05
FCRL3,Fc receptor-like protein 3,Chapter II Neoplasms,"Non-Hodgkin lymphoma, all, excluding all cancers (controls excluding all cancers)",24128,118,1.82 [1.37-2.43],3.770223344106889e-05
FCRL3,Fc receptor-like protein 3,Chapter II Neoplasms,"Other and unspecified types of non-Hodgkin lymphoma, hilmo, excluding all cancers",24078,68,2.08 [1.45-2.98],7.247362321097149e-05
FCRL3,Fc receptor-like protein 3,"Chapter VII Diseases of the eye, adnexa, ear and mastoid process",Background diabetic retinopathy,27728,196,1.55 [1.24-1.93],9.580320859461496e-05
FCRL3,Fc receptor-like protein 3,Chapter XIV Diseases of the genitourinary system,Glomerular disorders in diseases classified elsewhere,27657,69,2.32 [1.71-3.15],6.409720747175016e-08
