Protein,Protein_definition,Disease_category,Disease,NB_individual,NB_case,HR[95%CI],P_value
SCRIB,Protein scribble homolog,"Chapter IV Endocrine, nutritional and metabolic diseases",Type 2 diabetes without complications,23585,1309,1.13 [1.07-1.19],3.864231873259879e-06
SCRIB,Protein scribble homolog,Chapter VI Diseases of the nervous system,Carpal tunnel syndrome,22861,418,1.20 [1.10-1.31],3.591951035836744e-05
SCRIB,Protein scribble homolog,"Chapter VII Diseases of the eye, adnexa, ear and mastoid process",Other disorders of eye and adnexa,23921,99,1.37 [1.18-1.60],6.227874280610271e-05
SCRIB,Protein scribble homolog,Chapter XI Diseases of the digestive system,Diseases of liver,23836,643,1.16 [1.08-1.24],6.910449334268132e-05
SCRIB,Protein scribble homolog,Chapter XI Diseases of the digestive system,Nonalcoholic fatty liver disease,23918,338,1.23 [1.12-1.35],1.4132189518479551e-05
SCRIB,Protein scribble homolog,Chapter XI Diseases of the digestive system,Other diseases of liver,23711,518,1.18 [1.09-1.28],2.557003125386088e-05
SCRIB,Protein scribble homolog,Chapter XIII Diseases of the musculoskeletal system and connective tissue,Polyarthropathies,19840,1559,1.11 [1.05-1.16],4.229207719468731e-05
