Protein,Protein_definition,Disease_category,Disease,NB_individual,NB_case,HR[95%CI],P_value
KLF4,Krueppel-like factor 4,"Chapter IV Endocrine, nutritional and metabolic diseases",Alcohol dependence,22169,121,2.36 [1.89-2.96],6.198007837130095e-14
KLF4,Krueppel-like factor 4,Chapter V Mental and behavioural disorders,"Alcohol use disorder, ICD-based",23697,323,1.60 [1.31-1.94],3.1527863691685546e-06
KLF4,Krueppel-like factor 4,Chapter V Mental and behavioural disorders,"Mental and behavioural disorders due to alcohol, excluding acute intoxication",23642,374,1.58 [1.31-1.90],1.3194665983544509e-06
KLF4,Krueppel-like factor 4,Chapter V Mental and behavioural disorders,"Substance abuse, excluding more controls",21521,1528,1.28 [1.15-1.44],1.2843312780334816e-05
KLF4,Krueppel-like factor 4,Chapter X Diseases of the respiratory system,Early onset COPD,23582,450,1.46 [1.22-1.75],4.013367556779432e-05
KLF4,Krueppel-like factor 4,Chapter X Diseases of the respiratory system,Other respiratory diseases principally affecting the interstitium,23790,175,1.69 [1.31-2.18],5.2770924096657205e-05
KLF4,Krueppel-like factor 4,Chapter XI Diseases of the digestive system,Coeliac disease,22596,96,1.91 [1.41-2.59],2.846741119586683e-05
KLF4,Krueppel-like factor 4,Chapter XIV Diseases of the genitourinary system,Chronic kidney disease,23217,547,1.43 [1.21-1.69],2.4210529068820435e-05
