Protein,Protein_definition,Disease_category,Disease,NB_individual,NB_case,HR[95%CI],P_value
STX7,Syntaxin-7,Chapter II Neoplasms,"Chronic lymphocytic leukaemia and small lyphocytis leukaemia, excluding all cancers (controls excluding all cancers)",20637,31,3.68 [1.99-6.78],3.161420758905649e-05
STX7,Syntaxin-7,Chapter II Neoplasms,Lymphoid leukaemia,20633,27,3.59 [1.89-6.82],9.611293627135702e-05
STX7,Syntaxin-7,"Chapter IV Endocrine, nutritional and metabolic diseases",Type 2 diabetes without complications,23567,1310,1.31 [1.17-1.46],1.054802425395918e-06
STX7,Syntaxin-7,Chapter IX Diseases of the circulatory system,Hypertension,22722,4262,1.13 [1.07-1.20],4.183032162361071e-05
STX7,Syntaxin-7,Chapter IX Diseases of the circulatory system,"Hypertension, essential",22731,4271,1.13 [1.07-1.20],5.185114184878919e-05
