Protein,Protein_definition,Disease_category,Disease,NB_individual,NB_case,HR[95%CI],P_value
CCN1,CCN family member 1,"Chapter IV Endocrine, nutritional and metabolic diseases",Type 2 diabetes without complications,22178,2127,1.13 [1.08-1.20],3.728771635526346e-06
CCN1,CCN family member 1,Chapter IX Diseases of the circulatory system,"Ischaemic heart disease, wide definition",21209,2893,1.10 [1.05-1.15],7.866753665298634e-05
CCN1,CCN family member 1,Chapter IX Diseases of the circulatory system,Major coronary heart disease event,22330,1051,1.17 [1.08-1.26],7.137488712829788e-05
CCN1,CCN family member 1,Chapter IX Diseases of the circulatory system,"Myocardial infarction, strict",19221,905,1.19 [1.10-1.30],2.330671223198017e-05
CCN1,CCN family member 1,Chapter XI Diseases of the digestive system,Acute peritonitis,22532,113,1.79 [1.40-2.29],2.7344196998718883e-06
CCN1,CCN family member 1,Chapter XIII Diseases of the musculoskeletal system and connective tissue,Gout,14660,795,1.22 [1.11-1.33],1.8151813008702745e-05
CCN1,CCN family member 1,Chapter XIV Diseases of the genitourinary system,Chronic kidney disease,21594,2327,1.12 [1.06-1.17],2.805434576944127e-05
