Protein,Protein_definition,Disease_category,Disease,NB_individual,NB_case,HR[95%CI],P_value
THPO,Thrombopoietin,Chapter III Diseases of the blood and blood-forming organs and certain disorders involving the immune mechanism,"Thrombocytopenia, unspecified",22508,282,0.47 [0.35-0.62],9.507796046863833e-08
THPO,Thrombopoietin,Chapter IX Diseases of the circulatory system,Hypertensive Renal Disease,11882,205,2.19 [1.63-2.96],2.567178454350792e-07
THPO,Thrombopoietin,Chapter X Diseases of the respiratory system,"Asthma, excluding more controls",15201,1673,1.25 [1.12-1.40],7.787765101086598e-05
THPO,Thrombopoietin,Chapter X Diseases of the respiratory system,"Asthma, unspecified (mode)",15558,1651,1.26 [1.13-1.41],4.241390814425181e-05
THPO,Thrombopoietin,Chapter XIII Diseases of the musculoskeletal system and connective tissue,Arthrosis,18645,4943,1.15 [1.08-1.23],1.2234640710888082e-05
THPO,Thrombopoietin,Chapter XIII Diseases of the musculoskeletal system and connective tissue,Gonarthrosis,15683,1981,1.24 [1.12-1.37],3.750423651613949e-05
THPO,Thrombopoietin,Chapter XIV Diseases of the genitourinary system,Chronic kidney disease,21333,2301,1.21 [1.10-1.33],7.808046308705396e-05
THPO,Thrombopoietin,Chapter XIV Diseases of the genitourinary system,Chronic nephritic syndrome,22511,131,2.45 [1.71-3.51],1.0039103153646569e-06
