Protein,Protein_definition,Disease_category,Disease,NB_individual,NB_case,HR[95%CI],P_value
PDZD2,PDZ domain-containing protein 2,Chapter III Diseases of the blood and blood-forming organs and certain disorders involving the immune mechanism,Diseases of the blood and blood-forming organs and certain disorders involving the immune mechanism,18878,2863,1.12 [1.06-1.19],5.6793843037207e-05
PDZD2,PDZ domain-containing protein 2,Chapter X Diseases of the respiratory system,Influenza and pneumonia,19255,2063,1.15 [1.07-1.23],6.942165639215734e-05
PDZD2,PDZ domain-containing protein 2,Chapter X Diseases of the respiratory system,Other respiratory diseases principally affecting the interstitium,19360,504,1.30 [1.15-1.48],4.196695316248639e-05
PDZD2,PDZ domain-containing protein 2,Chapter X Diseases of the respiratory system,"Pneumonia, organism unspecified",19020,1828,1.15 [1.07-1.24],8.731485061051847e-05
PDZD2,PDZ domain-containing protein 2,Chapter XIV Diseases of the genitourinary system,Dialysis,16653,67,1.76 [1.35-2.29],3.527474180649416e-05
