Protein,Protein_definition,Disease_category,Disease,NB_individual,NB_case,HR[95%CI],P_value
TAX1BP1,Tax1-binding protein 1,Chapter III Diseases of the blood and blood-forming organs and certain disorders involving the immune mechanism,Other and unspecified iron deficiency,19824,1184,1.25 [1.15-1.36],1.0610314534994065e-07
TAX1BP1,Tax1-binding protein 1,Chapter XIII Diseases of the musculoskeletal system and connective tissue,"Other (seronegative) rheumatoid arthritis, wide",19983,469,1.33 [1.17-1.52],1.2381831342267585e-05
TAX1BP1,Tax1-binding protein 1,Chapter XIII Diseases of the musculoskeletal system and connective tissue,Other/unspecified rheumatoid arthritis,19994,464,1.30 [1.15-1.49],6.391359175118197e-05
TAX1BP1,Tax1-binding protein 1,Chapter XIII Diseases of the musculoskeletal system and connective tissue,Rheumatoid arthritis,12678,476,1.36 [1.20-1.55],1.8802448552645307e-06
TAX1BP1,Tax1-binding protein 1,Chapter XIV Diseases of the genitourinary system,Dialysis,17213,71,1.83 [1.36-2.48],7.912096455426052e-05
