Protein,Protein_definition,Disease_category,Disease,NB_individual,NB_case,HR[95%CI],P_value
CSF3,Granulocyte colony-stimulating factor,Chapter I Certain infectious and parasitic diseases,Implicit fungal Sepsis,18636,332,1.44 [1.20-1.73],9.252520895569572e-05
CSF3,Granulocyte colony-stimulating factor,Chapter III Diseases of the blood and blood-forming organs and certain disorders involving the immune mechanism,Agranulocytosis,22429,385,1.40 [1.18-1.66],9.376039787136038e-05
CSF3,Granulocyte colony-stimulating factor,Chapter XI Diseases of the digestive system,Diseases of tongue,21931,93,1.86 [1.43-2.42],3.4715645128557035e-06
CSF3,Granulocyte colony-stimulating factor,Chapter XIII Diseases of the musculoskeletal system and connective tissue,Sicca syndrome [Sjgren],21993,90,1.87 [1.44-2.43],2.2267190274018463e-06
CSF3,Granulocyte colony-stimulating factor,Chapter XIII Diseases of the musculoskeletal system and connective tissue,Systemic lupus erythematosus,22012,109,1.73 [1.34-2.22],1.909645062612429e-05
CSF3,Granulocyte colony-stimulating factor,Chapter XIV Diseases of the genitourinary system,Chronic kidney disease,21333,2292,1.19 [1.10-1.28],5.924540068679806e-06
