Protein,Protein_definition,Disease_category,Disease,NB_individual,NB_case,HR[95%CI],P_value
PHYKPL,5-phosphohydroxy-L-lysine phospho-lyase,Chapter III Diseases of the blood and blood-forming organs and certain disorders involving the immune mechanism,Other and unspecified iron deficiency,19438,1168,1.40 [1.22-1.60],1.2446182927192326e-06
PHYKPL,5-phosphohydroxy-L-lysine phospho-lyase,"Chapter IV Endocrine, nutritional and metabolic diseases",Type 2 diabetes without complications,19045,1813,1.30 [1.16-1.44],3.22546924582718e-06
PHYKPL,5-phosphohydroxy-L-lysine phospho-lyase,Chapter IX Diseases of the circulatory system,Cardiac arrest,7940,221,1.96 [1.45-2.64],1.1513815927322656e-05
PHYKPL,5-phosphohydroxy-L-lysine phospho-lyase,Chapter VI Diseases of the nervous system,Generalized epilepsy,19427,43,3.91 [2.21-6.94],3.0395028751405188e-06
PHYKPL,5-phosphohydroxy-L-lysine phospho-lyase,Chapter XI Diseases of the digestive system,Alcoholic liver disease,18911,50,3.61 [2.14-6.11],1.6778161835099126e-06
PHYKPL,5-phosphohydroxy-L-lysine phospho-lyase,Chapter XI Diseases of the digestive system,"Cirrhosis of liver, NAS",19619,110,2.86 [1.94-4.22],1.1743911911019065e-07
PHYKPL,5-phosphohydroxy-L-lysine phospho-lyase,Chapter XI Diseases of the digestive system,Diseases of liver,19633,772,1.43 [1.21-1.69],2.4555863950430546e-05
PHYKPL,5-phosphohydroxy-L-lysine phospho-lyase,Chapter XI Diseases of the digestive system,Fibrosis and cirrhosis of liver,18989,128,2.60 [1.79-3.77],5.362935816310933e-07
