Protein,Protein_definition,Disease_category,Disease,NB_individual,NB_case,HR[95%CI],P_value
LEPR,Leptin receptor,"Chapter IV Endocrine, nutritional and metabolic diseases",Alcohol dependence,21682,113,3.61 [2.30-5.65],2.0568657978556832e-08
LEPR,Leptin receptor,Chapter IX Diseases of the circulatory system,"Hypertension, portal",23009,99,2.80 [1.97-3.98],8.223325029374161e-09
LEPR,Leptin receptor,Chapter V Mental and behavioural disorders,"Alcohol use disorder, ICD-based",23098,334,2.30 [1.82-2.91],4.2872286023173175e-12
LEPR,Leptin receptor,Chapter V Mental and behavioural disorders,"Mental and behavioural disorders due to alcohol, excluding acute intoxication",23070,393,2.23 [1.80-2.78],4.376362723150913e-13
LEPR,Leptin receptor,Chapter XI Diseases of the digestive system,Alcoholic liver disease,22194,65,3.50 [2.48-4.95],1.3513363746250805e-12
LEPR,Leptin receptor,Chapter XI Diseases of the digestive system,"Cirrhosis of liver, NAS",23041,131,2.62 [1.89-3.62],5.856456009181483e-09
LEPR,Leptin receptor,Chapter XIV Diseases of the genitourinary system,Acute renal failure,21653,2263,1.47 [1.32-1.65],5.257656040576661e-12
