Protein,Protein_definition,Disease_category,Disease,NB_individual,NB_case,HR[95%CI],P_value
LDLR,Low-density lipoprotein receptor,"Chapter IV Endocrine, nutritional and metabolic diseases",Disorders of lipoprotein metabolism and other lipidaemias,19751,4619,1.24 [1.18-1.30],5.858476443023742e-17
LDLR,Low-density lipoprotein receptor,"Chapter IV Endocrine, nutritional and metabolic diseases",Type 2 diabetes without complications,22388,2146,1.28 [1.19-1.38],1.5360543945723823e-11
LDLR,Low-density lipoprotein receptor,Chapter VI Diseases of the nervous system,Falls/tendency to fall,22571,3452,0.80 [0.75-0.85],2.1656487205382505e-13
LDLR,Low-density lipoprotein receptor,Chapter XII Diseases of the skin and subcutaneous tissue,Other disorders of skin and subcutaneous tissue,22620,2125,0.79 [0.73-0.86],2.456166128713106e-09
LDLR,Low-density lipoprotein receptor,Chapter XIII Diseases of the musculoskeletal system and connective tissue,Osteopathies and chondropathies,22803,2246,0.80 [0.74-0.86],2.0403928808547483e-09
LDLR,Low-density lipoprotein receptor,Chapter XIII Diseases of the musculoskeletal system and connective tissue,Osteoporosis,22133,1576,0.74 [0.68-0.81],5.4031176474275527e-11
