Protein,Protein_definition,Disease_category,Disease,NB_individual,NB_case,HR[95%CI],P_value
DEFB103A_DEFB103B,Beta-defensin 103,Chapter I Certain infectious and parasitic diseases,Condition for Implicit Sepsis (Organ dysfunction codes),18640,3448,1.20 [1.12-1.28],5.53972060085484e-08
DEFB103A_DEFB103B,Beta-defensin 103,"Chapter IV Endocrine, nutritional and metabolic diseases",Type 2 diabetes without complications,18727,1785,1.27 [1.17-1.39],4.9971052999811706e-08
DEFB103A_DEFB103B,Beta-defensin 103,Chapter X Diseases of the respiratory system,Pneumonitis due to solids and liquids,19292,281,1.53 [1.31-1.78],7.469812292637843e-08
DEFB103A_DEFB103B,Beta-defensin 103,Chapter XII Diseases of the skin and subcutaneous tissue,Arthropathic psoriasis,19107,61,1.89 [1.54-2.32],9.501023471831847e-10
DEFB103A_DEFB103B,Beta-defensin 103,Chapter XIII Diseases of the musculoskeletal system and connective tissue,Psoriatic arthropathies,11805,60,1.90 [1.55-2.33],5.786727395737035e-10
DEFB103A_DEFB103B,Beta-defensin 103,Chapter XIV Diseases of the genitourinary system,Acute renal failure,18303,1764,1.29 [1.19-1.41],3.547709354673502e-09
