Protein,Protein_definition,Disease_category,Disease,method,nsnp,OR [95% CI],Pvalue,QTL_type
ASAH2,Neutral ceramidase,Chapter IX Diseases of the circulatory system,I9_AF,Inverse variance weighted,40,0.97 [0.93-1.01],0.132392066676051,cis
ASAH2,Neutral ceramidase,Chapter II Neoplasms,C3_BREAST_EXALLC,Inverse variance weighted,40,1.02 [0.98-1.05],0.403202668811758,cis
ASAH2,Neutral ceramidase,"Chapter IV Endocrine, nutritional and metabolic diseases",E4_DM2NOCOMP,Inverse variance weighted,23,0.99 [0.96-1.02],0.5465585623491,cis
ASAH2,Neutral ceramidase,Chapter IX Diseases of the circulatory system,I9_AF,Inverse variance weighted,43,0.98 [0.94-1.02],0.25471206782069,trans
ASAH2,Neutral ceramidase,Chapter II Neoplasms,C3_BREAST_EXALLC,Inverse variance weighted,43,1.01 [0.97-1.06],0.577155920803684,trans
