Protein,Protein_definition,Disease_category,Disease,method,nsnp,OR [95% CI],Pvalue,QTL_type
RBP1,Retinol-binding protein 1,Chapter XI Diseases of the digestive system,K11_COELIAC,Wald ratio,1,0.66 [0.43-1.02],0.0629385416711075,cis
RBP1,Retinol-binding protein 1,Chapter XI Diseases of the digestive system,K11_MALABSORB,Wald ratio,1,0.63 [0.3-1.32],0.218476675325673,cis
RBP1,Retinol-binding protein 1,Chapter XIV Diseases of the genitourinary system,N14_CHRONKIDNEYDIS,Wald ratio,1,0.87 [0.66-1.14],0.308811849308772,cis
RBP1,Retinol-binding protein 1,Chapter XI Diseases of the digestive system,K11_OTHDIG,Wald ratio,1,0.91 [0.74-1.13],0.398465089621965,cis
RBP1,Retinol-binding protein 1,"Chapter IV Endocrine, nutritional and metabolic diseases",E4_THYROID,Wald ratio,1,0.96 [0.85-1.08],0.477698140620768,cis
RBP1,Retinol-binding protein 1,Chapter III Diseases of the blood and blood-forming organs and certain disorders involving the immune mechanism,D3_BLOOD_IMMUN,Wald ratio,1,1.02 [0.88-1.18],0.764462123362453,cis
RBP1,Retinol-binding protein 1,Chapter X Diseases of the respiratory system,J10_INTERSTITIUM,Wald ratio,1,1.03 [0.65-1.63],0.913887286189483,cis
