Protein,Protein_definition,Disease_category,Disease,NB_individual,NB_case,OR[95%CI],P_value
CRYM,Ketimine reductase mu-crystallin,Chapter II Neoplasms,"Malignant neoplasm of colon, excluding all cancers (controls excluding all cancers)",34597,104,1.40 [1.18-1.66],0.0001178133967521
CRYM,Ketimine reductase mu-crystallin,Chapter IX Diseases of the circulatory system,Coronary atherosclerosis,39191,1538,0.85 [0.79-0.92],6.116373568562349e-05
CRYM,Ketimine reductase mu-crystallin,Chapter XI Diseases of the digestive system,Diseases of the digestive system,40987,528,1.21 [1.10-1.32],8.597862740398244e-05
CRYM,Ketimine reductase mu-crystallin,Chapter XI Diseases of the digestive system,Intestinal malabsorption,40578,119,1.34 [1.14-1.58],0.0004375604482217
CRYM,Ketimine reductase mu-crystallin,Chapter XI Diseases of the digestive system,Coeliac disease,40558,99,1.35 [1.13-1.61],0.0007475117631696
