Protein,Protein_definition,Disease_category,Disease,NB_individual,NB_case,OR[95%CI],P_value
IFT20,Intraflagellar transport protein 20 homolog,Chapter III Diseases of the blood and blood-forming organs and certain disorders involving the immune mechanism,Diseases of the blood and blood-forming organs and certain disorders involving the immune mechanism,38769,1299,1.25 [1.11-1.40],0.0002019992070801
IFT20,Intraflagellar transport protein 20 homolog,"Chapter IV Endocrine, nutritional and metabolic diseases",Disorders of the thyroid gland,41022,906,1.29 [1.13-1.48],0.0002302360245367
IFT20,Intraflagellar transport protein 20 homolog,Chapter XI Diseases of the digestive system,Diseases of the digestive system,41197,520,1.51 [1.27-1.79],2.358054800388858e-06
IFT20,Intraflagellar transport protein 20 homolog,Chapter XI Diseases of the digestive system,Intestinal malabsorption,40794,117,2.58 [1.99-3.35],8.920268759281938e-13
IFT20,Intraflagellar transport protein 20 homolog,Chapter XI Diseases of the digestive system,Coeliac disease,40775,98,2.37 [1.76-3.20],1.4774667068880102e-08
IFT20,Intraflagellar transport protein 20 homolog,Chapter XIV Diseases of the genitourinary system,Chronic kidney disease,39554,83,2.07 [1.45-2.96],5.9214031289505965e-05
