Protein,Protein_definition,Disease_category,Disease,NB_individual,NB_case,OR[95%CI],P_value
RABGAP1L,Rab GTPase-activating protein 1-like,Chapter X Diseases of the respiratory system,Other respiratory disorders and diseases,48015,214,1.40 [1.17-1.69],0.0003081795240125
RABGAP1L,Rab GTPase-activating protein 1-like,Chapter XI Diseases of the digestive system,Intestinal malabsorption,47294,138,1.47 [1.18-1.85],0.0007699029957586
RABGAP1L,Rab GTPase-activating protein 1-like,Chapter XIII Diseases of the musculoskeletal system and connective tissue,Rheumatoid arthritis,35298,299,1.37 [1.17-1.60],0.0001076610830768
RABGAP1L,Rab GTPase-activating protein 1-like,Chapter XIII Diseases of the musculoskeletal system and connective tissue,"Other (seronegative) rheumatoid arthritis, wide",49677,287,1.36 [1.16-1.60],0.0001519048067829
RABGAP1L,Rab GTPase-activating protein 1-like,Chapter XIII Diseases of the musculoskeletal system and connective tissue,Other/unspecified rheumatoid arthritis,49697,259,1.44 [1.22-1.70],1.7178157659056695e-05
