Protein,Protein_definition,Disease_category,Disease,NB_individual,NB_case,OR[95%CI],P_value
UBXN1,UBX domain-containing protein 1,"Chapter VII Diseases of the eye, adnexa, ear and mastoid process",Disorders of lacrimal system,42140,131,1.51 [1.21-1.90],0.000340717302697
UBXN1,UBX domain-containing protein 1,Chapter IX Diseases of the circulatory system,"Myocardial infarction, strict",38602,492,0.80 [0.70-0.91],0.0009708173266711
UBXN1,UBX domain-containing protein 1,Chapter IX Diseases of the circulatory system,Atrial fibrillation and flutter,24763,745,0.82 [0.73-0.91],0.0004277490617444
UBXN1,UBX domain-containing protein 1,Chapter IX Diseases of the circulatory system,Other or ill-defined heart diseases,36447,159,0.66 [0.52-0.84],0.0006851448635062
UBXN1,UBX domain-containing protein 1,Chapter XIV Diseases of the genitourinary system,Other disorders of kidney and ureter,43054,113,1.53 [1.20-1.94],0.0005613267039783
