Protein,Protein_definition,Disease_category,Disease,NB_individual,NB_case,OR[95%CI],P_value
PMS1,PMS1 protein homolog 1,Chapter I Certain infectious and parasitic diseases,Implicit bacterial Sepsis,37164,359,1.40 [1.19-1.64],5.744128232511773e-05
PMS1,PMS1 protein homolog 1,Chapter I Certain infectious and parasitic diseases,Implicit Sepsis,28485,1287,1.23 [1.11-1.36],4.757920309636429e-05
PMS1,PMS1 protein homolog 1,Chapter IX Diseases of the circulatory system,"Hypertension, essential",32446,3736,1.12 [1.05-1.21],0.0009282750663716
PMS1,PMS1 protein homolog 1,Chapter XIII Diseases of the musculoskeletal system and connective tissue,Diseases of the musculoskeletal system and connective tissue,31367,6761,1.11 [1.05-1.17],7.658307028162588e-05
PMS1,PMS1 protein homolog 1,Chapter XIII Diseases of the musculoskeletal system and connective tissue,Arthropathies,34108,3936,1.14 [1.07-1.22],3.890608131270254e-05
PMS1,PMS1 protein homolog 1,Chapter XIV Diseases of the genitourinary system,Chronic kidney disease,39554,83,1.62 [1.22-2.15],0.000893401061512
