Protein,Protein_definition,Disease_category,Disease,NB_individual,NB_case,OR[95%CI],P_value
SNAP23,Synaptosomal-associated protein 23,Chapter VI Diseases of the nervous system,Epilepsy,48125,305,0.82 [0.74-0.92],0.0004570310326612
SNAP23,Synaptosomal-associated protein 23,Chapter IX Diseases of the circulatory system,Atrial fibrillation and flutter,29008,884,0.83 [0.78-0.89],3.7273867647304133e-07
SNAP23,Synaptosomal-associated protein 23,Chapter IX Diseases of the circulatory system,Other or ill-defined heart diseases,42704,185,0.73 [0.63-0.83],4.589356150691522e-06
SNAP23,Synaptosomal-associated protein 23,Chapter XI Diseases of the digestive system,Diseases of liver,49827,246,0.70 [0.62-0.79],4.217416587842893e-09
SNAP23,Synaptosomal-associated protein 23,Chapter XI Diseases of the digestive system,Other diseases of liver,49717,136,0.74 [0.63-0.86],0.0001897171639614
SNAP23,Synaptosomal-associated protein 23,Chapter XIII Diseases of the musculoskeletal system and connective tissue,Spondylopathies,44936,590,0.87 [0.80-0.95],0.0009307611781135
SNAP23,Synaptosomal-associated protein 23,"Chapter XV Pregnancy, childbirth and the puerperium",Haemorrhage in early pregnancy,27488,125,0.74 [0.62-0.88],0.0005823622140802
