Protein,Protein_definition,Disease_category,Disease,NB_individual,NB_case,OR[95%CI],P_value
CSPG5,Chondroitin sulfate proteoglycan 5,Chapter III Diseases of the blood and blood-forming organs and certain disorders involving the immune mechanism,Diseases of the blood and blood-forming organs and certain disorders involving the immune mechanism,38599,1315,1.20 [1.08-1.32],0.0003709108162398
CSPG5,Chondroitin sulfate proteoglycan 5,"Chapter IV Endocrine, nutritional and metabolic diseases",Metabolic disorders,35051,1908,1.16 [1.07-1.27],0.0006207421245144
CSPG5,Chondroitin sulfate proteoglycan 5,Chapter XII Diseases of the skin and subcutaneous tissue,Infections of the skin and subcutaneous tissue,41766,681,1.26 [1.11-1.44],0.0004775691229247
CSPG5,Chondroitin sulfate proteoglycan 5,Chapter XIV Diseases of the genitourinary system,Chronic kidney disease,39375,82,1.98 [1.58-2.48],3.312320584735526e-09
CSPG5,Chondroitin sulfate proteoglycan 5,Chapter XIV Diseases of the genitourinary system,Unspecified kidney failure,39388,95,1.65 [1.27-2.14],0.0001494232112488
