Protein,Protein_definition,Disease_category,Disease,NB_individual,NB_case,OR[95%CI],P_value
KLK1,Kallikrein-1,Chapter III Diseases of the blood and blood-forming organs and certain disorders involving the immune mechanism,Other and unspecified iron deficiency,48400,392,1.15 [1.07-1.23],4.4366228309803695e-05
KLK1,Kallikrein-1,Chapter VI Diseases of the nervous system,Episodal and paroxysmal disorders,48313,952,1.09 [1.04-1.14],0.000148495144628
KLK1,Kallikrein-1,Chapter IX Diseases of the circulatory system,Death due to cardiac causes,36068,6505,1.05 [1.03-1.08],1.247936208527117e-06
KLK1,Kallikrein-1,Chapter IX Diseases of the circulatory system,"Hypertension, essential",37976,4487,1.06 [1.04-1.09],5.104156732456907e-07
KLK1,Kallikrein-1,Chapter IX Diseases of the circulatory system,Hypertension,38040,4551,1.06 [1.04-1.09],2.032114171494083e-07
KLK1,Kallikrein-1,Chapter XI Diseases of the digestive system,"Diseases of oesophagus, stomach and duodenum",42478,4266,1.04 [1.02-1.06],0.0008301142748383
KLK1,Kallikrein-1,Chapter XIV Diseases of the genitourinary system,Renal tubulo-interstitial diseases,45750,506,1.11 [1.05-1.18],0.0002726232984897
KLK1,Kallikrein-1,Chapter XIV Diseases of the genitourinary system,Unspecified kidney failure,45973,135,1.21 [1.09-1.35],0.0005163880099935
