Protein,Protein_definition,Disease_category,Disease,NB_individual,NB_case,HR[95%CI],P_value
IL1RL2,Interleukin-1 receptor-like 2,"Chapter IV Endocrine, nutritional and metabolic diseases",Hypo-osmolality and hyponatraemia,22296,622,0.66 [0.55-0.79],6.009648631714497e-06
IL1RL2,Interleukin-1 receptor-like 2,Chapter IX Diseases of the circulatory system,"Heart failure, strict",27138,853,0.68 [0.58-0.79],8.933621314077251e-07
IL1RL2,Interleukin-1 receptor-like 2,Chapter IX Diseases of the circulatory system,Other or ill-defined heart diseases,24425,799,0.71 [0.60-0.83],2.179365395688432e-05
IL1RL2,Interleukin-1 receptor-like 2,Chapter V Mental and behavioural disorders,"Alcohol use disorder, ICD-based",27190,212,0.52 [0.39-0.70],8.945095615893328e-06
IL1RL2,Interleukin-1 receptor-like 2,Chapter V Mental and behavioural disorders,"Mental and behavioural disorders due to alcohol, excluding acute intoxication",27158,252,0.53 [0.40-0.68],1.3542060333806944e-06
