Protein,Protein_definition,Disease_category,Disease,NB_individual,NB_case,HR[95%CI],P_value
GRHPR,Glyoxylate reductase/hydroxypyruvate reductase,Chapter III Diseases of the blood and blood-forming organs and certain disorders involving the immune mechanism,Other and unspecified iron deficiency,23866,1085,1.22 [1.12-1.33],1.1177958587185305e-05
GRHPR,Glyoxylate reductase/hydroxypyruvate reductase,"Chapter IV Endocrine, nutritional and metabolic diseases",Disorders of lipoprotein metabolism and other lipidaemias,22090,2760,1.16 [1.09-1.22],4.204288128903382e-07
GRHPR,Glyoxylate reductase/hydroxypyruvate reductase,"Chapter IV Endocrine, nutritional and metabolic diseases",Metabolic disorders,23450,4120,1.13 [1.08-1.18],2.486615897652862e-07
GRHPR,Glyoxylate reductase/hydroxypyruvate reductase,"Chapter IV Endocrine, nutritional and metabolic diseases",Type 2 diabetes without complications,23809,1313,1.30 [1.20-1.41],1.4864224053771244e-10
GRHPR,Glyoxylate reductase/hydroxypyruvate reductase,Chapter X Diseases of the respiratory system,Bronchiectasis,20916,356,1.37 [1.17-1.59],6.648638162985372e-05
GRHPR,Glyoxylate reductase/hydroxypyruvate reductase,Chapter XI Diseases of the digestive system,Nonalcoholic fatty liver disease,24213,303,1.46 [1.24-1.73],7.47059408142567e-06
