Protein,Protein_definition,Disease_category,Disease,NB_individual,NB_case,HR[95%CI],P_value
PARK7,Parkinson disease protein 7,Chapter I Certain infectious and parasitic diseases,Implicit Sepsis,19391,1697,1.19 [1.10-1.29],2.36614766443797e-05
PARK7,Parkinson disease protein 7,"Chapter IV Endocrine, nutritional and metabolic diseases",Disorders of lipoprotein metabolism and other lipidaemias,25296,3202,1.13 [1.07-1.20],2.9166865286525985e-05
PARK7,Parkinson disease protein 7,"Chapter IV Endocrine, nutritional and metabolic diseases",Metabolic disorders,26877,4783,1.13 [1.07-1.18],9.133101783991322e-07
PARK7,Parkinson disease protein 7,Chapter IX Diseases of the circulatory system,Hypertensive Renal Disease,19484,100,1.91 [1.39-2.62],6.436284154024442e-05
PARK7,Parkinson disease protein 7,Chapter X Diseases of the respiratory system,Diseases of the respiratory system,25676,5231,1.11 [1.06-1.16],9.362328635788677e-06
PARK7,Parkinson disease protein 7,Chapter XIV Diseases of the genitourinary system,Acute renal failure,26698,1279,1.21 [1.11-1.33],3.823903278759983e-05
