Protein,Protein_definition,Disease_category,Disease,NB_individual,NB_case,HR[95%CI],P_value
F11,Coagulation factor XI,Chapter III Diseases of the blood and blood-forming organs and certain disorders involving the immune mechanism,Diseases of the blood and blood-forming organs and certain disorders involving the immune mechanism,23027,2571,0.74 [0.64-0.85],1.2832841392365008e-05
F11,Coagulation factor XI,"Chapter IV Endocrine, nutritional and metabolic diseases",Fluid overload,19247,174,0.35 [0.21-0.59],8.058532928296384e-05
F11,Coagulation factor XI,"Chapter IV Endocrine, nutritional and metabolic diseases",Hypo-osmolality and hyponatraemia,19608,535,0.44 [0.32-0.59],6.513714374468565e-08
F11,Coagulation factor XI,"Chapter IV Endocrine, nutritional and metabolic diseases","Other disorders of fluid, electrolyte and acid-base balance",20373,1300,0.64 [0.53-0.78],6.5015198217189685e-06
F11,Coagulation factor XI,Chapter IX Diseases of the circulatory system,Other pulmonary heart/vessel disease,23416,287,0.43 [0.29-0.66],7.05593644615957e-05
F11,Coagulation factor XI,Chapter XI Diseases of the digestive system,Constipation,23622,1466,0.64 [0.54-0.77],2.2264929843527004e-06
F11,Coagulation factor XI,Chapter XI Diseases of the digestive system,Other functional intestinal disorders,18585,1518,0.66 [0.55-0.78],3.197521338111259e-06
F11,Coagulation factor XI,Chapter XIII Diseases of the musculoskeletal system and connective tissue,"Other dorsopathies, not elsewhere classified",22148,1783,0.72 [0.61-0.85],7.155376336890827e-05
