Protein,Protein_definition,Disease_category,Disease,NB_individual,NB_case,HR[95%CI],P_value
C2orf69,UPF0565 protein C2orf69,Chapter III Diseases of the blood and blood-forming organs and certain disorders involving the immune mechanism,Idiopathic thrombocytopenic purpura,23207,43,1.65 [1.29-2.11],5.3843178658733525e-05
C2orf69,UPF0565 protein C2orf69,"Chapter IV Endocrine, nutritional and metabolic diseases",Alcohol dependence,22318,53,1.63 [1.37-1.93],3.89228891413797e-08
C2orf69,UPF0565 protein C2orf69,"Chapter IV Endocrine, nutritional and metabolic diseases",Disorders of lipoprotein metabolism and other lipidaemias,21478,2689,1.14 [1.07-1.20],1.081826006024218e-05
C2orf69,UPF0565 protein C2orf69,"Chapter IV Endocrine, nutritional and metabolic diseases",Metabolic disorders,22799,4010,1.11 [1.06-1.16],1.8512985352622143e-05
C2orf69,UPF0565 protein C2orf69,Chapter IX Diseases of the circulatory system,Other arterial embolism and thrombosis,22691,60,1.74 [1.42-2.14],9.017179351268269e-08
