Protein,Protein_definition,Disease_category,Disease,NB_individual,NB_case,HR[95%CI],P_value
PPP1R2,Protein phosphatase inhibitor 2,Chapter III Diseases of the blood and blood-forming organs and certain disorders involving the immune mechanism,Diseases of the blood and blood-forming organs and certain disorders involving the immune mechanism,26757,3018,1.10 [1.05-1.14],7.076519947261677e-06
PPP1R2,Protein phosphatase inhibitor 2,Chapter III Diseases of the blood and blood-forming organs and certain disorders involving the immune mechanism,Other and unspecified iron deficiency,27370,1285,1.17 [1.10-1.24],3.580795028679155e-07
PPP1R2,Protein phosphatase inhibitor 2,"Chapter IV Endocrine, nutritional and metabolic diseases",Disorders of lipoprotein metabolism and other lipidaemias,25287,3188,1.09 [1.05-1.13],1.2644861157674192e-05
PPP1R2,Protein phosphatase inhibitor 2,"Chapter IV Endocrine, nutritional and metabolic diseases",Metabolic disorders,26861,4762,1.08 [1.05-1.12],8.710784428729072e-07
PPP1R2,Protein phosphatase inhibitor 2,Chapter X Diseases of the respiratory system,Diseases of the respiratory system,25667,5227,1.08 [1.04-1.11],2.189971093596543e-06
