Protein,Protein_definition,Disease_category,Disease,NB_individual,NB_case,OR[95%CI],P_value
S100A14,Protein S100-A14,"Chapter IV Endocrine, nutritional and metabolic diseases",Type 2 diabetes,41372,927,0.33 [0.28-0.38],3.697682103306152e-45
S100A14,Protein S100-A14,"Chapter IV Endocrine, nutritional and metabolic diseases",Type 2 diabetes without complications,41346,901,0.33 [0.28-0.38],7.453170765925829e-44
S100A14,Protein S100-A14,Chapter XI Diseases of the digestive system,"Disorders of gallbladder, biliary tract and pancreas",42271,1057,1.38 [1.25-1.53],5.913342157144365e-10
S100A14,Protein S100-A14,Chapter XI Diseases of the digestive system,Intestinal malabsorption,41871,119,2.15 [1.72-2.69],2.0094098802405664e-11
S100A14,Protein S100-A14,Chapter XIV Diseases of the genitourinary system,Chronic kidney disease,40600,86,2.14 [1.69-2.70],2.160190267025848e-10
