Protein,Protein_definition,Disease_category,Disease,NB_individual,NB_case,OR[95%CI],P_value
TTR,Transthyretin,Chapter I Certain infectious and parasitic diseases,Implicit Sepsis,28972,1314,0.51 [0.42-0.63],3.9000142075951255e-10
TTR,Transthyretin,"Chapter IV Endocrine, nutritional and metabolic diseases",Type 1 diabetes,40332,204,0.11 [0.07-0.16],1.5044277794075332e-23
TTR,Transthyretin,"Chapter IV Endocrine, nutritional and metabolic diseases",Type 1 diabetes without complications,40312,184,0.11 [0.07-0.17],2.7212934944182097e-21
TTR,Transthyretin,Chapter X Diseases of the respiratory system,Diseases of the respiratory system,35405,3576,0.57 [0.50-0.65],1.4457582536861171e-16
TTR,Transthyretin,Chapter X Diseases of the respiratory system,Chronic lower respiratory diseases,39582,1756,0.57 [0.48-0.68],4.384247023583762e-10
TTR,Transthyretin,Chapter XI Diseases of the digestive system,Other diseases of liver,42829,117,0.12 [0.07-0.20],1.055761738020786e-14
