Protein,Protein_definition,Disease_category,Disease,NB_individual,NB_case,OR[95%CI],P_value
FCRL6,Fc receptor-like protein 6,Chapter IX Diseases of the circulatory system,Hypertensive Renal Disease,33957,160,2.07 [1.68-2.54],5.985438967377897e-12
FCRL6,Fc receptor-like protein 6,Chapter XIV Diseases of the genitourinary system,Renal tubulo-interstitial diseases,46124,508,1.48 [1.32-1.66],5.178770633137356e-11
FCRL6,Fc receptor-like protein 6,Chapter XIV Diseases of the genitourinary system,Chronic kidney disease,46364,143,2.39 [1.92-2.97],3.607628856327777e-15
FCRL6,Fc receptor-like protein 6,"Chapter XV Pregnancy, childbirth and the puerperium",Complications of labour and delivery,27717,1202,1.42 [1.30-1.56],5.0090710895413126e-14
FCRL6,Fc receptor-like protein 6,"Chapter XV Pregnancy, childbirth and the puerperium",Perineal laceration during delivery,27185,670,1.53 [1.36-1.72],2.4503976879484648e-12
