Protein,Protein_definition,Disease_category,Disease,NB_individual,NB_case,OR[95%CI],P_value
CNTN3,Contactin-3,Chapter III Diseases of the blood and blood-forming organs and certain disorders involving the immune mechanism,Diseases of the blood and blood-forming organs and certain disorders involving the immune mechanism,45734,1584,0.55 [0.49-0.63],1.6603948804940825e-18
CNTN3,Contactin-3,"Chapter IV Endocrine, nutritional and metabolic diseases",Type 2 diabetes,47681,1110,3.00 [2.50-3.60],7.450691906188938e-32
CNTN3,Contactin-3,"Chapter IV Endocrine, nutritional and metabolic diseases",Type 2 diabetes without complications,47646,1075,3.03 [2.52-3.65],1.2475205138763004e-31
CNTN3,Contactin-3,Chapter IX Diseases of the circulatory system,Atrial fibrillation and flutter,29024,875,0.52 [0.42-0.64],7.202719455723076e-10
CNTN3,Contactin-3,Chapter X Diseases of the respiratory system,Diseases of the respiratory system,41042,4117,0.73 [0.67-0.80],9.893732879638082e-12
