Protein,Protein_definition,Disease_category,Disease,NB_individual,NB_case,OR[95%CI],P_value
MMP1,Interstitial collagenase,Chapter III Diseases of the blood and blood-forming organs and certain disorders involving the immune mechanism,Diseases of the blood and blood-forming organs and certain disorders involving the immune mechanism,44092,1556,1.17 [1.12-1.24],9.143033991744587e-10
MMP1,Interstitial collagenase,"Chapter IV Endocrine, nutritional and metabolic diseases",Type 2 diabetes,45935,1067,1.30 [1.22-1.39],2.928896746482408e-15
MMP1,Interstitial collagenase,"Chapter IV Endocrine, nutritional and metabolic diseases",Type 2 diabetes without complications,45903,1035,1.29 [1.21-1.38],5.840984130587627e-14
MMP1,Interstitial collagenase,Chapter IX Diseases of the circulatory system,"Hypertension, essential",36931,4382,1.12 [1.08-1.16],4.5429713543544326e-10
MMP1,Interstitial collagenase,Chapter IX Diseases of the circulatory system,Hypertension,36997,4448,1.12 [1.08-1.16],1.0710168680281991e-10
