Protein,Protein_definition,Disease_category,Disease,NB_individual,NB_case,OR[95%CI],P_value
HMOX1,Heme oxygenase 1,"Chapter IV Endocrine, nutritional and metabolic diseases",Type 2 diabetes,47144,1107,0.42 [0.37-0.48],9.540768497893364e-43
HMOX1,Heme oxygenase 1,"Chapter IV Endocrine, nutritional and metabolic diseases",Type 2 diabetes without complications,47109,1072,0.42 [0.37-0.48],5.217692529416129e-41
HMOX1,Heme oxygenase 1,Chapter IX Diseases of the circulatory system,"Ischaemic heart disease, wide definition",46532,2380,0.74 [0.68-0.80],3.728410844975939e-13
HMOX1,Heme oxygenase 1,Chapter IX Diseases of the circulatory system,Coronary atherosclerosis,46011,1894,0.73 [0.67-0.80],9.678589874464482e-12
HMOX1,Heme oxygenase 1,Chapter XI Diseases of the digestive system,Diseases of liver,49263,245,2.18 [1.79-2.65],1.0956728445795316e-14
